Sentence,Entities
"In the personal interview of the two
 western princes, Constantine, by the ascendant of genius and
 power, obtained the ready concurrence of his colleague,
 Licinius; the union of their names and authority disarmed
 the fury of Maximin; and, after the death of the tyrant of
 the East, the edict of Milan was received as a general and
 fundamental law of the Roman world.","('two', 'CARDINAL'), ('Constantine', 'PERSON'), ('Licinius', 'PERSON'), ('Maximin', 'PERSON'), ('East', 'LOC'), ('Milan', 'GPE'), ('Roman', 'NORP')"
"In the second civil war Licinius felt and dreaded the power
 of this consecrated banner the sight of which in the
 distress of battle animated the soldiers of Constantine with
 an invincible enthusiasm, and scattered terror and dismay
 through the ranks of the adverse legions.(36) The Christian 
 emperors, who respected the example of Constantine,
 displayed in all their military expeditions the standard of
 the cross; but when the degenerate successors of Theodosius
 had ceased to appear in person at the head of their armies,
 the labarum was deposited as a venerable but useless relic
 in the palace of Constantinople. (37)","('second', 'ORDINAL'), ('Licinius', 'PERSON'), ('Constantine', 'PERSON'), ('Christian', 'NORP'), ('Constantine', 'PERSON'), ('Theodosius', 'PERSON'), ('Constantinople', 'GPE'), ('37', 'CARDINAL')"
"In the space of two
 centuries, from the reign of Constantine to that of
 Justinian, the eighteen hundred churches of the empire were
 enriched by the frequent and unalienable gifts of the prince
 and people.","('the space of two\r\n centuries', 'DATE'), ('Constantine', 'PERSON'), ('Justinian', 'PERSON'), ('eighteen hundred', 'CARDINAL')"
"Instead of asserting his just superiority above
 the imperfect heroism and profane philosophy of Trajan and
 the Antonines, the mature age of Constantine forfeited the
 reputation which he had acquired in his youth.","('Trajan', 'PERSON'), ('Antonines', 'PERSON'), ('Constantine', 'PERSON')"
"Instead of retiring
 from the congregation when the voice of the deacon dismissed
 the profane multitude, he prayed with the faithful, disputed
 with the bishops, preached on the most sublime and intricate
 subjects of theology, celebrated with sacred rites the vigil
 of Easter, and publicly declared himself, not only a
 partaker, but, in some measure, a priest and hierophant of
 the Christian mysteries. (64)","('Easter', 'DATE'), ('Christian', 'NORP'), ('64', 'CARDINAL')"
"It is described(34) as a long pike 
 intersected by a transversal beam.","('34', 'CARDINAL')"
"It was
 impossible to execute this spiritual censure, if the
 Christian pontiff who punished the obscure sins of the
 multitude, respected the conspicuous vices and destructive
 crimes of the magistrate: but it was impossible to arraign
 the conduct of the magistrate without controlling the
 administration of civil government.","('Christian', 'NORP')"
"It was an arduous task
 to eradicate the habits and prejudices of his education, to
 acknowledge the divine power of Christ and to understand
 that the truth of his revelation was incompatible with the
 worship of the gods.","('Christ', 'PERSON')"
"It was enacted that the
 places of worship, and public lands, which had been
 confiscated, should be restored to the church, without
 dispute, without delay, and without expense: and this severe
 injunction was accompanied with a gracious promise, that, if
 any of the purchasers had paid a fair and adequate price,
 they should be indemnified from the Imperial treasury.","('Imperial', 'ORG')"
"It was long since established as a
 fundamental maxim of the Roman constitution, that every rank
 of citizens was alike subject to the laws, and that the care
 of religion was the right as well as duty of the civil
 magistrate.","('Roman', 'NORP')"
"Its honours are still 
 preserved on the medals of the Flavian family.","('Flavian', 'NORP')"
"Legal Establishment and Constitution of the Christian, or Catholic, Church THE public establishment of Christianity may be considered
 as one of the most important and domestic revolutions which
 excite the most lively curiosity, and afford the most
 valuable instruction.","('Legal Establishment and Constitution', 'LAW'), ('Christian', 'NORP'), ('Catholic', 'NORP'), ('Church', 'ORG'), ('Christianity', 'NORP'), ('one', 'CARDINAL')"
Loyalty and zeal of the Christian party.,"('Christian', 'NORP')"
"Many years before his baptism and death Constantine had 
 proclaimed to the world that neither his person nor his
 image should evermore be seen within the walls of an
 idolatrous temple; while he distributed through the
 provinces a variety of medals and pictures which represented
 the emperor in an humble and suppliant posture of Christian
 devotion.(66)
Delay of his baptism till the approach of death.","('Constantine', 'PERSON'), ('Christian', 'NORP')"
"Nazarius and Eusebius are the two most celebrated orators 
 who, in studied panegyrics, have laboured to exalt the glory
 of Constantine.","('Nazarius', 'PERSON'), ('Eusebius', 'PERSON'), ('two', 'CARDINAL'), ('Constantine', 'PERSON')"
"Nine years after the Roman victory A.D. 321 Nazarius
 (46) describes an army of divine warriors, who seemed to fall 
 from the sky; he marks their beauty, their spirit, their
 gigantic forms, the stream of light which beamed from their
 celestial armour, their patience in suffering themselves to
 be heard, as well as seen, by mortals; and their declaration
 that they were sent, that they flew, to the assistance of
 the great Constantine.","('Nine years', 'DATE'), ('Roman', 'NORP'), ('321', 'CARDINAL'), ('Nazarius', 'PERSON'), ('46', 'CARDINAL'), ('Constantine', 'PERSON')"
"Nor can it be deemed incredible that the mind of an
 unlettered soldier should have yielded to the weight of
 evidence which, in a more enlightened age, has satisfied or
 subdued the reason of a Grotius, a Pascal, or a Locke.","('Grotius', 'NORP'), ('Pascal', 'PERSON'), ('Locke', 'PERSON')"
"Or perhaps he
 might embrace the philosophic and pleasing idea that,
 notwithstanding the variety of names, of rites, and of
 opinions, all the sects and all the nations of mankind are
 united in the worship of the common Father and Creator of
 the universe.(16)
Use and beauty of the Christian morality.","('16', 'CARDINAL'), ('Christian', 'NORP')"
"Personal interest is often the standard of our belief, as
 well as of our practice and the same motives of temporal
 advantage which might influence the public conduct and
 professions of Constantine would insensibly dispose his mind
 to embrace a religion so propitious to his fame and
 fortunes.","('Constantine', 'PERSON')"
"Philosophy still exercised her temperate sway over the human
 mind, but the cause of virtue derived very feeble support
 from the influence of the Pagan superstition.","('Pagan', 'NORP')"
Propagation of Christianity.,"('Christianity', 'NORP')"
"Six hundred parabolani, or adventurers, 
 visited the sick at Alexandria; eleven hundred copiate, or
 grave-diggers buried the dead at Constantinople; and the
 swarms of monks, who arose from the Nile, overspread and
 darkened the face of the Christian world.","('Six hundred', 'CARDINAL'), ('Alexandria', 'GPE'), ('eleven hundred', 'CARDINAL'), ('Constantinople', 'GPE'), ('Nile', 'LOC'), ('Christian', 'NORP')"
"Some considerations might perhaps incline a sceptical mind to suspect the judgment or the veracity of the rhetorician, whose pen, either from zeal or interest, was devoted to the cause of the prevailing faction.(40)","('40', 'CARDINAL')"
"St. Athanasius ex-communicated one of the ministers
 of Egypt, and the interdict which he pronounced of fire and
 water was solemnly transmitted to the churches of
 Cappodocia.(115)","('St. Athanasius', 'PERSON'), ('one', 'CARDINAL'), ('Egypt', 'GPE'), ('Cappodocia', 'GPE'), ('115', 'CARDINAL')"
State of the bishops under the Christian emperors..,"('Christian', 'NORP')"
"Such a tribunal, unless it was inflamed by
 personal resentment or religious discord, might be
 favourable, or even partial, to the sacerdotal order: but
 Constantine was satisfied (112) that secret impunity would be  less pernicious than public scandal, and the Nicene council was edified by his public declaration, that, if he surprised
 a bishop in the act of adultery, he should cast his Imperial
 mantle over the episcopal sinner.","('Constantine', 'PERSON'), ('112', 'CARDINAL'), ('Nicene', 'PERSON'), ('Imperial', 'ORG')"
"Such principles and such 
 examples insensibly prepared the triumph of the Roman
 pontiffs, who have trampled on the necks of kings.","('Roman', 'NORP')"
"Such profound reverence of an absolute monarch towards a 
 feeble and unarmed assembly of his own subjects can only be
 compared to the respect with which the senate had been
 treated by the Roman princes who adopted the policy of
 Augustus.","('Roman', 'NORP'), ('Augustus', 'PERSON')"
"Such was the strict
 subordination of the Catholic church that the same concerted
 sounds might issue at once from an hundred pulpits of Italy
 or Egypt, if they were tuned(123) by the masterhand of the Roman or Alexandrian primate.","('Catholic', 'NORP'), ('hundred', 'CARDINAL'), ('Italy', 'GPE'), ('Egypt', 'GPE'), ('123', 'CARDINAL'), ('Roman', 'NORP'), ('Alexandrian', 'NORP')"
"The
 Christian temples of Antioch, Alexandria, Jerusalem,
 Constantinople, etc., displayed the ostentatious piety of a
 prince ambitious in a declining age to equal the perfect
 labours of antiquity. (104)","('Christian', 'NORP'), ('Antioch', 'GPE'), ('Alexandria', 'GPE'), ('Jerusalem', 'GPE'), ('Constantinople', 'GPE'), ('104', 'CARDINAL')"
"The
 character of the Roman tyrant disgraced the purple and human
 nature; and though the Christians might enjoy his precarious
 favour, they were exposed, with the rest of his subjects, to
 the effects of his wanton and capricious cruelty.","('Roman', 'NORP'), ('Christians', 'NORP')"
"The
 cities which signalised a forward zeal by the voluntary
 destruction of their temples were distinguished by municipal
 privileges and rewarded with popular donatives; and the new
 capital of the East gloried in the singular advantage that
 Constantinople was never profaned by the worship of idols.
 (73)","('East', 'LOC'), ('Constantinople', 'GPE')"
"The
 clerical name and privilege were extended to many pious
 fraternities, who devoutly supported the ecclesiastical
 throne. (100)","('100', 'CARDINAL')"
"The
 conduct of Licinius soon betrayed the reluctance with which
 he had consented to the wise and humane regulations of the
 edict of Milan.","('Licinius', 'PERSON'), ('Milan', 'GPE')"
"The
 first magistrate of the state, as often as he was prompted
 by superstition or policy, performed with his own hands the
 sacerdotal functions;(82) nor was there any order of priests, 
 either at Rome or in the provinces, who claimed a more
 sacred character among men, or a more intimate communication
 with the gods.","('first', 'ORDINAL'), ('82', 'CARDINAL'), ('Rome', 'GPE')"
"The
 humble Christians were sent into the world as sheep among
 wolves; and since they were not permitted to employ force
 even in the defence of their religion, they should be still
 more criminal if they were tempted to shed the blood of
 their fellow-creatures in disputing the vain privileges or
 the sordid possessions of this transitory life.","('Christians', 'NORP')"
"The
 impenitent sinners more cruel than Phalaris or Sennacherib,
 more destructive than war, pestilence, or a cloud of
 locusts, are deprived of the name and privileges of
 Christians, of the participation of the sacraments, and of
 the hope of Paradise.","('Phalaris', 'NORP'), ('Sennacherib', 'NORP'), ('Christians', 'NORP')"
"The 
 fugitive, and even guilty, suppliants were permitted to
 implore either the justice or the mercy of the Deity and his
 ministers.","('Deity', 'PERSON')"
"The 
 safety of the labarum was intrusted to fifty guards of
 approved valour and fidelity their station was marked by
 honours and emoluments; and some fortunate accidents soon
 introduced an opinion that as long as the guards of the
 labarum were engaged in the execution of their office they
 were secure and invulnerable amidst the darts of the enemy.","('fifty', 'CARDINAL')"
"The Catholic church was administered by the spiritual and
 legal jurisdiction of eighteen hundred bishops(86) of whom 
 one thousand were seated in the Greek, and eight hundred in
 the Latin, provinces of the empire.","('Catholic', 'NORP'), ('eighteen hundred', 'CARDINAL'), ('86', 'CARDINAL'), ('one thousand', 'CARDINAL'), ('Greek', 'NORP'), ('eight hundred', 'CARDINAL'), ('Latin', 'NORP')"
"The Christian fable of Eusebius,
 which, in the space of twenty-six years, might arise A.D. 338 from
 the original dream, is cast in a much more correct and
 elegant mould.","('Christian', 'NORP'), ('Eusebius', 'PERSON'), ('twenty-six years', 'DATE'), ('A.D. 338', 'DATE')"
"The Christianity of 
 Constantine must be allowed in a much more vague and
 qualified sense; and the nicest accuracy is required in
 tracing the slow and almost imperceptible gradations by
 which the monarch declared himself the protector, and at
 length the proselyte, of the church.","('Christianity', 'NORP'), ('Constantine', 'PERSON')"
"The Christians had been obliged to elect their own
 magistrates, to raise and distribute a peculiar revenue, and
 to regulate the internal policy of their republic by a code
 of laws, which were ratified by the consent of the people
 and the practice of three hundred years.","('Christians', 'NORP'), ('three hundred years', 'DATE')"
"The Christians not only recovered 
 the lands and houses of which they had been stripped by the
 persecuting laws of Diocletian, but they acquired a perfect
 title to all the possessions which they had hitherto enjoyed
 by the connivance of the magistrate.","('Christians', 'NORP'), ('Diocletian', 'PERSON')"
"The Christians of Persia were
 suspected, in time of war, of preferring their religion to
 their country; but as long as peace subsisted between the
 two empires, the persecuting spirit of the Magi was
 effectually restrained by the interposition of Constantine.
 (77)","('Christians', 'NORP'), ('Persia', 'GPE'), ('two', 'CARDINAL'), ('Magi', 'PERSON'), ('Constantine', 'PERSON'), ('77', 'CARDINAL')"
"The Goths and Germans, who enlisted under the standard of Rome, revered the cross which glittered at the head of the
 legions, and their fierce countrymen received at the same
 time the lessons of faith and of humanity.","('Goths', 'NORP'), ('Germans', 'NORP'), ('Rome', 'GPE')"
"The Labarum, or standard of the cross..","('Labarum', 'PRODUCT')"
"The Latin clergy, who erected their tribunal on the
 ruins of the civil and common law, have modestly accepted,
 as the gift of Constantine,(110) the independent jurisdiction 
 which was the fruit of time, of accident, and of their own
 industry.","('Latin', 'NORP'), ('Constantine', 'PERSON'), ('110', 'CARDINAL')"
"The Pagan orator, who had 
 seized an earlier opportunity of celebrating the virtues of
 the conqueror, supposes that he alone enjoyed a secret and
 intimate commerce with the Supreme Being, who delegated the
 care of mortals to his subordinate deities; and thus assigns
 a very plausible reason why the subjects of Constantine
 should not presume to embrace the new religion of their
 sovereign.","('Pagan', 'NORP'), ('Constantine', 'PERSON')"
"The Protestant and philosophic readers of the present age
 will incline to believe that, in the account of his own
 conversion, Constantine attested a wilful falsehood by a
 solemn and deliberate perjury.","('Protestant', 'NORP'), ('Constantine', 'PERSON')"
"The Sun was universally celebrated as the invincible
 guide and protector of Constantine; and the Pagans might
 reasonably expect that the insulted god would pursue with
 unrelenting vengeance the impiety of his ungrateful
 favourite.(12)
He protects the Christians of Gaul.","('Sun', 'PERSON'), ('Constantine', 'PERSON'), ('Pagans', 'NORP'), ('Christians', 'NORP'), ('Gaul', 'PERSON')"
"The altars of Apollo were crowned with the
 votive offerings of Constantine; and the credulous multitude
 were taught to believe that the emperor was permitted to
 behold with mortal eyes the visible majesty of their tutelar
 deity; and that, either waking or in a vision, he was
 blessed with the auspicious omens of a long and victorious
 reign.","('Apollo', 'LOC'), ('Constantine', 'PERSON')"
"The assurance that the elevation of Constantine was
 intimately connected with the designs of Providence
 instilled into the minds of the Christians two opinions,
 which, by very different means, assisted the accomplishment
 of the prophecy.","('Constantine', 'PERSON'), ('Providence', 'GPE'), ('Christians', 'NORP'), ('two', 'CARDINAL')"
"The authority of the church 
 might alone have had sufficient weight to justify the
 devotion of Constantine, who, in the same prudent and
 gradual progress, acknowledged the truth and assumed the
 symbol of Christianity.","('Constantine', 'PERSON'), ('Christianity', 'NORP')"
"The awful mysteries of the Christian faith and worship were
 concealed from the eyes of strangers, and even of
 catechumens, with an affected secrecy, which served to
 excite their wonder and curiosity.(63)","('Christian', 'NORP')"
"The bishops and
 teachers of the new sect, whose dress and manners had not
 qualified them for the residence of a court, were admitted
 to the Imperial table; they accompanied the monarch in his
 expeditions; and the ascendant which one of them, an
 Egyptian or a Spaniard, (55) acquired over his mind was 
 imputed by the Pagans to the effect of magic.(56) Lactantius, 
 who has adorned the precepts of the Gospel with the
 eloquence of Cicero, (57) and Eusebius, who has consecrated 
 the learning and philosophy of the Greeks to the service of
 religion,(58) were both received into the friendship and 
 familiarity of their sovereign; and those able masters of
 controversy could patiently watch the soft and yielding
 moments of persuasion, and dexterously apply the arguments
 which were the best adapted to his character and
 understanding.","('Imperial', 'NORP'), ('one', 'CARDINAL'), ('Egyptian', 'NORP'), ('Spaniard', 'NORP'), ('55', 'DATE'), ('Pagans', 'NORP'), ('Lactantius', 'PERSON'), ('Gospel', 'WORK_OF_ART'), ('Cicero', 'PERSON'), ('57', 'DATE'), ('Eusebius', 'PERSON'), ('Greeks', 'NORP'), ('58', 'CARDINAL')"
"The bishops of Gaul and Spain, of Thrace
 and Pontus, reigned over an ample territory, and delegated
 their rural suffragans to execute the subordinate duties of
 the pastoral office. (87)","('Gaul', 'GPE'), ('Spain', 'GPE'), ('Thrace', 'GPE'), ('Pontus', 'GPE'), ('87', 'CARDINAL')"
"The bishops whom he summoned in his last
 illness to the palace of Nicomedia were edified by the
 fervour with which he requested and received the sacrament
 of baptism, by the solemn protestation that the remainder of
 his life should be worthy of a disciple of Christ, and by
 his humble refusal to wear the Imperial purple after he had
 been clothed in the white garment of a Neophyte.","('Nicomedia', 'PERSON'), ('Christ', 'PERSON'), ('Imperial', 'NORP'), ('Neophyte', 'PRODUCT')"
"The bishops(95) (till the abuse 
 was restrained by the prudence of the laws) might constrain
 the reluctant and protect the distressed, and the imposition
 of hands for ever bestowed some of the most valuable
 privileges of civil society.","('95', 'DATE')"
"The church of Ptolemais, obscure
 and contemptible as she may appear, addresses this
 declaration to all her sister churches of the world; and the
 profane who reject her decrees will be involved in he guilt
 and punishment of Andronicus and his impious followers.","('Ptolemais', 'GPE'), ('Andronicus', 'PERSON')"
"The clergy 
 of Rome, Alexandria, Thessalonica, etc., might solicit and
 obtain some partial exemptions; but the premature attempt of
 the great council of Rimini, which aspired to universal
 freedom, was successfully resisted by the son of
 Constantine.(109)
Civil Jurisdiction.","('Rome', 'GPE'), ('Alexandria', 'GPE'), ('Thessalonica', 'GPE'), ('Rimini', 'GPE'), ('Constantine', 'PERSON'), ('109', 'CARDINAL')"
"The colonies of Jews who had penetrated into Arabia and
 Ethiopia(78) opposed the progress of Christianity; but the 
 labour of the missionaries was in some measure facilitated
 by a previous knowledge of the Mosaic revelation; and
 Abyssinia still reveres the memory of Frumentius, who, in
 the time of Constantine, devoted his life to the conversion
 of those sequestered regions.","('Jews', 'NORP'), ('Arabia', 'GPE'), ('Ethiopia', 'GPE'), ('78', 'DATE'), ('Christianity', 'NORP'), ('Mosaic', 'NORP'), ('Abyssinia', 'PERSON'), ('Frumentius', 'PERSON'), ('Constantine', 'PERSON')"
"The conquest of Italy produced a General Edict, A.D. 324 general edict of toleration; and as soon as the defeat of Licinius had invested Constantine with the sole dominion of the Roman
 world, he immediately, by circular letters, exhorted all his
 subjects to imitate, without delay, the example of their
 sovereign, and to embrace the divine truth of Christianity.
 (24)","('Italy', 'GPE'), ('General Edict', 'ORG'), ('324', 'CARDINAL'), ('Licinius', 'PERSON'), ('Constantine', 'PERSON'), ('Roman', 'NORP'), ('Christianity', 'NORP'), ('24', 'CARDINAL')"
"The conversion of the
 magistrates themselves, and of the whole empire, might
 gradually remove the fears and scruples of the Christians.","('Christians', 'NORP')"
"The convocation of provincial synods was
 prohibited in his dominions; his Christian officers were
 ignominiously dismissed; and if he avoided the guilt, or
 rather danger, of a general persecution, his partial
 oppressions were rendered still more odious by the violation
 of a solemn and voluntary engagement. (23)","('Christian', 'NORP')"
"The corruption of taste and
 language is strongly marked in the vehement declamations of
 the Latin bishops; but the compositions of Gregory and
 Chrysostom have been compared with the most splendid models
 of Attic, or at least of Asiatic, eloquence.(124)","('Latin', 'NORP'), ('Gregory', 'PERSON'), ('Chrysostom', 'PERSON'), ('Asiatic', 'NORP'), ('124', 'CARDINAL')"
"The discipline of the West was indeed less relaxed
 than that of the East; but the same passions which made
 those regulations necessary rendered them ineffectual.","('West', 'LOC'), ('East', 'LOC')"
"The discretion of parents often suspended the
 baptism of their children till they could understand the
 obligations which they contracted: the severity of ancient
 bishops exacted from the new converts a novitiate of two or
 three years; and the catechumens themselves, from different
 motives of a temporal or a spiritual nature, were seldom
 impatient to assume the character of perfect and initiated
 Christians.","('two or\r\n three years', 'DATE'), ('Christians', 'NORP')"
"The ecclesiastical revenues of
 each diocese were divided into four parts, for the
 respective uses of the bishop himself, of his inferior
 clergy, of the poor, and of the public worship; and the
 abuse of this sacred trust was strictly and repeatedly
 checked.(107)","('four', 'CARDINAL')"
"The edict of Milan secured the revenue as well as the
 peace of the church.","('Milan', 'GPE')"
"The education which he
 bestowed on his sons and nephews secured to the empire a
 race of princes whose faith was still more lively and
 sincere, as they imbibed, in their earliest infancy, the
 spirit, or at least the doctrine, of Christianity.","('Christianity', 'NORP')"
"The eloquent Lactantius, in the
 midst of his court.","('Lactantius', 'PERSON')"
"The eloquent apologist seemed
 firmly to expect, and almost ventured to promise, that the
 establishment of Christianity would restore the innocence
 and felicity of the primitive age; that the worship of the
 true God would extinguish war and dissension among those who
 mutually considered themselves as the children of a common
 parent; that every impure desire, every angry or selfish
 passion, would be restrained by the knowledge of the Gospel;
 and that the magistrates might sheath the sword of justice
 among a people who would be universally actuated by the
 sentiments of truth and piety, of equity and moderation, of
 harmony and universal love.(17)
Theory and practice of passive obedience..","('Christianity', 'NORP')"
"The emperor
 acquaints him that the treasurers of the province are
 directed to pay into his hands the sum of three thousand
 folles, or eighteen thousand pounds sterling, and to obey
 his farther requisitions for the relief of the churches of
 Africa, Numidia and Mauritania. (103)","('three thousand', 'CARDINAL'), ('eighteen thousand pounds', 'QUANTITY'), ('Africa', 'LOC'), ('Numidia', 'GPE'), ('Mauritania', 'GPE'), ('103', 'CARDINAL')"
"The emperor might be 
 saluted as the father of his people, but he owed a filial
 duty and reverence to the fathers of the church; and the
 same marks of respect which Constantine had paid to the
 persons of saints and confessors were soon exacted by the
 pride of the episcopal order.(84) A secret conflict between 
 the civil and ecclesiastical jurisdictions embarrassed the
 operations of the Roman government; and a pious emperor was
 alarmed by the guilt and danger of touching with a profane
 hand the ark of the covenant.","('Constantine', 'PERSON'), ('84', 'CARDINAL'), ('Roman', 'NORP')"
