Sentence,Entities
"This remarkable behaviour divulged the
 real condition of Maria, who, in the absence of the bishop
 of Cyrrhus, was redeemed from slavery by the generosity of
 some soldiers of the garrison.","('Maria', 'PERSON'), ('Cyrrhus', 'PERSON')"
"Three hundred bishops, (17) with many thousands of the 
 inferior clergy, were torn from their churches, stripped of
 their ecclesiastical possessions, banished to the islands,
 and proscribed by the laws, if they presumed to conceal
 themselves in the provinces of Africa.","('Three hundred', 'CARDINAL'), ('17', 'CARDINAL'), ('many thousands', 'CARDINAL'), ('Africa', 'LOC')"
"Under these 
 circumstances Genseric, a Christian, but an enemy of the
 orthodox communion, showed himself to the Donatists as a
 powerful deliverer, from whom they might reasonably expect
 the repeal of the odious and oppressive edicts of the Roman
 emperors.(21) The conquest of Africa was facilitated by the 
 active real or the secret favour of a domestic faction; the
 wanton outrages against the churches and the clergy, of
 which the Vandals are accused, may be fairly imputed to the
 fanaticism of their allies; and the intolerant spirit which
 disgraced the triumph of Christianity contributed to the
 loss of the most important province of the West.(22)","('Genseric', 'PERSON'), ('Christian', 'NORP'), ('Donatists', 'NORP'), ('Roman', 'NORP'), ('21', 'CARDINAL'), ('Africa', 'LOC'), ('Vandals', 'NORP'), ('Christianity', 'NORP'), ('22', 'CARDINAL')"
"Vanquished in
 battle by an inferior enemy, Castinus fled with dishonour to
 Tarragona; and this memorable defeat, which has been
 represented as the punishment, was most probably the effect,
 of his rash presumption.","('Castinus', 'PERSON'), ('Tarragona', 'GPE')"
"When the city, some months after his
 death was burnt by the Vandals, the library was fortunately
 saved which contained his voluminous writings—two hundred
 and thirty-two separate books or treatises on theological
 subjects, besides a complete exposition of the Psalter and
 the gospel, and a copious magazine of epistles and homilies.
 (27)","('some months', 'DATE'), ('Vandals', 'PRODUCT'), ('two hundred\r\n and thirty-two', 'CARDINAL'), ('Psalter', 'WORK_OF_ART'), ('27', 'CARDINAL')"
"When the emperor Decius persecuted the 
 Christians, seven noble youths of Ephesus concealed
 themselves in a spacious cavern in the side of an adjacent
 mountain where they were doomed to perish by the tyrant, who
 gave orders that the entrance should be firmly secured with
 a pile of huge stones.","('Decius', 'PERSON'), ('Christians', 'NORP'), ('seven', 'CARDINAL'), ('Ephesus', 'GPE')"
"While the ministers of Constantinople deliberated, the
 vacant throne of Honorius was usurped by the ambition of a
 stranger.","('Constantinople', 'GPE'), ('Honorius', 'PERSON')"
"Within a few months
 after the arrival of Placidia a swift messenger announced
 the death of Honorius, the consequence of a dropsy; but the
 important secret was not divulged till the necessary orders
 had been despatched for the march of a large body of troops
 to the sea-coast of Dalmatia.","('a few months', 'DATE'), ('Placidia', 'GPE'), ('Honorius', 'PERSON'), ('Dalmatia', 'GPE')"
"Yet I shall not easily be
 persuaded that it was the common practice of the Vandals to
 extirpate the olives and other fruit trees of a country
 where they intended to settle: nor can I believe that it
 was a usual stratagem to slaughter great numbers of their
 prisoners before the walls of a besieged city, for the sole
 purpose of infecting the air and producing a pestilence, of
 which they themselves must have been the first victims.(24)
Siege of Hippo, A.D. 430, May.","('Vandals', 'NORP'), ('first', 'ORDINAL'), ('24', 'CARDINAL'), ('Siege of Hippo', 'WORK_OF_ART'), ('430', 'CARDINAL'), ('May', 'DATE')"
"Yet this
 incident, unfortunate as it might seem, facilitated the
 conquest of Italy.","('Italy', 'GPE')"
"Yet this various
 multitude amounted only to fifty thousand effective men; and
 though Genseric artfully magnified his apparent strength by
 appointing eighty chiliarchs, or commanders of thousands,
 the fallacious increase of old men, of children, and of
 slaves, would scarcely have swelled his army to the number
 of four-score thousand persons.(14) But his own dexterity and 
 the discontents of Africa soon fortified the Vandal powers
 by the accession of numerous and active allies.","('fifty thousand', 'CARDINAL'), ('Genseric', 'PERSON'), ('eighty', 'CARDINAL'), ('thousands', 'CARDINAL'), ('four-score thousand', 'CARDINAL'), ('14', 'CARDINAL'), ('Africa', 'LOC'), ('Vandal', 'PERSON')"
"was gently released, in the third month of
 the siege and in the seventy-sixth year of his age, from the
 actual and the impending calamities of his country.","('the third month', 'DATE'), ('the seventy-sixth year', 'DATE')"
