Sentence,Entities
"His guards
 and freedmen, the ministers of his serious business, and the
 companions of his looser hours, those who by his interest
 had been promoted to any commands in the army or provinces,
 with the long-connected chain of their dependents, were
 included in the proscription; which endeavoured to reach
 every one who had maintained the smallest correspondence
 with Geta, who lamented his death, or who even mentioned his
 name.(26) Helvius Pertinax, son to the prince of that name, 
 lost his life by an unseasonable witticism. (27)","('hours', 'TIME'), ('Geta', 'PERSON'), ('Helvius Pertinax', 'PERSON')"
"His memory was branded with eternal infamy
 by the senate; the justice of whose decree has been ratified
 by posterity.(62)
Accession of Alexander Severus.","('Alexander Severus', 'PERSON')"
"His own troops seemed
 to take the field with faintness and reluctance; but (A.D.
 218, June 7), in the heat of the battle,(49) the Praetorian 
 guards, almost by an involuntary impulse, asserted the
 superiority of their valour and discipline.","('218', 'CARDINAL'), ('June 7)', 'DATE'), ('49', 'CARDINAL'), ('Praetorian', 'NORP')"
"His relation to the
 family of Severus, whose name he assumed, was the same as
 that of his predecessor; his virtue and his danger had
 already endeared him to the Romans, and the eager liberality
 of the senate conferred upon him, in one day, the various
 titles and powers of tin Imperial dignity. (63)","('Severus', 'PERSON'), ('Romans', 'NORP'), ('one day', 'DATE')"
"His table was served with
 the most frugal simplicity; and whenever he was at liberty
 to consult his own inclination, the company consisted of a
 few select friends, men of learning and virtue, amongst whom
 Ulpian was constantly invited.","('Ulpian', 'PERSON')"
"His unalterable regard for his mother,
 and his esteem for the wise Ulpian, guarded his
 inexperienced youth from the poison of flattery.","('Ulpian', 'PERSON')"
"His unbounded liberality flowed not,
 however, from the sentiments of a generous mind; it was the
 sordid result of avarice, and will naturally be illustrated
 by some observations on the finances of that state, from the
 victorious ages of the commonwealth to the reign of
 Alexander Severus.","('Alexander Severus', 'PERSON')"
"His virtues as
 well as the vices of Elagabalus, contracted a tincture of
 weakness and effeminacy from the soft climate of Syria, of
 which he was a native; though he blushed at his foreign
 origin, and listened with a vain complacency to the
 flattering genealogists, who derived his race from the
 ancient stock of Roman nobility.(79)","('Elagabalus', 'PERSON'), ('Syria', 'GPE'), ('Roman', 'NORP'), ('79', 'CARDINAL')"
"His wife the empress Julia
 Like most of the Africans, Severus was passionately addicted
 to the vain studies of magic and divination, deeply versed
 in the interpretation of dreams and omens, and perfectly
 acquainted with the science of judicial astrology; which, in
 almost every age, except the present, has maintained its
 dominion over the mind of man.","('Julia', 'PERSON'), ('Africans', 'NORP'), ('Severus', 'PERSON')"
"History has never perhaps suffered a greater or more
 irreparable injury, than in the loss of the curious register
 bequeathed by Augustus to the senate, in which that
 experienced prince so accurately balanced the revenues and
 expenses of the Roman empire.(85) Deprived of this clear and 
 comprehensive estimate, we are reduced to collect a few
 imperfect hints from such of the ancients as have
 accidentally turned aside from the splendid to the more
 useful parts of history.","('Augustus', 'PERSON'), ('Roman', 'NORP'), ('85', 'CARDINAL')"
"I. In a great empire like that of Rome, a natural balance of
 money must have gradually established itself.","('Rome', 'GPE')"
"Impatient of any delay or division of empire, he attempted,
 more than once, to shorten the small remainder of his
 father's days, and endeavoured, but without success, to
 excite a mutiny among the troops.","('days', 'DATE')"
"In
 Illyricum, in Mauritania, in Armenia, in Mesopotamia, in Germany, fresh mutinies perpetually broke out; his officers were murdered, his authority was insulted, and his life at last sacrificed to the fierce discontents of the army. (76)","('Illyricum', 'GPE'), ('Mauritania', 'GPE'), ('Armenia', 'GPE'), ('Mesopotamia', 'GPE'), ('Germany', 'GPE')"
"In a hasty sally of passion, Elagabalus resolved to execute by force what he had been unable to compass by fraud, and by a despotic sentence degraded his cousin from the rank and honours of Caesar.","('Elagabalus', 'PERSON'), ('Caesar', 'PERSON')"
"In a magnificent temple
 raised on the Palatine Mount, the sacrifices of the god of
 Elagabalus were celebrated with every circumstance of cost
 and solemnity.","('the Palatine Mount', 'LOC'), ('Elagabalus', 'PERSON')"
"In a solemn procession through
 the streets of Rome, the way was strewed with gold dust; the
 black stone, set in precious gems, was placed on a chariot
 drawn by six milk-white horses richly caparisoned.","('Rome', 'GPE'), ('six', 'CARDINAL')"
"In every age and country, the wiser, or at least the
 stronger, of the two sexes, has usurped the powers of the
 state, and confined the other to the cares and pleasures of
 domestic life.","('two', 'CARDINAL')"
"In full assurance of his
 virtues and abilities Severus, on his deathbed, had conjured
 him to watch over the prosperity and union of the Imperial
 family.(29)","('Severus', 'PERSON'), ('Imperial', 'ORG'), ('29', 'CARDINAL')"
"In hereditary monarchies, however, and
 especially in those of modern Europe, the gallant spirit of
 chivalry, and the law of succession, have accustomed us to
 allow a singular exception; and a woman is often
 acknowledged the absolute sovereign of a great kingdom, in
 which she would be deemed incapable of exercising the
 smallest employment; civil or military.","('Europe', 'LOC')"
"In the
 midst of their conversation, some centurions, who had
 contrived to conceal themselves, rushed with drawn swords
 upon the unfortunate Geta.","('Geta', 'PERSON')"
"In the
and abolition of the tribute on Roman citizens  course of a few years, the riches of Syracuse, of Carthage,
of Macedonia, and of Asia, were brought in triumph to Rome.","('Roman', 'NORP'), ('a few years', 'DATE'), ('Syracuse', 'GPE'), ('Carthage', 'GPE'), ('Macedonia', 'GPE'), ('Asia', 'LOC'), ('Rome', 'GPE')"
"In the anguish
of a disappointed father, Severus foretold that the weaker of his sons would fall a sacrifice to the stronger; who, in his turn, would be ruined by his own vices.(11)
The Caledonian war.","('Severus', 'PERSON'), ('11', 'CARDINAL'), ('The Caledonian war', 'EVENT')"
"In the choice 
 of a second, he sought only to connect himself with some
 favourite of fortune; and as soon as he had discovered that
 a young lady of Emesa in Syria had a royal nativity he
 solicited, and obtained her hand.(4) Julia Domna (for that 
 was her name) deserved all that the stars could promise her.","('second', 'ORDINAL'), ('Emesa', 'PERSON'), ('Syria', 'GPE'), ('Julia Domna', 'PERSON')"
"In the civil administration of Alexander, wisdom was
 enforced by power, and the people, sensible of the public
 felicity, repaid their benefactor with their love and
 gratitude.","('Alexander', 'PERSON')"
"In the first and golden years of the reign of Nero, that
 prince, from a desire of popularity, and perhaps from a
 blind impulse of benevolence conceived a wish of abolishing
 the oppression of the customs and excise.","('the first and golden years', 'DATE'), ('Nero', 'PERSON')"
"In the management of this necessary reformation, Macrinus
 proceeded with a cautious prudence, which would have
 restored health and vigour to the Roman army, in an easy and
 almost imperceptible manner.","('Macrinus', 'ORG'), ('Roman', 'NORP')"
"In the midst of peace, and upon the slightest 
 provocation, he issued his commands, at Alexandria in Egypt,
 for a general massacre.","('Alexandria', 'GPE'), ('Egypt', 'GPE')"
"In the reign of Augustus and his successors,
 duties were imposed on every kind of merchandise, which
 through a thousand channels flowed to the great centre of
 opulence and luxury; and in whatsoever manner the law was
 expressed, it was the Roman purchaser, and not the
 provincial merchant, who paid the tax.(97)","('Augustus', 'PERSON'), ('a thousand', 'CARDINAL'), ('Roman', 'NORP')"
"In the room of Elagabalus, his cousin Alexander was raised
 to the throne by the Praetorian guards.","('Elagabalus', 'GPE'), ('Alexander', 'PERSON'), ('Praetorian', 'NORP')"
"In the second rank that amiable prince soon acquired the affections of the public, and excited the tyrant's jealousy, who resolved to terminate the dangerous competition, either by corrupting the manners, or by taking away the life, of his rival.","('second', 'ORDINAL')"
"In their marches he relaxed the severe obligation of
 carrying seventeen days' provision on their shoulders.","('seventeen days', 'DATE')"
"In these circumstances the intelligence of a war in Britain
 and of an invasion (A.D. 208) of the province by the
 barbarians of the North, was received with pleasure by
 Severus.","('Britain', 'GPE'), ('208', 'CARDINAL'), ('North', 'LOC'), ('Severus', 'PERSON')"
"Instead of
 a twentieth, he exacted a tenth of all legacies and
 inheritances; and during his reign (for the ancient
 proportion was restored after his death) he crushed alike
 every part of the empire under the weight of his iron
 sceptre.(114)","('twentieth', 'DATE'), ('a tenth', 'CARDINAL'), ('114', 'CARDINAL')"
"It
 had hitherto been considered as a fundamental maxim of the
 constitution, that the emperor must be always chosen in the
 senate, and the sovereign power, no longer exercised by the
 whole body, was always delegated to one of its members.","('one', 'CARDINAL')"
"It became the
 honourable appellation of the sons of Severus, was bestowed
 on young Diadumenianus, and at length prostituted to the
 infamy of the high priest of Emesa.","('Severus', 'PERSON'), ('Diadumenianus', 'PERSON'), ('Emesa', 'PERSON')"
"It did not take place unless
 the object was of a certain value, most probably of fifty or
 an hundred pieces of gold,(103) nor could it be exacted from 
 the nearest of kin on the father's side.(104)","('fifty or\r\n an hundred', 'CARDINAL'), ('103', 'CARDINAL'), ('104', 'CARDINAL')"
"It had hitherto been the peculiar felicity of the Romans,
 and in the worst of times their consolation, that the virtue
 of the emperors was active, and their vice indolent.","('Romans', 'NORP')"
"It is impossible to conjecture the motive that engaged him to spare so trifling a remnant of the public evil, but the noxious weed, which had not been totally eradicated, again sprang up with the most luxuriant
growth, and in the succeeding age darkened the Roman world with its deadly shade.","('Roman', 'NORP')"
"It is not
 easy to determine whether, on this occasion, he acted as the
 common father of the Roman world, or as the oppressor of
 liberty; whether he wished to relieve the provinces, or to
 impoverish the senate and the equestrian order.","('Roman', 'NORP')"
"It is scarcely
 necessary to add, that his son Diadumenianus was involved in
 the same fate.","('Diadumenianus', 'PERSON')"
"It may seem probable, the vices and follies of Elagabalus
 have been adorned by fancy, and blackened by prejudice.(60)","('Elagabalus', 'GPE')"
"It seldom
 exceeded one per cent.; but it comprehended whatever was
 sold in the markets or by public auction, from the most
 considerable purchases of lands and houses to those minute
 objects which can only derive a value from their infinite
 multitude and daily consumption.","('one per cent', 'PERCENT')"
"It was
 impossible that it could long subsist between two implacable
 enemies, who neither desired nor could trust a
 reconciliation.","('two', 'CARDINAL')"
"It was a 
 sufficient crime of Thrasea Priscus, to be descended from a
 family in which the love of liberty seemed an hereditary
 quality.(28)","('Thrasea Priscus', 'PERSON')"
"It was agreed that Caracalla, as
 the elder brother, should remain in possession of Europe and
 the western Africa; and that he should relinquish the
 sovereignty of Asia and Egypt to Geta, who might fix his
 residence at Alexandria or Antioch, cities little inferior
 to Rome itself in wealth and greatness; that numerous armies
 should be constantly encamped on either side of the Thracian
 Bosphorus, to guard the frontiers of the rival monarchies;
 and that the senators of European extraction should
 acknowledge the sovereign of Rome, whilst the natives of
 Asia followed the emperor of the East.","('Caracalla', 'PERSON'), ('Europe', 'LOC'), ('Africa', 'LOC'), ('Asia', 'LOC'), ('Egypt', 'GPE'), ('Geta', 'PERSON'), ('Alexandria', 'GPE'), ('Antioch', 'GPE'), ('Rome', 'GPE'), ('the Thracian\r\n Bosphorus', 'LOC'), ('European', 'NORP'), ('Rome', 'GPE'), ('Asia', 'LOC'), ('East', 'LOC')"
"It was computed that, under the
 vague appellation of the friends of Geta, above twenty
 thousand persons of both sexes suffered death.","('Geta', 'PERSON'), ('twenty\r\n thousand', 'CARDINAL')"
"It was impossible that such a character, and such a conduct
 as that of Caracalla, could inspire either love or esteem;
 but as long as his vices were beneficial to the armies, he
 was secure from the danger of rebellion.","('Caracalla', 'PERSON')"
"It was impossible that such a reconciliation should last, or
 that even the mean soul of Elagabalus could hold an empire
 on such humiliating terms of dependence.","('Elagabalus', 'GPE')"
"It was reserved for the virtue of Alexander to relieve them in a great measure from this intolerable grievance, by reducing the tributes to a thirtieth part of the sum exacted at the time of his accession.","('Alexander', 'PERSON')"
"Julia Maosa, her
 sister, was ordered to leave the court and Antioch.(46)","('Julia Maosa', 'PERSON'), ('Antioch', 'GPE')"
"Learning, 
 and the love of justice, became the only recommendations 
 for civil offices; valour, and the love of discipline, the 
 only qualifications for military employments.(68)
Education and virtuous temper of Alexander.","('Alexander', 'PERSON')"
Licentiousness of the Army.,"('Army', 'ORG')"
"Macrinus
 read his fate, and resolved to prevent it.","('Macrinus', 'PERSON')"
Macrinus attempts a reformation of the army.,"('Macrinus', 'PERSON')"
"Malice or fanaticism had suggested to an African, deeply
 skilled in the knowledge of futurity, a very dangerous
 prediction, that Macrinus and his son were destined to reign
 over the empire.","('African', 'NORP'), ('Macrinus', 'PERSON')"
"Mention is made of a mine near Carthagena which yielded every day twenty-five thousand drachms of silver, or about three hundred thousand pounds a year.(93) Twenty thousand pound weight of gold was annually received from the provinces of Asturia, Gallicia, and Lusitania.(94)
of the isle of Gyarus","('Carthagena', 'GPE'), ('twenty-five thousand drachms', 'QUANTITY'), ('about three hundred thousand pounds', 'QUANTITY'), ('93', 'CARDINAL'), ('Twenty thousand pound', 'QUANTITY'), ('Asturia', 'GPE'), ('Gallicia', 'GPE'), ('Lusitania', 'GPE'), ('94', 'CARDINAL'), ('Gyarus', 'GPE')"
Murder of Caracalla.,"('Caracalla', 'PERSON')"
"Neither business, nor
 pleasure, nor flattery, could defend Caracalla from the
 stings of a guilty conscience; and he confessed, in the
 anguish of a tortured mind, that his disordered fancy often
 beheld the angry forms of his father and his brother rising
 into life, to threaten and upbraid him.(25)","('Caracalla', 'PERSON')"
"New terms and new
 inventions in these sciences, the only ones cultivated and
 patronised by the monarch, (56) signalised his reign, and 
 transmitted his infamy to succeeding times.","('56', 'DATE')"
"Nor was the rapacious son of
Severus contented with such a measure of taxation, as had
appeared sufficient to his moderate predecessors.","('Severus', 'PERSON')"
"Notwithstanding his advanced
 age (for he was above threescore), and his gout, which
 obliged him to be carried in a litter, he transported
 himself in person into that remote island, attended by his
 two sons, his whole court, and a formidable army.","('two', 'CARDINAL')"
"Notwithstanding the respectful civility
 expressed by the usurper towards the widow of Severus, she
 descended with a painful struggle into the condition of a
 subject, and soon withdrew herself by a voluntary death from
 the anxious and humiliating dependence.","('Severus', 'PERSON')"
"Notwithstanding this act of jealous cruelty, as well as some
 instances of avarice, with which Mamaea is charged, the
 general tenor of her administration was equally for the
 benefit of her son and of the empire.","('Mamaea', 'PERSON')"
"Of the
 several impositions introduced by Augustus, the twentieth on
 inheritances and legacies was the most fruitful, as well as
 the most comprehensive.","('Augustus', 'PERSON'), ('twentieth', 'ORDINAL')"
"On their arrival at Rome,
 they immediately divided the vast extent of the Imperial
 palace.(18) No communication was allowed between their 
 apartments: the doors and passages were diligently
 fortified, and guards posted and relieved with the same
 strictness as in a besieged place.","('Rome', 'GPE'), ('Imperial', 'NORP'), ('18', 'CARDINAL')"
"One dangerous maxim, worthy of  a tyrant, was remembered and abused by Caracalla, ""To secure
 the affections of the army, and to esteem the rest of his subjects as of little moment.""  (37)","('One', 'CARDINAL'), ('Caracalla', 'PERSON'), ('37', 'CARDINAL')"
"One fatal error destroyed the 
 salutary effects of this judicious plan.","('One', 'CARDINAL')"
"Our constant attention to that
 great object will not suffer us to overlook a most important
 edict of Antoninus Caracalla, which communicated to all the
 free inhabitants of the empire the name and privileges of
 Roman citizens.","('Antoninus Caracalla', 'PERSON'), ('Roman', 'NORP')"
"Pallas had been first chosen for his comfort; but as it was dreaded lest her warlike  terrors might affright the soft delicacy of a Syrian deity,  the Moon, adored by the Africans under the name of Astarte, was deemed a more suitable companion for the Sun.","('Pallas', 'PERSON'), ('first', 'ORDINAL'), ('Syrian', 'NORP'), ('Moon', 'PERSON'), ('Africans', 'NORP'), ('Astarte', 'PERSON'), ('Sun', 'PERSON')"
"Perhaps, if the
 singular transaction had been investigated by the
 penetration of a philosophers, we should discover the secret
 causes which on that occasion authorised the boldness of the
 prince, and commanded the obedience of the troops; and
 perhaps, if it had been related by a judicious historian, we
 should find this action, worthy of Caesar himself, reduced
 nearer to the level of probability and the common standard
 of the character of Alexander Severus.","('Caesar', 'PERSON'), ('Alexander Severus', 'PERSON')"
Power of his mother Mamaea.,"('Mamaea', 'PERSON')"
"Refreshed by the use of the bath and a
 slight dinner, he resumed, with new vigour, the business of
 the day; and, till the hour of supper, the principal meal of
 the Romans, he was attended by his secretaries, with whom he
 read and answered the multitude of letters, memorials, and
 petitions, that must have been addressed to the master of
 the greatest part of the world.","('Romans', 'NORP')"
Remorse and cruelty of Caracalla,"('Caracalla', 'PERSON')"
"Seditions of the Praetorian guards, and murder of Ulpian.","('Praetorian', 'NORP'), ('Ulpian', 'PERSON')"
"She 
 retired to Emesa with an immense fortune, the fruit of
 twenty years' favour, accompanied by her two daughters,
 Soaemias and Mamma, each of whom was a widow, and each had
 an only son.","('Emesa', 'PERSON'), (""twenty years'"", 'DATE'), ('two', 'CARDINAL'), ('Soaemias', 'PERSON'), ('Mamma', 'PERSON')"
"Since the
 accession of Commodus, the Roman world had experienced,
 during a term of forty years, the successive and various
 vices of four tyrants.","('Commodus', 'EVENT'), ('Roman', 'NORP'), ('forty years', 'DATE'), ('four', 'CARDINAL')"
"Some pre-eminence of rank seems to have been allowed to the
 elder brother; but they both administered the empire with equal and independent power.(17)
Jealousy and hatred of the two emperors
 Such a divided form of government would have proved a source
 of discord between the most affectionate brothers.","('17', 'CARDINAL'), ('two', 'CARDINAL')"
"Some trifling
 accident blew up their discontent into a furious mutiny; and
 a civil war raged, during three days, in Rome, whilst the
 life of that excellent minister was defended by the grateful
 people.","('three days', 'DATE'), ('Rome', 'GPE')"
"Something of a doubtful mist still hangs over 
 these Highland traditions; nor can it be entirely dispelled
 by the most ingenious researches of modern criticism:(14) but 
 if we could, with safety, indulge the pleasing supposition,
 that Fingal lived, and that Ossian sung, the striking
 contrast of the situation and manners of the contending
 nations might amuse a philosophic mind.","('Highland', 'NORP'), ('14', 'CARDINAL'), ('Fingal', 'PERSON'), ('Ossian', 'PERSON')"
"Such a tax, plentiful as it must prove in every wealthy
 community, was most happily suited to the situation of the
 Romans, who could frame their arbitrary wills, according to
 the dictates of reason or caprice, without any restraint
 from the modern fetters of entails and settlements.","('Romans', 'NORP')"
"Such an uniform tenor of life, which left not a moment for
 vice or folly, is a better proof of the wisdom and justice
 of Alexander's government, than all the trifling details
 preserved in the compilation of Lampridius.","('Alexander', 'PERSON'), ('Lampridius', 'ORG')"
"Such intrepid virtue, which had escaped pure and unsullied from the intrigues of courts, the habits of business, and the arts of his profession, reflects more lustre on the memory of Papinian, than all his great employments, his numerous writings, and the superior reputation as a lawyer, which he has preserved through every age of the Roman jurisprudence.(32)
His tyranny extended over the whole empire","('Papinian', 'NORP'), ('Roman', 'NORP')"
"Such was the end of a monster whose life disgraced human nature, and whose reign accused the patience of the Romans.","('Romans', 'NORP')"
Such were not the maxims of government adopted by Caracalla and his pretended son.,"('Caracalla', 'PERSON')"
"Taxes on Roman citizens instituted by Augustus 
 Notwithstanding the seeming probability of both these
 conclusions, the latter of them at least is positively
 disowned by the language and conduct of Augustus.","('Roman', 'NORP'), ('Augustus', 'PERSON')"
"Terrified, at length, by the sight of some houses in
 flames, and by the threats of a general conflagration, the
 people yielded with a sigh, and left the virtuous, but
 unfortunate, Ulpian to his fate.","('Ulpian', 'NORP')"
"That amiable prince was sensible of; the obligation
 but as his gratitude was restrained within the limits of
 reason and justice, they soon were more dissatisfied with
 the virtues of Alexander, than they had ever been with the
 vices of Elagabalus.","('Alexander', 'PERSON'), ('Elagabalus', 'PERSON')"
"That magistrate, who had received
 the most pressing instructions to inform himself of the
 successors of Caracalla, immediately communicated the
 examination of the African to the Imperial court, which at
 that time resided in Syria.","('Caracalla', 'PERSON'), ('African', 'NORP'), ('Imperial', 'NORP'), ('Syria', 'GPE')"
"The
 artful Maosa saw and cherished their rising partiality, and
 readily sacrificing her daughter's reputation to the fortune
 of her grandson, she insinuated that Bassianus was the
 natural son of their murdered sovereign.","('Maosa', 'PERSON'), ('Bassianus', 'PERSON')"
"The
 bold assassin was instantly killed by a Scythian archer of the Imperial guard.","('Scythian', 'NORP'), ('Imperial', 'NORP')"
"The
 emperor received the letters from Rome; and as he was then
 engaged in the conduct of a chariot-race, he delivered them
 unopened to the Praetorian Praefect, directing him to
 dispatch the ordinary affairs, and to report the more
 important business that might be contained in them.","('Rome', 'GPE'), ('the Praetorian Praefect', 'ORG')"
"The
 master of the Roman world affected to copy the dress and
 manners of the female sex, preferred the distaff to the
 sceptre, and dishonoured the principal dignities of the
 empire by distributing them among his numerous lovers; one
 of whom was publicly invested with the title and authority
 of the emperor's, or, as he more properly styled himself, of
 the empress's husband.(59)
Contempt of decency which distinguished the Roman tyrants","('Roman', 'NORP'), ('one', 'CARDINAL'), ('Roman', 'NORP')"
"The
 principal commands of the army were filled by men who had
 received a liberal education, were well instructed in the
 advantages of laws and letters, and who had risen, by equal
 steps, through the regular succession of civil and military
 honours.(116)","('116', 'CARDINAL')"
"The
 rest of his reign was spent in the several provinces of the
 empire, particularly those of the East, and every province
 was by turns the scene of his rapine and cruelty.","('East', 'LOC')"
