Sentence,Entities
"The
 senators, compelled by fear to attend his capricious
 motions, were obliged to provide daily entertainments at an
 immense expense, which he abandoned with contempt to his
 guards and to erect, in every city, magnificent palaces and
 theatres, which he either disdained to visit, or ordered to
 be immediately thrown down.","('daily', 'DATE')"
"The
 specious letters in which the young conqueror announced his
 victory to the obedient senate, were filled with professions
 of virtue and moderation; the shining examples of Marcus and
 Augustus he should ever consider as the great rule of his
 administration; and he affected to dwell with pride on the
 striking resemblance of his own age and fortunes with those
 of Augustus, Who in the earliest youth had revenged by a
 successful war the murder of his father.","('Marcus', 'PERSON'), ('Augustus', 'PERSON'), ('Augustus', 'PERSON')"
"The
 veterans, instead of being flattered by the advantageous
 distinction, were alarmed by the first steps of the emperor,
 which they considered as the presage of his future
 intentions.","('first', 'ORDINAL')"
"The 
 substance, not the pageantry, of power was the object of
 Mamaea's manly ambition.","('Mamaea', 'PERSON')"
"The Caledonians at
 length yielded to the powerful and obstinate attack, sued
 for peace, and surrendered a part of their arms, and a large
 tract of territory.","('Caledonians', 'NORP')"
"The Patrician was executed on the ready accusation of
 treason, and the wife of Alexander driven with ignominy from
 the palace, and banished into Africa.(67)","('Patrician', 'PERSON'), ('Alexander', 'PERSON'), ('Africa', 'LOC')"
"The Phoenicians were acquainted only with the sea-coast of Spain; avarice, as well as ambition, carried the arms of Rome and Carthage into the heart of the country, and almost every part of the soil was found pregnant with copper, silver, and gold.","('Phoenicians', 'NORP'), ('Spain', 'GPE'), ('Rome', 'GPE'), ('Carthage', 'GPE')"
"The Praetorian guards swore to protect Alexander, and to revenge the dishonoured majesty of the throne.","('Praetorian', 'NORP'), ('Alexander', 'PERSON')"
"The Praetorian guards were attached to the Youth of
 Alexander.","('Praetorian', 'NORP'), ('the Youth of\r\n Alexander', 'ORG')"
"The Praetorian praefecture was divided between two
 ministers.","('Praetorian', 'PERSON'), ('two', 'CARDINAL')"
"The Romans had
 reason to dread that the disjoined members would soon be
 reduced by a civil war under the dominion of one master; but
 if the separation was permanent, the division of the
 provinces must terminate in the dissolution of an empire
 whose unity had hitherto remained inviolate.(20)
Murder of Geta","('Romans', 'NORP'), ('one', 'CARDINAL'), ('20', 'CARDINAL')"
"The Sun was worshipped at Emesa, under the name of
 Elagabalus,(52) and under the form of a black conical stone, 
 which, as it was universally believed, had fallen from
 heaven on that sacred place.","('Sun', 'PERSON'), ('Emesa', 'PERSON'), ('Elagabalus', 'PERSON'), ('52', 'CARDINAL')"
The administration of Alexander was an unavailing struggle against the corruption of his age.,"('Alexander', 'PERSON')"
"The arts of attendance and flattery were formed
 into a most lucrative science; those who professed it
 acquired a peculiar appellation; and the whole city,
 according to the lively descriptions of satire, was divided
 between two parties, the hunters and their game.(107)","('two', 'CARDINAL'), ('107', 'CARDINAL')"
"The battle still raged with doubtful violence, and Macrinus
 might have obtained the victory, had he not betrayed his own
 cause by a shameful and precipitate flight.","('Macrinus', 'PERSON')"
"The beautiful figure of the youth,
 assisted by an additional donative, for which the ceremony
 furnished a pretext, might attract, it was hoped, the favour
 of the army, and secure the doubtful throne of Macrinus.","('Macrinus', 'PERSON')"
"The careless profusion of the son was the policy of one reign, and the inevitable ruin both of the army and of the empire.","('one', 'CARDINAL')"
"The celebrated Ulpian, equally distinguished by
 his knowledge of, and his respect for, the laws of Rome, was
 at their head; and the prudent firmness of this aristocracy
 restored order and authority to the government.","('Ulpian', 'PERSON'), ('Rome', 'GPE')"
"The crafty Maesa, sensible that her grandson Elagabalus must inevitably destroy himself by his own vices, had provided another and surer support of her
 family.","('Maesa', 'PERSON'), ('Elagabalus', 'PERSON')"
"The cruel fate
 of Caracalla, though her good sense must have long taught
 her to expect it, awakened the feelings of a mother and of
 an empress.","('Caracalla', 'PERSON')"
"The death of
 Papinian, the Praetorian praefect, was lamented as a public
 calamity.","('Papinian', 'NORP'), ('Praetorian', 'NORP')"
The death of Severus.,"('Severus', 'PERSON')"
"The decisive weight of the Praetorian guards
 elevated the hopes of their praefects, and these powerful
 ministers began to assert their legal claim to fill the
 vacancy of the Imperial throne.","('Praetorian', 'NORP'), ('Imperial', 'ORG')"
"The declining health and last illness of Severus inflamed
 the wild ambition and black passions of Caracalla's soul.","('Severus', 'PERSON'), ('Caracalla', 'PERSON')"
"The demeanour of Caracalla was haughty
 and full of pride; but with the troops he forgot even the proper dignity of his rank, encouraged their insolent familiarity, and, neglecting the essential duties of a general, affected to imitate the dress and manners of a common soldier.","('Caracalla', 'PERSON')"
"The devotion of Caracalla prompted him to
 make a pilgrimage from Edessa to the celebrated temple of
 the Moon at Carrhae. (39)","('Caracalla', 'PERSON'), ('Edessa', 'GPE'), ('Moon', 'LOC'), ('Carrhae', 'GPE'), ('39', 'CARDINAL')"
"The discovery of the rich western continent by the Phoenicians, and the oppression of the simple natives, who were compelled to labour in their own mines for the benefit of strangers, form an exact type of the more recent history of Spanish America. (92)","('Phoenicians', 'NORP'), ('Spanish America', 'LOC'), ('92', 'CARDINAL')"
"The dissolute tyranny of Commodus, the civil wars occasioned
 by his death, and the new maxims of policy introduced by the
 house of Severus, had all contributed to increase the
 dangerous power of the army, and to obliterate the faint
 image of laws and liberty that was still impressed on the
 minds of the Romans.","('Commodus', 'EVENT'), ('Severus', 'PERSON'), ('Romans', 'NORP')"
"The dress of Alexander was plain 
 and modest, his demeanour courteous and affable: at the
 proper hours his palace was open to all his subjects, but
 the voice of a crier was heard, as in the Eleusinian
 mysteries, pronouncing the same salutary admonition; General happiness of the Roman world.","('Alexander', 'PERSON'), ('Eleusinian', 'NORP'), ('Roman', 'NORP')"
"The empress Julia had experienced all the vicissitudes of
 fortune.","('Julia', 'PERSON')"
"The excise, introduced by Augustus after the civil wars,
 was extremely moderate, but it was general.","('Augustus', 'PERSON')"
"The exercises of the
 body succeeded to those of the mind; and Alexander, who was
 tall, active, and robust, surpassed most of his equals in
 the gymnastic arts.","('Alexander', 'PERSON')"
"The fatigues of the Persian war irritated 
 the military discontent; the unsuccessful event degraded the
 reputation of the emperor as a general, and even as a
 soldier.","('the Persian war', 'EVENT')"
"The fond
 hopes of the father, and of the Roman world, were soon
 disappointed by these vain youths, who displayed the
 indolent security of hereditary princes; and a presumption
 that fortune would supply the place of merit and
 application.","('Roman', 'NORP')"
"The good sense, or the indifference, of succeeding 
 princes, restrained them from offending the prejudices of
 their subjects; and it was reserved for the profligate
 Elagabalus to discharge the acts of the senate, with the
 name of his mother Soaemias, who was placed by the side of
 the consuls, and subscribed, as a regular member, the
 decrees of the legislative assembly.","('Elagabalus', 'PERSON'), ('Soaemias', 'PERSON')"
"The grateful flattery of the learned has 
 celebrated her virtue; but, if we may credit the scandal of
 ancient history, chastity was very far from being the most
 conspicuous virtue of the empress Julia.(8)","('Julia', 'PERSON')"
"The grave senators 
 confessed with a sigh, that, after having long experienced
 the stern tyranny of their own countrymen, Rome was at
 length humbled beneath the effeminate luxury of Oriental
 despotism.","('Rome', 'GPE'), ('Oriental', 'NORP')"
"The haughty Agrippina 
 aspired, indeed, to share the honours of the empire, which
 she had conferred on her son; but her mad ambition, detested
 by every citizen who felt for the dignity of Rome, was
 disappointed by the artful firmness of Seneca and Burrhus.
 (65)","('Agrippina', 'PERSON'), ('Rome', 'GPE'), ('Seneca', 'PERSON'), ('Burrhus', 'PERSON'), ('65', 'CARDINAL')"
The historian Dion Cassius had commanded the Pannonian legions with the spirit of ancient discipline.,"('Dion Cassius', 'PERSON'), ('Pannonian', 'NORP')"
The honest labours of Papinian served only to inflame the hatred which Caracalla had already conceived against his father's minister.,"('Papinian', 'PERSON'), ('Caracalla', 'PERSON')"
"The introduction of customs was followed
 by the establishment of an excise, and the scheme of
 taxation was completed by an artful assessment on the real
 and personal property of the Roman citizens, who had been
 exempted from any kind of contribution above a century and a
 half.","('Roman', 'NORP'), ('a century and a\r\n half', 'DATE')"
"The jealous emperor threatened them with instant death;
 the sentence was executed against Fadilla, the last
 remaining daughter of the emperor Marcus; and even the
 afflicted Julia was obliged to silence her lamentations, to
 suppress her sighs, and to receive the assassin with smiles
 of joy and approbation.","('Fadilla', 'PERSON'), ('Marcus', 'PERSON'), ('Julia', 'PERSON')"
"The letters of Macrinus had condescended to inform the
 senate of the slight disturbance occasioned by an impostor
 in Syria, and a decree immediately passed, declaring the
 rebel and his family public enemies; with a promise of
 pardon, however, to such of his deluded adherents as should
 merit it by an immediate return to their duty.","('Macrinus', 'PERSON'), ('Syria', 'GPE')"
"The licentious soldiers, who had raised to the throne the
 dissolute son of Caracalla, blushed at their ignominious
 choice, and turned with disgust from that monster, to contemplate with pleasure the opening virtues of his cousin Alexander the son of Mamaea.","('Caracalla', 'PERSON'), ('Alexander the son of Mamaea', 'PERSON')"
"The military department was intrusted to
 Adventus, an experienced rather than an able soldier; and
 the civil affairs were transacted by Opilius Macrinus, who,
 by his dexterity in business, had raised himself, with a
 fair character, to that high office.","('Adventus', 'PERSON'), ('Opilius Macrinus', 'PERSON')"
"The name of Antoninus, ennobled by the virtues of Pius and
 Marcus, had been communicated by adoption to the dissolute
 Verus, and by descent to the cruel Commodus.","('Antoninus', 'PERSON'), ('Pius', 'PERSON'), ('Marcus', 'PERSON'), ('Verus', 'PERSON'), ('Commodus', 'PRODUCT')"
"The new citizens,
 though charged, on equal terms,(113) with the payment of new 
 taxes, which had not affected them as subjects, derived an
 ample compensation from the rank they obtained, the
 privileges they acquired, and the fair prospect of honours","('113', 'CARDINAL')"
"The new princes soon left the Caledonians in peace, returned to the capital, celebrated their father's funeral with divine honours, and were cheerfully acknowledged as lawful sovereigns, by the senate, the people, and the provinces.","('Caledonians', 'NORP')"
"The numerous army,
 assembled in the East by the late emperor, instead of being
 immediately dispersed by Macrinus through the several
 provinces, was suffered to remain united in Syria, during
 the winter that followed his elevation.","('East', 'LOC'), ('Macrinus', 'PERSON'), ('Syria', 'GPE'), ('the winter', 'DATE')"
"The obsequious assembly was always prepared to
 ratify the decision of fortune; but as Caracalla wished to
 assuage the first emotions of public indignation, the name
 of Geta was mentioned with decency, and he received the
 funeral honours of a Roman emperor.(24) Posterity, in pity to 
 his misfortune, has cast a veil over his vices.","('Caracalla', 'PERSON'), ('first', 'ORDINAL'), ('Geta', 'PERSON'), ('Roman', 'NORP'), ('24', 'CARDINAL')"
"The old emperor had 
 often censured the misguided lenity of Marcus, who, by a
 single act of justice, might have saved the Romans from the
 tyranny of his worthless son.","('Marcus', 'PERSON'), ('Romans', 'NORP')"
"The parallel would
 be little to the advantage of the more civilised people, if
 we compared the unrelenting revenge of Severus with the
 generous clemency of Fingal, the timid and brutal cruelty of
 Caracalla, with the bravery, the tenderness, the elegant
 genius of Ossian; the mercenary chiefs who, from motives of
 fear or interest, served under the Imperial standard, with
 the freeborn warriors who started to arms at the voice of
 the king of Morven; if, in a word, we contemplated the
 untutored Caledonians, glowing with the warm virtues of
 nature, and the degenerate Romans, polluted with the mean
 vices of wealth and slavery.","('Severus', 'PERSON'), ('Fingal', 'PERSON'), ('Caracalla', 'PERSON'), ('Ossian', 'PERSON'), ('Imperial', 'NORP'), ('Morven', 'PERSON'), ('Caledonians', 'NORP'), ('Romans', 'NORP')"
"The philosophic Seneca had condescended to compose a similar epistle to the senate, in the name of the son and assassin of Agrippina.(30) That it was easier to commit than to  justify a ""parricide,""  was the glorious reply of Papinian, (31) who did not hesitate between the loss of life and that of  honour.","('Seneca', 'PERSON'), ('Agrippina', 'PERSON'), ('Papinian', 'PERSON'), ('31', 'DATE')"
"The pride and avarice of 
 his mother cast a shade on the glories of his reign; and by
 exacting from his riper years the sage dutiful obedience
 which she had justly claimed from his inexperienced youth,
 Mamaea exposed to public ridicule, both her son's character
 and her own. (80)","('Mamaea', 'PERSON')"
"The prodigality of Caracalla had left behind it a
 long train of ruin and disorder; and if that worthless
 tyrant had been capable of reflecting on the sure
 consequences of his own conduct, he would perhaps have
 enjoyed the dark prospect of the distress and calamities
 which he bequeathed to his successors.","('Caracalla', 'PERSON')"
"The provinces, relieved from the oppressive taxes invented
 by Caracalla and his pretended son, flourished in peace and
 prosperity, under the administration of magistrates, who
 were convinced by experience, that to deserve the love of
 the subjects was their best and only method of obtaining the
 favour of their sovereign.","('Caracalla', 'PERSON')"
"The rate of the 
 customs varied from the eighth to the fortieth part of the
 value of the commodity; and we have a right to suppose that
 the variation was directed by the unalterable maxims of
 policy: that a higher duty was fixed on the articles of
 luxury than on those of necessity, and that the productions
 raised or manufactured by the labour of the subjects of the
 empire were treated with more indulgence than was shown to
 the pernicious, or at least the unpopular, commerce of
 Arabia and India. (98)","('eighth', 'ORDINAL'), ('Arabia', 'GPE'), ('India', 'GPE'), ('98', 'CARDINAL')"
"The rebel ranks
 were broken; when the mother and grandmother of the Syrian
 prince, who, according to their eastern custom, had attended
 the army, threw themselves from their covered chariots, and,
 by exciting the compassion of the soldiers, endeavoured to
 animate their drooping courage.","('Syrian', 'NORP')"
"The report of the death of Alexander, and the
 natural suspicion that he had been murdered, inflamed their
 passions into fury, and the tempest of the camp could only
 be appeased by the presence and authority of the popular
 youth.","('Alexander', 'PERSON')"
"The report was soon diffused through the
 province; and when the man was sent in chains to Rome, he
 still asserted, in the presence of the Praefect of the city,
 the faith of his prophecy.","('Rome', 'GPE')"
"The salutary advice never reached the heart, or even the understanding, of the impetuous youths; but the more obedient troops, mindful of their oath of allegiance, and of the authority of their deceased master, resisted the solicitations of Caracalla, and proclaimed both brothers emperors of Rome.","('Caracalla', 'PERSON'), ('Rome', 'GPE')"
"The sentiments of
 honour and gallantry have introduced a refinement of
 pleasure, a regard for decency, and a respect for the public
 opinion, into the modern courts of Europe; but the corrupt
 and opulent nobles of Rome gratified every vice that could
 be collected from the mighty conflux of nations and manners.","('Europe', 'LOC'), ('Rome', 'GPE')"
"The sentiments, and, indeed, the situation of Caracalla,
 were very different from those of the Antonines.","('Caracalla', 'GPE'), ('Antonines', 'NORP')"
"The siege of Veii in Tuscany, the first considerable
 enterprise of the Romans, was protracted to the tenth year,
 much less by the strength of the place than by the
 unskilfulness of the besiegers.","('Veii', 'GPE'), ('Tuscany', 'GPE'), ('first', 'ORDINAL'), ('Romans', 'NORP'), ('the tenth year', 'DATE')"
"The simple journal of his ordinary occupations exhibits a  pleasing picture of an accomplished emperor, (69) and with 
 some allowance for the difference of manners, might well
 deserve the imitation of modern princes.","('69', 'DATE')"
"The soldiers, who resorted in crowds
 to the temple of the Sun, beheld with veneration and delight
 the elegant dress and figure of a young Pontiff: they
 recognised, or they thought that they recognised, the
 features of Caracalla, whose memory they now adored.","('Sun', 'LOC'), ('Pontiff', 'PERSON'), ('Caracalla', 'PERSON')"
"The states of Italy
 paid their tribute in military service only, and the vast
 force both by sea and land, which was exerted in the Punic
 wars, was maintained at the expense of the Romans
 themselves.","('Italy', 'GPE'), ('the Punic\r\n wars', 'EVENT'), ('Romans', 'NORP')"
"The sudden elevation of the 
 Praetorian praefects betrayed the meanness of their origin;
 and the equestrian order was still in possession of that
 great office, which commanded with arbitrary sway the lives
 and fortunes of the senate.","('Praetorian', 'NORP')"
"The sums
 distributed by her emissaries with a lavish hand silenced
 every objection, and the profusion sufficiently proved the
 affinity, or at least the resemblance, of Bassianus with the
 great original.","('Bassianus', 'PERSON')"
"The tears and promises of the trembling Elagabalus, who only begged them to spare his life, and to leave him in the possession of his beloved Hierocles, diverted their just indignation and they contented themselves with empowering their praefects to watch over the safety of Alexander, and the conduct of the
 emperor. (61)
Sedition of the guards, and murder of Elagabalus.","('Elagabalus', 'PERSON'), ('Hierocles', 'PERSON'), ('Alexander', 'PERSON'), ('61', 'CARDINAL'), ('Elagabalus', 'PERSON')"
"The tears of the
 empress Julia interrupted the negotiation, the first idea of
 which had filled every Roman breast with surprise and
 indignation.","('Julia', 'PERSON'), ('first', 'ORDINAL'), ('Roman', 'NORP')"
"The ten thousand of Africa Euboic or Phoenician talents, about four millions sterling, (89) which vanquished Carthage was condemned to pay within the  term of fifty years, were a slight acknowledgment of the
 superiority of Rome,(90) and cannot bear the least proportion with the taxes afterwards raised both on the lands and on the persons of the inhabitants, when the fertile coast of
 Africa was reduced into a province.(91)
Spain, by a very singular fatality, was the Peru and Mexico of the old world.","('ten thousand', 'CARDINAL'), ('Africa Euboic', 'NORP'), ('Phoenician', 'NORP'), ('about four millions sterling', 'MONEY'), ('89', 'CARDINAL'), ('Carthage', 'GPE'), ('fifty years', 'DATE'), ('Rome', 'GPE'), ('90', 'CARDINAL'), ('Africa', 'LOC'), ('Spain', 'GPE'), ('Peru', 'GPE'), ('Mexico', 'GPE')"
"The triumph of the
 God of Emesa over all the religions of the earth, was the
 great object of his zeal and vanity: and the appellation of
 Elagabalus (for he presumed as pontiff and favourite to
 adopt that sacred name) was dearer to him than all the
 titles of Imperial greatness.","('the\r\n God of Emesa', 'PERSON'), ('Elagabalus', 'PERSON'), ('Imperial', 'ORG')"
"The tyranny of Tiberius,
 Nero, and Domitian, who resided almost constantly at Rome,
 or in the adjacent villas, was confined to the senatorial
 and equestrian orders.(33) But Caracalla was the common enemy 
 of mankind.","('Tiberius', 'PERSON'), ('Nero', 'PERSON'), ('Domitian', 'PERSON'), ('Rome', 'GPE'), ('Caracalla', 'PERSON')"
"The unaccustomed hardships
 of so many winter campaigns, at the distance of near twenty
 miles from home, (81) required more than common 
 encouragements; and the senate wisely prevented the clamours
 of the people, by the institution of a regular pay for the
 soldiers, which was levied by a general tribute, assessed
 according to an equitable proportion on the property of the
 citizens.(82) During more than two hundred years after the 
 conquest of Veii, the victories of the republic added less
 to the wealth than to the power of Rome.","('winter', 'DATE'), ('twenty\r\n miles', 'QUANTITY'), ('81', 'CARDINAL'), ('82', 'CARDINAL'), ('more than two hundred years', 'DATE'), ('Veii', 'PERSON'), ('Rome', 'GPE')"
"The wise instructions of Severus never made any lasting impression on the mind of his son, who, although not destitute of imagination and eloquence, was equally devoid of judgment and humanity.(36)","('Severus', 'PERSON')"
"The wisest
 senators applauded his magnanimity; but they diverted him
 from the execution of a design, which would have dissolved
 the strength and resources of the republic. (110)","('110', 'CARDINAL')"
"The works of
 Virgil and Horace, the Republics of Plato and Cicero, formed
 his taste, enlarged his understanding, and gave him the
 noblest ideas of man and government.","('Virgil', 'PERSON'), ('Horace', 'PERSON'), ('the Republics of', 'GPE'), ('Plato', 'PERSON'), ('Cicero', 'PERSON')"
"The young Antoninus (for he had assumed and
 polluted that respectable name) was (A.D. 218, May 16)
 declared emperor by the troops of Emesa, asserted his
 hereditary right, and called aloud on the armies to follow
 the standard of a young and liberal prince, who had taken up
 arms to revenge his father's death and the oppression of the
 military order.(47)
Defeat and death of Macrinus
 Whilst a conspiracy of women and eunuchs was concerted with
 prudence, and conducted with rapid vigour, Macrinus, who, by
 a decisive motion, might have crushed his infant enemy,
 floated between the opposite extremes of terror and
 security, which alike fixed him inactive at Antioch.","('Antoninus', 'PERSON'), ('A.D. 218', 'DATE'), ('May 16', 'DATE'), ('Emesa', 'PERSON'), ('47', 'CARDINAL'), ('Macrinus', 'PERSON'), ('Macrinus', 'PERSON'), ('Antioch', 'GPE')"
"Their
 discontent died away in idle murmurs, and Caracalla soon
 convinced them of the justice of his cause, by distributing
 in one lavish donative the accumulated treasures of his
 father's reign.(23)","('Caracalla', 'PERSON'), ('23', 'CARDINAL')"
"Their
 restless spirit provoked Severus to send a new army into
 Caledonia, with the most bloody orders, not to subdue but to
 extirpate the natives.","('Severus', 'PERSON'), ('Caledonia', 'GPE')"
"Their aversion,
 confirmed by years, and fomented by the arts of their
 interested favourites, broke out in childish, and gradually
 in more serious, competitions; and, at length, divided the
 theatre, the circus, and the court, into two factions;
 actuated by the hopes and fears of their respective leaders.","('years', 'DATE'), ('two', 'CARDINAL')"
"Their brethren of Rome, embracing the common cause of military licence, demanded the head of the reformer.","('Rome', 'GPE')"
"Their conversation was
 familiar and instructive; and the pauses were occasionally
 enlivened by the recital of some pleasing composition, which
 supplied the place of the dancers, comedians, and even
 gladiators, so frequently summoned to the tables of the rich
 and luxurious Romans. (70)","('Romans', 'NORP'), ('70', 'CARDINAL')"
"Their indignant
 murmurs were received by Augustus with his usual temper.","('Augustus', 'PERSON')"
"Their praefect, the wise Ulpian, was
 the friend of the laws and of the people; he was considered
 as the enemy of the soldiers, and to his pernicious counsels
 every scheme of reformation was imputed.","('Ulpian', 'PERSON')"
"Their rapid journey through Gaul and Italy,
 during which they never ate at the same table, or slept in
 the same house, displayed to the provinces the odious
 spectacle of fraternal discord.","('Gaul', 'GPE'), ('Italy', 'GPE')"
