Sentence,Entities
"He employed the awful
 moments with the firm temper of a hero and a sage; the
 philosophers who had accompanied him in this fatal
 expedition compared the tent of Julian with the prison of
 Socrates; and the spectators, whom duty, or friendship, or
 curiosity, had assembled round his couch, listened with
 respectful grief to the funeral oration of their dying
 emperor.","('Julian', 'PERSON'), ('Socrates', 'PERSON')"
"He enacted that, in a time of scarcity, it should
 be sold at a price which had seldom been known in the most
 plentiful years; and that his own example might strengthen
 his laws, he sent into the market four hundred and
 twenty-two thousand modii, or measures, which were drawn
 by his order from the granaries of Hierapolis, of Chalcis,
 and even of Egypt.","('the most\r\n plentiful years', 'DATE'), ('four hundred and\r\n twenty-two thousand', 'CARDINAL'), ('Hierapolis', 'GPE'), ('Chalcis', 'GPE'), ('Egypt', 'GPE')"
"He excited their resentment by a lively picture of the insolence of the Persians and he exhorted them to imitate his firm resolution either to extirpate that perfidious nation, or to devote his life in the cause of the republic.","('Persians', 'NORP')"
"He expressed a pious attachment to the memory of Constantius, from whose hands he had received in marriage Olympias, the daughter of the praefect Ablavius; and the alliance of a female who had been educated as the destined wife of the emperor Constans exalted the dignity of a barbarian king. (39) Tiranus professed the Christian religion; he reigned over a nation of Christians; and he was restrained, by every principle of conscience and interest, from contributing to the victory which would consummate the ruin of the church.","('Constantius', 'PERSON'), ('Olympias', 'PERSON'), ('Ablavius', 'PERSON'), ('Constans', 'PERSON'), ('Tiranus', 'PERSON'), ('Christian', 'NORP'), ('Christians', 'NORP')"
"He had been insulted by satires and libels; in his turn he composed, under the title of the Enemy of the Beard, an ironical confession of his own faults, and a severe satire of the licentious and effeminate manners of Antioch.","('the Enemy of the Beard', 'WORK_OF_ART'), ('Antioch', 'GPE')"
"He immediately
 detached the royal cavalry, perhaps the ten thousand
 Immortals, (104) to second and support the pursuit and discharged the whole weight of his united forces on the
 rearguard of the Romans.","('ten thousand', 'CARDINAL'), ('Immortals', 'NORP'), ('104', 'CARDINAL'), ('second', 'ORDINAL'), ('Romans', 'NORP')"
"He informed Libanius of his 
 progress as far as Hierapolis by an elegant epistle,(33) 
 which displays the facility of his genius and his tender
 friendship for the sophist of Antioch.","('Libanius', 'PERSON'), ('Hierapolis', 'PERSON'), ('33', 'CARDINAL'), ('Antioch', 'GPE')"
"He punished
 with death, or ignominy, the misbehaviour of three troops of
 horse, who, in a skirmish with the Surenas, had lost their
 honour and one of their standards: and he distinguished with
 obsidional(62) crowns the valour of the foremost soldiers 
 who had ascended into the city of Maogamalcha.","('three', 'CARDINAL'), ('Surenas', 'NORP'), ('one', 'CARDINAL'), ('62', 'CARDINAL'), ('Maogamalcha', 'GPE')"
"He resolves to march against the Persians, A.D. 362","('Persians', 'NORP')"
He saves the Roman Army by a disgraceful Treaty.,"('the Roman Army', 'ORG'), ('Treaty', 'LAW')"
He transports his fleet from the Euphrates to the Tigris,"('Euphrates', 'LOC'), ('Tigris', 'LOC')"
"He was a Persian prince, of the royal race of the Sassanides, who, in the troubles of the minority of Sapor, had escaped from prison to the hospitable court of
 the great Constantine.","('Persian', 'NORP'), ('Sassanides', 'NORP'), ('Sapor', 'NORP'), ('Constantine', 'PERSON')"
"He was accompanied by two of the king's sons and
 many of the principal satraps; and fame and expectation
 exaggerated the strength of the remaining powers, which
 slowly advanced under the conduct of Sapor himself.","('two', 'CARDINAL'), ('Sapor', 'PERSON')"
"He was astonished by the inflexible firmness of a
 hero who remembered, most unfortunately for himself and for
 his country, that Alexander had uniformly rejected the
 propositions of Darius.","('Alexander', 'PERSON'), ('Darius', 'PERSON')"
"He was impatient to secure an empire at the
 expense of a few provinces, and the respectable names of
 religion and honour concealed the personal fears and the
 ambition of Jovian Notwithstanding the dutiful solicitations
 of the inhabitants, decency, as well as prudence, forbade
 the emperor to lodge in the palace of Nisibis; but the next
 morning after his arrival, Bineses, the ambassador of
 Persia, entered the place, displayed from the citadel the
 standard of the Great King, and proclaimed, in his name, the
 cruel alternative of exile or servitude.","('Nisibis', 'PERSON'), ('the next\r\n morning', 'TIME'), ('Bineses', 'PERSON'), ('Persia', 'GPE')"
"He was persuaded, perhaps with truth, that the
 senators of Antioch, who possessed lands or were concerned
 in trade, had themselves contributed to the calamities of
 their country; and he imputed the disrespectful boldness
 which they assumed to the sense, not of public duty, but of
 private interest.","('Antioch', 'ORG')"
"His
 ardent desire to march into the heart of Persia was checked
 by the indispensable duty of regulating the state of the
 empire, by his zeal to revive the worship of the gods, and
 by the advice of his wisest friends, who represented the
 necessity of allowing the salutary interval of winter
 quarters to restore the exhausted strength of the legions of
 Gaul and the discipline and spirit of the Eastern troops.","('Persia', 'GPE'), ('winter', 'DATE'), ('Gaul', 'PERSON'), ('Eastern', 'NORP')"
"His
 expectations were disappointed by the treachery of the
 Armenian king, who permitted and most probably directed, the
 desertion of his auxiliary troops from the camp of the
 Romans;(74) and by the dissensions of the two generals, who 
 were incapable of forming or executing any plan for the
 public service.","('Armenian', 'NORP'), ('Romans', 'NORP'), ('74', 'CARDINAL'), ('two', 'CARDINAL')"
"His design of invading Persia  
 Hierapolis, situate almost on the banks of the Euphrates,(34) 
 had been appointed for the general rendezvous of the Roman
 troops, who immediately passed the great river on the bridge
 of boats which was previously constructed.","('Persia  \r\n Hierapolis', 'LOC'), ('Euphrates', 'LOC'), ('34', 'CARDINAL'), ('Roman', 'NORP')"
"His just indignation was
 expressed in the grave and manly language of a Roman.","('Roman', 'NORP')"
"His school was assiduously frequented by the Grecian youth;
 his disciples, who sometimes exceeded the number of eighty,
 celebrated their incomparable master; and the jealousy of
 his rivals, who persecuted him from one city to another,
 confirmed the favourable opinion which Libanius
 ostentatiously displayed of his superior merit.","('Grecian', 'NORP'), ('eighty', 'CARDINAL'), ('one', 'CARDINAL'), ('Libanius', 'PERSON')"
"His subjects complained
 with superstitious indignation, that famine had pursued the
 emperor's steps from Constantinople to Antioch, and the
 discontent of a hungry people was exasperated by the
 injudicious attempt to relieve their distress.","('Constantinople', 'GPE'), ('Antioch', 'GPE')"
His successful Expedition against the Persians.—,"('Persians', 'NORP')"
"His suspicions are
 unsupported by fact or argument, and we can only esteem the
 generous zeal of the sophist of Antioch for the cold and
 neglected ashes of his friend.(135)
and funeral of Julian","('Antioch', 'GPE'), ('135', 'CARDINAL'), ('Julian', 'PERSON')"
"His unexpected death left the
 empire without a master, and without an heir, in a state of
 perplexity and danger which, in the space of four-score
 years, had never been experienced, since the election of
 Diocletian.","('four-score\r\n years', 'DATE'), ('Diocletian', 'PERSON')"
"His wound began to bleed with fresh violence: his respiration was embarrassed by the swelling of the veins: he called for a draught of cold water, and, as soon as he had drunk it, expired without pain, about the hour of midnight.","('about the hour of midnight', 'TIME')"
"History has
 recorded the name of a private soldier, the first who
 ascended from the mine into a deserted tower.","('first', 'ORDINAL')"
"Hormisdas and Arinthseus were appointed generals of the horse, and the singular adventures of Hormisdas (46) are not undeserving of our notice.","('Hormisdas', 'PERSON'), ('Arinthseus', 'PERSON'), ('Hormisdas', 'PERSON'), ('46', 'CARDINAL')"
"Hormisdas at first excited the compassion, and at length acquired the esteem, of his new masters; his valour and fidelity raised him to the military honours of the Roman service; and, though a Christian, he might indulge the secret satisfaction of convincing his
 ungrateful country that an oppressed subject may prove the most dangerous enemy.","('Hormisdas', 'PERSON'), ('first', 'ORDINAL'), ('Roman', 'NORP'), ('Christian', 'NORP')"
"If he
 had stretched as far as the Euphrates the claims of his
 ambition, he might have been secure, says Libanius, of not
 meeting with a refusal.","('Euphrates', 'LOC'), ('Libanius', 'PERSON')"
"If he had fixed, as the boundary of
 Persia, the Orontes, the Cydnus, the Sangarius, or even the
 Thracian Bosphorus, flatterers would not have been wanting
 in the court of Jovian to convince the timid monarch that
 his remaining provinces would still afford the most ample
 gratifications of power and luxury.(112)","('Persia', 'LOC'), ('Orontes', 'NORP'), ('Cydnus', 'NORP'), ('Sangarius', 'NORP'), ('the\r\n Thracian Bosphorus', 'LOC'), ('Jovian', 'GPE')"
"If the 
 inclinations of Julian had been similar to those of his
 predecessor, he might have wasted the active and important
 season of the year in the circus of Samosata or in the
 churches of Edessa.","('Julian', 'PERSON'), ('the active and important\r\n season of the year', 'DATE'), ('Samosata', 'EVENT'), ('Edessa', 'GPE')"
"If they had followed this royal
 canal, which bore the name of NaharMalcha, (66) the 
 intermediate situation of Coche would have separated the
 fleet and army of Julian; and the rash attempt of steering
 against the current of the Tigris, and forcing their way
 through the midst of a hostile capital, must have been
 attended with the total destruction of the Roman navy.","('NaharMalcha', 'GPE'), ('66', 'CARDINAL'), ('Coche', 'GPE'), ('Julian', 'PERSON'), ('Tigris', 'LOC'), ('Roman', 'NORP')"
"If, on the contrary, it was advisable to
 advance into the inland country, the destruction of the
 fleet and magazines was the only measure which could save
 that valuable prize from the hands of the numerous and
 active troops which might suddenly be poured from the gates
 of Ctesiphon.","('Ctesiphon', 'GPE')"
"In every useful
 labour the hand of Julian was prompt and strenuous; and the
 Imperial purple was wet and dirty, as the coarse garment of
 the meanest soldier.","('Julian', 'PERSON'), ('Imperial', 'NORP')"
"In his last moments he displayed, perhaps with some ostentation, the love of virtue and of fame, which had been the ruling passions of his life. (99)
Election of the emperor Jovian, A.D. 363, June 27.","('Jovian', 'PERSON'), ('A.D. 363', 'DATE'), ('June 27', 'DATE')"
"In the cool moments of reflection, Julian preferred the
 useful and benevolent virtues of Antoninus; but his
 ambitious spirit was inflamed by the glory of Alexander, and
 he solicited, with equal ardour, the esteem of the wise and
 the applause of the multitude.","('Julian', 'PERSON'), ('Antoninus', 'PERSON'), ('Alexander', 'PERSON')"
"In the hurry of military preparation, and the
 careless confidence of a familiar correspondence, the zeal
 of Julian appears to have been lively and uniform.","('Julian', 'PERSON')"
"In the neighbourhood of the same 
 river, at no very considerable distance from the fatal
 station of Dura, (114) the ten thousand Greeks, without 
 generals, or guides, or provisions, were abandoned, above
 twelve hundred miles from their native country, to the
 resentment of a victorious monarch.","('Dura', 'ORG'), ('114', 'CARDINAL'), ('ten thousand', 'CARDINAL'), ('Greeks', 'NORP'), ('twelve hundred miles', 'QUANTITY')"
"In the obscure freedom of a private
 station, the son indulged his taste for wine and women; yet
 he supported, with credit, the character of a Christian(102)  and a soldier.","('Christian', 'NORP'), ('102', 'CARDINAL')"
"In the season of life when
 the powers of the mind and body enjoy the most active
 vigour, the emperor, who was instructed by the experience
 and animated by the success of the German war, resolved to
 signalise his reign by some more splendid and memorable
 achievement.","('the German war', 'EVENT')"
"In the silence of the night they swam the Tigris,
 surprised an unguarded post of the enemy, and displayed at
 the dawn of day the signal of their resolution and fortune.","('the night', 'TIME'), ('Tigris', 'LOC'), ('the dawn of day', 'DATE')"
"In the succeeding night
 the camp of Carche was protected by the lofty dykes of the
 river; and the Roman army, though incessantly exposed to the
 vexatious pursuit of the Saracens, pitched their tents near
 the city of Dura (106) four days after the death of Julian.","('the succeeding night', 'TIME'), ('Carche', 'GPE'), ('Roman', 'NORP'), ('Saracens', 'NORP'), ('Dura', 'GPE'), ('106', 'CARDINAL'), ('four days', 'DATE'), ('Julian', 'PERSON')"
"In the warm climate of Assyria, which 
 solicited a luxurious people to the gratification of every
 sensual desire, (60) a youthful conqueror preserved his 
 chastity pure and inviolate: nor was Julian ever tempted,
 even by a motive of curiosity, to visit his female captives
 of exquisite beauty,(61) who, instead of resisting his power, 
 would have disputed with each other the honour of his
 embraces.","('Assyria', 'GPE'), ('60', 'CARDINAL'), ('Julian', 'PERSON')"
"In this fruitful and pleasant country the
 Romans were plentifully supplied with water and forage: and
 several forts, which might have embarrassed the motions of
 the army, submitted, after some resistance, to the efforts
 of their valour.","('Romans', 'NORP')"
"In this hopeless situation, the fainting spirits of the
 Romans were revived by the sound of peace.","('Romans', 'NORP')"
"In this scene of
 terror and distress, the body of the deceased prince,
 according to his own directions, was decently embalmed; and,
 at the dawn of day, the generals convened a military senate,
 at which the commanders of the legions, and the officers
 both of cavalry and infantry, were invited to assist.","('the dawn of day', 'DATE')"
"In this unequal contest, in which the produce of the land is claimed by one party as his exclusive property, is used by another as a lucrative object of trade, and is required by a third for the daily and necessary support of life, all the profits of the intermediate agents are accumulated on the head of the
 defenceless consumers.","('one', 'CARDINAL'), ('third', 'ORDINAL')"
"Instead of confining his servile march
 to the banks of the Euphrates and Tigris, he resolved to
 imitate the adventurous spirit of Alexander, and boldly to
 advance into the inland provinces, till he forced his rival
 to contend with him, perhaps in the plains of Arbela, for
 the empire of Asia.","('Euphrates', 'LOC'), ('Tigris', 'LOC'), ('Alexander', 'PERSON'), ('Arbela', 'GPE'), ('Asia', 'LOC')"
"Instead of pressing, with the foremost of the
 crowd, into the palace of Constantinople, Libanius calmly
 expected his arrival at Antioch, withdrew from court on the
 first symptoms of coldness and indifference, required a
 formal invitation for each visit, and taught his sovereign
 an important lesson, that he might command the obedience of
 a subject, but that he must deserve the attachment of a
 friend.","('Constantinople', 'GPE'), ('Libanius', 'PERSON'), ('Antioch', 'GPE'), ('first', 'ORDINAL')"
"Instead of tamely resigning
 themselves to the secret deliberations and private views of
 a single person, the united councils of the Greeks were
 inspired by the generous enthusiasm of a popular assembly,
 where the mind of each citizen is filled with the love of
 glory, the pride of freedom, and the contempt of death.","('Greeks', 'NORP')"
"It is
 not easy for us to conceive by what arts of fortification a
 city thrice besieged and taken by the predecessors of Julian
 could be rendered impregnable against an army of sixty
 thousand Romans, commanded by a brave and experienced
 general, and abundantly supplied with ships, provisions,
 battering engines, and military stores.","('Julian', 'PERSON'), ('sixty\r\n thousand', 'CARDINAL'), ('Romans', 'NORP')"
"It is the common calamity of old age
 (27) to lose whatever might have rendered it desirable; but 
 Libanius experienced the peculiar misfortune of surviving
 the religion and the sciences to which he had consecrated
 his genius.","('27', 'DATE'), ('Libanius', 'PERSON')"
"It was an ancient custom in the funerals, as well as in the
 triumphs of the Romans that the voice of praise should be
 corrected by that of satire and ridicule, and that, in the
 midst of the splendid pageants which displayed the glory of
 the living or of the dead, their imperfections should not be
 concealed from the eyes of the world.(136)","('Romans', 'NORP'), ('136', 'CARDINAL')"
"It was considered as an indulgence that the
 inhabitants of those fortresses were permitted to retire
 with their effects; but the conqueror rigorously insisted
 that the Romans should for ever abandon the king and kingdom
 of Armenia.","('Romans', 'NORP'), ('Armenia', 'GPE')"
"Jovian alleged, with some confusion, the sanctity of oaths; and as the reluctance with which he accepted the present of a crown of gold convinced the citizens of their hopeless condition, the advocate Sylvanus was provoked to exclaim, ""O emperor!","('Jovian', 'PERSON'), ('Sylvanus', 'PERSON')"
"Jovian, who in a few weeks had assumed the
 habits of a prince, (124) was displeased with freedom, and  offended with truth; and as he reasonably supposed that the discontent of the people might incline them to submit to the
 Persian government, he published an edict, under pain of death, that they should leave the city within the term of three days.","('Jovian', 'PERSON'), ('a few weeks', 'DATE'), ('124', 'CARDINAL'), ('Persian', 'NORP'), ('three days', 'DATE')"
"Julian
 attempted to draw the deadly weapon from his side; but his
 fingers were cut by the sharpness of the steel, and he fell
 senseless from his horse.","('Julian', 'PERSON')"
"Julian
 led the van with the skill and attention of a consummate
 general; he was alarmed by the intelligence that his rear
 was suddenly attacked.","('Julian', 'PERSON')"
"Julian
 marched over the same ground which had been trod above seven
 hundred years before by the footsteps of the younger Cyrus,
 and which is described by one of the companions of his
 expedition, the sage and heroic Xenophon.(47)","('Julian', 'PERSON'), ('seven\r\n hundred years', 'DATE'), ('Cyrus', 'PERSON'), ('one', 'CARDINAL'), ('Xenophon', 'PERSON'), ('47', 'CARDINAL')"
"Julian checked their ardour, that he might
 ensure their success; and immediately diverted the attention
 of the garrison by the tumult and clamour of a general
 assault.","('Julian', 'PERSON')"
"Julian composes a satire against Antioch  But instead of abusing or exerting the authority of the state to revenge his personal injuries, Julian contented himself with an inoffensive mode of retaliation, which it would be in the power of few princes to employ.","('Julian', 'PERSON'), ('Antioch', 'GPE'), ('Julian', 'PERSON')"
"Julian disguised the silent anxiety of
 his own mind with smiles of confidence and joy; and amused
 the hostile nations with the spectacle of military games,
 which he insultingly celebrated under the walls of Coche.","('Julian', 'PERSON'), ('Coche', 'PERSON')"
"Julian might expect that a conqueror who
 possessed the two forcible instruments of persuasion, steel
 and gold, would easily procure a plentiful subsistence from
 the fears or avarice of the natives.","('Julian', 'PERSON'), ('two', 'CARDINAL')"
"Julian still
 continued to applaud his own policy, treated the complaints
 of the people as a vain and ungrateful murmur, and convinced
 Antioch that he had inherited the obstinacy, though not the
 cruelty, of his brother Gallus.(16)","('Julian', 'PERSON'), ('Antioch', 'PERSON'), ('Gallus', 'PERSON'), ('16', 'CARDINAL')"
"Julian was convinced
 that he had seen the menacing countenance of the god of war;
 (91) the council which he summoned, of Tuscan Haruspices,(92) 
 unanimously pronounced that he should abstain from action;
 but, on this occasion, necessity and reason were more
 prevalent than superstition; and the trumpets sounded at the
 break of day.","('Julian', 'PERSON'), ('91', 'CARDINAL'), ('Tuscan Haruspices', 'PERSON'), ('92', 'DATE')"
"Julian was persuaded to fix, till the ensuing spring, his
 residence at Antioch, among a people maliciously disposed to
 deride the haste and to censure the delays of their
 sovereign.(10)
Licentious manners of the people of Antioch  
 If Julian had flattered himself that his personal connection
 with the capital of the East would be productive of mutual
 satisfaction to the prince and people, he made a very false
 estimate of his own character and of the manners of Antioch.","('Julian', 'PERSON'), ('the ensuing spring', 'DATE'), ('Antioch', 'GPE'), ('Antioch', 'GPE'), ('Julian', 'PERSON'), ('East', 'LOC'), ('Antioch', 'GPE')"
"Julian, on this occasion, showed himself ignorant
 or careless of the laws of civility, which the prudence and
 refinement of polished ages have established between hostile
 princes.","('Julian', 'PERSON')"
"Julian, placing himself
 between them, attempted without success to inculcate the
 lesson and example of toleration, supported, with affected
 calmness, the indiscreet zeal of the aged Christian, who
 seemed to forget the sentiments of nature and the duty of a
 subject, and at length, turning towards the afflicted youth,  The emperor was received in a manner much more agreeable to his wishes at
 Batnae, a small town pleasantly seated in a grove of
 cypresses, about twenty miles from the city of Hierapolis.","('Julian', 'PERSON'), ('Christian', 'NORP'), ('Batnae', 'GPE'), ('about twenty miles', 'QUANTITY'), ('Hierapolis', 'GPE')"
"Julius Caesar,
 Augustus, Trajan, and Marcus Antoninus, were selected as the
 most illustrious candidates; the effeminate Constantine(4) was not excluded from this honourable competition; and the great Alexander was invited to dispute the prize of glory
 with the Roman heroes.","('Julius Caesar', 'PERSON'), ('Augustus, Trajan', 'ORG'), ('Marcus Antoninus', 'PERSON'), ('Constantine', 'PERSON'), ('4', 'CARDINAL'), ('Alexander', 'PERSON'), ('Roman', 'NORP')"
July 1st,"('July 1st', 'DATE')"
July.,"('July', 'DATE')"
June 26.,"('June 26', 'DATE')"
June 27th—,"('June 27th', 'DATE')"
June.,"('June', 'DATE')"
"Many of these daring
 adventurers were swallowed by the waves; many others, who
 were carried along by the violence of the stream, fell an
 easy prey to the avarice or cruelty of the wild Arabs; and
 the loss which the army sustained in the passage of the
 Tigris was not inferior to the carnage of a day of battle.","('Arabs', 'NORP'), ('Tigris', 'LOC'), ('a day', 'DATE')"
May.,"('May', 'DATE')"
"Near the ruins of Seleucia the camp
 of Julian was fixed, and secured by a ditch and rampart
 against the sallies of the numerous and enterprising
 garrison of Coche.","('Seleucia', 'GPE'), ('Julian', 'PERSON'), ('Coche', 'PERSON')"
"On a sudden they wheeled to the right,
 traversed the level and naked plain of Carrhae, and reached,
 on the third day, the banks of the Euphrates, where the
 strong town of Nicephorium, or Callinicum, had been founded
 by the Macedonian kings.","('Carrhae', 'GPE'), ('the third day', 'DATE'), ('Euphrates', 'LOC'), ('Nicephorium', 'GPE'), ('Callinicum', 'GPE'), ('Macedonian', 'NORP')"
"On the ensuing day 
 the barbarians, instead of harassing the march, attacked the
 camp of Jovian, which had been seated in a deep and
 sequestered valley.","('the ensuing day', 'DATE'), ('Jovian', 'GPE')"
"On the present occasion the zeal and obedience of
 the Persians seconded the commands of Sapor; and the emperor
 was soon reduced to the scanty stock of provisions which
 continually wasted in his hands.","('Persians', 'NORP'), ('Sapor', 'PERSON')"
"On the right, the brave Nevitta led a
 column of several legions along the banks of the Euphrates, and almost always in sight of the fleet.","('Nevitta', 'PERSON'), ('Euphrates', 'LOC')"
"On the second day after the battle the domestic guards, the
 Jovians and Herculians, and the remaining troops, which
 composed near two-thirds of the whole army, were securely
 wafted over the Tigris. (73)","('the second day', 'DATE'), ('Jovians', 'NORP'), ('Herculians', 'NORP'), ('near two-thirds', 'CARDINAL'), ('Tigris', 'LOC')"
"On their side the Romans acknowledged
 the loss of only seventy-five men; while they affirmed that
 the barbarians had left on the field of battle two thousand
 five hundred, or even six thousand, of their bravest
 soldiers.","('Romans', 'NORP'), ('only seventy-five', 'CARDINAL'), ('two thousand\r\n five hundred, or even six thousand', 'CARDINAL')"
"One party lamented the approaching ruin of their altars, the
 other celebrated the marvellous deliverance of the church.","('One', 'CARDINAL')"
