Sentence,Entities
"They might add that the throne of the
 emperors would be established on a fixed and permanent basis
 if all their subjects, embracing the Christian doctrine,
 should learn to suffer and to obey.","('Christian', 'NORP')"
"They produce,
 besides a reserved rent of oil, linen, paper, aromatics,
 etc., a clear annual revenue of twenty-two thousand pieces
 of gold, or twelve thousand pounds sterling.","('twenty-two thousand', 'CARDINAL'), ('twelve thousand pounds', 'QUANTITY')"
"This
 motive of credibility could not survive the power of the
 Flavian family, and the celestial sign, which the Infidels
 might afterwards deride, (51) was disregarded by the 
 Christians of the age which immediately followed the
 conversion of Constantine. (52)","('Flavian', 'NORP'), ('Infidels', 'NORP'), ('51', 'DATE'), ('Christians', 'NORP'), ('Constantine', 'PERSON'), ('52', 'CARDINAL')"
"This date is alone sufficient to refute the
 ignorant and malicious suggestions of Zosimus(69) who affirms 
 that, after the death of Crispus, the remorse of his father
 accepted from the ministers of Christianity the expiation
 which he had vainly solicited from the Pagan pontiffs.","('Zosimus', 'PERSON'), ('69', 'DATE'), ('Crispus', 'PERSON'), ('Christianity', 'NORP'), ('Pagan', 'NORP')"
"Three hundred and eighteen bishops obeyed the
 summons of their indulgent master; the ecclesiastics of
 every rank and sect and denomination have been computed at
 two thousand and forty-eight persons; (127) the Greeks 
 appeared in person; and the consent of the Latins was
 expressed by the legates of the Roman pontiff.","('Three hundred and eighteen', 'CARDINAL'), ('two thousand and forty-eight', 'CARDINAL'), ('127', 'CARDINAL'), ('Greeks', 'NORP'), ('Latins', 'NORP'), ('Roman', 'NORP')"
"Under the reign of his son
 Constantius, Theophilus, (79) who was himself of Indian 
 extraction, was invested with the double character of
 ambassador and bishop.","('Constantius', 'PERSON'), ('Theophilus', 'PERSON'), ('79', 'DATE'), ('Indian', 'NORP')"
"Under the reign of the younger Theodosius, 
 the polite and eloquent Synesius, one of the descendants of
 Hercules,(116) filled the episcopal seat of Ptolemais, near 
 the ruins of ancient Cyrene,(117) and the philosophic bishop 
 supported with dignity the character which he had assumed
 with reluctance.(118)","('Theodosius', 'PERSON'), ('Synesius', 'PERSON'), ('one', 'CARDINAL'), ('Hercules', 'LOC'), ('116', 'CARDINAL'), ('Ptolemais', 'GPE'), ('Cyrene', 'LOC'), ('117', 'CARDINAL'), ('118', 'CARDINAL')"
"War and
 commerce had spread the knowledge of the Gospel beyond the
 confines of the Roman provinces; and the barbarians, who had
 disdained an humble and proscribed sect, soon learned to
 esteem a religion which had been so lately embraced by the
 greatest monarch and the most civilised nation of the globe.
 (76)","('Roman', 'NORP'), ('76', 'CARDINAL')"
"Whatever advantages might be derived from the
 acquisition of an Imperial proselyte, he was distinguished
 by the splendour of his purple, rather than by the
 superiority of wisdom or virtue, from the many thousands of
 his subjects who had embraced the doctrines of Christianity.","('Imperial', 'NORP'), ('thousands', 'CARDINAL'), ('Christianity', 'NORP')"
"Whatever symptoms of Christian piety might transpire in the
 discourses or actions of Constantine, he persevered till he
 was near forty years of age in the practice of the
 established religion;(10) and the same conduct which in the 
 court of Nicomedia might be imputed to his fear, could be
 ascribed only to the inclination or policy of the sovereign
 of Gaul.","('Christian', 'NORP'), ('Constantine', 'PERSON'), ('forty years of age', 'DATE'), ('10', 'CARDINAL'), ('Nicomedia', 'PERSON'), ('Gaul', 'PERSON')"
"When Constantine
 embraced the faith of the Christians, he seemed to contract
 a perpetual alliance with a distinct and independent
 society; and the privileges granted or confirmed by that
 emperor, or by his successors, were accepted, not as the
 precarious favours of the court, but as the just and
 inalienable rights of the ecclesiastical order.","('Constantine', 'PERSON'), ('Christians', 'NORP')"
"While 
 Constantine in his own dominions increased the number and
 zeal of his faithful adherents, he could depend on the
 support of a powerful faction in those provinces which were
 still possessed or usurped by his rivals.","('Constantine', 'PERSON')"
"While one of the
 candidates boasted the honours of his family, a second
 allured his judges by the delicacies of a plentiful table,
 and a third, more guilty than his rivals, offered to share
 the plunder of the church among the accomplices of his
 sacrilegious hopes.(90)","('one', 'CARDINAL'), ('second', 'ORDINAL'), ('third', 'ORDINAL')"
"While the East, 
 according to the lively expression of Eusebius, was involved
 in the shades of infernal darkness.","('East', 'LOC'), ('Eusebius', 'PERSON')"
"While the civil and
 military professions were separated by the policy of
 Constantine, a new and perpetual order of ecclesiastical ministers, always respectable, sometimes dangerous, was
 established in the church and state.","('Constantine', 'PERSON')"
"While they experienced the
 rigour of persecution, they were never provoked either to
 meet their tyrants in the field, or indignantly to withdraw
 themselves into some remote and sequestered corner of the
 globe.(19)","('19', 'CARDINAL')"
"While this important 
 revolution yet remained in suspense, the Christians and the
 Pagans watched the conduct of their sovereign with the same
 anxiety, but with very opposite sentiments.","('Christians', 'NORP'), ('Pagans', 'NORP')"
"Whilst his anxiety for the approaching day, which must decide the fate of the empire, was suspended by a short and interrupted slumber, the venerable form of Christ, and the well-known symbol of his religion, might forcibly offer themselves to the active fancy of a prince who reverenced the name, and had perhaps secretly implored the power, of the God of the Christians.","('the approaching day', 'DATE'), ('Christ', 'PERSON'), ('Christians', 'NORP')"
"Within the space of fifty years, a philosophic
 spectator of the vicissitudes of human affairs might have
 contemplated Tacitus in the senate of Rome, and Constantine
 in the council of Nice.","('the space of fifty years', 'DATE'), ('Tacitus', 'PERSON'), ('Rome', 'GPE'), ('Constantine', 'PERSON'), ('Nice', 'GPE')"
"Yet, instead of ascertaining the
 precise circumstances of time and place, which always serve
 to detect falsehood or establish truth; (49) instead of 
 collecting and recording the evidence of so many living
 witnesses, who must have been spectators of this stupendous
 miracle,(50) Eusebius contents himself with alleging a very 
 singular testimony, that of the deceased Constantine, who,
 many years after the event, in the freedom of conversation,
 had related to him this extraordinary incident of his own
 life, and had attested the truth of it by a solemn oath.","('50', 'CARDINAL'), ('Eusebius', 'PERSON'), ('Constantine', 'PERSON')"
renounced the gods of Rome and of his ancestors.,"('Rome', 'GPE')"
"seems impatient(1) to proclaim to the  world the glorious example of the sovereign of Gaul; who, in the first moments of his reign, acknowledged and adored the majesty of the true and only God.(2)","('1', 'CARDINAL'), ('Gaul', 'PERSON'), ('first', 'ORDINAL'), ('2', 'CARDINAL')"
"the auspicious rays of
 celestial light warmed and illuminated the provinces of the
 West.","('West', 'LOC')"
the heavens whilst he meditated and prepared the Italian expedition.,"('Italian', 'NORP')"
"which enjoined the solemn
 observance of Sunday, (8) and the second directed the regular 
 consultation of the Aruspices. (9)","('Sunday, (8)', 'DATE'), ('second', 'ORDINAL'), ('Aruspices', 'ORG'), ('9', 'CARDINAL')"
