Sentence,Entities
"The emperors still continued to
 exercise a supreme jurisdiction over the A.D. 312-438ecclesiastical
 order; and the sixteenth book of the Theodosian code
 represents, under a variety of titles, the authority which
 they assumed in the government of the Catholic church.","('sixteenth', 'ORDINAL'), ('Theodosian', 'WORK_OF_ART'), ('Catholic', 'NORP')"
"The emperors, as the guardians of
 the public peace, and as the first citizens of Rome and
 Constantinople, might effectually declare their wishes in
 the choice of a primate; but those absolute monarchs
 respected the freedom of ecclesiastical elections, and,
 while they distributed and resumed the honours of the state
 and army, they allowed eighteen hundred perpetual
 magistrates to receive their important offices from the free
 suffrages of the people.(92)","('first', 'ORDINAL'), ('Rome', 'GPE'), ('Constantinople', 'GPE'), ('eighteen hundred', 'CARDINAL'), ('92', 'CARDINAL')"
"The enemies of
 Constantine have imputed to interested motives the alliance
 which he insensibly contracted with the Catholic church, and
 which apparently contributed to the success of his ambition.","('Constantine', 'PERSON'), ('Catholic', 'NORP')"
"The evidence of
 ecclesiastical history is prepared to affirm that their
 expectations were justified by the conspicuous miracle to
 which the conversion of the first Christian emperor has been
 almost unanimously ascribed.","('first', 'ORDINAL'), ('Christian', 'NORP')"
"The exact balance of the two religions
 continued but a moment; and the piercing eye of ambition and
 avarice soon discovered that the profession of Christianity
 might contribute to the interest of the present, as well as
 of a future life.","('two', 'CARDINAL'), ('Christianity', 'NORP')"
"The example
 and reputation of Constantine seemed to countenance the
 delay of baptism. (70)","('Constantine', 'PERSON'), ('70', 'CARDINAL')"
"The example of his 
 father instructed Constantine to esteem and to reward the
 merit of the Christians; and in the distribution of public
 offices he had the advantage of strengthening his government
 by the choice of ministers or generals in whose fidelity he
 could repose a just and unreserved confidence.","('Constantine', 'PERSON'), ('Christians', 'NORP')"
"The experience of Greek and Roman history could
 not inform the world how far the system of national manners
 might be reformed and improved by the precepts of a divine
 revelation; and Constantine might listen with some
 confidence to the flattering, and indeed reasonable,
 assurances of Lactantius.","('Greek', 'NORP'), ('Roman', 'NORP'), ('Constantine', 'PERSON'), ('Lactantius', 'ORG')"
"The extent and
 boundaries of their respective dioceses had been variously
 and accidentally decided by the zeal and success of the
 first missionaries, by the wishes of the people, and by the
 propagation of the Gospel.","('first', 'ORDINAL'), ('Gospel', 'ORG')"
"The fathers of the Capitol and those
 of the church had alike degenerated from the virtues of
 their founders; but as the bishops were more deeply rooted
 in the public opinion, they sustained their dignity with
 more decent pride, and sometimes opposed with a manly spirit
 the wishes of their sovereign.","('Capitol', 'ORG')"
"The frequent repetition of miracles serves to provoke, where it does not subdue, the reason of mankind; but if the dream of Constantine is separately considered, it may be naturally explained either by the policy or the enthusiasm of the emperor.","('Constantine', 'PERSON')"
"The gratitude of the church has exalted the virtues and
 excused the failings of a generous patron, who seated
 Christianity on the throne of the Roman world; and the
 Greeks, who celebrate the festival of the Imperial saint,
 seldom mention the name of Constantine without adding the
 title of equal to the Apostles .(71)","('Christianity', 'NORP'), ('Roman', 'NORP'), ('Greeks', 'NORP'), ('Imperial', 'NORP'), ('Constantine', 'PERSON'), ('Apostles', 'PERSON'), ('71', 'CARDINAL')"
"The habits 
 of mankind and the interest of religion gradually abated the
 horror of war and bloodshed which had so long prevailed
 among the Christians; and in the councils which were
 assembled under the gracious protection of Constantine the
 authority of the bishops was seasonably employed to ratify
 the obligation of the military oath, and to inflict the
 penalty of excommunication on those soldiers who threw away
 their arms during the peace of the church. (27)","('Christians', 'NORP'), ('Constantine', 'PERSON'), ('27', 'CARDINAL')"
The historian Zosimus maliciously asserts that the emperor had imbrued his hands in the blood of his eldest son before he publicly A.D. 326.,"('Zosimus', 'PERSON'), ('A.D. 326', 'DATE')"
"The interested views, the selfish and angry
 passions, the arts of perfidy and dissimulation, the secret
 corruption, the open and even bloody violence which had
 formerly disgraced the freedom of election in the
 commonwealths of Greece and Rome, too often influenced the
 choice of the successors of the apostles.","('Greece', 'GPE'), ('Rome', 'GPE')"
"The irresistible power of the Roman emperors was displayed
 in the important and dangerous change of the national
 religion.","('Roman', 'NORP')"
"The kings of
 Iberia and Armenia worshipped the God of their protector;
 and their subjects, who have invariably preserved the name
 of Christians, soon formed a sacred and perpetual connection
 with their Roman brethren.","('Iberia', 'LOC'), ('Armenia', 'GPE'), ('Christians', 'NORP'), ('Roman', 'NORP')"
"The latter, till their just apprehensions were
 changed into despair and resentment, attempted to conceal
 from the world, and from themselves, that the gods of Rome
 could no longer reckon the emperor in the number of their
 votaries.","('Rome', 'GPE')"
The learned Eusebius has  ascribed the faith of Constantine to the miraculous sign which was displayed in A.D. 312.,"('Eusebius', 'PERSON'), ('Constantine', 'PERSON'), ('A.D. 312', 'DATE')"
"The learned bishop of Caesarea appears 
 to be sensible that the recent discovery of this marvellous
 anecdote would excite some surprise and distrust among the
 most pious of his readers.","('Caesarea', 'GPE')"
"The liberality of 
 Constantine increased in a just proportion to his faith and
 to his vices.","('Constantine', 'PERSON')"
"The mind of Constantine might fluctuate
 between the Pagan and the Christian religions.","('Constantine', 'PERSON'), ('Pagan', 'NORP'), ('Christian', 'NORP')"
"The office of supreme
 pontiff, which, from the time of Numa to that of Augustus,
 had always been exercised by one of the most eminent of the
 senators, was at length united to the Imperial dignity.","('Numa', 'GPE'), ('Augustus', 'PERSON'), ('one', 'CARDINAL'), ('Imperial', 'ORG')"
"The partial and increasing
 favour of Constantine may naturally be referred to the
 esteem which he entertained for the moral character of the
 Christians, and to a persuasion that the propagation of the
 Gospel would inculcate the practice of private and public
 virtue.","('Constantine', 'PERSON'), ('Christians', 'NORP'), ('Gospel', 'WORK_OF_ART')"
"The passive and unresisting obedience which bows under the
 yoke of authority, or even of oppression, must have appeared
 in the eyes of an absolute monarch the most conspicuous and
 useful of the evangelic virtues.(18) The primitive Christians 
 derived the institution of civil government, not from the
 consent of the people, but from the decrees of Heaven.","('18', 'CARDINAL'), ('Christians', 'NORP')"
"The patrimony of the church was still subject 
 to all the public impositions of the state.(108)","('108', 'CARDINAL')"
The perplexity  produced by these discordant authorities is derived from the behaviour of Constantine himself.,"('Constantine', 'PERSON')"
"The piety of Constantine was admitted as an
 unexceptionable proof of the justice of his arms; and his
 use of victory confirmed the opinion of the Christians, that
 their hero was inspired and conducted by the Lord of Hosts.","('Constantine', 'PERSON'), ('Christians', 'NORP'), ('the Lord of Hosts', 'WORK_OF_ART')"
"The piety, rather than the humanity, of 
 Constantine soon abolished in his dominions the punishment
 which the Saviour of mankind had condescended to suffer;(30) 
 but the emperor had already learned to despise the
 prejudices of his education and of his people, before he
 could erect in the midst of Rome his own statue, bearing a
 cross in its right hand, with an inscription which referred
 the victory of his arms, and the deliverance of Rome, to the
 virtue of that salutary sign, the true symbol of force and
 courage.","('Constantine', 'PERSON'), ('30', 'CARDINAL'), ('Rome', 'GPE'), ('Rome', 'GPE')"
"The poet was
 perhaps unconscious of the secret sense and object of these
 sublime predictions, which have been so unworthily applied
 to the infant son of a consul, or a triumvir:(61) but if a 
 more splendid, and indeed specious, interpretation of the
 fourth eclogue contributed to the conversion of the first
 Christian emperor, Virgil may deserve to be ranked among the
 most successful missionaries of the Gospel.(62)
Devotion and privileges of Constantine.","('fourth', 'ORDINAL'), ('first', 'ORDINAL'), ('Christian', 'NORP'), ('Virgil', 'PERSON'), ('62', 'CARDINAL'), ('Constantine', 'PERSON')"
"The powerful influence 
 of Constantine was not circumscribed by the narrow limits of
 his life or of his dominions.","('Constantine', 'PERSON')"
"The preternatural origin of dreams was universally admitted by the nations of antiquity, and a considerable part of the Gallic army was already prepared to
 place their confidence in the salutary sign of the Christian
 religion.","('Gallic', 'NORP'), ('Christian', 'NORP')"
"The pride of Constantine might 
 assume, and his services had deserved, some extraordinary
 distinction; an ill-timed rigour might have blasted the
 unripened fruits of his conversion; and if the doors of the
 church had been strictly closed against a prince who had
 deserted the altars of the gods, the master of the empire
 would have been left destitute of any form of religious
 worship.","('Constantine', 'PERSON')"
"The pride of Constantine, who refused the privileges of a
 catechumen, cannot easily be explained or excused; but the
 delay of his baptism may be justified by the maxims and the
 practice of ecclesiastical antiquity.","('Constantine', 'PERSON')"
"The primates of Rome, Alexandria, Antioch,
 Carthage, and afterwards Constantinople, who exercised a
 more ample jurisdiction, convened the numerous assembly of
 their dependent bishops.","('Rome', 'GPE'), ('Alexandria', 'GPE'), ('Antioch', 'GPE'), ('Carthage', 'GPE'), ('Constantinople', 'GPE')"
"The progress of time and
 superstition erased the memory of the weakness, the passion,
 the ignorance, which disgraced these ecclesiastical synods;
 and the catholic world has unanimously submitted(129) to the 
 infallible decrees of the general councils.(130)","('129', 'CARDINAL'), ('130', 'CARDINAL')"
"The protestants of France, of Germany, and of 
 Britain, who asserted with such intrepid courage their civil
 and religious freedom, have been insulted by the invidious
 comparison between the conduct of the primitive and of the
 reformed Christians.(20) Perhaps, instead of censure, some 
 applause may be due to the superior sense and spirit of our
 ancestors, who had convinced themselves that religion cannot
 abolish the unalienable rights of human nature.(21) Perhaps 
 the patience of the primitive church may be ascribed to its
 weakness as well as to its virtue.","('France', 'GPE'), ('Germany', 'GPE'), ('Britain', 'GPE'), ('Christians', 'NORP'), ('20', 'CARDINAL')"
The rays of the Gospel illuminated the coast of India.,"('Gospel', 'LOC'), ('India', 'GPE')"
"The real or imaginary cause of
 so important an event deserves and demands the attention of
 posterity; and I shall endeavour to form a just estimate of
 the famous vision of Constantine, by a distinct
 consideration of the standard, the dream, and the celestial
 sign; by separating the historical, the natural, and the
 marvellous parts of this extraordinary story, which, in the
 composition of a specious argument, have been artfully
 confounded in one splendid and brittle mass.","('Constantine', 'PERSON'), ('one', 'CARDINAL')"
"The regular
 correspondence which connected the bishops of the most
 distant provinces enabled them freely to communicate their
 wishes and their designs, and to transmit without danger any
 useful intelligence, or any pious contributions, which might
 promote the service of Constantine, who publicly declared
 that he had taken up arms for the deliverance of the church.
 (28)
Expectation and belief of a miracle.","('Constantine', 'PERSON'), ('28', 'CARDINAL')"
"The religions of antiquity, which
 established a separate order of priests, dedicated a holy
 race, a tribe or family, to the perpetual service of the
 gods. (94)","('94', 'CARDINAL')"
"The representatives of the Christian republic were
 regularly assembled in the spring and autumn of each year
 and these synods diffused the spirit of ecclesiastical
 discipline and legislation through the hundred and twenty
 provinces of the Roman world. (125)","('Christian', 'NORP'), ('hundred and twenty', 'CARDINAL'), ('Roman', 'NORP'), ('125', 'CARDINAL')"
"The right of voting was vested in
 the inferior clergy, who were best qualified to judge of the
 merit of the candidates; in the senators or nobles of the
 city, all those who were distinguished by their rank or
 property; and finally in the whole body of the people, who
 on the appointed day flocked in multitudes from the most
 remote parts of the diocese,(89) and sometimes silenced, by 
 their tumultuous acclamations, the voice of reason and the
 laws of discipline.","('89', 'CARDINAL')"
"The ruin of civil liberty had silenced the
 demagogues of Athens and the tribunes of Rome; the custom of
 preaching, which seems to constitute a considerable part of
 Christian devotion, had not been introduced into the temples
 of antiquity; and the ears of monarchs were never invaded by
 the harsh sound of popular eloquence till the pulpits of the
 empire were filled with sacred orators, who possessed some
 advantages unknown to their profane predecessors.(122)","('Athens', 'GPE'), ('Rome', 'GPE'), ('Christian', 'NORP'), ('122', 'CARDINAL')"
"The sacrament of
 baptism(67) was regularly administered by the bishop himself, 
 with his assistant clergy, in the cathedral church of the
 diocese, during the fifty days between the solemn festivals
 of Easter and Pentecost; and this holy term admitted a
 numerous band of infants and adult persons into the bosom of
 the church.","('the fifty days', 'DATE'), ('Easter and Pentecost', 'EVENT')"
"The salvation of the common people was 
 purchased at an easy rate, if it be true that, in one year,
 twelve thousand men were baptised at Rome, besides a
 proportionable number of women and children, and that a
 white garment, with twenty pieces of gold, had been promised
 by the emperor to every convert.","('one year', 'DATE'), ('twelve thousand', 'CARDINAL'), ('Rome', 'GPE'), ('twenty', 'CARDINAL')"
"The same extraordinary providence, which was no longer
 confined to the Jewish people, might elect Constantine and
 his family as the protectors of the Christian world; and the
 devout Lactantius announces, in a prophetic tone, the future
 glories of his long and universal reign.(22) Galerius and 
 Maximin, Maxentius and Licinius, were the rivals who shared
 with the favourite of Heaven the provinces of the empire.","('Jewish', 'NORP'), ('Constantine', 'PERSON'), ('Christian', 'NORP'), ('Lactantius', 'PERSON'), ('Galerius', 'PERSON'), ('Maximin', 'PERSON'), ('Maxentius', 'PERSON'), ('Licinius', 'PERSON')"
"The same messenger who carried over to
 Africa the head of Maxentius might be intrusted with an
 epistle to Caecilian, bishop of Carthage.","('Africa', 'LOC'), ('Maxentius', 'GPE'), ('Caecilian', 'PERSON'), ('Carthage', 'GPE')"
"The same passions and prejudices have engaged the
 partial writers of the times to connect the public
 profession of Christianity with the most glorious or the
 most ignominious era of the reign of Constantine.","('Christianity', 'NORP'), ('Constantine', 'PERSON')"
"The sceptre and the sword were committed to the
 hands of Moses, of Joshua, of Gideon, of David, of the
 Maccabees; the virtues of those heroes were the motive or
 the effect of the divine favour, the success of their arms
 was destined to achieve the deliverance or the triumph of
 the church.","('Moses', 'PERSON'), ('Joshua', 'PERSON'), ('Gideon', 'GPE'), ('David', 'PERSON'), ('Maccabees', 'NORP')"
"The secret vision of Constantine could be disproved only by the event; and the intrepid hero who had passed the Alps and the Apennine might view with careless despair the consequences of a defeat under the walls of
 Rome.","('Constantine', 'PERSON'), ('Alps', 'LOC'), ('Apennine', 'PERSON'), ('Rome', 'GPE')"
"The senate and people, exulting in their own deliverance from an odious tyrant, acknowledged that the victory of Constantine surpassed the powers of man, without daring to insinuate that it had been obtained by the
 protection of the gods.","('Constantine', 'PERSON')"
"The separation of men into the
 two orders of the clergy and of the laity was, indeed,
 familiar to many nations of antiquity; and the priests of
 India, of Persia, of Assyria, of Judea, of Ethiopia, of
 Egypt, and of Gaul, derived from a celestial origin the
 temporal power and possessions which they had acquired.","('two', 'CARDINAL'), ('India', 'GPE'), ('Persia', 'GPE'), ('Assyria', 'GPE'), ('Judea', 'GPE'), ('Ethiopia', 'GPE'), ('Egypt', 'GPE'), ('Gaul', 'PERSON')"
"The session,
 which lasted about two months, was frequently honoured by
 the presence of the emperor.","('about two months', 'DATE')"
"The solemn epithets of safety
 of the republic, glory of the army, restoration of public
 happiness, are equally applied to the religious and military
 trophies; and there is still extant a medal of the emperor
 Constantius, where the standard of the labarum is
 accompanied with these memorable words, BY THIS SIGN THOU
 SHALT CONQUER.(38)
The dream of Constantine.","('Constantius', 'PERSON'), ('Constantine', 'PERSON')"
"The son of Constantius immediately suspended or
 repealed the edicts of persecution, and granted the free
 exercise of their religious ceremonies to all those who had
 already professed themselves members of the church.","('Constantius', 'PERSON')"
"The sublime theory 
 of the Gospel had made a much fainter impression on the
 heart than on the understanding of Constantine himself.","('Gospel', 'WORK_OF_ART'), ('Constantine', 'PERSON')"
"The submission or the resistance of the clergy
 and people, on various occasions, afforded different
 precedents, which were insensibly converted into positive
 laws and provincial customs: (91) but it was everywhere 
 admitted, as a fundamental maxim of religious policy, that
 no bishop could be imposed on an orthodox church without the
 consent of its members.","('91', 'CARDINAL')"
"The success of Constantine against Maxentius and
 Licinius removed the two formidable competitors who still
 opposed the triumph of the second David, and his cause might
 seem to claim the peculiar interposition of Providence.","('Constantine', 'PERSON'), ('Maxentius', 'PERSON'), ('Licinius', 'PERSON'), ('two', 'CARDINAL'), ('second', 'ORDINAL'), ('David', 'PERSON'), ('Providence', 'GPE')"
"The summit
 of the pike supported a crown of gold, which enclosed the
 mysterious monogram, at once expressive of the figure of the
 cross and the initial letters of the name of Christ.(35)","('Christ', 'PERSON'), ('35', 'CARDINAL')"
"The terrors of a military force silenced the faint
 and unsupported murmurs of the Pagans, and there was reason
 to expect that the cheerful submission of the Christian
 clergy, as well as the people, would be the result of
 conscience and gratitude.","('Pagans', 'NORP'), ('Christian', 'NORP')"
"The timbers were framed for the most
 part of cedars of Libanus; the roof was covered with tiles,
 perhaps of gilt brass; and the walls, the columns, the
 pavement, were incrusted with variegated marbles.","('Libanus', 'GPE')"
"The tragic deaths of Galerius and Maximin soon gratified the
 resentment, and fulfilled the sanguine expectations, of the
 Christians.","('Galerius', 'PERSON'), ('Maximin', 'PERSON'), ('Christians', 'NORP')"
"The triumphal arch, which was
 erected about three years after the event, proclaims, in
 ambiguous language, that, by the greatness of his own mind,
 and by an instinct or impulse of the Divinity, he had saved
 and avenged the Roman republic.(43)","('about three years', 'DATE'), ('Roman', 'NORP'), ('43', 'CARDINAL')"
"The two emperors proclaim to the
 world that they have granted a free and absolute power to
 the Christians, and to all others, of following the religion
 which each individual thinks proper to prefer, to which he
 has addicted his mind, and which he may deem the best
 adapted to his own use.","('two', 'CARDINAL'), ('Christians', 'NORP')"
"The understandings of their
 congregations were perplexed by mystery, their passions were
 inflamed by invectives; and they rushed from the Christian
 temples of Antioch, or Alexandria, prepared either to suffer
 or to inflict martyrdom.","('Christian', 'NORP'), ('Antioch', 'GPE'), ('Alexandria', 'GPE')"
"The victories and the civil policy of
 Constantine no longer influence the state of Europe; but a
 considerable portion of the globe still retains the
 impression which it received from the conversion of that
 monarch; and the ecclesiastical institutions of his reign
 are still connected, by an indissoluble chain, with the
 opinions, the passions, and the interests of the present
 generation.","('Constantine', 'PERSON'), ('Europe', 'LOC')"
"The vision of Constantine maintained an honourable
 place in the legend of superstition till the bold and
 sagacious spirit of criticism presumed to depreciate the
 triumph, and to arraign the truth, of the first Christian
 emperor.(53)
The conversion of Constantine might be sincere.","('Constantine', 'PERSON'), ('first', 'ORDINAL'), ('Christian', 'NORP'), ('Constantine', 'PERSON')"
"The wealthy Christians were encouraged by the
 example of their sovereign.","('Christians', 'NORP')"
"Their
 grateful devotion has placed the monogram of Christ in the
 midst of the ensigns of Rome.","('Christ', 'PERSON'), ('Rome', 'GPE')"
"Their ranks(99) and numbers 
 were insensibly multiplied by the superstition of the times,
 which introduced into the church the splendid ceremonies of
 a Jewish or Pagan temple; and a long train of priests,
 deacons, subdeacons, acolytes, exorcists, readers, singers,
 and doorkeepers contributed, in their respective stations,
 to swell the pomp and harmony of religious worship.","('99', 'CARDINAL'), ('Jewish', 'NORP'), ('Pagan', 'NORP')"
"Theophilus was intrusted with many other useful
 or curious presents, which might raise the admiration and
 conciliate the friendship of the barbarians; and he
 successfully employed several years in a pastoral visit to
 the churches of the torrid zone.(80)
Change of the national religion..","('Theophilus', 'PERSON'), ('several years', 'DATE'), ('80', 'CARDINAL')"
"These spiritual terrors were enforced by a dexterous
 application to the Byzantine court; the trembling president
 implored the mercy of the church, and the descendant of
 Hercules enjoyed the satisfaction of raising a prostrate
 tyrant from the ground. (121)","('Byzantine', 'NORP'), ('Hercules', 'PERSON'), ('121', 'CARDINAL')"
"These venerable institutions had gradually assimilated
 themselves to the manners and government of their respective
 countries;(85) but the opposition or contempt of the civil 
 power served to cement the discipline of the primitive
 church.","('85', 'CARDINAL')"
"They
 were soon encouraged to depend on the favour as well as on
 the justice of their sovereign, who had imbibed a secret and
 sincere reverence for the name of Christ, and for the God of
 the Christians.(14)
Edict of Milan.","('Christ', 'PERSON'), ('Christians', 'NORP'), ('14', 'CARDINAL'), ('Milan', 'GPE')"
"They condescend to assign two weighty
 reasons which have induced them to allow this universal
 toleration: the humane intention of consulting the peace and
 happiness of their people; and the pious hope that by such a
 conduct they shall appease and propitiate the Deity, whose
 seat is in heaven.","('two', 'CARDINAL')"
"They gratefully acknowledge the many
 signal proofs which they have received of the divine favour;
 and they trust that the same Providence will for ever
 continue to protect the prosperity of the prince and people.","('Providence', 'GPE')"
"They marched to battle with the
 full assurance that the same God who had formerly opened a
 passage to the Israelites through the waters of Jordan, and
 had thrown down the walls of Jericho at the sound of the
 trumpets of Joshua, would display his visible majesty and
 power in the victory of Constantine.","('Israelites', 'NORP'), ('Jordan', 'GPE'), ('Jericho', 'GPE'), ('Joshua', 'PERSON'), ('Constantine', 'PERSON')"
"They may not hesitate to
 pronounce that, in the choice of a religion, his mind was
 determined only by a sense of interest; and that ( according
 to the expression of a profane poet(54) ) he used the altars 
 of the church as a convenient footstool to the throne of the
 empire.","('54', 'DATE')"
