Sentence,Entities
"The nations which he vanquished exercised a base and impotent revenge; and ignorance has long repeated the tale of calumny, (5) which had disfigured the birth and character, the person, and even the name, of Tamerlane. (6)","('6', 'CARDINAL')"
"The only hope of salvation for the Greek empire, and the
 adjacent kingdoms, would have been some more powerful weapon, some discovery in the art of war, that would give them a decisive superiority over their Turkish foes.","('Greek', 'NORP'), ('Turkish', 'NORP')"
"The open country was overspread with
 hordes of shepherds and robbers of Tartar or Turkman origin;
 the recent conquests of Bajazet were restored to the emirs,
 one of whom, in base revenge, demolished his sepulchre; and
 his five sons were eager, by civil discord, to consume the
 remnant of their patrimony.","('Tartar', 'NORP'), ('Turkman', 'NORP'), ('Bajazet', 'GPE'), ('one', 'CARDINAL'), ('five', 'CARDINAL')"
"The precise aera of the invention and application of gunpowder (91) is involved in doubtful traditions and equivocal language; yet we may clearly discern, that it was known before the middle of the fourteenth century; and that before the end of the same, the use of artillery in battles and sieges, by sea and land, was familiar to the states of Germany, Italy, Spain, France, and England. (92)","('the middle of the fourteenth century', 'DATE'), ('Germany', 'GPE'), ('Italy', 'GPE'), ('Spain', 'GPE'), ('France', 'GPE'), ('England', 'GPE'), ('92', 'CARDINAL')"
"The primitive
 subjects of Othman were the four hundred families of
 wandering Turkmans, who had followed his ancestors from the
 Oxus to the Sangar; and the plains of Anatolia are still
 covered with the white and black tents of their rustic
 brethren.","('Othman', 'PERSON'), ('four hundred', 'CARDINAL'), ('Turkmans', 'NORP'), ('Oxus', 'LOC'), ('Sangar', 'LOC'), ('Anatolia', 'LOC')"
"The provinces of Thrace,
 Macedonia, Albania, Bulgaria, and Servia, became the
 perpetual seminary of the Turkish army; and when the royal
 fifth of the captives was diminished by conquest, an inhuman
 tax of the fifth child, or of every fifth year, was
 rigorously levied on the Christian families.","('Thrace', 'GPE'), ('Macedonia', 'GPE'), ('Albania', 'GPE'), ('Bulgaria', 'GPE'), ('Servia', 'GPE'), ('Turkish', 'NORP'), ('fifth', 'ORDINAL'), ('fifth', 'ORDINAL'), ('every fifth year', 'DATE'), ('Christian', 'NORP')"
"The public and private injuries were poorly
 redressed by the tardy rigour of inquiry and punishment; and
 we must be content to praise the Institutions of Timour, as
 the specious idea of a perfect monarchy.","('the Institutions of Timour', 'ORG')"
"The public joy was
 testified by illuminations and masquerades; the trades of
 Samarcand passed in review; and every trade was emulous to
 execute some quaint device, some marvellous pageant, with
 the materials of their peculiar art.","('Samarcand', 'GPE')"
"The pursuit of a flying enemy carried Timour into the tributary provinces of Russia: a duke of the reigning family was made prisoner amidst the ruins of his capital; and Yeletz, by the pride and ignorance of the Orientals, might easily be confounded with the genuine metropolis of the nation.","('Timour', 'PERSON'), ('Russia', 'GPE'), ('Yeletz', 'PERSON'), ('Orientals', 'NORP')"
"The reader has not forgot the garrison of French, whom the marshal Boucicault left behind him for the
 defence of Constantinople.","('French', 'NORP'), ('Boucicault', 'PERSON'), ('Constantinople', 'GPE')"
"The religious merit of subduing the city of the Caesars
 attracted from Asia a crowd of volunteers, who aspired to
 the crown of martyrdom: their military ardour was inflamed by
 the promise of rich spoils and beautiful females; and the
 sultan's ambition was consecrated by the presence and
 prediction of Seid Bechar, a descendant of the prophet, (83)
 who arrived in the camp, on a mule, with a venerable train
 of five hundred disciples.","('Caesars', 'LOC'), ('Asia', 'LOC'), ('Seid Bechar', 'PERSON'), ('83', 'DATE'), ('five hundred', 'CARDINAL')"
"The resemblance of character was still more dangerous than the opposition of interest; and in their
 victorious career, Timour was impatient of an equal, and Bajazet was ignorant of a superior.","('Timour', 'PERSON'), ('Bajazet', 'PERSON')"
"The rich plunder that was abandoned to his soldiers might stimulate their avarice; but their cruelty was enforced by the peremptory command of producing an adequate number of heads, which, according to his custom, were curiously piled in columns and pyramids: the Moguls celebrated the feast of victory, while the surviving Moslems passed the night in tears and in chains.","('Moguls', 'NORP'), ('Moslems', 'NORP')"
"The royal captive showed some signs of repentance, accepted the humiliation of a robe of honour, and embraced with tears his son Mousa, who, at his request, was sought and found among the captives of the field.","('Mousa', 'PERSON')"
"The ruin was
 suspended by the prudence and moderation of the conqueror:
 he faithfully discharged his own obligations and those of
 Soliman, respected the laws of gratitude and peace; and left
 the emperor guardian of his two younger sons, in the vain
 hope of saving them from the jealous cruelty of their
 brother Amurath.","('Soliman', 'PERSON'), ('two', 'CARDINAL'), ('Amurath', 'PERSON')"
"The same success attended the other mirzas and
 emirs in their excursions; and Smyrna, defended by the zeal
 and courage of the Rhodian knights, alone deserved the
 presence of the emperor himself.","('Smyrna', 'PERSON'), ('Rhodian', 'NORP')"
"The siege, more especially of the castle, might have been a work of time; but he tempted, by the appearance of weakness, the sultan Mahmoud and his vizier to descend into the plain, with ten thousand cuirassiers, forty thousand of his foot-guards, and one hundred and twenty elephants, whose tusks are said to have been armed with sharp and poisoned daggers.","('Mahmoud', 'PERSON'), ('ten thousand', 'CARDINAL'), ('forty thousand', 'CARDINAL'), ('one hundred and twenty', 'CARDINAL')"
"The spoil,
 however, of the palace and city was immense: the inhabitants
 had escaped; but the buildings, for the most part of wood,
 were reduced to ashes From Boursa, the grandson of Timour
 advanced to Nice, ever yet a fair and flourishing city; and
 the Mogul squadrons were only stopped by the waves of the
 Propontis.","('Boursa', 'PERSON'), ('Timour', 'PERSON'), ('Nice', 'GPE'), ('Propontis', 'PRODUCT')"
"The standard was unfurled for the
 invasion of China: the emirs made their report of two
 hundred thousand, the select and veteran soldiers of Iran
 and Touran: their baggage and provisions were transported by
 five hundred great wagons, and an immense train of horses
 and camels; and the troops might prepare for a long absence,
 since more than six months were employed in the tranquil
 journey of a caravan from Samarcand to Pekin.","('China', 'GPE'), ('two\r\n hundred thousand', 'CARDINAL'), ('Iran', 'GPE'), ('Touran', 'GPE'), ('five hundred', 'CARDINAL'), ('more than six months', 'DATE'), ('Samarcand', 'GPE'), ('Pekin', 'GPE')"
"The strength
 of the walls resisted an army of two hundred thousand Turks;
 their assaults were repelled by the sallies of the Greeks
 and their foreign mercenaries; the old resources of defence
 were opposed to the new engines of attack; and the
 enthusiasm of the dervis, who was snatched to heaven in
 visionary converse with Mahomet, was answered by the
 credulity of the Christians, who beheld the Virgin Mary, in
 a violet garment, walking on the rampart and animating their
 courage. (84)","('two hundred thousand', 'CARDINAL'), ('Turks', 'NORP'), ('Greeks', 'NORP'), ('Mahomet', 'PERSON'), ('Christians', 'NORP'), ('the Virgin Mary', 'PERSON')"
"The sultan and five
 hundred guards embarked on board the admiral's ship; which
 was manned by eight hundred of the bravest Franks.","('five\r\n hundred', 'CARDINAL'), ('eight hundred', 'CARDINAL'), ('Franks', 'PERSON')"
"The two passages of the Bosphorus and Hellespont,
 of Constantinople and Gallipoli, were possessed, the one by
 the Christians, the other by the Turks.","('two', 'CARDINAL'), ('Bosphorus', 'LOC'), ('Hellespont', 'LOC'), ('Constantinople', 'GPE'), ('Gallipoli', 'GPE'), ('Christians', 'NORP'), ('Turks', 'NORP')"
"The victor dropped a tear over his grave: his body, with royal pomp, was conveyed to the mausoleum which he had erected at Boursa; and his son Mousa, after receiving a rich present of gold and jewels, of horses and arms, was invested by a patent in red ink with
 the kingdom of Anatolia.","('Boursa', 'PERSON'), ('Mousa', 'PERSON'), ('Anatolia', 'LOC')"
"The whole course of the Tigris and Euphrates, from the mouth to the sources of those rivers, was reduced
 to his obedience: he entered Edessa; and the Turkmans of the black sheep were chastised for the sacrilegious pillage of a caravan of Mecca.","('Tigris', 'LOC'), ('Euphrates', 'LOC'), ('Edessa', 'PERSON'), ('Turkmans', 'NORP'), ('Mecca', 'GPE')"
"The youths most conspicuous for birth, talents,
 and beauty, were admitted into the inferior class of
 Agiamoglans, or the more liberal rank of Ichoglans, of whom
 the former were attached to the palace, and the latter to
 the person, of the prince.","('Agiamoglans', 'NORP'), ('Ichoglans', 'NORP')"
"Their efforts might have instructed
 the Christian powers; and had they occupied, with a
 confederate fleet, the Straits of Gallipoli, the Ottomans,
 at least in Europe, must have been speedily annihilated.","('Christian', 'NORP'), ('the Straits of Gallipoli', 'LOC'), ('Ottomans', 'NORP'), ('Europe', 'LOC')"
"Their union was short and jealous; but the policy of Timour, in their frequent quarrels, exposed his rival to the reproach of injustice and
 perfidy; and, after a final defeat, Houssein was slain by
 some sagacious friends, who presumed, for the last time, to
 disobey the commands of their lord.","('Timour', 'PERSON'), ('Houssein', 'PERSON')"
"They appeal with confidence to the
 Persian history of Sherefeddin Ali, which has been given to
 our curiosity in a French version, and from which I shall
 collect and abridge a more specious narrative of this
 memorable transaction.","('Persian', 'NORP'), ('Sherefeddin Ali', 'PERSON'), ('French', 'NORP')"
"They consisted of four hundred thousand horse and foot, (39) whose merit and fidelity were of an unequal complexion.","('four hundred thousand', 'CARDINAL'), ('39', 'CARDINAL')"
"They landed
 in sight of Mustapha and Gallipoli; two thousand Italians,
 armed with lances and battle-axes, attended Amurath to the
 conquest of Adrianople; and this venal service was soon
 repaid by the ruin of the commerce and colony of Phocaea.","('Mustapha', 'PERSON'), ('Gallipoli', 'GPE'), ('two thousand', 'CARDINAL'), ('Italians', 'NORP'), ('Amurath', 'GPE'), ('Adrianople', 'GPE'), ('Phocaea', 'GPE')"
"They unanimously
 deplore the captivity of the iron cage; and some credit may
 be allowed to national historians, who cannot stigmatize the
 Tartar without uncovering the shame of their king and
 country.","('Tartar', 'NORP')"
"They were celebrated in the gardens of Canighul, decorated
 with innumerable tents and pavilions, which displayed the
 luxury of a great city and the spoils of a victorious camp.","('Canighul', 'GPE')"
"They were on the spot to receive
 the earliest and most faithful intelligence of the overthrow
 of their great adversary; and it is more than probable, that
 some of them accompanied the Greek embassy to the camp of
 Tamerlane.","('Greek', 'NORP'), ('Tamerlane', 'GPE')"
"This remote, and perhaps imaginary,
 danger was averted by the submission of the sultan of Egypt:
 the honours of the prayer and the coin attested at Cairo the
 supremacy of Timour; and a rare gift of a giraffe, or
 camelopard, and nine ostriches, represented at Samarcand the
 tribute of the African world.","('Egypt', 'GPE'), ('Cairo', 'GPE'), ('Timour', 'PERSON'), ('nine', 'CARDINAL'), ('Samarcand', 'ORG'), ('African', 'NORP')"
"Through the gates of Derbend, he entered Persia at
 the head of ninety thousand horse: with the innumerable
 forces of Kipzak, Bulgaria, Circassia, and Russia, he passed
 the Sihoon, burnt the palaces of Timour, and compelled him,
 amidst the winter snows, to contend for Samarcand and his life.","('Derbend', 'GPE'), ('Persia', 'GPE'), ('ninety thousand', 'CARDINAL'), ('Kipzak', 'GPE'), ('Bulgaria', 'GPE'), ('Circassia', 'GPE'), ('Russia', 'GPE'), ('Sihoon', 'NORP'), ('Timour', 'GPE'), ('Samarcand', 'PERSON')"
"Timour crossed the Indus at the ordinary passage of Attok; and successively traversed, in the footsteps of Alexander, the Punjab, or five rivers, (25) that fall into the master stream.","('Timour', 'PERSON'), ('Indus', 'LOC'), ('Attok', 'GPE'), ('Alexander', 'GPE'), ('Punjab', 'GPE'), ('five', 'CARDINAL'), ('25', 'CARDINAL')"
"Timour had read in some fabulous
 history a similar treatment of one of his predecessors, a king of Persia; and Bajazet was condemned to represent the person, and expiate the guilt, of the Roman Caesar. (58) Death of Bajazet, A.D. 1403,March 9.","('Timour', 'PERSON'), ('one', 'CARDINAL'), ('Persia', 'PERSON'), ('Bajazet', 'PERSON'), ('the Roman Caesar', 'PERSON'), ('Bajazet', 'GPE'), ('A.D. 1403', 'DATE'), ('March 9', 'DATE')"
"Timour invades Syria, A.D. 1400.","('Timour', 'PERSON'), ('Syria', 'GPE'), ('A.D. 1400', 'DATE')"
"Timour made his triumphal entry into the capital of Hindostan; and admired, with a view to imitate, the architecture of the stately mosque; but the order or license of a general pillage and massacre polluted the festival of his victory.","('Timour', 'PERSON'), ('Hindostan', 'GPE')"
"Timour might boast, that, at his accession to the throne,
 Asia was the prey of anarchy and rapine, whilst under his
 prosperous monarchy a child, fearless and unhurt, might
 carry a purse of gold from the East to the West.","('Timour', 'PERSON'), ('Asia', 'LOC'), ('East', 'LOC'), ('West', 'LOC')"
"Timour was urged to this
 enterprise by national honour and religious zeal.","('Timour', 'PERSON')"
"Timour's front was covered with a line of Indian elephants, whose turrets were filled with archers and Greek fire: the rapid
 evolutions of his cavalry completed the dismay and disorder; the Syrian crowds fell back on each other: many thousands were stifled or slaughtered in the entrance of the great street; the Moguls entered with the fugitives; Sacks Aleppo, A.D. 1400, Nov. 11. and after a short defence, the citadel, the impregnable citadel of Aleppo, was surrendered by cowardice or treachery.","('Timour', 'PERSON'), ('Indian', 'NORP'), ('Greek', 'NORP'), ('Syrian', 'NORP'), ('many thousands', 'CARDINAL'), ('Moguls', 'FAC'), ('Sacks Aleppo', 'PERSON'), ('A.D. 1400', 'DATE'), ('Nov. 11', 'DATE'), ('Aleppo', 'GPE')"
"To
 escape a similar indignity, it is said that his successors,
 except in a single instance, have abstained from legitimate
 nuptials; and the Ottoman practice and belief, at least in
 the sixteenth century, is asserted by the observing
 Busbequius, (55) ambassador from the court of Vienna to the
 great Soliman.","('Ottoman', 'NORP'), ('the sixteenth century', 'DATE'), ('Busbequius', 'PERSON'), ('55', 'CARDINAL'), ('Vienna', 'GPE'), ('Soliman', 'PERSON')"
To live in the memory and esteem of future ages was the second wish of his magnanimous spirit.,"('second', 'ORDINAL')"
"To reign, rather than to govern,
 was the ambition of his children and grandchildren; (70) the
 enemies of each other and of the people.","('70', 'CARDINAL')"
"To the soldiers who had served in the Indian war he granted the choice of remaining at home, or following their prince; but the troops of all the provinces and kingdoms of Persia were commanded to assemble at Ispahan, and wait the arrival of the Imperial standard.","('the Indian war', 'EVENT'), ('Persia', 'GPE'), ('Ispahan', 'GPE'), ('Imperial', 'NORP')"
"To these doctors he proposed a captious question, which the casuists of Bochara,
 Samarcand, and Herat, were incapable of resolving.","('Bochara', 'GPE'), ('Samarcand', 'GPE'), ('Herat', 'GPE')"
"Toctamish, a fugitive prince, was entertained
 and protected in his court: the ambassadors of Auruss Khan
 were dismissed with a haughty denial, and followed on the
 same day by the armies of Zagatai; and their success
 established Toctamish in the Mogul empire of the North.","('Toctamish', 'PERSON'), ('Auruss Khan', 'PERSON'), ('the\r\n same day', 'DATE'), ('Zagatai', 'NORP'), ('Toctamish', 'ORG'), ('Mogul', 'LOC'), ('North', 'LOC')"
"Twenty-two
 years after that event, he was sent ambassador to Amurath
 the Second; and the historian might converse with some
 veteran Janizaries, who had been made prisoners with the
 sultan, and had themselves seen him in his iron cage.","('Twenty-two\r\n years', 'DATE'), ('Amurath', 'PERSON'), ('Second', 'ORDINAL'), ('Janizaries', 'NORP')"
"We may discriminate the Janizaries, who have been gradually raised to an establishment of forty thousand men; a national
 cavalry, the Spahis of modern times; twenty thousand cuirassiers of Europe, clad in black and impenetrable armour; the troops of Anatolia, whose princes had taken refuge in the camp of Timour, and a colony of Tartars, whom he had
 driven from Kipzak, and to whom Bajazet had assigned a settlement in the plains of Adrianople.","('Janizaries', 'NORP'), ('forty thousand', 'CARDINAL'), ('Spahis', 'NORP'), ('twenty thousand', 'CARDINAL'), ('Europe', 'LOC'), ('Anatolia', 'LOC'), ('Timour', 'GPE'), ('Tartars', 'NORP'), ('Kipzak', 'GPE'), ('Bajazet', 'PERSON'), ('Adrianople', 'GPE')"
"Weighty indeed is this evidence, adopted by all the
 Persian histories; (48) yet flattery, more especially in the
 East, is base and audacious; and the harsh and ignominious
 treatment of Bajazet is attested by a chain of witnesses,
 some of whom shall be produced in the order of their time
 and country.","('Persian', 'NORP'), ('48', 'CARDINAL'), ('East', 'LOC'), ('Bajazet', 'PERSON')"
"When Manuel
 abdicated the government, it was his prayer, rather than his
 hope, that the ruin of the church and state might be delayed
 beyond his unhappy days; and after his return from a western
 pilgrimage, he expected every hour the news of the sad
 catastrophe.","('Manuel', 'PERSON'), ('every hour', 'TIME')"
"When Timour first proposed to his princes and emirs the invasion of India or Hindostan, (24) he was answered by a murmur of discontent:","('Timour', 'PERSON'), ('first', 'ORDINAL'), ('India', 'GPE'), ('Hindostan', 'PERSON'), ('24', 'DATE')"
"When Timour, in every sense, had
 evacuated Anatolia, he left the cities without a palace, a
 treasure, or a king.","('Timour', 'PERSON'), ('Anatolia', 'LOC')"
"When they left the seraglio, and
 suffered their beards to grow as the symbol of
 enfranchisement, they found themselves in an important
 office, without faction or friendship, without parents and
 without heirs, dependent on the hand which had raised them
 from the dust, and which, on the slightest displeasure,
 could break in pieces these statues of glass, as they were
 aptly termed by the Turkish proverb. (89)","('Turkish', 'NORP'), ('89', 'CARDINAL')"
"While he led his Janizaries to
 new conquests in Europe and Asia, the Byzantine empire was
 indulged in a servile and precarious respite of thirty
 years.","('Janizaries', 'NORP'), ('Europe', 'LOC'), ('Asia', 'LOC'), ('Byzantine', 'NORP'), ('thirty\r\n years', 'DATE')"
"While he triumphed on the Volga or the
 Ganges, his servants, and even his sons, forgot their master
 and their duty.","('Volga', 'LOC'), ('Ganges', 'LOC')"
"While the transient dynasties of Asia have been continually subverted by a crafty vizier in the palace, or a victorious general in the camp, the Ottoman succession has been confirmed by the practice of five centuries, and is now incorporated with the vital principle of the Turkish nation.","('Asia', 'LOC'), ('Ottoman', 'NORP'), ('five centuries', 'DATE'), ('Turkish', 'NORP')"
"Whole forests were cut down to supply fuel for the kitchens;
 the plain was spread with pyramids of meat, and vases of
 every liquor, to which thousands of guests were courteously
 invited: the orders of the state, and the nations of the
 earth, were marshalled at the royal banquet; nor were the
 ambassadors of Europe (says the haughty Persian) excluded
 from the feast; since even the casses, the smallest of fish,
 find their place in the ocean.","('thousands', 'CARDINAL'), ('Europe', 'LOC'), ('Persian', 'NORP')"
"Without any possible correspondence between the Latin and
 the Arabian writer, they agree in the fact of the iron cage;
 and their agreement is a striking proof of their common
 veracity.","('Latin', 'NORP'), ('Arabian', 'NORP')"
"Without expatiating on the victories of thirty-five campaigns; without describing the lines of march, which he repeatedly traced over the continent of Asia; I shall briefly represent his conquests in, I. Persia, II.","('thirty-five', 'CARDINAL'), ('Asia', 'LOC'), ('I. Persia', 'PERSON')"
"Yet fear is still more rapid in
 its course; and Soliman, the son of Bajazet, had already
 passed over to Europe with the royal treasure.","('Soliman', 'PERSON'), ('Bajazet', 'GPE'), ('Europe', 'LOC')"
"Yet his real merit would be enhanced, rather than debased, by the elevation of a peasant to the throne of Asia; nor can his lameness be a theme of reproach, unless he had the weakness to blush at a natural, or perhaps an honourable, infirmity.","('Asia', 'LOC')"
"Yet in his first expedition, Timour was satisfied with the siege
 and destruction of Siwas or Sebaste, a strong city on the borders of Anatolia; and he revenged the indiscretion of the Ottoman, on a garrison of four thousand Armenians, who were buried alive for the brave and faithful discharge of their
 duty.","('first', 'ORDINAL'), ('Timour', 'PERSON'), ('Siwas', 'GPE'), ('Sebaste', 'GPE'), ('Anatolia', 'LOC'), ('Ottoman', 'NORP'), ('four thousand', 'CARDINAL'), ('Armenians', 'NORP')"
"and as both generals were alike impatient for action, the plains round that city were the scene of a memorable battle, which has immortalized the glory of Timour and the shame of Bajazet.","('Timour', 'PERSON'), ('Bajazet', 'PERSON')"
"but I shall briefly mention, (36) that he erected on the ruins of Bagdad a pyramid of ninety thousand heads; again visited Georgia; encamped on the banks of Araxes; and proclaimed his resolution of marching against the Ottoman emperor.","('Bagdad', 'GPE'), ('ninety thousand', 'CARDINAL'), ('Georgia', 'GPE'), ('Araxes', 'LOC'), ('Ottoman', 'NORP')"
disproved by the Persian historian of Timour;,"('Persian', 'NORP'), ('Timour', 'PERSON')"
