Sentence,Entities
(107),"('107', 'CARDINAL')"
(15),"('15', 'CARDINAL')"
"(18)
Political heresy of Arnold of Brescia, A.D. 1140.","('Arnold', 'PERSON'), ('Brescia', 'GPE'), ('A.D. 1140', 'DATE')"
(19),"('19', 'CARDINAL')"
(31),"('31', 'CARDINAL')"
(41),"('41', 'CARDINAL')"
(53),"('53', 'CARDINAL')"
"A credulous
 devotion for the fables and oracles of the priesthood most
 powerfully acts on the mind of a Barbarian; yet such a mind
 is the least capable of preferring imagination to sense, of
 sacrificing to a distant motive, to an invisible, perhaps an
 ideal, object, the appetites and interests of the present
 world.","('Barbarian', 'NORP')"
A flight of a hundred steps led to the summit of the Tarpeian rock; and far steeper was the ascent before the declivities had been smoothed and the precipices filled by the ruins of fallen edifices.,"('hundred', 'CARDINAL'), ('Tarpeian', 'NORP')"
"A just anxiety for his
 reputation, a clear foresight of the difficulties of the
 task, had engaged him to refuse the honour of their choice:
 the statutes of Rome were suspended, and his office
 prolonged to the term of three years.","('Rome', 'GPE'), ('three years', 'DATE')"
"A majority of the clergy and people
 supported his cause: he reigned several years in the
 Vatican; and it is only the eloquence of St. Bernard, and
 the final triumph of Innocence the Second, that has branded
 Anacletus with the epithet of antipope.","('several years', 'DATE'), ('Vatican', 'FAC'), ('St. Bernard', 'GPE'), ('Innocence the Second', 'WORK_OF_ART'), ('Anacletus', 'PERSON')"
"A new channel
 was opened by the diligence of Boniface the Eighth, who
 reconciled the vices of ambition and avarice; and the pope
 had sufficient learning to recollect and revive the secular
 games which were celebrated in Rome at the conclusion of
 every century.","('Boniface the Eighth', 'PERSON'), ('Rome', 'GPE')"
"A new constitution was hastily framed by private
 ambition or popular enthusiasm; nor could Rome, in the
 twelfth century, produce an antiquary to explain, or a
 legislator to restore, the harmony and proportions of the
 ancient model.","('Rome', 'GPE'), ('the\r\n twelfth century', 'DATE')"
"A new jurisprudence had established in the Latin church the right and practice of appeals; (7) and from the North and West the bishops and
 abbots were invited or summoned to solicit, to complain, to
 accuse, or to justify, before the threshold of the apostles.","('Latin', 'NORP'), ('North', 'LOC'), ('West', 'LOC')"
"A peaceful and perpetual succession was
 ascertained by Alexander the Third, (68) who finally abolished the tumultuary votes of the clergy and people, and defined the right of election in the sole college of cardinals. (69)","('Alexander the Third', 'PERSON'), ('68', 'DATE'), ('69', 'CARDINAL')"
"A rare prodigy is once recorded, that two horses, belonging
 to the archbishops of Mentz and Cologne, repassed the Alps,
 yet laden with gold and silver: (8) but it was soon
 understood, that the success, both of the pilgrims and
 clients, depended much less on the justice of their cause
 than on the value of their offering.","('two', 'CARDINAL'), ('Mentz', 'ORG'), ('Cologne', 'GPE'), ('Alps', 'LOC'), ('8', 'CARDINAL')"
"A repetition (13) of such capricious brutality, without
 connection or design, would be tedious and disgusting; and I
 shall content myself with some events of the twelfth
 century, which represent the state of the popes and the
 city.","('13', 'CARDINAL'), ('the twelfth\r\n century', 'DATE')"
"A servant, in whom they possessed but a third share, was
 dismissed by the independent Romans: in his place they
 elected a patrician; but this title, which Charlemagne had
 not disdained, was too lofty for a citizen or a subject; A.D. 1198-1216. and, after the first fervour of rebellion, they consented without reluctance to the restoration of the praefect.","('third', 'ORDINAL'), ('Romans', 'NORP'), ('Charlemagne', 'PERSON'), ('1198-1216', 'CARDINAL'), ('first', 'ORDINAL')"
"A specious offer was made and accepted, that, in the term of
 forty days, they would elect one of the three candidates who
 should be named by their opponents.","('forty days', 'DATE'), ('one', 'CARDINAL'), ('three', 'CARDINAL')"
"A trifling
 oblation from each individual would accumulate a royal
 treasure; and two priests stood night and day, with rakes in
 their hands, to collect, without counting, the heaps of gold
 and silver that were poured on the altar of St. Paul. (86)","('two', 'CARDINAL'), ('St. Paul', 'GPE'), ('86', 'CARDINAL')"
"A vacancy of almost three years had preceded the elevation of George the Tenth, who resolved to prevent the future abuse;
 and his bull, after some opposition, has been consecrated in the code of the canon law. (70)","('almost three years', 'DATE'), ('George the Tenth', 'PERSON')"
A.D. 1086-1305.,"('A.D. 1086-1305', 'DATE')"
A.D. 1130-1143.,"('1130-1143', 'CARDINAL')"
"A.D. 1144,1145.","('A.D. 1144,1145', 'DATE')"
A.D. 1144-1154.,"('A.D. 1144-1154', 'DATE')"
A.D. 1144.,"('A.D. 1144', 'DATE')"
A.D. 1179.,"('A.D. 1179', 'DATE')"
A.D. 1281.,"('A.D. 1281', 'DATE')"
A.D. 1294-1303.,"('A.D. 1294-1303', 'DATE')"
A.D. 1328.,"('A.D. 1328', 'DATE')"
"About
 twelve years afterwards, he besieged Rome, to seat an
 antipope in the chair of St. Peter; and twelve Pisan galleys
 were introduced into the Tyber: but the senate and people
 were saved by the arts of negotiation and the progress of
 disease; nor did Frederic or his successors reiterate the
 hostile attempt.","('About\r\n twelve years afterwards', 'DATE'), ('Rome', 'GPE'), ('St. Peter', 'GPE'), ('twelve', 'CARDINAL'), ('Pisan', 'NORP'), ('Tyber', 'NORP'), ('Frederic', 'PERSON')"
"About fifty years after this event, Innocent the Third, the
 most ambitious, or at least the most fortunate, of the
 Pontiffs, delivered the Romans and himself from this badge
 of foreign dominion: he invested the praefect with a banner
 instead of a sword, and absolved him from all dependence of
 oaths or service to the German emperors. (42)","('About fifty years', 'DATE'), ('Third', 'ORDINAL'), ('Pontiffs', 'NORP'), ('Romans', 'NORP'), ('German', 'NORP'), ('42', 'CARDINAL')"
"About fifty years afterwards, the same title was granted to the emperor Lewis of Bavaria; and the liberty of Rome was acknowledged by her two sovereigns, who accepted a municipal office in the government of their own metropolis.","('About fifty years afterwards', 'DATE'), ('Lewis', 'PERSON'), ('Bavaria', 'GPE'), ('Rome', 'GPE'), ('two', 'CARDINAL')"
"About the end of the thirteenth century, the
 most powerful branch was composed of an uncle and six
 bothers, all conspicuous in arms, or in the honours of the
 church.","('About the end of the thirteenth century', 'DATE'), ('six', 'CARDINAL')"
Absence of the popes from Rome.,"('Rome', 'GPE')"
"According to their own and
 the public opinion, the primitive and remote source was
 derived from the banks of the Rhine; (99) and the sovereigns
 of Germany were not ashamed of a real or fabulous affinity
 with a noble race, which in the revolutions of seven hundred
 years has been often illustrated by merit and always by
 fortune. (100)","('Rhine', 'ORG'), ('99', 'CARDINAL'), ('Germany', 'GPE'), ('seven hundred\r\n years', 'DATE')"
Addresses of Rome to the emperors.,"('Rome', 'GPE')"
"Adrian
 the Fourth, (28) the only Englishman who has ascended the throne of St. Peter; and whose merit emerged from the mean condition of a monk, and almost a beggar, in the monastery
 of St. Albans.","('Adrian\r\n the Fourth', 'PERSON'), ('28', 'DATE'), ('Englishman', 'NORP'), ('St. Peter', 'GPE'), ('St. Albans', 'GPE')"
"After a
 dark series of revolutions, all records of pedigree were
 lost; the distinction of surnames was abolished; the blood
 of the nations was mingled in a thousand channels; and the
 Goths and Lombards, the Greeks and Franks, the Germans and
 Normans, had obtained the fairest possessions by royal
 bounty, or the prerogative of valour.","('a thousand', 'CARDINAL'), ('Goths', 'NORP'), ('Lombards', 'NORP'), ('Greeks', 'NORP'), ('Franks', 'PERSON'), ('Germans', 'NORP'), ('Normans', 'NORP')"
"After an abdication of eight hundred years, the Roman senate asserted this honourable and lucrative privilege; which was tacitly renounced by the popes, from Paschal the Second to the establishment of their residence beyond the Alps.","('eight hundred years', 'DATE'), ('Roman', 'NORP'), ('Paschal', 'PERSON'), ('Second', 'ORDINAL'), ('Alps', 'LOC')"
"After his decease, the tedious and equal suspense of the
 conclave was fixed by the dexterity of the French faction.","('French', 'NORP')"
"After his defeat
 and death, the posterity of Leo is no longer conspicuous;
 and none will be found of the modern nobles ambitious of
 descending from a Jewish stock.","('Leo', 'PERSON'), ('Jewish', 'NORP')"
"After his retreat from Rome,
 Arnold had been protected by the viscounts of Campania, from whom he was extorted by the power of Caesar: the praefect of the city pronounced his sentence:","('Rome', 'GPE'), ('Arnold', 'PERSON'), ('Campania', 'GPE'), ('Caesar', 'PERSON')"
"After so long an interruption, it may not be
 useless to repeat that the successors of Charlemagne and the
 Othos were chosen beyond the Rhine in a national diet; but
 that these princes were content with the humble names of
 kings of Germany and Italy, till they had passed the Alps
 and the Apennine, to seek their Imperial crown on the banks
 of the Tyber. (3)","('Charlemagne', 'PERSON'), ('Othos', 'PERSON'), ('Rhine', 'LOC'), ('Germany', 'GPE'), ('Italy', 'GPE'), ('Alps', 'LOC'), ('Apennine', 'ORG'), ('Imperial', 'ORG'), ('Tyber', 'PRODUCT'), ('3', 'CARDINAL')"
"After some complaint of his silence and neglect, they exhort the former of these princes to pass the Alps, and assume from their hands the Imperial crown.","('Alps', 'LOC'), ('Imperial', 'ORG')"
"After some negotiation with the magistrates, the Roman people were assembled (73) in the square before St. Peter's: the pope of Avignon, John the Twenty-second, was deposed: the choice of his successor was ratified by their consent and applause.","('Roman', 'NORP'), (""St. Peter's"", 'FAC'), ('Avignon', 'GPE'), ('John', 'PERSON'), ('Twenty-second', 'DATE')"
"After the extinction of
 the house of Swabia, they were banished beyond the Alps: and
 their last coronations betrayed the impotence and poverty of
 the Teutonic Caesars. (61)","('Swabia', 'GPE'), ('Alps', 'LOC'), ('Teutonic', 'NORP'), ('61', 'CARDINAL')"
After the retreat of the popes to Avignon they disputed in arms the vacant republic; and the mischiefs of discord were perpetuated by the wretched compromise of electing each year two rival senators.,"('Avignon', 'GPE'), ('two', 'CARDINAL')"
"After the revival of the senate, (43) the
 conscript fathers (if I may use the expression) were
 invested with the legislative and executive power; but their
 views seldom reached beyond the present day; and that day
 was most frequently disturbed by violence and tumult.","('43', 'CARDINAL'), ('the present day', 'DATE'), ('that day', 'DATE')"
"All that has been observed of the greatness of the Colonna will likewise redeemed to the glory of the Ursini, their constant and equal antagonists in the long hereditary feud, which distracted above two hundred and fifty years the ecclesiastical state.","('Colonna', 'PERSON'), ('Ursini', 'NORP'), ('two hundred and fifty years', 'DATE')"
"All the
 spiritual censures and disqualifications were abolished (103)
 by his prudent successors; and the fortune of the house was
 more firmly established by this transient hurricane.","('103', 'CARDINAL')"
"Among the nations who revered the apostolic throne, the tumults of Rome provoked a general indignation; Innocent II.","('Rome', 'GPE'), ('Innocent II', 'PERSON')"
"An insurrection of the people delivered their bishop: the rival families opposed the violence of the Frangipani; and Cencio, who sued for pardon, repented of the failure, rather than of the guilt, of his enterprise.","('Frangipani', 'PERSON'), ('Cencio', 'PERSON')"
"Anarchy, no longer
 tempered by the pastoral care of their bishop, admonished
 the Romans that they were incapable of governing themselves;
 and they sought abroad those blessings which they were
 hopeless of finding at home.","('Romans', 'NORP')"
"And
 sometimes, thundering from the Vatican, they created, judged, and deposed the kings of the world; nor could the proudest Roman be disgraced by submitting to a priest, whose feet were kissed, and whose stirrup was held, by the
 successors of Charlemagne. (6)","('Vatican', 'FAC'), ('Roman', 'NORP'), ('Charlemagne', 'PERSON'), ('6', 'CARDINAL')"
"And it was
 thus, that the shrine of St. Peter was profaned by the
 thoughtless Romans; who pillaged the offerings, and wounded
 the pilgrims, without computing the number and value of
 similar visits, which they prevented by their inhospitable
 sacrilege.","('St. Peter', 'FAC'), ('Romans', 'NORP')"
"And the muse of
 Petrarch inspired a wish, a hope, a prediction, that the generous youth, the son of his venerable hero, would restore Rome and Italy to their pristine glory; that his justice would extirpate the wolves and lions, the serpents and
 bears, who labored to subvert the eternal basis of the
 marble COLUMN. (109)","('Petrarch', 'PERSON'), ('Rome', 'GPE'), ('Italy', 'GPE'), ('109', 'CARDINAL')"
"Arnold of Brescia enjoyed, or
 deplored, the effects of his mission: his reign continued
 above ten years, while two popes, Innocent the Second and
 Anastasius the Fourth, either trembled in the Vatican, or
 wandered as exiles in the adjacent cities.","('Arnold', 'PERSON'), ('Brescia', 'GPE'), ('ten years', 'DATE'), ('two', 'CARDINAL'), ('Second', 'ORDINAL'), ('Anastasius', 'NORP'), ('Fourth', 'ORDINAL'), ('Vatican', 'FAC')"
"As he passed
 through the city, in his road to victory, he received their
 oath of allegiance, lodged in the Lateran palace, and
 smoothed in a short visit the harsh features of his despotic
 character.","('Lateran', 'NORP')"
"As the pope resided at Anagni, without the suspicion of danger, his palace and
 person were assaulted by three hundred horse, who had been secretly levied by William of Nogaret, a French minister, and Sciarra Colonna, of a noble but hostile family of Rome.","('Anagni', 'GPE'), ('three hundred', 'CARDINAL'), ('William of Nogaret', 'PERSON'), ('French', 'NORP'), ('Sciarra Colonna', 'PERSON'), ('Rome', 'GPE')"
"At his choice, four
 or six knights and civilians, his assessors in arms and
 justice, attended the Podesta, (47) who maintained at his own
 expense a decent retinue of servants and horses: his wife,
 his son, his brother, who might bias the affections of the
 judge, were left behind: during the exercise of his office
 he was not permitted to purchase land, to contract an
 alliance, or even to accept an invitation in the house of a
 citizen; nor could he honourably depart till he had satisfied
 the complaints that might be urged against his government.","('four', 'CARDINAL'), ('six', 'CARDINAL'), ('Podesta', 'PERSON'), ('47', 'DATE')"
"Authority of the popes in Rome,","('Rome', 'GPE')"
"Battle of Viterbo, A.D. 1234.","('Viterbo', 'GPE'), ('1234', 'CARDINAL')"
"Before
 his departure, the prudent senator had required the exchange of thirty hostages of the noblest families of Rome: on the news of his danger, and at the prayer of his wife, they were more strictly guarded; and Bologna, in the cause of honour, sustained the thunders of a papal interdict.","('thirty', 'CARDINAL'), ('Rome', 'GPE'), ('Bologna', 'PERSON')"
"Blending in the same
 discourse the texts of Livy and St. Paul, uniting the
 motives of gospel, and of classic, enthusiasm, he admonished
 the Romans, how strangely their patience and the vices of
 the clergy had degenerated from the primitive times of the
 church and the city.","('Livy', 'PERSON'), ('St. Paul', 'GPE'), ('Romans', 'NORP')"
"Both the father and the son were the parents of a
 numerous progeny: their riches, the fruits of usury, were
 shared with the noblest families of the city; and so
 extensive was their alliance, that the grandson of the
 proselyte was exalted by the weight of his kindred to the
 throne of St. Peter.","('St. Peter', 'PERSON')"
"Brancaleone, A.D. 1252-1258.","('Brancaleone', 'GPE'), ('A.D. 1252-1258', 'DATE')"
"But
 in arms, the modern Romans were not above, and in arts, they were far below, the common level of the neighbouring republics.","('Romans', 'NORP')"
"But
 the feeble and disorderly government of Rome was unequal to
 the task of curbing her rebellious sons, who scorned the
 authority of the magistrate within and without the walls.","('Rome', 'GPE')"
"But
 the position of Rome was less favourable, the territory less
 fruitful: the character of the inhabitants was debased by
 indolence and elated by pride; and they fondly conceived
 that the tribute of subjects must forever nourish the
 metropolis of the church and empire.","('Rome', 'GPE')"
"But Lewis forgot his own debility and the prejudices of the times: beyond the precincts of a German camp, his useless phantom was rejected; the Romans despised their own workmanship; the antipope implored the mercy of his lawful sovereign; (75) and the exclusive right of the
 cardinals was more firmly established by this unseasonable attack.","('Lewis', 'PERSON'), ('German', 'NORP'), ('Romans', 'NORP'), ('75', 'CARDINAL')"
"But after the emperors had been divested of their
 prerogatives, after a maxim had been established that the
 vicar of Christ is amenable to no earthly tribunal, each
 vacancy of the holy see might involve Christendom in
 controversy and war.","('Christ', 'PERSON'), ('Christendom', 'NORP')"
"But among, perhaps above, the peers and princes of the city,
 I distinguish the rival houses of COLONNA and URSINI, whose
 private story is an essential part of the annals of modern Rome.","('COLONNA', 'ORG'), ('URSINI', 'ORG'), ('Rome', 'GPE')"
"But as the concurrence of two thirds of the votes had been made necessary, the election was often delayed by the private interest and passions of the cardinals; and while they prolonged their independent reign, the Christian world was left destitute of a head.","('two thirds', 'CARDINAL'), ('Christian', 'NORP')"
"But every Roman prejudice was awakened by the
 name, the language, and the manners, of a Barbarian lord.","('Roman', 'NORP'), ('Barbarian', 'NORP')"
"But in this transient reign,
 the senators of Rome indulged their avarice and ambition:
 their justice was perverted by the interest of their family
 and faction; and as they punished only their enemies, they
 were obeyed only by their adherents.","('Rome', 'GPE')"
"But none of either family had fallen by the sword, till the most renowned champion of the Ursini was surprised and slain by the younger Stephen Colonna. (108)","('Ursini', 'PERSON'), ('Stephen Colonna', 'PERSON'), ('108', 'CARDINAL')"
"But the
 first of the family in fame and merit was the elder Stephen, whom Petrarch loved and esteemed as a hero superior to his own times, and not unworthy of ancient Rome.","('first', 'ORDINAL'), ('Stephen', 'PERSON'), ('Petrarch', 'PERSON'), ('Rome', 'GPE')"
"But the
 regular distribution of the thirty-five tribes, the nice
 balance of the wealth and numbers of the centuries, the
 debates of the adverse orators, and the slow operations of
 votes and ballots, could not easily be adapted by a blind
 multitude, ignorant of the arts, and insensible of the
 benefits, of legal government.","('thirty-five', 'CARDINAL'), ('the centuries', 'DATE')"
"But the Romans forgot, and were forgotten.","('Romans', 'NORP')"
"But the Vatican and Capitol were nourished by the incessant and increasing swarms of pilgrims and suppliants: the pale of Christianity was enlarged, and the
 pope and cardinals were overwhelmed by the judgment of ecclesiastical and secular causes.","('Vatican', 'FAC'), ('Capitol', 'ORG'), ('Christianity', 'NORP')"
"But the favour of the people is less
 permanent than the resentment of the priest; and after the
 heresy of Arnold had been condemned by Innocent the Second,
 (22) in the general council of the Lateran, the magistrates
 themselves were urged by prejudice and fear to execute the
 sentence of the church.","('Arnold', 'PERSON'), ('Second', 'ORDINAL'), ('22', 'DATE'), ('the general council of the Lateran', 'ORG')"
"But the revenge of Adrian was yet
 unsatisfied, and the approaching coronation of Frederic
 Barbarossa was fatal to the bold reformer, who had offended,
 though not in an equal degree, the heads of the church and
 state.","('Adrian', 'PERSON'), ('Frederic\r\n Barbarossa', 'PERSON')"
But the root of mischief was deep and perennial; and a momentary calm was preceded and followed by such tempests as had almost sunk the bark of St. Peter.,"('St. Peter', 'GPE')"
"But the scandals of the tenth century were obliterated by the austere and more dangerous virtues of Gregory the Seventh and his successors; and in the ambitious contests which they maintained for the rights of the church, their
 sufferings or their success must equally tend to increase the popular veneration.","('the tenth century', 'DATE'), ('Gregory the Seventh', 'PERSON')"
"But these splendid and fallacious wishes were not cherished by Conrad the Franconian, whose eyes were fixed on the Holy Land, and who died without visiting Rome soon after his return from the Holy Land.","('Conrad the Franconian', 'PERSON'), ('the Holy Land', 'GPE'), ('Rome', 'GPE'), ('the Holy Land', 'GPE')"
"But they encountered the triple scourge
 of war, pestilence, and famine: many wives and virgins were
 violated in the castles of Italy; and many strangers were
 pillaged or murdered by the savage Romans, no longer
 moderated by the presence of their bishops. (89)","('Italy', 'GPE'), ('Romans', 'NORP'), ('89', 'CARDINAL')"
"But they preached to the winds, and the same principle that weakened the effect, must temper the abuse, of the thunders of the Vatican.","('Vatican', 'FAC')"
"But they were soon distinguished among the nobles of Rome, by the number and bravery of their kinsmen, the strength of their towers, the honours of the senate and sacred college, and the elevation of two popes, Celestin the Third and Nicholas the Third, of their name and lineage. (105)","('Rome', 'GPE'), ('two', 'CARDINAL'), ('Celestin', 'PERSON'), ('Third', 'ORDINAL'), ('Nicholas', 'PERSON'), ('Third', 'ORDINAL'), ('105', 'CARDINAL')"
"By his sentence two nobles of the Annibaldi family
 were executed on a gibbet; and he inexorably demolished, in
 the city and neighbourhood, one hundred and forty towers, the
 strong shelters of rapine and mischief.","('two', 'CARDINAL'), ('Annibaldi', 'PERSON'), ('one hundred and forty', 'CARDINAL')"
"By land,
 by sea, by the Rhone, the position of Avignon was on all
 sides accessible; the southern provinces of France do not
 yield to Italy itself; new palaces arose for the
 accommodation of the pope and cardinals; and the arts of
 luxury were soon attracted by the treasures of the church.","('Rhone', 'LOC'), ('Avignon', 'GPE'), ('France', 'GPE'), ('Italy', 'GPE')"
"By the
 usurpation of Cavae, the Colonna provoked the arms of
 Paschal the Second; but they lawfully held in the Campagna
 of Rome the hereditary fiefs of Zagarola and Colonna; and
 the latter of these towns was probably adorned with some
 lofty pillar, the relic of a villa or temple.","('Cavae', 'GPE'), ('Colonna', 'PERSON'), ('Second', 'ORDINAL'), ('Campagna', 'LOC'), ('Rome', 'GPE'), ('Zagarola', 'GPE'), ('Colonna', 'PERSON')"
"By the conquest of Justinian, we have been recalled to the banks of the Tyber, to the deliverance of the ancient metropolis; but that deliverance was a change, or perhaps an aggravation, of servitude.","('Justinian', 'GPE'), ('Tyber', 'NORP')"
"By the public robbers, whom he had provoked for
 their sake, the Romans were excited to depose and imprison
 their benefactor; nor would his life have been spared, if
 Bologna had not possessed a pledge for his safety.","('Romans', 'NORP'), ('Bologna', 'GPE')"
"By these institutions the Romans were excluded from the election of their prince
 and bishop; and in the fever of wild and precarious liberty, they seemed insensible of the loss of this inestimable privilege.","('Romans', 'NORP')"
"By this wise regulation, all doubt and scandal were removed, and the root of schism was so effectually destroyed, that in a period of six hundred years a double choice has only once divided the unity of the sacred college.","('a period of six hundred years', 'DATE')"
"Cencio Frangipani, (14) a potent and factious baron, burst into the assembly furious and in arms: the cardinals were stripped, beaten, and trampled under foot; and he seized, without pity or respect, the vicar of Christ by the throat.","('Cencio Frangipani', 'PERSON'), ('14', 'DATE'), ('Christ', 'PERSON')"
Character of the Romans by St. Bernard.,"('Character of the Romans', 'PERSON'), ('St. Bernard', 'GPE')"
"Charles of Anjou and Provence, the most
 ambitious and warlike monarch of the age, accepted at the
 same time the kingdom of Naples from the pope, and the
 office of senator from the Roman people. (50)","('Charles', 'PERSON'), ('Anjou', 'GPE'), ('Provence', 'GPE'), ('Naples', 'GPE'), ('Roman', 'NORP'), ('50', 'CARDINAL')"
Conrad III.,"('Conrad III', 'PERSON')"
"Degraded, banished, proscribed, the six brothers, in
 disguise and danger, wandered over Europe without renouncing
 the hope of deliverance and revenge.","('six', 'CARDINAL'), ('Europe', 'LOC')"
