Sentence,Entities
(101),"('101', 'CARDINAL')"
"(13) In the East and in the West he had seen the 
 different effects of severity and indulgence; and as the
 former was rendered still more odious by the example of
 Galerius, his implacable enemy, the latter was recommended
 to his imitation by the authority and advice of a dying
 father.","('East', 'LOC'), ('West', 'LOC'), ('Galerius', 'PERSON')"
"(15) The wisdom of the emperors provided for the restitution of
 all the civil and religious rights of which the Christians
 had been so unjustly deprived.","('Christians', 'NORP')"
(3),"('3', 'CARDINAL')"
"(31) The same symbol sanctified the arms of the 
 soldiers of Constantine, the cross glittered on their
 helmet, was engraved on their shields, was interwoven into
 their banners; and the consecrated emblems which adorned the
 person of the emperor himself were distinguished only by
 richer materials and more exquisite workmanship.(32) But the 
 principal standard which displayed the triumph of the cross
 was styled the Labarum,(33) an obscure, though celebrated, 
 name, which has been vainly derived from almost all the
 languages of the world.","('Constantine', 'PERSON'), ('Labarum', 'NORP'), ('33', 'CARDINAL')"
(4),"('4', 'CARDINAL')"
(44),"('44', 'CARDINAL')"
(6),"('6', 'CARDINAL')"
(72),"('72', 'CARDINAL')"
(75),"('75', 'CARDINAL')"
"2. The domestic
 jurisdiction of the bishops was at once a privilege and a
 restraint of the ecclesiastical order, whose civil causes
 were decently withdrawn from the cognisance of a secular
 judge.","('2', 'CARDINAL')"
"3. The arbitration of the
 bishops was ratified by a positive law and the judges were
 instructed to execute, without appeal or delay, the
 episcopal decrees, whose validity had hitherto depended on
 the consent of the parties.","('3', 'CARDINAL')"
"4. The ancient
 privilege of sanctuary was transferred to the Christian
 temples, and extended, by the liberal piety of the younger
 Theodosius, to the precincts of consecrated ground.(113)","('4', 'CARDINAL'), ('Christian', 'NORP'), ('Theodosius', 'PERSON'), ('113', 'CARDINAL')"
"A Christian diocese might be spread 
 over a province, or reduced to a village; but all the
 bishops possessed an equal and indelible character; they all
 derived the same powers and privileges from the apostles,
 from the people, and from the laws.","('Christian', 'NORP')"
"A conclusion so harsh and so absolute is not,
 however, warranted by our knowledge of human nature, of
 Constantine, or of Christianity.","('Constantine', 'PERSON'), ('Christianity', 'NORP')"
"A secret
 disaffection was diffused among the Christian subjects of
 Maxentius and Licinius; and the resentment which the latter
 did not attempt to conceal served only to engage them still
 more deeply in the interest of his competitor.","('Christian', 'NORP'), ('Maxentius', 'PERSON'), ('Licinius', 'PERSON')"
"A sect of unwarlike
 plebeians, without leaders, without arms, without
 fortifications, must have encountered inevitable destruction
 in a rash and fruitless resistance to the master of the
 Roman legions.","('Roman', 'NORP')"
A.D. 306,"('A.D. 306', 'DATE')"
A.D. 306-312.,"('A.D. 306-312', 'DATE')"
"A.D. 313, March.","('A.D. 313', 'DATE'), ('March', 'DATE')"
"About five months after the conquest of Italy, the emperor
 made a solemn and authentic declaration of his sentiments by
 the celebrated edict of Milan, which restored peace to the
 catholic church.","('About five months', 'DATE'), ('Italy', 'GPE'), ('Milan', 'GPE')"
"According to
 the loose and complying notions of Polytheism, he might
 acknowledge the God of the Christians as one of the many
 deities who compose the hierarchy of heaven.","('Polytheism', 'PERSON'), ('Christians', 'NORP'), ('one', 'CARDINAL')"
"According to the strictness of ecclesiastical language, the first of the Christian emperors was unworthy of that name till the moment
 of his death; since it was only during his last illness that
 he A.D. 337.","('first', 'ORDINAL'), ('Christian', 'NORP'), ('A.D. 337', 'DATE')"
"After a fruitless attempt to reclaim the haughty magistrate
 by mild and religious admonition, Synesius proceeds to
 inflict the last sentence of ecclesiastical justice,(120) 
 which devotes Andronicus, with his associates and their
 families, to the abhorrence of earth and heaven.","('Synesius', 'PERSON'), ('Andronicus', 'PERSON')"
"Among the proselytes of
 Christianity there were many who judged it imprudent to
 precipitate a salutary rite which could not be repeated; to
 throw away an inestimable privilege which could never be
 recovered.","('Christianity', 'NORP')"
"An absolute monarch, who is rich
 without patrimony, may be charitable without merit; and
 Constantine too easily believed that he should purchase the
 favour of Heaven if he maintained the idle at the expense of
 the industrious, and distributed among the saints the wealth
 of the republic.","('Constantine', 'PERSON')"
"An annual income of six hundred pounds sterling
 may be reasonably assigned to the bishops, who were placed
 at an equal distance between riches and poverty,(105) but the 
 standard of their wealth insensibly rose with the dignity
 and opulence of the cities which they governed.","('six hundred pounds', 'QUANTITY'), ('105', 'CARDINAL')"
"An authentic
 but imperfect(106) rent-roll specifies some houses, shops, 
 gardens, and farms, which belonged to the three Basilicue of
 Rome — St. Peter, St. Paul, and St. John Lateran — in the
 provinces of Italy, Africa, and the East.","('106', 'CARDINAL'), ('three', 'CARDINAL'), ('Basilicue', 'GPE'), ('Rome', 'GPE'), ('St. Peter', 'GPE'), ('St. Paul', 'GPE'), ('St. John Lateran', 'GPE'), ('Italy', 'GPE'), ('Africa', 'LOC'), ('East', 'LOC')"
"As he
 gradually advanced in the knowledge of truth, he
 proportionably declined in the practice of virtue; and the
 same year of his reign in which he convened the council of
 Nice was polluted by the execution, or rather murder, of his
 eldest son.","('the\r\n same year', 'DATE'), ('Nice', 'GPE')"
"As long as Constantine exercised a limited sovereignty over
 the provinces of Gaul, his Christian subjects were protected
 by the authority, and perhaps by the laws, of a prince who
 wisely left to the gods the care of vindicating their own
 honour.","('Constantine', 'PERSON'), ('Gaul', 'PERSON'), ('Christian', 'NORP')"
"As readily might a consummate statesman indulge himself in the use of one of those military stratagems, one of those pious frauds, which Philip and Sertorius had employed with
 such art and effect.(42)","('one', 'CARDINAL'), ('one', 'CARDINAL'), ('Philip', 'PERSON'), ('Sertorius', 'PERSON')"
"As real virtue is sometimes excited by
 undeserved applause, the specious piety of Constantine, if
 at first it was only specious, might gradually, by the
 influence of praise, of habit, and of example, be matured
 into serious faith and fervent devotion.","('Constantine', 'PERSON')"
"As soon as Christianity
 became the religion of the emperor and the empire, the
 national clergy might claim a decent and honourable
 maintenance: and the payment of an annual tax might have
 delivered the people from the more oppressive tribute which
 superstition imposes on her votaries.","('Christianity', 'NORP')"
"As soon as a bishop had closed his eyes, the
 metropolitan issued a commission to one of his suffragans to
 administer the vacant see, and prepare, within a limited
 time, the future election.","('one', 'CARDINAL')"
"At
 the time of the death of Crispus the emperor could no longer
 hesitate in the choice of a religion; he could no longer be
 ignorant that the church was possessed of an infallible
 remedy, though he chose to defer the application of it till
 the approach of death had removed the temptation and danger
 of a relapse.","('Crispus', 'PERSON')"
"At an early period, when
 Constantine was the protector rather than the proselyte of
 Christianity, he referred the African controversy to the
 council of Arles; in which the bishops of York, of Treves,
 of Milan, and of Carthage, met as friends and brethren, to
 debate in their native tongue on the common interest of the
 Latin A.D. 325.or Western church.(126)","('Constantine', 'PERSON'), ('Christianity', 'NORP'), ('African', 'NORP'), ('the\r\n council of Arles', 'ORG'), ('York', 'GPE'), ('Treves', 'GPE'), ('Milan', 'GPE'), ('Carthage', 'GPE'), ('Western', 'NORP'), ('126', 'CARDINAL')"
"But
 if the parallel is confined to the extent and number of
 their evangelic victories, the success of Constantine might
 perhaps equal that of the Apostles themselves.","('Constantine', 'PERSON'), ('Apostles', 'PERSON')"
"But every principle which had once
 maintained the vigour and purity of Rome and Sparta was long
 since extinguished in a declining and despotic empire.","('Rome', 'GPE'), ('Sparta', 'GPE')"
"But if the clergy were guilty of any crime which
 could not be sufficiently expiated by their degradation from
 an honourable and beneficial profession, the Roman
 magistrate drew the sword of justice, without any regard to
 ecclesiastical immunities.","('Roman', 'NORP')"
"But in the Christian church, which intrusts
 the service of the altar to a perpetual succession of
 consecrated ministers, the monarch, whose spiritual rank is
 less honourable than that of the meanest deacon, was seated
 below the rails of the sanctuary, and confounded with the
 rest of the faithful multitude. (83)","('Christian', 'NORP'), ('83', 'CARDINAL')"
"But the
 Christian sanctuary was open to every ambitious candidate
 who aspired to its heavenly promises or temporal
 possessions.","('Christian', 'NORP')"
"But the Catholic church, both 
 of the East and of the West, has adopted a prodigy which
 favours, or seems to favour, the popular worship of the
 cross.","('Catholic', 'NORP'), ('East', 'LOC'), ('West', 'LOC')"
"But the Christians, when they deprecated the
 wrath of Diocletian, or solicited the favour of Constantine,
 could allege, with truth and confidence, that they held the
 principle of passive obedience, and that, in the space of
 three centuries, their conduct had always been conformable
 to their principles.","('Christians', 'NORP'), ('Diocletian', 'PERSON'), ('Constantine', 'PERSON'), ('the space of\r\n three centuries', 'DATE')"
"But the distinction of the spiritual and temporal powers,(81) 
 which had never been imposed on the free spirit of Greece
 and Rome, was introduced and confirmed by the legal
 establishment of Christianity.","('81', 'CARDINAL'), ('Greece', 'GPE'), ('Rome', 'GPE'), ('Christianity', 'NORP')"
"But the liberality of the Christian emperors had
 actually endowed them with some legal prerogatives which
 secured and dignified the sacerdotal character.(111) 1. Under 
 a despotic government, the bishops alone enjoyed and
 asserted the inestimable privilege of being tried only by
 their peers; and even in a capital accusation, a synod of
 their brethren were the sole judges of their guilt or
 innocence.","('Christian', 'NORP'), ('111', 'CARDINAL'), ('1', 'CARDINAL')"
"But the severe rules 
 of discipline which the prudence of the bishops had
 instituted were relaxed by the same prudence in favour of an
 Imperial proselyte, whom it was so important to allure, by
 every gentle condescension, into the pale of the church; and
 Constantine was permitted, at least by a tacit dispensation,
 to enjoy most of the privileges, before he had contracted
 any of the obligations, of a Christian.","('Imperial', 'NORP'), ('Constantine', 'PERSON'), ('Christian', 'NORP')"
"But they still resorted to the tribunal of the bishops,
 whose abilities and integrity they esteemed; and the
 venerable Austin enjoyed the satisfaction of complaining
 that his spiritual functions were perpetually interrupted by
 the invidious labour of deciding the claim or the possession
 of silver and gold, of lands and cattle.","('Austin', 'PERSON')"
"By the
 influence of these dignified missionaries the proselytes of
 the new faith must have multiplied in the court and army;
 the barbarians of Germany, who filled the ranks of the
 legions, were of a careless temper, which acquiesced without
 resistance in the religion of their commander; and when they
 passed the Alps it may fairly be presumed that a great
 number of the soldiers had already consecrated their swords
 to the service of Christ and of Constantine.(26)","('Germany', 'GPE'), ('Alps', 'LOC'), ('Constantine', 'PERSON'), ('26', 'CARDINAL')"
"By the edicts
 of toleration he removed the temporal disadvantages which
 had hitherto retarded the progress of Christianity; and its
 active and numerous ministers received a free permission, a
 liberal encouragement, to recommend the salutary truths of
 revelation by every argument which could affect the reason
 or piety of mankind.","('Christianity', 'NORP')"
"Christ appeared before his
 eyes; and displaying the same celestial sign of the cross,
 he directed Constantine to frame a similar standard, and to
 march, with an assurance of victory, against Maxentius and
 all his enemies. (48)","('Christ', 'PERSON'), ('Constantine', 'PERSON'), ('Maxentius', 'PERSON'), ('48', 'CARDINAL')"
"Constantine and his successors could not easily
 persuade themselves that they had forfeited, by their
 conversion, any branch of the Imperial prerogatives, or that
 they were incapable of giving laws to a religion which they
 had protected and embraced.","('Constantine', 'PERSON'), ('Imperial', 'ORG')"
"Constantine listened
 with patience and spoke with modesty; and while he
 influenced the debates, he humbly professed that he was the
 minister, not the judge, of the successors of the apostles,
 who had been established as priests and as gods upon earth.
 (128)","('Constantine', 'PERSON'), ('128', 'CARDINAL')"
Date of the conversion of Constantine.,"('Constantine', 'PERSON')"
Divine right of Constantine.,"('Constantine', 'PERSON')"
"During the
 whole course of his reign, the stream of Christianity flowed
 with a gentle, though accelerated, motion: but its general
 direction was sometimes checked, and sometimes diverted by
 the accidental circumstances of the times, and by the
 prudence, or possibly by the caprice, of the monarch.","('Christianity', 'NORP')"
"Each bishop acquired an absolute and 
 indefeasible right to the perpetual obedience of the clerk
 whom he ordained; the clergy of each episcopal church, with
 its dependent parishes, formed a regular and permanent
 society; and the cathedrals of Constantinople (97) and 
 Carthage(98) maintained their peculiar establishment of five 
 hundred ecclesiastical ministers.","('Constantinople', 'GPE'), ('97', 'CARDINAL'), ('Carthage', 'GPE'), ('98', 'CARDINAL'), ('five \r\n hundred', 'CARDINAL')"
"Eight years after the
 edict of Milan, Constantine granted to all his subjects the
 free and universal permission of bequeathing their fortunes
 to the holy Catholic church; (102) and their devout 
 liberality, which during their lives was checked by luxury
 or avarice, flowed with a profuse stream at the hour of
 their death.","('Eight years', 'DATE'), ('Milan', 'GPE'), ('Constantine', 'PERSON'), ('Catholic', 'NORP'), ('102', 'CARDINAL'), ('the hour', 'TIME')"
"Eleven years afterwards, a more 
 numerous and celebrated assembly was convened at Nice in
 Bithynia, to extinguish, by their final sentence, the subtle
 disputes which had arisen in Egypt on the subject of the
 Trinity.","('Eleven years afterwards', 'DATE'), ('Nice', 'GPE'), ('Bithynia', 'GPE'), ('Egypt', 'GPE'), ('Trinity', 'ORG')"
"Episcopal churches were closely
 planted along the banks of the Nile, on the seacoast of
 Africa, in the proconsular Asia, and through the southern
 provinces of Italy.","('Episcopal', 'NORP'), ('Nile', 'LOC'), ('Africa', 'LOC'), ('Asia', 'LOC'), ('Italy', 'GPE')"
"Every event, or
 appearance, or accident, which seems to deviate from the
 ordinary course of nature, has been rashly ascribed to the
 immediate action of the Deity; and the astonished fancy of
 the multitude has sometimes given shape and colour, language
 and motion, to the fleeting but uncommon meteors of the air.
 (45)","('45', 'CARDINAL')"
"Faithful to
 the doctrine of the apostle, who in the reign of Nero had
 preached the duty of unconditional submission, the
 Christians of the three first centuries preserved their
 conscience pure and innocent of the guilt of secret
 conspiracy or open rebellion.","('Nero', 'PERSON'), ('Christians', 'NORP'), ('the three first centuries', 'DATE')"
"For the truth of this prodigy the
 Pagan orator appeals to the whole Gallic nation, in whose
 presence he was then speaking; and seems to hope that the
 ancient apparitions(47) would now obtain credit from this 
 recent and public event.","('Pagan', 'NORP'), ('Gallic', 'NORP'), ('47', 'CARDINAL')"
"Forty years before the birth of Christ, the Mantuan bard, as
 if inspired by the celestial muse of Isaiah, had celebrated,
 with all the pomp of oriental metaphor, the return of the
 Virgin, the fall of the serpent, the approaching birth of a
 godlike child, the offspring of the great Jupiter, who
 should expiate the guilt of human kind and govern the
 peaceful universe with the virtues of his father; the rise
 and appearance of an heavenly race, a primitive nation
 throughout the world; and the gradual restoration of the
 innocence and felicity of the golden age.","('Forty years', 'DATE'), ('Christ', 'PERSON'), ('Mantuan', 'NORP'), ('Isaiah', 'PERSON'), ('Jupiter', 'LOC')"
"From these vague and indefinite expressions of piety three
 suppositions may be deduced, of a different, but not of an
 incompatible nature.","('three', 'CARDINAL')"
"He affirms, with the most perfect
 confidence, that, in the night which preceded the last
 battle against Maxentius, Constantine was admonished in a
 dream to inscribe the shields of his soldiers with the
 celestial sign of God, the sacred monogram of the name of
 Christ; that he executed the commands of Heaven, and that his valour and obedience were rewarded by the decisive victory of the Milvian Bridge.","('the night', 'TIME'), ('Maxentius', 'PERSON'), ('Constantine', 'PERSON'), ('Christ', 'PERSON'), ('the Milvian Bridge', 'FAC')"
"He appears to have published his ""Deaths of the Persecutors"" at Nicomedia about three years after the Roman victory; but the interval of a thousand miles, and a thousand days, will allow an ample latitude for the invention of declaimers, the credulity of party, and the tacit approbation of the emperor himself; who might listen without indignation to a marvellous tale which exalted his fame and promoted his designs.","('""Deaths of the Persecutors""', 'WORK_OF_ART'), ('Nicomedia', 'ORG'), ('about three years', 'DATE'), ('Roman', 'NORP'), ('a thousand miles', 'QUANTITY'), ('a thousand days', 'DATE')"
"He embarked on the Red Sea with two
 hundred horses of the purest breed of Cappadocia, which were
 sent by the emperor of the prince of the Sabaeans, or
 Homerites.","('the Red Sea', 'LOC'), ('two\r\n hundred', 'CARDINAL'), ('Cappadocia', 'GPE'), ('Sabaeans', 'NORP'), ('Homerites', 'NORP')"
"He vanquished the monster of Libya, the 
 president Andronicus, who abused the authority of a venal
 office, invented new modes of rapine and torture, and
 aggravated the guilt of oppression by that of sacrilege.(119)","('Libya', 'GPE'), ('Andronicus', 'PERSON'), ('119', 'CARDINAL')"
"His
 ministers were permitted to signify the intentions of their
 master in the various language which was best adapted to
 their respective principles; (7) and he artfully balanced the 
 hopes and fears of his subjects, by publishing in the same
 year two edicts; the first of A.D. 321.","('two', 'CARDINAL'), ('first', 'ORDINAL'), ('A.D. 321', 'DATE')"
His Pagan superstition.,"('Pagan', 'NORP')"
"His liberality restored and enriched the temples of
 the gods; the medals which issued from his Imperial mint are
 impressed with the figures and attributes of Jupiter and
 Apollo, of Mars and Hercules; and his filial piety increased
 the council of Olympus by the solemn apotheosis of his
 father Constantius.(11) But the devotion of Constantine was 
 more peculiarly directed to the genius of the Sun, the
 Apollo of Greek and Roman mythology; and he was pleased to
 be represented with the symbols of the God of Light and
 Poetry.","('Imperial', 'NORP'), ('Jupiter', 'LOC'), ('Apollo', 'PERSON'), ('Mars', 'LOC'), ('Hercules', 'LOC'), ('Olympus', 'LOC'), ('Constantius', 'PERSON'), ('Constantine', 'PERSON'), ('Sun', 'PERSON'), ('Apollo', 'PERSON'), ('Greek', 'NORP'), ('Roman', 'NORP')"
"His vanity was gratified by the flattering
 assurance that he had been chosen by Heaven to reign over
 the earth: success had justified his divine title to the
 throne, and that title was founded on the truth of the
 Christian revelation.","('Christian', 'NORP')"
"I. An instrument of the tortures which were inflicted only
 on slaves and strangers became an object of horror in the
 eyes of a Roman citizen; and the ideas of guilt, of pain,
 and of ignominy, were closely united with the idea of the
 cross. (29)","('Roman', 'NORP')"
"I. The freedom of elections subsisted long after the legal
 establishment of Christianity, (88) and the subjects of Rome 
 enjoyed in the church the privilege which they had lost in
 the republic, of choosing the magistrates whom they were
 bound to obey.","('Christianity', 'NORP'), ('88', 'CARDINAL'), ('Rome', 'GPE')"
"If the judges of Israel were occasional and
 temporary magistrates, the kings of Judah derived from the
 royal unction of their great ancestor an hereditary and
 indefeasible right, which could not be forfeited by their
 own vices, nor recalled by the caprice of their subjects.","('Israel', 'GPE'), ('Judah', 'GPE')"
"If we may credit the assertion of Constantine
 himself, he had been an indignant spectator of the savage
 cruelties which were inflicted, by the hands of Roman
 soldiers, on those citizens whose religion was their only
 crime.","('Constantine', 'PERSON'), ('Roman', 'NORP')"
"In
 the midst of the incessant labours of his great office this
 soldier employed or affected to employ, the hours of the
 night in the diligent study of the Scriptures, and the
 composition of theological discourses, which he afterwards
 pronounced in the presence of a numerous and applauding
 audience.","('the hours of the\r\n night', 'TIME'), ('Scriptures', 'WORK_OF_ART')"
"In a very long discourse, which is still extant,
 the royal preacher expatiates on the various proofs of
 religion; but he dwells with peculiar complacency on the
 Sibylline verses,(59) and the fourth eclogue of Virgil. (60)","('Sibylline', 'NORP'), ('59', 'CARDINAL'), ('fourth', 'ORDINAL'), ('Virgil', 'PERSON'), ('60', 'CARDINAL')"
"In all occasions of danger or distress it was the
 practice of the primitive Christians to fortify their minds
 and bodies by the sign of the cross, which they used in all
 their ecclesiastical rites, in all the daily occurrences of
 life, as an infallible preservative against every species of
 spiritual or temporal evil. (39)","('Christians', 'NORP'), ('39', 'CARDINAL')"
"In favour of Licinius, who still dissembled his animosity to the Christians, the same author has provided a similar vision, of a form of prayer, which was communicated by an angel, and repeated by the whole army before they engaged the legions of the tyrant Maximin.(41)","('Licinius', 'PERSON'), ('Christians', 'NORP'), ('Maximin', 'PERSON'), ('41', 'CARDINAL')"
"In his last visit to Rome he piously disclaimed and
 insulted the superstition of his ancestors, by refusing to
 lead the military procession of the equestrian order, and to
 offer the public vows to the Jupiter of the Capitoline Hill.
 (65)","('Rome', 'GPE'), ('the Jupiter of the Capitoline Hill', 'PRODUCT'), ('65', 'CARDINAL')"
"In one of the marches of Constantine he is
 reported to have seen with his own eyes the luminous trophy
 of the cross, placed above the meridian sun, and inscribed
 with the following words: BY THIS CONQUER.","('one', 'CARDINAL'), ('Constantine', 'PERSON')"
"In the age of
 Constantine and Justinian the bishops no longer possessed,
 perhaps they no longer deserved, the unsuspecting confidence
 of their clergy and people.","('Constantine', 'PERSON'), ('Justinian', 'PERSON')"
"In the beginning of the fourth century the Christians still
 bore a very inadequate proportion to the inhabitants of the
 empire; but among a degenerate people, who viewed the change
 of masters with the indifference of slaves, the spirit and
 union of a religious party might assist the popular leader,
 to whose service, from a principle of conscience, they had
 devoted their lives and fortunes. (25)","('the beginning of the fourth century', 'DATE'), ('Christians', 'NORP'), ('25', 'CARDINAL')"
"In the consideration of a subject which may be examined with impartiality, but cannot be viewed with indifference, a difficulty immediately arises of a very unexpected nature — that of ascertaining the real and precise date of the conversion of Constantine.","('Constantine', 'PERSON')"
"In the general order of Providence princes and tyrants are
 considered as the ministers of Heaven, appointed to rule or
 to chastise the nations of the earth.","('Providence', 'GPE')"
