Sentence,Entities
"His western trophy was erected, not on the walls
 of Carthage, (62) but in the neighbourhood of Tripoli; the
 Greek colonies of Cyrene were finally extirpated; and the
 conqueror, treading in the footsteps of Alexander, returned
 in triumph through the sands of the Libyan desert. of Asia Minor, A.D. 616 etc.","('Carthage', 'GPE'), ('Tripoli', 'GPE'), ('Greek', 'NORP'), ('Cyrene', 'GPE'), ('Alexander', 'PERSON'), ('Libyan', 'NORP'), ('Asia Minor', 'LOC'), ('616', 'CARDINAL')"
Hormouz is deposed and imprisoned.,"('Hormouz', 'PERSON')"
"However it might be
 varnished by fiction or sophistry, Chosroes turned with
 horror from the assassin, imprisoned the pretended envoy,
 disclaimed the usurper, and declared himself the avenger of
 his father and benefactor.","('Chosroes', 'PERSON')"
"I have already traced the steps
 of a revolution so pleasing, in Gregory's opinion, both to
 heaven and earth;","('Gregory', 'PERSON')"
"If he marched against the
 enemy, the pleasant valleys of Mount Haemus opposed an
 insuperable barrier; but in his retreat, he explored, with
 fearless curiosity, the most difficult and obsolete paths,
 which had almost escaped the memory of the oldest native.","('Mount Haemus', 'LOC')"
"If the
 motives of Chosroes had been pure and honourable, he must
 have ended the quarrel with the death of Phocas, and he
 would have embraced, as his best ally, the fortunate African
 who had so generously avenged the injuries of his benefactor
 Maurice.","('Chosroes', 'PERSON'), ('Phocas', 'PERSON'), ('African', 'NORP'), ('Maurice', 'PERSON')"
"In
 the course of this successful inroad, he signalized the zeal
 and revenge of a Christian emperor: at his command, the
 soldiers extinguished the fire, and destroyed the temples,
 of the Magi; the statues of Chosroes, who aspired to divine
 honours, were abandoned to the flames; and the ruins of
 Thebarma or Ormia, (90) which had given birth to Zoroaster
 himself, made some atonement for the injuries of the holy
 sepulchre.","('Christian', 'NORP'), ('Magi', 'PERSON'), ('Chosroes', 'PERSON'), ('Thebarma', 'NORP'), ('Ormia', 'PERSON'), ('90', 'CARDINAL'), ('Zoroaster', 'PERSON')"
"In
 the heat of the action, three valiant chiefs were
 successively slain by the sword and lance of the emperor:
 among these was Rhazates himself; he fell like a soldier,
 but the sight of his head scattered grief and despair
 through the fainting ranks of the Persians.","('three', 'CARDINAL'), ('Rhazates', 'PERSON'), ('Persians', 'NORP')"
"In
 the massacre of the Imperial family, (50) the mercy, or
 rather the discretion, of Phocas had spared these unhappy
 females, and they were decently confined to a private house.","('Imperial', 'NORP'), ('50', 'CARDINAL'), ('Phocas', 'PERSON')"
"In
 the recovery of the standards and prisoners which had fallen
 into the hands of the Persians, the emperor imitated the
 example of Augustus: their care of the national dignity was
 celebrated by the poets of the times, but the decay of
 genius may be measured by the distance between Horace and
 George of Pisidia: the subjects and brethren of Heraclius
 were redeemed from persecution, slavery, and exile; but,
 instead of the Roman eagles, the true wood of the holy cross
 was restored to the importunate demands of the successor of
 Constantine.","('Persians', 'NORP'), ('Augustus', 'PERSON'), ('Horace', 'PERSON'), ('George of Pisidia', 'PERSON'), ('Heraclius', 'PERSON'), ('Roman', 'NORP'), ('Constantine', 'PERSON')"
"In a dispute of precedency between the two factions, his partial judgment inclined in favour of the greens.","('two', 'CARDINAL')"
"In a dispute with
 the Greek and Indian philosophers, Buzurg (8) had once
 maintained, that the most grievous misfortune of life is old
 age without the remembrance of virtue; and our candor will
 presume that the same principle compelled him, during three
 years, to direct the councils of the Persian empire.","('Greek', 'NORP'), ('Indian', 'NORP'), ('Buzurg', 'PERSON'), ('8', 'CARDINAL'), ('three\r\n years', 'DATE'), ('Persian', 'NORP')"
"In a secret
 interview, he produced the portrait of his daughter Eudocia,
 (99) condescended to flatter the Barbarian with the promise
 of a fair and august bride; obtained an immediate succour of
 forty thousand horse, and negotiated a strong diversion of
 the Turkish arms on the side of the Oxus. (100)","('Eudocia', 'PERSON'), ('99', 'DATE'), ('Barbarian', 'NORP'), ('forty thousand', 'CARDINAL'), ('Turkish', 'NORP'), ('Oxus', 'PRODUCT'), ('100', 'CARDINAL')"
"In a small
 bark, the unfortunate Maurice, with his wife and nine
 children, escaped to the Asiatic shore; but the violence of
 the wind compelled him to land at the church of St.
 Autonomus, (44) near Chalcedon, from whence he despatched
 Theodosius, he eldest son, to implore the gratitude and
 friendship of the Persian monarch.","('Maurice', 'PERSON'), ('nine', 'CARDINAL'), ('Asiatic', 'NORP'), ('St.\r\n Autonomus', 'FAC'), ('44', 'CARDINAL'), ('Chalcedon', 'GPE'), ('Theodosius', 'PERSON'), ('Persian', 'NORP')"
"In a strain of artful adulation, which assumed the
 language of freedom, they presumed to censure the excess of
 his gratitude and friendship for the Greeks; a nation with
 whom it was dangerous to conclude either peace or alliance;
 whose superstition was devoid of truth and justice, and who
 must be incapable of any virtue, since they could perpetrate
 the most atrocious of crimes, the impious murder of their
 sovereign. (56)","('Greeks', 'NORP')"
"In every word, and in every
 action, the son of Nushirvan degenerated from the virtues of
 his father.","('Nushirvan', 'PERSON')"
"In five
 successive battles, which seem to have been conducted with
 skill and resolution, seventeen thousand two hundred
 Barbarians were made prisoners: near sixty thousand, with
 four sons of the chagan, were slain: the Roman general
 surprised a peaceful district of the Gepidae, who slept
 under the protection of the Avars; and his last trophies
 were erected on the banks of the Danube and the Teyss.","('five', 'CARDINAL'), ('seventeen thousand two hundred', 'CARDINAL'), ('Barbarians', 'NORP'), ('near sixty thousand', 'CARDINAL'), ('four', 'CARDINAL'), ('Roman', 'NORP'), ('Gepidae', 'NORP'), ('Avars', 'NORP'), ('Danube', 'LOC'), ('Teyss', 'PRODUCT')"
"In that grave, the faults and errors of Maurice were kindly interred.","('Maurice', 'PERSON')"
"In the
 disposition both of his troops and provinces the chagan
 exposed the vassals, whose lives he disregarded, (33) to the
 first assault; and the swords of the enemy were blunted
 before they encountered the native valour of the Avars.","('33', 'CARDINAL'), ('first', 'ORDINAL'), ('Avars', 'NORP')"
"In the
 first and last years of a long reign, the emperor appears to
 be the slave of sloth, of pleasure, or of superstition, the
 careless and impotent spectator of the public calamities.","('the\r\n first and last years', 'DATE')"
"In the
 same campaign, another army advanced from the Euphrates to
 the Thracian Bosphorus; Chalcedon surrendered after a long
 siege, and a Persian camp was maintained above ten years in
 the presence of Constantinople.","('Euphrates', 'LOC'), ('the Thracian Bosphorus', 'LOC'), ('Chalcedon', 'GPE'), ('Persian', 'NORP'), ('ten years', 'DATE'), ('Constantinople', 'GPE')"
"In the battle of Nineveh, his courage might have
 taught the Persians to vanquish, or he might have fallen
 with honour by the lance of a Roman emperor.","('Nineveh', 'GPE'), ('Persians', 'NORP'), ('Roman', 'NORP')"
"In the battle of Nineveh, which was fiercely
 fought from daybreak to the eleventh hour, twenty-eight
 standards, besides those which might be broken or torn, were
 taken from the Persians; the greatest part of their army was
 cut in pieces, and the victors, concealing their own loss,
 passed the night on the field.","('Nineveh', 'GPE'), ('daybreak', 'TIME'), ('the eleventh hour', 'TIME'), ('twenty-eight', 'CARDINAL'), ('Persians', 'NORP')"
"In the camp of Issus, the Roman general
 reformed the sloth and disorder of the veterans, and
 educated the new recruits in the knowledge and practice of
 military virtue.","('Issus', 'NORP'), ('Roman', 'NORP')"
"In the construction and use of ships, engines, and fortifications, the
Barbarians admired the superior ingenuity of a people whom they had so often vanquished in the
field.","('Barbarians', 'NORP')"
"In the games of
 the Circus, which he repeated with unusual pomp, Maurice
 disguised, with smiles of confidence, the anxiety of his
 heart, condescended to solicit the applause of the factions,
 and flattered their pride by accepting from their respective
 tribunes a list of nine hundred blues and fifteen hundred
 greens, whom he affected to esteem as the solid pillars of
 his throne Their treacherous or languid support betrayed his
 weakness and hastened his fall: the green faction were the
 secret accomplices of the rebels, and the blues recommended
 lenity and moderation in a contest with their Roman brethren","('Circus', 'EVENT'), ('Maurice', 'PERSON'), ('nine hundred', 'CARDINAL'), ('fifteen hundred', 'CARDINAL'), ('Roman', 'NORP')"
"In the just assurance, that
 his accomplices could neither forgive nor hope to be
 forgiven, and that every Persian might be trusted as the
 judge and enemy of the tyrant, he instituted a public trial
 without a precedent and without a copy in the annals of the
 East.","('Persian', 'NORP'), ('East', 'LOC')"
"In the just fervour of indignation, an order was signified to the army of the Danube, that they
 should spare the magazines of the province, and establish
 their winter quarters in the hostile country of the Avars.","('Danube', 'LOC'), ('Avars', 'NORP')"
"In the language of a Barbarian, without
 guile, the prince of the Avars affected to complain of the
 insincerity of the Greeks; (26) yet he was not inferior to
 the most civilized nations in the refinement of
 dissimulation and perfidy.","('Barbarian', 'NORP'), ('Avars', 'PERSON'), ('Greeks', 'NORP'), ('26', 'CARDINAL')"
"In the language of the usurpers of every
 age, he imputes his own crimes to the Deity, and, without
 degrading his equal majesty, he offers to reconcile the long
 discord of the two nations, by a treaty of peace and
 alliance more durable than brass or iron.","('two', 'CARDINAL')"
"In the mean
 while, the magistrates of Constantinople repeatedly strove
 to purchase the retreat of the chagan; but their deputies
 were rejected and insulted; and he suffered the patricians
 to stand before his throne, while the Persian envoys, in
 silk robes, were seated by his side.","('Constantinople', 'GPE'), ('Persian', 'NORP')"
"In the mean while his general Adarman advanced from Babylon, traversed the desert, passed the Euphrates, insulted the suburbs of Antioch, reduced to ashes the city of Apamea, and laid the spoils of Syria at the feet of his master, whose perseverance in the midst of winter at length subverted the bulwark of the East.","('Adarman', 'PERSON'), ('Babylon', 'GPE'), ('Euphrates', 'LOC'), ('Antioch', 'GPE'), ('Apamea', 'GPE'), ('Syria', 'GPE'), ('East', 'LOC')"
"In the name of his
 generous benefactor, a rich diadem was presented to the
 fugitive prince, with an inestimable gift of jewels and
 gold; a powerful army was assembled on the frontiers of
 Syria and Armenia, under the command of the valiant and
 faithful Narses, (17) and this general, of his own nation,
 and his own choice, was directed to pass the Tigris, and
 never to sheathe his sword till he had restored Chosroes to
 the throne of his ancestors.","('Syria', 'GPE'), ('Armenia', 'GPE'), ('Narses', 'PERSON'), ('17', 'CARDINAL'), ('Tigris', 'LOC'), ('Chosroes', 'PERSON')"
"In the obscure
 picture of the calamities of the empire, (64) it is not easy
 to discern the figure of Chosroes himself, to separate his
 actions from those of his lieutenants, or to ascertain his
 personal merit in the general blaze of glory and
 magnificence.","('64', 'DATE'), ('Chosroes', 'PERSON')"
"In the presence of the senate, the son-in-law of
 Phocas was condemned to embrace the monastic life; and the
 sentence was justified by the weighty observation of
 Heraclius, that the man who had betrayed his father could
 never be faithful to his friend.","('Phocas', 'PERSON'), ('Heraclius', 'PERSON')"
"In the severity of the winter season, Sarbaraza
 deemed himself secure in the walls of Salban: he was surprised by the activity of Heraclius, who divided his troops, and performed a laborious march in the silence of the night.","('the winter season', 'DATE'), ('Sarbaraza', 'PERSON'), ('Salban', 'PERSON'), ('Heraclius', 'PERSON'), ('the silence of the night', 'TIME')"
"In the space of two
 centuries, none of the successors of Theodosius had appeared
 in the field: their lives were supinely spent in the palace
 of Constantinople; and the Greeks could no longer
 understand, that the name of emperor, in its primitive
 sense, denoted the chief of the armies of the republic.","('the space of two\r\n centuries', 'DATE'), ('Theodosius', 'PERSON'), ('Constantinople', 'GPE'), ('Greeks', 'NORP')"
"In the useless altercations, that precede and justify the quarrels of princes, the Greeks and the Barbarians accused each other of violating the peace which had been concluded between the two empires about four years before the death of
 Justinian.","('Greeks', 'NORP'), ('Barbarians', 'NORP'), ('two', 'CARDINAL'), ('about four years', 'DATE'), ('Justinian', 'PERSON')"
"Instead of half
 a million of inhabitants, which have been ascribed to Tauris
 under the reign of the Sophys, the city contained no more
 than three thousand houses; but the value of the royal
 treasures was enhanced by a tradition, that they were the
 spoils of Croesus, which had been transported by Cyrus from
 the citadel of Sardes.","('half\r\n a million', 'CARDINAL'), ('Tauris', 'PERSON'), ('Sophys', 'NORP'), ('more\r\n than three thousand', 'CARDINAL'), ('Croesus', 'PRODUCT'), ('Cyrus', 'PERSON'), ('Sardes', 'GPE')"
"Instead of skirmishing on the frontier, the two monarchs who
 disputed the empire of the East aimed their desperate
 strokes at the heart of their rival.","('two', 'CARDINAL'), ('East', 'LOC')"
"It is not improbable,
 that a native subject of Persia should encourage his master
 and his friend to deliver and possess the provinces of Asia.","('Persia', 'GPE'), ('Asia', 'LOC')"
"It is still more probable, that Chosroes should animate his
 troops by the assurance that the sword which they dreaded
 the most would remain in its scabbard, or be drawn in their
 favour.","('Chosroes', 'PERSON')"
"It was
 the duty of the Byzantine historians to have revealed the
 causes of his slumber and vigilance.","('Byzantine', 'NORP')"
"It was determined
 by the conspirators, that Siroes, with the ensigns of
 royalty, should appear in the camp; and if the enterprise
 should fail, his escape was contrived to the Imperial court.","('Siroes', 'PERSON'), ('Imperial', 'ORG')"
"It was more difficult to trust the fidelity of
 Crispus, whose recent services were recompensed by the
 command of the Cappadocian army.","('Crispus', 'PERSON'), ('Cappadocian', 'NORP')"
"It was still in the power of
 Chosroes to obtain a reasonable peace; and he was repeatedly
 pressed by the messengers of Heraclius to spare the blood of
 his subjects, and to relieve a humane conqueror from the
 painful duty of carrying fire and sword through the fairest
 countries of Asia.","('Chosroes', 'NORP'), ('Heraclius', 'PERSON'), ('Asia', 'LOC')"
"Lamenting the barren superfluity of materials, I have
 studied to compress the narrative of these uninteresting
 transactions: but the just Nushirvan is still applauded as
 the model of Oriental kings, and the ambition of his
 grandson Chosroes prepared the revolution of the East, which
 was speedily accomplished by the arms and the religion of
 the successors of Mahomet.","('Nushirvan', 'PERSON'), ('Oriental', 'NORP'), ('Chosroes', 'PERSON'), ('East', 'LOC'), ('Mahomet', 'PERSON')"
"Narses was removed from his military
 command; he reared an independent standard at Hierapolis, in
 Syria: he was betrayed by fallacious promises, and burnt
 alive in the market-place of Constantinople.","('Narses', 'PERSON'), ('Hierapolis', 'GPE'), ('Syria', 'GPE'), ('Constantinople', 'GPE')"
"Nine hundred and sixty
 elephants were maintained for the use or splendour of the
 great king: his tents and baggage were carried into the
 field by twelve thousand great camels and eight thousand of
 a smaller size; (66) and the royal stables were filled with
 six thousand mules and horses, among whom the names of
 Shebdiz and Barid are renowned for their speed or beauty.","('Nine hundred and sixty', 'CARDINAL'), ('twelve thousand', 'CARDINAL'), ('eight thousand', 'CARDINAL'), ('66', 'CARDINAL'), ('six thousand', 'CARDINAL'), ('Shebdiz', 'PERSON'), ('Barid', 'PERSON')"
"No sooner did the
 grandson of Nushirvan display his own and the Roman banners
 beyond the Tigris, than he was joined, each day, by the
 increasing multitudes of the nobility and people; and as he
 advanced, he received from every side the grateful offerings
 of the keys of his cities and the heads of his enemies.","('Nushirvan', 'PERSON'), ('Roman', 'NORP'), ('Tigris', 'LOC')"
"Nushirvan, or Chosroes, conducted in person the siege of Dara; and although that important fortress had been left destitute of troops and magazines, the valour of the inhabitants resisted above five months the archers, the elephants, and the military engines of the Great King.","('Nushirvan', 'GPE'), ('Chosroes', 'NORP'), ('Dara', 'PERSON'), ('five months', 'DATE'), ('the Great King', 'GPE')"
"Of the Persian spoils, the
 most valuable portion had been expended in the war,
 distributed to the soldiers, or buried, by an unlucky
 tempest, in the waves of the Euxine.","('Persian', 'NORP'), ('Euxine', 'PRODUCT')"
"Of the characters conspicuous in history, that of Heraclius
 is one of the most extraordinary and inconsistent.","('Heraclius', 'PERSON')"
"Of the soldiers who had conspired with Phocas,
 only two were found to have survived the stroke of time and
 of the Barbarians; (77) the loss, even of these seditious
 veterans, was imperfectly supplied by the new levies of
 Heraclius, and the gold of the sanctuary united, in the same
 camp, the names, and arms, and languages of the East and
 West.","('Phocas', 'PERSON'), ('only two', 'CARDINAL'), ('Barbarians', 'NORP'), ('77', 'CARDINAL'), ('Heraclius', 'NORP'), ('East', 'LOC'), ('West', 'LOC')"
"On a sudden the
 hippodrome was encompassed by the Scythian cavalry, who had
 pressed their secret and nocturnal march: the tremendous
 sound of the chagan's whip gave the signal of the assault,
 and Heraclius, wrapping his diadem round his arm, was saved
 with extreme hazard, by the fleetness of his horse.","('Scythian', 'NORP'), ('Heraclius', 'PERSON')"
"On the
 twenty-ninth of June, thirty thousand Barbarians, the
 vanguard of the Avars, forced the long wall, and drove into
 the capital a promiscuous crowd of peasants, citizens, and
 soldiers.","('the\r\n twenty-ninth of June', 'DATE'), ('thirty thousand', 'CARDINAL'), ('Barbarians', 'NORP'), ('Avars', 'NORP')"
"On the return of spring, Justinian descended into the fertile plains of Assyria; the flames of war approached the residence of Nushirvan;","('Justinian', 'NORP'), ('Assyria', 'GPE'), ('Nushirvan', 'GPE')"
"On the return of spring, the emperor traversed in seven days the mountains of Curdistan, and passed without resistance the
 rapid stream of the Tigris.","('spring', 'DATE'), ('seven days', 'DATE'), ('Curdistan', 'GPE'), ('Tigris', 'LOC')"
"On the shore of Chalcedon, the emperor
 held a safer conference with a more honourable foe, who,
 before Heraclius descended from his galley, saluted with
 reverence and pity the majesty of the purple.","('Chalcedon', 'GPE'), ('Heraclius', 'PERSON')"
"On the third day, amidst the acclamations of a
 thoughtless people, Phocas made his public entry in a
 chariot drawn by four white horses: the revolt of the troops
 was rewarded by a lavish donative; and the new sovereign,
 after visiting the palace, beheld from his throne the games of the hippodrome.","('the third day', 'DATE'), ('Phocas', 'PERSON'), ('four', 'CARDINAL')"
"On this memorable
 day, Heraclius, on his horse Phallas, surpassed the bravest
 of his warriors: his lip was pierced with a spear; the steed
 was wounded in the thigh; but he carried his master safe and
 victorious through the triple phalanx of the Barbarians.","('this memorable\r\n day', 'DATE'), ('Heraclius', 'PERSON'), ('Phallas', 'PERSON'), ('Barbarians', 'NORP')"
"Oppressed by the weight of
 their spoils and captives, the Roman army halted under the
 walls of Amida; and Heraclius informed the senate of
 Constantinople of his safety and success, which they had
 already felt by the retreat of the besiegers.","('Roman', 'NORP'), ('Amida', 'GPE'), ('Heraclius', 'PERSON'), ('Constantinople', 'GPE')"
"Pelusium, the key of that
 impervious country, was surprised by the cavalry of the
 Persians: they passed, with impunity, the innumerable
 channels of the Delta, and explored the long valley of the
 Nile, from the pyramids of Memphis to the confines of
 Aethiopia.","('Persians', 'NORP'), ('Delta', 'LOC'), ('Nile', 'LOC'), ('Memphis', 'GPE'), ('Aethiopia', 'GPE')"
"Perhaps he was awakened by the last insolent
 demand of the Persian conqueror; but at the moment when
 Heraclius assumed the spirit of a hero, the only hopes of
 the Romans were drawn from the vicissitudes of fortune,
 which might threaten the proud prosperity of Chosroes, and
 must be favourable to those who had attained the lowest
 period of depression.","('Persian', 'NORP'), ('Heraclius', 'PERSON'), ('Romans', 'NORP'), ('Chosroes', 'NORP')"
"Persia had
 already repented of her fatal rashness, which betrayed the
 heir of the house of Sassan to the ambition of a rebellious
 subject: and the bold refusal of the Magi to consecrate his
 usurpation, compelled Bahram to assume the sceptre,
 regardless of the laws and prejudices of the nation.","('Persia', 'GPE'), ('Sassan', 'PERSON'), ('Magi', 'PERSON'), ('Bahram', 'PERSON')"
Persia had been lost by a king; it was saved by a hero.,"('Persia', 'GPE')"
"Phocas emperor, A.D. 602, Nov. 23 - A.D. 610, October 4..","('A.D. 602', 'DATE'), ('Nov. 23 - A.D. 610', 'DATE'), ('October 4', 'DATE')"
"Placed on the verge of the two great empires of the East, Mahomet observed with secret joy the progress of their mutual destruction; and in the midst of the Persian triumphs, he ventured to foretell, that before many years should elapse, victory should again return to the banners of the Romans. (69)
Distress of Heraclius, A.D. 610-622.","('two', 'CARDINAL'), ('East', 'LOC'), ('Mahomet', 'PERSON'), ('Persian', 'NORP'), ('many years', 'DATE'), ('Romans', 'NORP'), ('69', 'CARDINAL')"
"Pride, polciy, and power of the chagan of the Avars, A.D. 570-600,etc.","('Avars', 'PRODUCT'), ('570-600', 'CARDINAL')"
"Reign of Heraclius, A.D. 610, October 5 - A.D. 642, February 11.","('Heraclius', 'GPE'), ('A.D. 610', 'DATE'), ('October 5 - A.D. 642', 'DATE'), ('February 11', 'DATE')"
"Restoration and policy of Chosroes, A.D. 591-603.","('Chosroes', 'ORG'), ('591-603', 'CARDINAL')"
Revolt of Constantinople.,"('Constantinople', 'GPE')"
"Revolutions of Persia after the Death of Chosroes or Nushirvan — His Son Hormouz, a Tyrant, Is Deposed — Usurpation of Bahram —  Flight and Restoration of Chosroes II —  His Gratitude to the Romans — The Chagan of the Avars —  Revolt of the Army against Maurice —  His Death.","('Persia', 'LOC'), ('the Death of Chosroes', 'WORK_OF_ART'), ('Son Hormouz', 'WORK_OF_ART'), ('Usurpation of Bahram —  Flight and Restoration of Chosroes II —  His Gratitude to the Romans — The Chagan of the Avars —  Revolt of the Army against Maurice —  His Death', 'WORK_OF_ART')"
"Sain was flayed alive, according to the inhuman practice of his country; and the separate and rigorous confinement of the ambassadors violated the law of nations, and the faith of an express stipulation.","('Sain', 'PERSON')"
"Sarbar still maintained the important station of
 Chalcedon; but the jealousy of Chosroes, or the artifice of
 Heraclius, soon alienated the mind of that powerful satrap
 from the service of his king and country.","('Sarbar', 'PERSON'), ('Chalcedon', 'GPE'), ('Chosroes', 'NORP'), ('Heraclius', 'PERSON')"
"Sarbar, the general of the third army,
 penetrated through the provinces of Asia to the well-known
 camp of Chalcedon, and amused himself with the destruction
 of the sacred and profane buildings of the Asiatic suburbs,
 while he impatiently waited the arrival of his Scythian
 friends on the opposite side of the Bosphorus.","('Sarbar', 'PERSON'), ('third', 'ORDINAL'), ('Asia', 'LOC'), ('Chalcedon', 'GPE'), ('Asiatic', 'NORP'), ('Scythian', 'NORP'), ('Bosphorus', 'LOC')"
"Since the days of Scipio and Hannibal, no bolder enterprise
 has been attempted than that which Heraclius achieved for
 the deliverance of the empire (83)","('the days', 'DATE'), ('Scipio', 'PERSON'), ('Hannibal', 'PERSON'), ('Heraclius', 'PERSON'), ('83', 'CARDINAL')"
