Sentence,Entities
"In many cities the temples were
 shut or deserted; the philosophers, who had abused their
 transient favour, thought it prudent to shave their beards
 and disguise their profession; and the Christians rejoiced
 that they were now in a condition to forgive or to revenge
 the injuries which they had suffered under the preceding
 reign.","('Christians', 'NORP')"
"In one of the suburbs of that capital, (27) thirty days after his own 
 elevation, he bestowed the title of Augustus on his brother
 Valens: and as the boldest patriots were convinced that
 their opposition, without being serviceable to their
 country, would be fatal to themselves, the declaration of
 his absolute will was received with silent submission.","('one', 'CARDINAL'), ('27', 'CARDINAL'), ('thirty days', 'DATE'), ('Augustus', 'PERSON'), ('Valens', 'PERSON')"
"In private families the
 sentiments of nature were extinguished by the blind fury of
 zeal and revenge; the majesty of the laws was violated or
 abused; the cities of the East were stained with blood; and
 the most implacable enemies of the Romans were in the bosom
 of their country.","('East', 'LOC'), ('Romans', 'NORP')"
"In that sequestered region he remained
 many months, exposed to the hardships of exile, of solitude,
 and of want; his melancholy temper brooding over his
 misfortune, and his mind agitated by the just apprehension
 that, if any accident should discover his name, the
 faithless barbarians would violate, without much scruple,
 the laws of hospitality.","('many months', 'DATE')"
"In the annual assembly of the three cities,
 they nominated two deputies to lay at the feet of
 Valentinian the customary offering of a gold victory, and to
 accompany this tribute of duty, rather than of gratitude,
 with their humble complaint that they were ruined by the
 enemy and betrayed by their governor.","('three', 'CARDINAL'), ('two', 'CARDINAL'), ('Valentinian', 'NORP')"
"In the beginning of the ensuing year the military force of the whole nation, in deep and solid
 columns, broke through the barrier of the Rhine during the
 severity of a northern winter.","('the beginning of the ensuing year', 'DATE'), ('Rhine', 'LOC')"
"In the capital of the empire the
 females of noble and opulent houses possessed a very ample
 share of independent property; and many of those devout
 females had embraced the doctrines of Christianity, not only
 with the cold assent of the understanding, but with the
 warmth of affection, and perhaps with the eagerness of
 fashion.","('Christianity', 'NORP')"
"In the castle or palace of Mediana,
 only three miles from Naissus, they executed the solemn and
 final division of the Roman empire.(32) Valentinian bestowed 
 on his brother the rich praefecture of the East, from the
 Lower Danube to the confines of Persia; whilst he reserved
 for his immediate government the warlike praefectures of
 Illyricum, Italy, and Gaul, from the extremity of Greece to
 the Caledonian rampart and from the rampart of Caledonia to
 the foot of Mount Atlas.","('Mediana', 'GPE'), ('three miles', 'QUANTITY'), ('Naissus', 'GPE'), ('Roman', 'NORP'), ('Valentinian', 'NORP'), ('East', 'LOC'), ('the\r\n Lower Danube', 'LOC'), ('Persia', 'LOC'), ('Illyricum', 'GPE'), ('Italy', 'GPE'), ('Gaul', 'PERSON'), ('Greece', 'GPE'), ('Caledonian', 'NORP'), ('Caledonia', 'GPE'), ('Mount Atlas', 'LOC')"
"In the course of their slow 
 and distant navigations they must always have been exposed
 to the danger, and very frequently to the misfortune, of
 shipwreck; and the naval annals of the Saxons were
 undoubtedly filled with the accounts of the losses which
 they sustained on the coasts of Britain and Gaul.","('Saxons', 'NORP'), ('Britain', 'GPE'), ('Gaul', 'GPE')"
"In the first
 years of the reign of Theodosius, a Persian embassy arrived
 at Constantinople to excuse the unjustifiable measures of
 the former reign, and to offer, as the tribute of
 friendship, or even of respect, a splendid present of gems,
 of silk, and of Indian elephants.(138)
Adventures of Para, king of Armenia","('the first\r\n years', 'DATE'), ('Theodosius', 'GPE'), ('Persian', 'NORP'), ('Constantinople', 'GPE'), ('Indian', 'NORP'), ('138', 'CARDINAL'), ('Armenia', 'GPE')"
"In the general picture of the affairs of the East under the
 reign of Valens, the adventures of Para form one of the most
 striking and singular objects.","('East', 'LOC'), ('Valens', 'PERSON'), ('one', 'CARDINAL')"
"In the heat of action,
 calmly taking off his helmet, he showed his grey hairs and
 venerable countenance, saluted the soldiers of Procopius by
 the endearing names of children and companions, and exhorted
 them no longer to support the desperate cause of a
 contemptible tyrant, but to follow their old commander, who
 had so often led them to honour and victory.","('Procopius', 'PERSON')"
"In the important station of the Upper
 Danube, the conqueror of Britain checked and defeated the
 armies of the Alemanni, before he was chosen to suppress the
 revolt of Africa.","('the Upper\r\n Danube', 'LOC'), ('Britain', 'GPE'), ('Alemanni', 'PERSON'), ('Africa', 'LOC')"
"In the march from Antioch he had reached
 his quarters at Ancyra, when he was unexpectedly summoned,
 without guilt and without intrigue, to assume, in the
 forty-third year of his age, the absolute government of the
 Roman empire.","('Antioch', 'GPE'), ('Ancyra', 'PERSON'), ('the\r\n forty-third year', 'DATE'), ('Roman', 'NORP')"
"In the meanwhile Valentinian was alarmed and perplexed by
 the doubtful intelligence of the revolt of the East.","('Valentinian', 'NORP'), ('East', 'LOC')"
"In the midst of a splendid entertainment, he was
 bound in chains of silver, as an honor due to the blood of
 the Arsacides; and, after a short confinement in the Tower
 of Oblivion at Ecbatana, he was released from the miseries
 of life, either by his own dagger or by that of an assassin.","('Arsacides', 'NORP'), ('the Tower\r\n of Oblivion', 'WORK_OF_ART'), ('Ecbatana', 'GPE')"
"In the space of seven months the Roman troops, who were now
 returned to Antioch, had performed a march of fifteen
 hundred miles, in which they had endured all the hardships
 of war, of famine, and of climate.","('the space of seven months', 'DATE'), ('Roman', 'NORP'), ('Antioch', 'GPE'), ('fifteen\r\n hundred miles', 'QUANTITY')"
"In the time of Julian
 he provoked the danger of disgrace by the contempt which he
 publicly expressed for the reigning religion; (22) and it 
 should seem, from his subsequent conduct, that the
 indiscreet and unseasonable freedom of Valentinian was the
 effect of military spirit rather than of Christian zeal.","('Julian', 'PERSON'), ('22', 'CARDINAL'), ('Valentinian', 'NORP'), ('Christian', 'NORP')"
"In the two
 engagements of Thyatira (41) and Nacolia the unfortunate 
 Procopius was deserted by his troops, who were seduced by
 the instructions and example of their perfidious officers.","('two', 'CARDINAL'), ('Thyatira', 'PERSON'), ('41', 'CARDINAL'), ('Nacolia', 'PERSON'), ('Procopius', 'PERSON')"
"In the unsuspicious moment of a
 Christian festival, Rando, a bold and artful chieftain, who
 had long meditated his attempt, suddenly passed the Rhine,
 entered the defenceless town, and retired with a multitude
 of captives of either sex.","('Christian', 'NORP'), ('Rando', 'PERSON'), ('Rhine', 'LOC')"
"Instead of increasing the weight of taxes, which in the
 space of forty years had been gradually doubled, he reduced,
 in the first years of his reign, one fourth of the tribute
 of the East. (63)","('the\r\n space of forty years', 'DATE'), ('the first years of his reign', 'DATE'), ('one fourth', 'CARDINAL'), ('East', 'LOC'), ('63', 'CARDINAL')"
"Instead of leading the nations of Germany and
 Scythia to the banks of the Danube, or even to the gates of
 Constantinople, the aged monarch of the Goths resigned to
 the brave Athanaric the danger and glory of a defensive war,
 against an enemy who wielded with a feeble hand the powers
 of a mighty state.","('Germany', 'GPE'), ('Scythia', 'GPE'), ('Danube', 'LOC'), ('Constantinople', 'GPE'), ('Goths', 'NORP'), ('Athanaric', 'NORP')"
"It is certain that, in the declining age of the Roman
 empire, Caledonia, Ireland, and the Isle of Man were
 inhabited by the Scots, and that the kindred tribes, who
 were often associated in military enterprise, were deeply
 affected by the various accidents of their mutual fortunes.","('Roman', 'NORP'), ('Caledonia', 'GPE'), ('Ireland', 'GPE'), ('the Isle of Man', 'GPE'), ('Scots', 'NORP')"
"It is not from the master of Innocence that we
 should expect the tender regard for the welfare of his
 subjects which prompted Valentinian to condemn the
 exposition of newborn infants,(60) and to establish fourteen 
 skilful physicians, with stipends and privileges, in the
 fourteen quarters of Rome.","('Innocence', 'WORK_OF_ART'), ('Valentinian', 'NORP'), ('fourteen', 'CARDINAL'), ('the\r\n fourteen quarters', 'DATE'), ('Rome', 'GPE')"
"It is probable that in some remote period of antiquity the
 fertile plains of Ulster received a colony of hungry Scots;
 and that the strangers of the North, who had dared to
 encounter the arms of the legions, spread their conquests
 over the savage and unwarlike natives of a solitary island.","('Ulster', 'GPE'), ('Scots', 'NORP'), ('North', 'LOC')"
"It should
 seem probable, however, that the most numerous auxiliaries
 of the Saxons were furnished by the nations who dwelt along
 the shores of the Baltic.","('Saxons', 'NORP'), ('Baltic', 'LOC')"
"It was his intention that the arts of rhetoric and grammar
 should be taught, in the Greek and Latin languages, in the
 metropolis of every province; and as the size and dignity of
 the school was usually proportioned to the importance of the
 city, the academies of Rome and Constantinople claimed a
 just and singular pre-eminence.","('Greek', 'LANGUAGE'), ('Latin', 'LANGUAGE'), ('Rome', 'GPE'), ('Constantinople', 'GPE')"
"It was the opinion of Valentinian
 that his soldiers must learn to fear their commander before
 they could cease to fear the enemy.","('Valentinian', 'NORP')"
January,"('January', 'DATE')"
"January 1. where Jovian assumed, with his infant son, the name and ensigns of the consulship. (14) Dadastana,(15) an obscure town, almost at an equal distance between Ancyra and
 Nice, was marked for the fatal term of his journey and his
 life.","('January 1.', 'DATE'), ('Jovian', 'PERSON'), ('Dadastana', 'PERSON'), ('15', 'CARDINAL'), ('Ancyra', 'GPE'), ('Nice', 'GPE')"
"Jovian was educated in the profession of
 Christianity; and as he marched from Nisibis to Antioch, the
 banner of the Cross, the LABARUM of Constantine, which was
 again displayed at the head of the legions, announced to the
 people the faith of their new emperor.","('Jovian', 'PERSON'), ('Christianity', 'NORP'), ('Nisibis', 'PERSON'), ('Antioch', 'GPE'), ('Constantine', 'PERSON')"
"Jovinus, who had viewed the
 ground with the eye of a general, made his silent approach
 through a deep and woody vale, till he could distinctly
 perceive the indolent security of the Germans.","('Jovinus', 'PERSON'), ('Germans', 'NORP')"
June.,"('June', 'DATE')"
"Let us not 
 hesitate to indulge a liberal pride that, in the present
 age, the enlightened part of Europe has abolished(44) a cruel 
 and odious prejudice, which reigned in every climate of the
 globe and adhered to every system of religious opinions.(45)","('Europe', 'LOC'), ('44', 'CARDINAL'), ('45', 'CARDINAL')"
"Lupicinus
 advanced by hasty marches to bring the legions of Syria to
 the aid of Valens.","('Syria', 'GPE'), ('Valens', 'PERSON')"
"Macrianus was afterwards admitted to the honour of a
 personal conference with the emperor, and the favours which
 he received fixed him, till the hour of his death, a steady
 and sincere friend of the republic.(100)
The Saxons.","('Macrianus', 'PERSON'), ('the hour', 'TIME'), ('100', 'CARDINAL'), ('Saxons', 'NORP')"
"Malarich had declined an office to which he thought
 himself unequal, and Lucillian was massacred at Rheims, in
 an accidental mutiny of the Batavian cohorts.(12) But the 
 moderation of Jovinus, master-general of the cavalry, who
 forgave the intention of his disgrace, soon appeased the
 tumult and confirmed the uncertain minds of the soldiers.","('Malarich', 'PERSON'), ('Lucillian', 'PERSON'), ('Rheims', 'PERSON'), ('Batavian', 'NORP'), ('Jovinus', 'PERSON')"
March 28,"('March 28', 'DATE')"
May 28,"('May 28', 'DATE')"
"May 2d. and the archbishop was permitted to end his
 life in peace and in glory, after a reign of forty-seven
 years.","('May 2d.', 'DATE'), ('forty-seven\r\n years', 'DATE')"
"Notwithstanding their
 services, their fatigues, and the approach of winter, the
 timid and impatient Jovian allowed only to the men and
 horses a respite of six weeks.","('winter', 'DATE'), ('Jovian', 'NORP'), ('six weeks', 'DATE')"
"On a sudden they
 heard the sound of the Roman trumpet; they saw the enemy in
 their camp.","('Roman', 'NORP')"
"On the sixth
 day after the death of Valentinian, the infant prince of the
 same name, who was only four years old, was shown, in the
 arms of his mother, to the legions, and solemnly invested,
 by military acclamation, with the titles and ensigns of
 supreme power.","('the sixth\r\n day', 'DATE'), ('Valentinian', 'NORP'), ('four years old', 'DATE')"
"On this
 slight foundation a huge superstructure of fable was
 gradually reared by the bards and the monks; two orders of
 men who equally abused the privilege of fiction.","('two', 'CARDINAL')"
"One
 philosopher and two lawyers; five sophists and ten
 grammarians for the Greek, and three orators and ten
 grammarians for the Latin tongue; besides seven scribes, or,
 as they were then styled, antiquarians, whose laborious pens
 supplied the public library with fair and correct copies of
 the classic writers.","('One', 'CARDINAL'), ('two', 'CARDINAL'), ('five', 'CARDINAL'), ('ten', 'CARDINAL'), ('Greek', 'NORP'), ('three', 'CARDINAL'), ('ten', 'CARDINAL'), ('Latin', 'NORP'), ('seven', 'CARDINAL')"
"Para suppressed
 his indignation, dissembled his fears, and, after secretly
 preparing his escape, mounted on horseback with three
 hundred of his faithful followers.","('three\r\n hundred', 'CARDINAL')"
"Para was invited to a Roman banquet, which had
 been prepared with all the pomp and sensuality of the East;
 the hall resounded with cheerful music, and the company was
 already heated with wine, when the count retired for an
 instant, drew his sword, and gave the signal of the murder.","('Roman', 'NORP'), ('East', 'LOC')"
"Perhaps the method of annals would
 more forcibly express the urgent and divided cares of the
 two emperors; but the attention of the reader, likewise,
 would be distracted by a tedious and desultory narrative.","('two', 'CARDINAL')"
"Praetextatus was a philosophic Pagan, a man of learning, of taste, and
 politeness; who disguised a reproach in the form of a jest,
 when he assured Damasus that if he could obtain the
 bishopric of Rome, he himself would immediately embrace the
 Christian religion.(87)","('Praetextatus', 'PERSON'), ('Pagan', 'NORP'), ('Damasus', 'PERSON'), ('Rome', 'GPE'), ('Christian', 'NORP'), ('87', 'CARDINAL')"
"Procopius
 had been hastily promoted from the obscure station of a
 tribune and a notary to the joint command of the army of
 Mesopotamia; the public opinion already named him as the
 successor of a prince who was destitute of natural heirs;
 and a vain rumour was propagated by his friends or his
 enemies, that Julian, before the altar of the Moon at
 Carrhae, had privately invested Procopius with the Imperial
 purple.(35) He endeavoured, by his dutiful and submissive 
 behaviour, to disarm the jealousy of Jovian, resigned
 without a contest his military command, and retired, with
 his wife and family, to cultivate the ample patrimony which
 he possessed in the province of Cappadocia.","('Procopius', 'PERSON'), ('Mesopotamia', 'GPE'), ('Julian', 'PERSON'), ('Moon', 'LOC'), ('Carrhae', 'GPE'), ('Procopius', 'PERSON'), ('Imperial', 'NORP'), ('Jovian', 'PERSON'), ('Cappadocia', 'GPE')"
"Restoration of Britain by Theodosius, A.D. 367-370","('Britain', 'GPE'), ('Theodosius', 'GPE'), ('A.D. 367-370', 'DATE')"
"Romanus, elated by
 impunity and irritated by resistance, was still continued in
 the military command, till the Africans were provoked, by
 his avarice, to join the rebellious standard of Firmus, the
 Moor.(121)
Revolt of Firmus.","('Romanus', 'PERSON'), ('Africans', 'NORP'), ('Firmus', 'ORG'), ('121', 'CARDINAL'), ('Firmus', 'ORG')"
"Sauromaces, who reigned in that country by the
 permission of the emperors, was expelled by a superior
 force, and, as an insult on the majesty of Rome, the king of
 kings placed a diadem on the head of his abject vassal
 Aspacuras.","('Sauromaces', 'PERSON'), ('Rome', 'GPE'), ('Aspacuras', 'PERSON')"
September 28.,"('September 28', 'DATE')"
"Severa was the mother of Gratian, who seemed to unite every claim which could entitle him to the undoubted succession of the Western empire.","('Severa', 'PERSON'), ('Gratian', 'PERSON'), ('Western', 'NORP')"
"Several candidates were proposed, and, after
 weighing the objections of character or situation, they were
 successively rejected: Election and character of Valentinian.","('Valentinian', 'NORP')"
"Several of
 the guilty accomplices of Firmus were abandoned according to
 ancient custom, to the tumult of a military execution; many
 more, by the amputation of both their hands, continued to
 exhibit an instructive spectacle of horror; the hatred of
 the rebels was accompanied with fear, and the fear of the
 Roman soldiers was mingled with respectful admiration.","('Firmus', 'ORG'), ('Roman', 'NORP')"
"Severus, count of
 the domestics, was hastily despatched, and as suddenly
 recalled, by the court of Treves.","('Severus', 'PERSON'), ('Treves', 'PERSON')"
"She was shown to the multitude in the arms of her
 adopted father, and, as often as she passed through the
 ranks, the tenderness of the soldiers was inflamed into
 martial fury:(38)","('38', 'CARDINAL')"
"Since
 the conversion of the Armenians and Iberians, those nations
 considered the Christians as the favourites, and the Magians
 as the adversaries, of the Supreme Being; the influence of
 the clergy over a superstitious people was uniformly exerted
 in the cause of Rome; and as long as the successors of
 Constantine disputed with those of Artaxerxes the
 sovereignty of the intermediate provinces, the religious
 connection always threw a decisive advantage into the scale
 of the empire.","('Armenians', 'NORP'), ('Iberians', 'NORP'), ('Christians', 'NORP'), ('Magians', 'NORP'), ('Rome', 'GPE'), ('Constantine', 'PERSON'), ('Artaxerxes', 'PERSON')"
"Six thousand of the Alemanni were slain, four thousand were
 wounded; and the brave Jovinus, after chasing the flying
 remnant of their host as far as the banks of the Rhine, July.","('Six thousand', 'CARDINAL'), ('Alemanni', 'PERSON'), ('four thousand', 'CARDINAL'), ('Jovinus', 'NORP'), ('Rhine', 'LOC'), ('July', 'DATE')"
"Six weeks before the death of Jovian,
 his infant son had been placed in the curule chair, adorned
 with the title of Nobilissimus and the vain ensigns of the
 consulship.","('Six weeks', 'DATE'), ('Jovian', 'PERSON'), ('Nobilissimus', 'WORK_OF_ART')"
"Six years after the death of Constantine the destructive
 inroads of the Scots and Picts required the presence of his
 youngest son, who reigned in the Western empire.","('Six years', 'DATE'), ('Constantine', 'PERSON'), ('Scots', 'NORP'), ('Picts', 'NORP'), ('Western', 'NORP')"
"Sixteen years afterwards he was still
 alive; but he had already been deprived of an eye, and his
 afflicted mother expected, every hour, that the innocent
 victim would be torn from her arms, to appease with his
 blood the suspicions of the reigning prince.(18)
Vacancy of the throne.","('Sixteen years afterwards', 'DATE'), ('every hour', 'TIME'), ('18', 'CARDINAL')"
"Sixty thousand blacks are annually
 embarked from the coast of Guinea, never to return to their
 native country; but they are embarked in chains;(132) and 
 this constant emigration which in the space of two centuries
 might have furnished armies to overrun the globe, accuses
 the guilt of Europe and the weakness of Africa.","('Sixty thousand', 'CARDINAL'), ('Guinea', 'GPE'), ('132', 'CARDINAL'), ('two centuries', 'DATE'), ('Europe', 'LOC'), ('Africa', 'LOC')"
"So improvident was the
 assassin Marcellinus, that he chose the moment when the
 bravest veterans had been drawn away to suppress the revolt
 of Firmus, and the whole province was exposed, with a very
 feeble defence, to the rage of the exasperated barbarians.","('Marcellinus', 'PERSON'), ('Firmus', 'ORG')"
"Some ecclesiastic, of real
 or apparent sanctity, was chosen to direct their timorous
 conscience, and to amuse the vacant tenderness of their
 heart: and the unbounded confidence which they hastily
 bestowed was often abused by knaves and enthusiasts, who
 hastened from the extremities of the East, to enjoy, on a
 splendid theatre, the privileges of the monastic profession.","('East', 'LOC')"
"Some of the
 prisoners were saved from the edge of the sword to shed
 their blood in the amphitheatre; and the orator Symmachus
 complains that twenty-nine of those desperate savages, by
 strangling themselves with their own hands, had disappointed
 the amusement of the public.","('Symmachus', 'PERSON'), ('twenty-nine', 'CARDINAL')"
"State of the church, A.D. 363.","('A.D. 363', 'DATE')"
"Such
 punishments were frequently inflicted on the leaders of the
 Homoousian party; and the misfortune of four-score
 ecclesiastics of Constantinople, who, perhaps accidentally,
 were burnt on shipboard, was imputed to the cruel and
 premeditated malice of the emperor and his Arian ministers.","('the\r\n Homoousian party', 'ORG'), ('Constantinople', 'GPE'), ('Arian', 'NORP')"
"Such reflections tend to
 enlarge the circle of our ideas, and to encourage the
 pleasing hope that New Zealand may produce in some future
 age the Hume of the Southern Hemisphere.","('New Zealand', 'GPE'), ('Hume', 'PERSON'), ('the Southern Hemisphere', 'LOC')"
"Such vain terrors 
 disturbed the peace of society and the happiness of
 individuals, and the harmless flame which insensibly melted
 a waxen image might derive a powerful and pernicious energy
 from the affrighted fancy of the person whom it was
 maliciously designed to represent. (50)","('50', 'CARDINAL')"
"Such were the weak and wicked
 maxims of the Roman administration, that, to attain a
 doubtful object of political interest, the laws of nations,
 and the sacred rights of hospitality, were inhumanly
 violated in the face of the world.","('Roman', 'NORP')"
"THE death of Julian had left the public affairs of the
 empire in a very doubtful and dangerous situation.","('Julian', 'PERSON')"
"That celebrated name, in which
 we have a clear and domestic interest, escaped the notice of
 Tacitus; and in the maps of Ptolemy it faintly marks the
 narrow neck of the Cimbric peninsula, and three small
 islands towards the mouth of the Elbe.(101)","('Tacitus', 'PERSON'), ('Ptolemy', 'LOC'), ('the Cimbric peninsula', 'LOC'), ('three', 'CARDINAL'), ('Elbe', 'LOC'), ('101', 'CARDINAL')"
"That prudent emperor, who diligently practised the wise
 maxims of Diocletian, was studious to foment and excite the
 intestine divisions of the tribes of Germany.","('Diocletian', 'PERSON'), ('Germany', 'GPE')"
"That royal maid,
 who had innocently supported the revolt of Procopius, was
 now the destined wife of the heir of the Western empire.","('Procopius', 'PERSON'), ('Western', 'NORP')"
"That school consisted of thirty-one
 professors in different branches of learning.","('thirty-one', 'CARDINAL')"
"The
 Danube, which separated the dominions of the two independent
 nations, was chosen for the scene of the conference.","('Danube', 'LOC'), ('two', 'CARDINAL')"
"The
 Scottish nation, with mistaken pride, adopted their Irish
 genealogy: and the annals of a long line of imaginary kings
 have been adorned by the fancy of Boethius and the classic
 elegance of Buchanan.(111)
Their invasion of Britain, A.D. 343-366","('Scottish', 'NORP'), ('Irish', 'NORP'), ('Boethius', 'PERSON'), ('Buchanan', 'PERSON'), ('111', 'CARDINAL'), ('Britain', 'GPE'), ('A.D. 343-366', 'DATE')"
"The
 arms and fortifications of the Gallic frontier checked the
 fury of their just resentment; and their massacre of the
 captives served to embitter the hereditary feud of the
 Burgundians and the Alemanni.","('Gallic', 'NORP'), ('Burgundians', 'NORP'), ('Alemanni', 'NORP')"
"The
 authority of Count Romanus had been suspended by the
 master-general of the cavalry, and he was committed to safe
 and honourable custody till the end of the war.","('Romanus', 'PERSON')"
"The
 avocations of a military life had diverted his youth from
 the elegant pursuits of literature; he was ignorant of the
 Greek language and the arts of rhetoric; but, as the mind of
 the orator was never disconcerted by timid perplexity, he
 was able, as often as the occasion prompted him, to deliver
 his decided sentiments with bold and ready elocution.","('Greek', 'LANGUAGE')"
"The
 bloody and obstinate conflict lasted a whole summer's day,
 with equal valour and with alternate success.","(""a whole summer's day"", 'DATE')"
