Sentence,Entities
"Passage of the Tigris, and victory of the Romans","('Passage of the Tigris', 'WORK_OF_ART'), ('Romans', 'NORP')"
Passage of the Tigris.—,"('Passage of the Tigris', 'WORK_OF_ART')"
"Perhaps he
 would not have refused to purchase, with one half of his
 kingdom, the safety of the remainder; and he would have
 gladly subscribed himself, in a treaty of peace, the
 faithful and dependent ally of the Roman conqueror.","('one half', 'CARDINAL'), ('Roman', 'NORP')"
"Reflections on the death,  
After Jovian had performed those engagements which the voice
 of his people might have tempted him to violate, he hastened
 away from the scene of his disgrace, and proceeded with his
 whole court to enjoy the luxury of Antioch.(128)","('Jovian', 'PERSON'), ('Antioch', 'GPE'), ('128', 'CARDINAL')"
Residence of Julian at Antioch—,"('Julian', 'PERSON'), ('Antioch', 'GPE')"
"Sapor enjoyed the glory and the fruits of his
 victory; and this ignominious peace has justly been
 considered as a memorable era in the decline and fall of the
 Roman empire.","('Sapor', 'PERSON'), ('Roman', 'NORP')"
"Sapor, who had been so
 long accustomed to the tardy ostentation of Constantius, was
 surprised by the intrepid diligence of his successor.","('Sapor', 'PERSON'), ('Constantius', 'PERSON')"
"Siege of Perisabor,  Two cities of Assyria presumed to
 resist the arms of a Roman emperor; and they both paid the
 severe penalty of their rashness","('Perisabor', 'GPE'), ('Two', 'CARDINAL'), ('Assyria', 'GPE'), ('Roman', 'NORP')"
"Similar orders were despatched by the 
 emperor for the evacuation of Singara and the castle of the
 Moors, and for the restitution of the five provinces beyond
 the Tigris.","('Singara', 'GPE'), ('Moors', 'LOC'), ('five', 'CARDINAL'), ('Tigris', 'LOC')"
"Singara and the castle of the Moors, one of the
 strongest places of Mesopotamia, were likewise dismembered
 from the empire.","('Singara', 'GPE'), ('Moors', 'LOC'), ('one', 'CARDINAL'), ('Mesopotamia', 'LOC')"
"Such imprudent declarations were 
 eagerly adopted by the malice or credulity of their
 adversaries, (133) who darkly insinuated or confidently 
 asserted that the governors of the church had instigated and
 directed the fanaticism of a domestic assassin.(134)","('133', 'CARDINAL'), ('134', 'CARDINAL')"
Such was the disposition of the three principal columns.,"('three', 'CARDINAL')"
"Such was the end of that extraordinary man, in the thirty-second year of his age, after a reign of one year and about eight months from the death of Constantius.","('the thirty-second year', 'DATE'), ('one year', 'DATE'), ('about eight months', 'DATE'), ('Constantius', 'PERSON')"
"The
 Assyrians maintained their loyalty by a skilful as well as
 vigorous defence, till the lucky stroke of a battering-ram
 having opened a large breach by shattering one of the angles
 of the wall, they hastily retired into the fortifications of
 the interior citadel.","('Assyrians', 'NORP'), ('one', 'CARDINAL')"
"The
 Persians derived some honour from the advantage which they
 obtained against the left wing, where Anatolius, master of
 the offices, was slain, and the praefect Sallust very
 narrowly escaped.","('Persians', 'NORP'), ('Anatolius', 'PERSON'), ('Sallust', 'PERSON')"
"The
 army of Julian, the most numerous that any of the Caesars
 had ever led against Persia, consisted of sixty-five
 thousand effective and well-disciplined soldiers.","('Julian', 'PERSON'), ('Caesars', 'ORG'), ('Persia', 'GPE'), ('sixty-five\r\n thousand', 'CARDINAL')"
"The
 desponding troops obeyed the signal of retreat, only seventy
 days June 16after they had passed the Chaboras with the sanguine
 expectation of subverting the throne of Persia.(87)
Retreat and distress of the Roman army","('only seventy\r\n days June 16after', 'DATE'), ('Chaboras', 'NORP'), ('Persia', 'GPE'), ('87', 'CARDINAL'), ('Roman', 'NORP')"
"The
 exhortations of Hormisdas were repulsed with contempt; and
 the ears of the Persian prince were wounded by a just
 reproach, that, unmindful of his royal birth, he conducted
 an army of strangers against his king and country.","('Hormisdas', 'PERSON'), ('Persian', 'NORP')"
"The
 generals were named, a formidable army was destined for this
 important service, and Julian, marching from Constantinople
 through the provinces of Asia Minor, August  arrived at Antioch about eight months after the death of his predecessor.","('Julian', 'PERSON'), ('Constantinople', 'GPE'), ('Asia Minor', 'LOC'), ('August', 'DATE'), ('Antioch', 'GPE'), ('about eight months', 'DATE')"
"The
 generals, who were surprised and perplexed by his refusal,
 showed some disposition to adopt the salutary advice of an
 inferior officer,(100) that they should act as they would  have acted in the absence of the emperor; that they should exert their abilities to extricate the army from the present
 distress; and, if they were fortunate enough to reach the
 confines of Mesopotamia, they should proceed with united and
 deliberate counsels in the election of a lawful sovereign.","('100', 'CARDINAL'), ('Mesopotamia', 'GPE')"
"The
 majority of the people supported the glory of the Christian
 name, which had been first invented by their ancestors:(13) 
 they contented themselves with disobeying the moral
 precepts, but they were scrupulously attached to the
 speculative doctrines, of their religion.","('Christian', 'NORP'), ('first', 'ORDINAL'), ('13', 'CARDINAL')"
"The
 name and glory of the adjacent Seleucia were for ever
 extinguished; and the only remaining quarter of that Greek
 colony had resumed, with the Assyrian language and manners,
 the primitive appellation of Coche.","('Seleucia', 'LOC'), ('Greek', 'NORP'), ('Assyrian', 'NORP'), ('Coche', 'PERSON')"
"The
 obscure domestic, exalted to the throne by fortune, rather
 than by merit, was impatient to escape from the hands of the
 Persians, that he might prevent the designs of Procopius,
 who commanded the army of Mesopotamia, and establish his
 doubtful reign over the legions and provinces which were
 still ignorant of the hasty and tumultuous choice of the
 camp beyond the Tigris.(113)","('Persians', 'NORP'), ('Procopius', 'PERSON'), ('Mesopotamia', 'GPE'), ('Tigris', 'LOC'), ('113', 'CARDINAL')"
"The
 preceptors of Julian had extorted a rash but solemn
 assurance that he would never attend the lectures of their
 adversary; the curiosity of the royal youth was checked and
 inflamed; he secretly procured the writings of this
 dangerous sophist, and gradually surpassed, in the perfect
 imitation of his style, the most laborious of his domestic
 pupils.(24) When Julian ascended the throne, he declared his 
 impatience to embrace and reward the Syrian sophist, who had
 preserved in a degenerate age the Grecian purity of taste,
 of manners, and of religion.","('Julian', 'PERSON'), ('Julian', 'PERSON'), ('Syrian', 'NORP'), ('Grecian', 'NORP')"
"The
 savage insensibility of Jovian appears to have aggravated
 the hardships of these unhappy fugitives.","('Jovian', 'PERSON')"
"The
 united parts contributed to form the common epithet of Al
 Modain, THE CITIES, which the Orientals have bestowed on the
 winter residence of the Sassanides; and the whole
 circumference of the Persian capital was strongly fortified
 by the waters of the river, by lofty walls, and by
 impracticable morasses.","('Al\r\n Modain', 'LOC'), ('Orientals', 'NORP'), ('winter', 'DATE'), ('Sassanides', 'LOC'), ('Persian', 'NORP')"
"The
 veteran bands of cavalry and infantry, of Romans and
 barbarians, had been selected from the different provinces,
 and a just pre-eminence of loyalty and valour was claimed by
 the hardy Gauls, who guarded the throne and person of their
 beloved prince.","('Romans', 'NORP'), ('Gauls', 'NORP')"
"The
 visionary conquests of Hyrcania and India, which had so long
 amused, now tormented, the mind of Julian.","('Hyrcania', 'GPE'), ('India', 'GPE'), ('Julian', 'PERSON')"
"The
 voluminous writings of Libanius still exist; for the most
 part they are the vain and idle compositions of an orator
 who cultivated the science of words—the productions of a
 recluse student, whose mind, regardless of his
 contemporaries, was incessantly fixed on the Trojan war and
 the Athenian commonwealth.","('Libanius', 'NORP'), ('the Trojan war', 'EVENT'), ('Athenian', 'NORP')"
"The
 welcome news of the death of Julian, which a deserter
 revealed to the camp of Sapor, inspired the desponding
 monarch with a sudden confidence of victory.","('Julian', 'PERSON'), ('Sapor', 'PERSON')"
"The
 whole engagement lasted above twelve hours; till the gradual
 retreat of the Persians was changed into a disorderly
 flight, of which the shameful example was given by the
 principal leaders and the Surenas himself.","('twelve hours', 'TIME'), ('Persians', 'NORP'), ('Surenas', 'PERSON')"
"The 
 disciple of Socrates was too deeply affected by these
 popular insults; but the monarch, endowed with quick
 sensibility and possessed of absolute power, refused his
 passions the gratification of revenge.","('Socrates', 'PERSON')"
"The Caesars of Julian  
 THE philosophical fable which Julian composed under the name
 of the Caesars (1) is one of the most agreeable and instructive productions of ancient wit.(2) During the freedom 
 and equality of the days of the Saturnalia, Romulus prepared
 a feast for the deities of Olympus, who had adopted him as a
 worthy associate, and for the Roman princes, who had reigned
 over his martial people and the vanquished nations of the
 earth.","('The Caesars of Julian', 'WORK_OF_ART'), ('Julian', 'PERSON'), ('Caesars', 'PERSON'), ('2', 'CARDINAL'), ('Saturnalia', 'NORP'), ('Romulus', 'PERSON'), ('Olympus', 'PERSON'), ('Roman', 'NORP')"
"The Christian
 bishops, Gregory and Augustin, insult the madness of the
 apostate, who executed, with his own hands, the sentence of
 divine justice.","('Christian', 'NORP'), ('Gregory', 'PERSON'), ('Augustin', 'PERSON')"
"The Christians applauded, in lofty and ambiguous strains,
 the stroke of divine vengeance which had been so long
 suspended over the guilty head of Julian.","('Christians', 'NORP'), ('Julian', 'PERSON')"
"The Imperial wheat was
 purchased by the rich merchants; the proprietors of land or
 of corn withheld from the city the accustomed supply; and
 the small quantities that appeared in the market were
 secretly sold at an advanced and illegal price.","('Imperial', 'ORG')"
"The Pagans already placed their
 beloved hero in the rank of those gods whose worship he had
 restored while the invectives of the Christians pursued the
 soul of the apostate to hell, and his body to the grave.(130)","('Pagans', 'NORP'), ('Christians', 'NORP'), ('130', 'CARDINAL')"
"The Persians repeatedly charged with
 fury; they were repeatedly repulsed with firmness; and the
 action at Maronga, which almost deserved the name of a
 battle, was marked by a considerable loss of satraps and
 elephants, perhaps of equal value in the eyes of their
 monarch.","('Persians', 'NORP'), ('Maronga', 'GPE')"
"The Persians, who from their walls contemptuously
 beheld the progress of an impotent attack, celebrated with
 songs of triumph the glory of Sapor; and ventured to assure
 the emperor that he might ascend the starry mansion of
 Ormusd before he could hope to take the impregnable city of
 Maogamalcha.","('Persians', 'NORP'), ('Sapor', 'PERSON'), ('Ormusd', 'PERSON'), ('Maogamalcha', 'GPE')"
The Retreat and Death of Julian.—,"('The Retreat and Death of Julian', 'WORK_OF_ART')"
"The Romans wandered several days in
 the country to the eastward of Bagdad; the Persian deserter,
 who had artfully led them into the snare, escaped from their
 resentment; and his followers, as soon as they were put to
 the torture, confessed the secret of the conspiracy.","('Romans', 'NORP'), ('several days', 'DATE'), ('Bagdad', 'GPE'), ('Persian', 'NORP')"
"The Romans, after sending up a military shout,
 advanced in measured steps to the animating notes of martial
 music; launched their formidable javelins, and rushed
 forwards with drawn swords to deprive the barbarians, by a
 closer onset, of the advantage of their missile weapons.","('Romans', 'NORP')"
"The Romans, who now
 aspired only to the permission of a safe and speedy retreat,
 endeavoured to persuade themselves that this formidable
 appearance was occasioned by a troop of wild asses, or
 perhaps by the approach of some friendly Arabs.","('Romans', 'NORP'), ('Arabs', 'NORP')"
"The Saracens
 sometimes intercepted the stragglers on the march; but the
 generals and troops of Sapor respected the cessation of
 arms, and Jovian was suffered to explore the most convenient
 place for the passage of the river.","('Saracens', 'NORP'), ('Sapor', 'PERSON'), ('Jovian', 'PERSON')"
"The Sassanian prince, whether he listened to the
 voice of pride or humanity, whether he consulted the
 sentiments of his birth or the duties of his situation, was
 equally inclined to promote a salutary measure which would
 terminate the calamities of Persia, and secure the triumph
 of Rome.","('Sassanian', 'NORP'), ('Persia', 'GPE'), ('Rome', 'GPE')"
"The Surenas
 himself, accompanied by another satrap, appeared in the camp
 of Jovian,(109) and declared that the clemency of his 
 sovereign was not averse to signify the conditions on which
 he would consent to spare and to dismiss the Caesar with the
 relics of his captive army.","('Surenas', 'PERSON'), ('Jovian', 'PERSON'), ('109', 'CARDINAL'), ('Caesar', 'PERSON')"
"The Tigris was still on their left; their hopes and
 provisions were almost consumed; and the impatient soldiers,
 who had fondly persuaded themselves that the frontiers of
 the empire were not far distant, requested their new
 sovereign that they might be permitted to hazard the passage
 of the river.","('Tigris', 'PRODUCT')"
"The alienated mind of Tiranus was exasperated by the indiscretion of Julian, who treated the king of Armenia as his slave, and as the enemy of the gods.","('Tiranus', 'PERSON'), ('Julian', 'PERSON'), ('Armenia', 'GPE')"
"The ambassadors of the East, from the continent
 of India and the isle of Ceylon,(6) had respectfully saluted 
 the Roman purple. (7)","('East', 'LOC'), ('India', 'GPE'), ('Ceylon', 'GPE'), ('6', 'CARDINAL'), ('Roman', 'NORP'), ('7', 'CARDINAL')"
"The ancient and magnificent temple, which
 had sanctified for so many ages the city of Hierapolis,(31) no longer subsisted, and the consecrated wealth, which afforded a liberal maintenance to more than three hundred
 priests, might hasten its downfall.","('Hierapolis', 'GPE'), ('31', 'CARDINAL'), ('more than three hundred', 'CARDINAL')"
"The army marched through a hilly country and
 the hills had been secretly occupied by the Persians.","('Persians', 'NORP')"
"The arts of luxury were honoured, the serious and
 manly virtues were the subject of ridicule, and the contempt
 for female modesty and reverent age announced the universal
 corruption of the capital of the East.","('East', 'LOC')"
"The barbarians fled: and Julian, who was
 foremost in every danger, animated the pursuit with his
 voice and gestures.","('Julian', 'PERSON')"
"The battle was at length restored by the
 persevering valour of the Romans; the Persians were repulsed
 with a great slaughter of men and elephants; and the army,
 after marching and fighting a long summer's day, arrived, in
 the evening, at Samara, on the banks of the Tigris, about
 one hundred miles above Ctesiphon. (105)","('Romans', 'NORP'), ('Persians', 'NORP'), (""a long summer's day"", 'DATE'), ('Samara', 'GPE'), ('Tigris', 'LOC'), ('about\r\n one hundred miles', 'QUANTITY'), ('Ctesiphon', 'LOC'), ('105', 'CARDINAL')"
"The bloody and
 obstinate conflict was maintained by the two armies till
 they were separated by the total darkness of the night.","('two', 'CARDINAL')"
"The broad channel of the Euphrates(41) was crowded by a fleet 
 of eleven hundred ships, destined to attend the motions and
 to satisfy the wants of the Roman army.","('Euphrates', 'LOC'), ('41', 'CARDINAL'), ('eleven hundred', 'CARDINAL'), ('Roman', 'NORP')"
"The church of
 Antioch was distracted by heresy and schism; but the Arians
 and the Athanasians, the followers of Meletius and those of
 Paulinus,(14) were actuated by the same pious hatred of their 
 common adversary.","('Antioch', 'GPE'), ('Arians', 'NORP'), ('Athanasians', 'NORP'), ('Meletius', 'PERSON'), ('Paulinus', 'NORP'), ('14', 'CARDINAL')"
"The city of Anah, or
 Anatho,(49) the actual residence of an Arabian emir, is composed of two long streets, which enclose, within a
 natural fortification, a small island in the midst, and two
 fruitful spots on either side, of the Euphrates.","('Anah', 'GPE'), ('Anatho', 'GPE'), ('49', 'CARDINAL'), ('Arabian', 'NORP'), ('two', 'CARDINAL'), ('two', 'CARDINAL'), ('Euphrates', 'LOC')"
"The city, or rather fortress, of Maogamalcha, which was
 defended by sixteen large towers, a deep ditch,, and two
 strong and solid walls of brick and bitumen, appears to have
 been constructed at the distance of eleven miles, as the
 safeguard of the capital of Persia.","('Maogamalcha', 'GPE'), ('sixteen', 'CARDINAL'), ('two', 'CARDINAL'), ('eleven miles', 'QUANTITY'), ('Persia', 'GPE')"
"The comedians, who
 resented his contempt and aversion for the theatre,
 exhibited, with the applause of a Christian audience, the
 lively and exaggerated representation of the faults and
 follies of the deceased emperor.","('Christian', 'NORP')"
"The conduct of the attack was assumed by Julian
 himself, who seemed to place his whole dependence in the
 military engines which he erected against the walls; while
 he secretly contrived a more efficacious method of
 introducing his troops into the heart of the city.","('Julian', 'PERSON')"
"The contest was continued
 by an incessant and mutual discharge of missile weapons; and
 the superiority which the Romans might derive from the
 mechanical powers of their balistae and catapultae was
 counterbalanced by the advantage of the ground on the side
 of the besieged.","('Romans', 'NORP')"
"The corpse of Julian was transported
 from Nisibis to Tarsus, in a slow march of fifteen days,
 and, as it passed through the cities of the East, was
 saluted by the hostile factions with mournful lamentations
 and clamorous insults.","('Julian', 'PERSON'), ('Nisibis', 'GPE'), ('Tarsus', 'GPE'), ('fifteen days', 'DATE'), ('East', 'LOC')"
"The country
 which they traversed from the Chaboras to the cultivated
 lands of Assyria may be considered as a part of the desert
 of Arabia, a dry and barren waste, which could never be
 improved by the most powerful arts of human industry.","('Chaboras', 'LOC'), ('Assyria', 'GPE'), ('Arabia', 'LOC')"
"The crafty Persian delayed,
 under various pretences, the conclusion of the agreement;
 started difficulties, required explanations, suggested
 expedients, receded from his concessions, increased his
 demands, and wasted four days in the arts of negotiation,
 till he had consumed the stock of provisions which yet
 remained in the camp of the Romans.","('Persian', 'NORP'), ('four days', 'DATE'), ('Romans', 'NORP')"
"The cumbersome train of artillery and wagons, which retards
 the operations of a modern army, was in a great measure
 unknown in the camps of the Romans.(83)","('Romans', 'NORP'), ('83', 'CARDINAL')"
"The custom of ancient discipline required a military oration, and Julian embraced every opportunity of displaying his eloquence","('Julian', 'PERSON')"
"The day was consecrated to pleasure; but, as soon as the
 hour of supper was past, the emperor summoned the generals
 to his tent, and acquainted them that he had fixed that
 night for the passage of the Tigris.","('that\r\n night', 'TIME'), ('Tigris', 'LOC')"
"The days of festivity, consecrated by
 ancient custom to the honour of the gods, were the only
 occasions in which Julian relaxed his philosophic severity,
 and those festivals were the only days in which the Syrians
 of Antioch could reject the allurements of pleasure.","('Julian', 'PERSON'), ('Syrians', 'NORP'), ('Antioch', 'GPE')"
"The death of Julian, A.D. 363.","('Julian', 'PERSON'), ('A.D. 363', 'DATE')"
"The distance of the last-mentioned city from the 
 Roman camp was not very considerable; and Julian must soon
 have renounced the vain and impracticable attempt of forcing
 upwards a great fleet against the stream of a rapid river,
 (80) which in several places was embarrassed by natural or 
 artificial cataracts.(81) The power of sails and oars was 
 insufficient, it became necessary to tow the ships against
 the current of the river; the strength of twenty thousand
 soldiers was exhausted in this tedious and servile labour;
 and if the Romans continued to march along the banks of the
 Tigris, they could only expect to return home without
 achieving any enterprise worthy of the genius or fortune of
 their leader.","('Roman', 'NORP'), ('Julian', 'PERSON'), ('80', 'CARDINAL'), ('81', 'CARDINAL'), ('twenty thousand', 'CARDINAL'), ('Romans', 'NORP'), ('Tigris', 'LOC')"
"The eloquence of Julian was enforced by a donative of one hundred and thirty pieces of silver to every soldier, and the bridge of the Chaboras was instantly cut away to convince the troops that they must place their hopes of safety in the success of their arms.","('Julian', 'PERSON'), ('one hundred and thirty', 'CARDINAL'), ('Chaboras', 'PRODUCT')"
"The emperor
 detached an army of thirty thousand men, under the command
 of his kinsman Procopius, and of Sebastian, who had been
 duke of Egypt.","('thirty thousand', 'CARDINAL'), ('Procopius', 'PERSON'), ('Sebastian', 'PERSON'), ('Egypt', 'GPE')"
"The emperor stood before
 the citadel of Perisabor, insensible of his extreme danger,
 and encouraged his troops to burst open the gates of iron,
 till he was almost overwhelmed under a cloud of missile
 weapons and huge stones that were directed against his
 person.","('Perisabor', 'PERSON')"
"The emperor,
 apprehensive of leaving such an important fortress in his
 rear, immediately formed the siege of Maogamalcha; and the
 Roman army was distributed for that purpose into three
 divisions.","('Maogamalcha', 'GPE'), ('Roman', 'NORP'), ('three', 'CARDINAL')"
"The esteem of a prince
 who possesses the virtues which he approves is the noblest
 recompense of a deserving subject; and the authority which
 Julian derived from his personal merit enabled him to revive
 and enforce the rigour of ancient discipline.","('Julian', 'PERSON')"
"The extensive region
 that lies between the river Tigris and the mountains of
 Media was filled with villages and towns; and the fertile
 soils for the most part, was in a very improved state of
 cultivation.","('Tigris', 'LOC'), ('Media', 'LOC')"
"The face of the country was interspersed with
 groves of innumerable palm-trees, (55) and the diligent 
 natives celebrated, either in verse or prose, the three
 hundred and sixty uses to which the trunk, the branches, the
 leaves, the juice, and the fruit were skilfully applied.","('three\r\n hundred and sixty', 'CARDINAL')"
"The father and the son
 were invited to the Imperial table.","('Imperial', 'ORG')"
"The fertile province of Assyria (52) which stretched beyond 
 the Tigris, as far as the mountains of Media,(53) extended 
 about four hundred miles from the ancient wall of Macepracta
 to the territory of Basra, where the united streams of the
 Euphrates and Tigris discharge themselves into the Persian
 Gulf.(54)","('Assyria', 'GPE'), ('52', 'CARDINAL'), ('Tigris', 'LOC'), ('Media', 'LOC'), ('53', 'CARDINAL'), ('about four hundred miles', 'QUANTITY'), ('Macepracta', 'GPE'), ('Basra', 'GPE'), ('Euphrates', 'LOC'), ('Tigris', 'LOC'), ('the Persian\r\n Gulf', 'LOC'), ('54', 'CARDINAL')"
"The fields of Assyria were devoted by Julian to the
 calamities of war; and the philosopher retaliated on a
 guiltless people the acts of rapine and cruelty which had
 been committed by their haughty master in the Roman
 provinces.","('Assyria', 'GPE'), ('Julian', 'PERSON'), ('Roman', 'NORP')"
"The first words that Julian uttered, after his recovery from
 the fainting fit into which he had been thrown by loss of
 blood, were expressive of his martial spirit.","('first', 'ORDINAL'), ('Julian', 'PERSON')"
"The five provinces beyond the
 Tigris, which had been ceded by the grandfather of Sapor,
 were restored to the Persian monarchy.","('five', 'CARDINAL'), ('Tigris', 'LOC'), ('Sapor', 'PERSON'), ('Persian', 'NORP')"
"The fleet passed from the Euphrates into an
 artificial deviation of that river, which pours a copious
 and navigable stream into the Tigris at a small distance
 below the great city.","('Euphrates', 'LOC'), ('Tigris', 'LOC')"
"The fortifications
 were razed to the ground; and not a vestige was left that
 the city of Maogamalcha had ever existed.","('Maogamalcha', 'GPE')"
"The friend of Julian was an indignant spectator
 of the triumph of Christianity, and his bigotry, which
 darkened the prospect of the visible world, did not inspire
 Libanius with any lively hopes of celestial glory and
 happiness.(28)
March of Julian to the Euphrates, A.D. 363, March 5","('Julian', 'PERSON'), ('Christianity', 'NORP'), ('Libanius', 'PERSON'), ('Euphrates', 'LOC'), ('363', 'CARDINAL'), ('March 5', 'DATE')"
"The friends of Julian had confidently announced the success
 of his expedition.","('Julian', 'PERSON')"
