Sentence,Entities
"On one of these, a gold medal, Christ is depictured holding in his left hand a book with this inscription: ""THE VOW OF THE ROMAN SENATE AND PEOPLE: ROME THE CAPITAL OF THE WORLD;"" on the reverse, St. Peter
 delivering a banner to a kneeling senator in his cap and
 gown, with the name and arms of his family impressed on a
 shield.","('one', 'CARDINAL'), ('Christ', 'PERSON'), ('THE VOW OF THE ROMAN SENATE AND PEOPLE: ROME THE CAPITAL OF THE WORLD', 'WORK_OF_ART'), ('St. Peter', 'GPE')"
"On the decease of a pope, two factions proceeded in
 different churches to a double election: the number and
 weight of votes, the priority of time, the merit of the
 candidates, might balance each other: the most respectable
 of the clergy were divided; and the distant princes, who
 bowed before the spiritual throne, could not distinguish the
 spurious, from the legitimate, idol.","('two', 'CARDINAL')"
"On the first provocation, of a cardinal
 killed or wounded in the streets, he cast an interdict on
 the guilty people; and from Christmas to Easter, Rome was
 deprived of the real or imaginary comforts of religious
 worship.","('first', 'ORDINAL'), ('Christmas to Easter', 'DATE'), ('Rome', 'GPE')"
"Once, and once only,
 in his life, each emperor, with an army of Teutonic vassals,
 descended from the Alps.","('Teutonic', 'NORP'), ('Alps', 'LOC')"
Political Heresy of Arnold of Brescia.,"('Arnold', 'PERSON'), ('Brescia', 'GPE')"
Pride of the Romans.,"('Romans', 'NORP')"
Restoration of the Republic.,"('the Republic', 'GPE')"
"Restoration of the senate, A.D. 1144.","('A.D. 1144', 'DATE')"
Right of the cardinals established by Alexander III.,"('Alexander III', 'PERSON')"
"Rome continually presented the aspect of war and discord: the churches and palaces were fortified and assaulted by the factions and families; Calistus II. A.D. 1119-1124.  and, after giving peace to Europe, Calistus the Second alone had resolution and power to prohibit the use of private arms in the metropolis.","('Rome', 'GPE'), ('A.D. 1119', 'DATE'), ('Europe', 'LOC'), ('Calistus', 'PERSON'), ('Second', 'ORDINAL')"
"Rome had been already stripped of her trophies, her gods, and her Caesars; nor was the Gothic dominion more inglorious and oppressive than the tyranny of the Greeks.","('Rome', 'GPE'), ('Caesars', 'PERSON'), ('Gothic', 'NORP'), ('Greeks', 'NORP')"
"Shaking the dust from his feet, the apostle withdrew from a city in which his dignity was
 insulted and his person was endangered; and the vanity of sacerdotal ambition is revealed in the involuntary confession, that one emperor was more tolerable than twenty.","('one', 'CARDINAL'), ('twenty', 'CARDINAL')"
"Since the loss
 of Palestine, the gift of plenary indulgences, which had
 been applied to the crusades, remained without an object;
 and the most valuable treasure of the church was sequestered
 above eight years from public circulation.","('Palestine', 'GPE'), ('eight years', 'DATE')"
"Six- and-thirty of
 his successors, (12) till their retreat to Avignon,
 maintained an unequal contest with the Romans: their age and
 dignity were often violated; and the churches, in the solemn
 rites of religion, were polluted with sedition and murder.","('Six- and-thirty', 'CARDINAL'), ('12', 'DATE'), ('Avignon', 'GPE'), ('Romans', 'NORP')"
"Sixty-eight years afterwards they marched against Viterbo in the ecclesiastical state with the whole force of the city; by a rare coalition the Teutonic eagle was blended, in the adverse banners, with the keys of St. Peter;  and the pope's auxiliaries were commanded by a count of
 Thoulouse and a bishop of Winchester.","('Sixty-eight years', 'DATE'), ('Viterbo', 'GPE'), ('Teutonic', 'NORP'), ('St. Peter', 'PERSON'), ('Thoulouse', 'ORG'), ('Winchester', 'GPE')"
"Some articles of inconvenient or superfluous rigour have been gradually relaxed, but the principle of confinement is vigorous and entire: they are still urged, by the personal motives of health and freedom, to accelerate the moment of their
 deliverance; and the improvement of ballot or secret votes has wrapped the struggles of the conclave (71) in the silky veil of charity and politeness. (72)","('72', 'CARDINAL')"
Some of these republican coins of the twelfth and thirteenth centuries are shown in the cabinets of the curious.,"('republican', 'NORP'), ('the twelfth and thirteenth centuries', 'DATE')"
"State and revolutions of Rome, A.D. 1100-1500","('Rome', 'GPE'), ('1100-1500', 'CARDINAL')"
State of Rome from the Twelfth Century.,"('Rome', 'GPE'), ('the Twelfth Century', 'DATE')"
"Such powerful motives should have firmly attached the
 voluntary and pious obedience of the Roman people to their
 spiritual and temporal father.","('Roman', 'NORP')"
"Surely this dark portrait is not coloured by the pencil of Christian charity; (17) yet the features, however harsh or ugly, express a lively resemblance of the Roman of the twelfth century.","('Christian', 'NORP'), ('17', 'CARDINAL'), ('Roman', 'NORP'), ('the twelfth century', 'DATE')"
"Surrounded by his ecclesiastical and secular princes, he gave audience in his camp at Sutri to the ambassadors of Rome, who thus addressed him in a free and florid oration:","('Sutri', 'GPE'), ('Rome', 'GPE')"
Temporal Dominion of the Popes.,"('Temporal Dominion of the Popes', 'PERSON')"
"The
 assembled in arms at the foot of the Capitol; sallied from
 the gates, plundered or burnt the harvests of their
 neighbours, engaged in tumultuary conflict, and returned home
 after an expedition of fifteen or twenty days.","('Capitol', 'FAC'), ('fifteen or twenty days', 'DATE')"
"The
 boldness of Sciarra Colonna was signalized in the captivity
 of Boniface, and long afterwards in the coronation of Lewis
 of Bavaria; and by the gratitude of the emperor, the pillar
 in their arms was encircled with a royal crown.","('Sciarra Colonna', 'PERSON'), ('Boniface', 'PERSON'), ('Lewis', 'PERSON'), ('Bavaria', 'GPE')"
"The
 calculation of their numbers could not be easy nor accurate;
 and they have probably been magnified by a dexterous clergy,
 well apprised of the contagion of example: yet we are
 assured by a judicious historian, who assisted at the
 ceremony, that Rome was never replenished with less than two
 hundred thousand strangers; and another spectator has fixed
 at two millions the total concourse of the year.","('Rome', 'GPE'), ('less than two\r\n hundred thousand', 'CARDINAL'), ('two millions', 'CARDINAL'), ('the year', 'DATE')"
"The
 pontiff, who watched and irritated their devout impatience,
 was soon persuaded by ancient testimony of the justice of
 their claim; and he proclaimed a plenary absolution to all
 Catholics who, in the course of that year, and at every
 similar period, should respectfully visit the apostolic
 churches of St. Peter and St. Paul.","('Catholics', 'NORP'), ('that year', 'DATE'), ('St. Peter', 'GPE'), ('St. Paul', 'GPE')"
"The Caesars of Saxony or Franconia were the chiefs of a
 feudal aristocracy; nor could they exercise the discipline
 of civil and military power, which alone secures the
 obedience of a distant people, impatient of servitude,
 though perhaps incapable of freedom.","('The Caesars of Saxony', 'ORG'), ('Franconia', 'GPE')"
The Capitol.,"('Capitol', 'FAC')"
The Colonna.,"('Colonna', 'PERSON')"
"The French and German emperors of Rome, A.D. 800-1100","('French', 'NORP'), ('German', 'NORP'), ('Rome', 'GPE'), ('800-1100', 'CARDINAL')"
"The Indian who fells the tree, that he
 may gather the fruit, (9) and the Arab who plunders the
 caravans of commerce, are actuated by the same impulse of
 savage nature, which overlooks the future in the present,
 and relinquishes for momentary rapine the long and secure
 possession of the most important blessings.","('Indian', 'NORP'), ('Arab', 'NORP')"
"The Jews had rejected the Christ when he appeared among them
 in a plebeian character; and the Romans might plead their
 ignorance of his vicar when he assumed the pomp and pride of
 a temporal sovereign.","('Jews', 'NORP'), ('Christ', 'PERSON'), ('Romans', 'NORP')"
"The Romans had despised their temporal prince:
 they submitted with grief and terror to the censures of
 their spiritual father: their guilt was expiated by penance,
 and the banishment of the seditious preacher was the price
 of their absolution.","('Romans', 'NORP')"
"The Romans were discomfited with shame and slaughter: but the English prelate must have indulged the vanity of a pilgrim, if he multiplied their numbers to one hundred, and their loss in
 the field to thirty, thousand men.","('Romans', 'NORP'), ('English', 'NORP'), ('one hundred', 'CARDINAL'), ('thirty, thousand', 'CARDINAL')"
"The Ursini migrated from Spoleto; (104) the sons of Ursus, as they are styled in the twelfth century, from some eminent person, who is only known as the  father of their race.","('Ursini', 'PERSON'), ('Spoleto', 'GPE'), ('104', 'CARDINAL'), ('Ursus', 'NORP'), ('the twelfth century', 'DATE')"
"The absolute term of his
 life was superseded by a renewal every third year; and the
 enmity of Nicholas the Third obliged the Sicilian king to
 abdicate the government of Rome.","('every third year', 'DATE'), ('Nicholas', 'PERSON'), ('Third', 'ORDINAL'), ('Sicilian', 'NORP'), ('Rome', 'GPE')"
"The adjacent territory on either side of the Tiber was always claimed, and sometimes possessed, as the patrimony of St. Peter; but the barons assumed a lawless independence, and the cities too faithfully copied the revolt and discord of
 the metropolis.","('Tiber', 'LOC'), ('St. Peter', 'GPE')"
"The applause of the magistrates and people confirmed his election, and the ecclesiastical power that was obeyed in  Sweden and Britain had been ultimately derived from the suffrage of the Romans.","('Sweden', 'GPE'), ('Britain', 'GPE'), ('Romans', 'NORP')"
"The archbishop of
 Bourdeaux, a furious enemy of his king and country, was the
 first on the list; but his ambition was known; and his
 conscience obeyed the calls of fortune and the commands of a
 benefactor, who had been informed by a swift messenger that
 the choice of a pope was now in his hands.","('Bourdeaux', 'PERSON'), ('first', 'ORDINAL')"
"The bishop, as a
 simple bishop, was compelled to reside in his diocese; and
 the standard of Brancaleone was displayed in the field with
 terror and effect.","('Brancaleone', 'PERSON')"
"The cardinals fled; the inhabitants of Anagni were seduced from their allegiance and gratitude; but the dauntless Boniface, unarmed and alone, seated himself in his chair, and awaited, like the conscript fathers of old, the swords of the Gauls.","('Anagni', 'GPE'), ('Boniface', 'PERSON'), ('Gauls', 'NORP')"
"The cardinals of both parties were soon astonished by a
 summons to attend him beyond the Alps; from whence, as they
 soon discovered, they must never hope to return.","('Alps', 'LOC')"
"The clergy triumphed in his death: with his  ashes, his sect was dispersed; his memory still lived in the minds of the Romans.","('Romans', 'NORP')"
"The deadly factions of the Guelphs and
 Ghibelines, so fatal to Italy, could never be embraced with
 truth or constancy by the Romans, the subjects and
 adversaries both of the bishop and emperor; but their
 support was solicited by both parties, and they alternately
 displayed in their banners the keys of St. Peter and the
 German eagle.","('Guelphs', 'NORP'), ('Ghibelines', 'NORP'), ('Italy', 'GPE'), ('Romans', 'NORP'), ('St. Peter', 'PERSON'), ('German', 'NORP')"
"The dignity was confined to the noble families of Rome: the choice of the people was ratified by the pope; but a triple oath of fidelity must have often
 embarrassed the praefect in the conflict of adverse duties.","('Rome', 'GPE')"
The eagle and the keys were displayed in their adverse banners; and the two factions of Italy most furiously raged when the origin and nature of the dispute were long since forgotten.,"('two', 'CARDINAL'), ('Italy', 'GPE')"
The emperor Lewis of Bavaria revived the example of the great Otho.,"('Lewis', 'PERSON'), ('Bavaria', 'GPE'), ('Otho', 'PERSON')"
"The emperor Lewis of Bavaria, A.D. 1328.","('Lewis', 'PERSON'), ('Bavaria', 'GPE'), ('A.D. 1328', 'DATE')"
The first Caesars had been invested with the exclusive coinage of the gold and silver; to the senate they abandoned the baser metal of bronze or copper: (38) the emblems and legends were inscribed on a more ample field by the genius of flattery; and the prince was relieved from the care of celebrating his own virtues.,"('first', 'ORDINAL'), ('Caesars', 'ORG'), ('38', 'CARDINAL')"
"The fixed revenue of the popes was probably impaired; many of the old patrimonial estates, both in Italy and the provinces, had been invaded by sacrilegious hands; nor could the loss be compensated by the claim, rather than the possession, of the more ample gifts of Pepin and his descendants.","('Italy', 'GPE'), ('Pepin', 'PERSON')"
"The flowers of Latin rhetoric were not yet exhausted; but Frederic, impatient of their vanity, interrupted the orators in the high tone of royalty and conquest.","('Latin', 'NORP'), ('Frederic', 'PERSON')"
"The former, as he ascended in battle array to assault the Capitol, was struck on the temple by a stone, and expired in a few days.","('Capitol', 'FAC'), ('a few days', 'DATE')"
"The foundation of a second Rome, on the shores of the Bosphorus, has compelled the historian to follow the successors of Constantine; and our curiosity has been tempted to visit the most remote countries of Europe and Asia, to explore the causes and the authors of the long decay of the Byzantine monarchy.","('second', 'ORDINAL'), ('Rome', 'GPE'), ('Bosphorus', 'LOC'), ('Constantine', 'PERSON'), ('Europe', 'LOC'), ('Asia', 'LOC'), ('Byzantine', 'NORP')"
"The gracious pontiff complied with their wishes;
 afforded Rome this poor consolation for his loss;","('Rome', 'GPE')"
"The hills, which afford a shady retirement from the autumnal heats, have again smiled with the blessings of peace; Frescati has arisen near the ruins of Tusculum; Tibur or Tivoli has resumed the honours of a city, (65) and the meaner towns of Albano and Palestrina are decorated with the villas of the cardinals and princes of Rome.","('Frescati', 'GPE'), ('Tusculum', 'GPE'), ('Tibur', 'GPE'), ('Tivoli', 'GPE'), ('65', 'CARDINAL'), ('Albano', 'GPE'), ('Palestrina', 'GPE'), ('Rome', 'GPE')"
The houses of his adherents were levelled with the ground: Paschal escaped with difficulty and danger; he levied an army in the patrimony of St. Peter; and his last days were embittered by suffering and inflicting the calamities of civil war.,"('Paschal', 'PERSON'), ('St. Peter', 'GPE'), ('last days', 'DATE')"
"The impotence of reason and virtue recommended in Italy a
 more effectual choice: instead of a private citizen, to whom
 they yielded a voluntary and precarious obedience, the
 Romans elected for their senator some prince of independent
 power, who could defend them from their enemies and
 themselves.","('Italy', 'GPE'), ('Romans', 'NORP')"
"The jealously of pre-eminence and power was the true ground of their quarrel; but as a specious badge of distinction, the Colonna embraced the name of Ghibelines and the party of the empire; the Ursini espoused the title of Guelphs and the cause of the church.","('Colonna', 'PERSON'), ('Ghibelines', 'PERSON'), ('Ursini', 'PERSON'), ('Guelphs', 'PERSON')"
"The jurisprudence of the republic was
 useless and unknown: the nations and families of Italy who
 lived under the Roman and Barbaric laws were insensibly
 mingled in a common mass; and some faint tradition, some
 imperfect fragments, preserved the memory of the Code and
 Pandects of Justinian.","('Italy', 'GPE'), ('Roman', 'NORP'), ('Barbaric', 'NORP'), ('Code', 'LAW'), ('Pandects of Justinian', 'PERSON')"
"The love of ancient freedom has encouraged a belief that as early as the tenth century, in their first struggles against the Saxon Othos, the commonwealth was vindicated and restored by the senate and people of Rome; that two consuls were annually elected among the nobles, and that ten or
 twelve plebeian magistrates revived the name and office of the tribunes of the commons. (30)","('the tenth century', 'DATE'), ('first', 'ORDINAL'), ('Saxon', 'NORP'), ('Rome', 'GPE'), ('two', 'CARDINAL'), ('ten', 'CARDINAL'), ('twelve', 'CARDINAL'), ('30', 'CARDINAL')"
"The motives of public and private interest might sometimes draw from the Romans an occasional and temporary sacrifice of their claims; and they renewed their oath of allegiance to the successor of St. Peter and Constantine, the lawful head of the church and the republic. (45)","('Romans', 'NORP'), ('St. Peter', 'PERSON'), ('Constantine', 'PERSON'), ('45', 'CARDINAL')"
"The name of Dominus or Lord was inscribed on the coin of the bishops: right;  their title was acknowledged by acclamations and oaths of allegiance, and with the free, or reluctant, consent of the German Caesars, they had long exercised a supreme or subordinate jurisdiction over the city and patrimony of St. Peter.","('Dominus', 'PERSON'), ('German', 'NORP'), ('Caesars', 'ORG'), ('St. Peter', 'GPE')"
"The name of Rome must yet command our involuntary respect: the climate (whatsoever may be its influence) was no longer the same: (1) the purity of blood had been contaminated through a thousand channels; but the venerable aspect of her ruins, and the memory of past greatness, rekindled a spark of the national character.","('Rome', 'GPE'), ('1', 'CARDINAL'), ('a thousand', 'CARDINAL')"
"The nobles, or barons of Rome.","('Rome', 'GPE')"
"The old consular line
 of the Frangipani discover their name in the generous act of
 breaking or dividing bread in a time of famine; and such
 benevolence is more truly glorious than to have enclosed,
 with their allies the Corsi, a spacious quarter of the city
 in the chains of their fortifications; the Savelli, as it
 should seem a Sabine race, have maintained their original
 dignity; the obsolete surname of the Capizucchi is inscribed
 on the coins of the first senators; the Conti preserve the
 honour, without the estate, of the counts of Signia; and the
 Annibaldi must have been very ignorant, or very modest, if
 they had not descended from the Carthaginian hero. (96)","('Frangipani', 'NORP'), ('quarter', 'CARDINAL'), ('Savelli', 'NORP'), ('Sabine', 'NORP'), ('Capizucchi', 'PERSON'), ('first', 'ORDINAL'), ('Conti', 'PERSON'), ('Signia', 'PERSON'), ('Annibaldi', 'PERSON'), ('Carthaginian', 'NORP'), ('96', 'CARDINAL')"
"The old patricians were the subjects,
 the modern barons the tyrants, of the state; nor would the
 enemies of peace and order, who insulted the vicar of
 Christ, have long respected the unarmed sanctity of a
 plebeian magistrate. (35)","('Christ', 'PERSON')"
"The pride of his contemporaries was gratified by the contrast of the past and the present: they would have been humbled by the prospect of futurity; by the prediction, that after a thousand years, Rome, despoiled of empire, and contracted to her primaeval limits, would renew the same hostilities, on the same ground which was then decorated with her villas and gardens.","('a thousand years', 'DATE'), ('Rome', 'GPE')"
"The profusion of indulgences, the revolt of
 the Protestants, and the decline of superstition, have much
 diminished the value of the jubilee; yet even the nineteenth
 and last festival was a year of pleasure and profit to the
 Romans; and a philosophic smile will not disturb the triumph
 of the priest or the happiness of the people. (90)","('Protestants', 'NORP'), ('nineteenth', 'ORDINAL'), ('Romans', 'NORP'), ('90', 'CARDINAL')"
"The progress of independence in Germany
 and Italy undermined the foundations of the Imperial
 sovereignty, and the triumph of the popes was the
 deliverance of Rome.","('Germany', 'GPE'), ('Italy', 'GPE'), ('Imperial', 'NORP'), ('Rome', 'GPE')"
"The progress of industry had produced and enriched the
 Italian republics: the aera of their liberty is the most
 flourishing period of population and agriculture, of
 manufactures and commerce; and their mechanic labours were
 gradually refined into the arts of elegance and genius.","('Italian', 'NORP')"
"The reign of the popes, which gratified the prejudices, was not incompatible with the liberties, of Rome; and a more critical inquiry would have revealed a still nobler source of their power; the gratitude of a nation, whom they had rescued from the heresy and oppression of the Greek tyrant.","('Rome', 'GPE'), ('Greek', 'NORP')"
"The remainder of his government was firm and fortunate; and as soon as envy was appeased by death, his head, enclosed in a precious vase, was deposited on a lofty column of marble. (49)
Charles of Anjou, A.D. 1265-1278.","('Charles', 'PERSON'), ('1265-1278', 'DATE')"
"The royal path to maintain the
 liberties of Rome was thrice reiterated, at the bridge, the
 gate, and on the stairs of the Vatican; and the distribution
 of a customary donative feebly imitated the magnificence of
 the first Caesars.","('Rome', 'GPE'), ('Vatican', 'FAC'), ('first', 'ORDINAL')"
The scenes that followed the election of his successor Gelasius the Second were still more scandalous to the church and city.,"('Gelasius', 'PERSON'), ('Second', 'ORDINAL')"
"The second jubilee, A.D. 1350.","('second', 'ORDINAL'), ('A.D. 1350', 'DATE')"
"The senators of the Catholic church, the coadjutors and legates of the supreme pontiff, were robed in purple, the symbol of martyrdom or royalty; they claimed a proud equality with kings; and their dignity was enhanced by the smallness of their number, which, till the reign of Leo the Tenth, seldom exceeded twenty or twenty-five persons.","('Catholic', 'NORP'), ('Leo the Tenth', 'PERSON'), ('twenty or twenty-five', 'CARDINAL')"
"The spiritual arms of excommunication and interdict were repulsed by the union of the three
 estates, and the privileges of the Gallican church; but the pope was not prepared against the carnal weapons which Philip the Fair had courage to employ.","('three', 'CARDINAL'), ('Gallican', 'NORP'), ('Philip the Fair', 'ORG')"
"The style of their ambassadors to Conrad the Third  and Frederic the First is a mixture of flattery and pride, the tradition and the ignorance of their own history.","('Conrad', 'PERSON'), ('Third', 'ORDINAL'), ('Frederic', 'PERSON'), ('First', 'ORDINAL')"
"The successors of Diocletian despised even the flattery of the senate: their royal officers at Rome, and in the provinces, assumed the sole direction of the mint; and the same prerogative was inherited by the Gothic kings of Italy, and the long series of the Greek, the French, and the German dynasties.","('Diocletian', 'PERSON'), ('Rome', 'GPE'), ('Gothic', 'NORP'), ('Italy', 'GPE'), ('Greek', 'NORP'), ('French', 'NORP'), ('German', 'NORP')"
"The sword
 of the nobles was broken; their slaves were enfranchised;
 their castles were demolished; they assumed the habits of
 society and obedience; their ambition was confined to
 municipal honours, and in the proudest aristocracy of Venice
 on Genoa, each patrician was subject to the laws.","('Venice', 'GPE'), ('Genoa', 'GPE')"
"The temples of Jupiter and his kindred deities had crumbled into dust; their place was supplied by monasteries and houses; and the solid walls, the long and shelving porticos, were decayed or ruined by the lapse of time.","('Jupiter', 'LOC')"
"The terms were
 regulated in a private interview; and with such speed and
 secrecy was the business transacted, that the unanimous
 conclave applauded the elevation of Clement the Fifth. (79)","('Clement', 'PERSON'), ('Fifth', 'ORDINAL')"
"The three orders of bishops, priests, and  deacons, were assimilated to each other by this important privilege; the parochial clergy of Rome obtained the first rank in the hierarchy: they were indifferently chosen among the nations of Christendom; and the possession of the richest benefices, of the most important bishoprics, was not incompatible with their title and office.","('three', 'CARDINAL'), ('Rome', 'GPE'), ('first', 'ORDINAL'), ('Christendom', 'NORP')"
"The trumpet of Roman liberty
 was first sounded by Arnold of Brescia, (20) whose promotion
 in the church was confined to the lowest rank, and who wore
 the monastic habit rather as a garb of poverty than as a
 uniform of obedience.","('Roman', 'NORP'), ('first', 'ORDINAL'), ('Arnold', 'PERSON'), ('Brescia', 'GPE'), ('20', 'CARDINAL')"
"The truth of the fact, the authenticity of his donation, was deeply rooted in the ignorance and tradition of four centuries; and the fabulous origin was lost in the real and permanent effects.","('four centuries', 'DATE')"
"The turbulent Romans disdained the yoke, and insulted the impotence, of their bishop:(10) nor would his education or character allow him to exercise, with decency
 or effect, the power of the sword.","('Romans', 'NORP'), ('10', 'CARDINAL')"
"The two
 cardinals, the uncle and the nephew, denied the election of
 Boniface the Eighth; and the Colonna were oppressed for a
 moment by his temporal and spiritual arms. (102)","('two', 'CARDINAL'), ('Boniface the Eighth', 'PERSON'), ('Colonna', 'PERSON'), ('102', 'CARDINAL')"
"The union and vigour of a public council was dissolved in a
 lawless city; and the Romans soon adopted a more strong and
 simple mode of administration.","('Romans', 'NORP')"
"The wealth and piety
 of these strangers were ostentatiously displayed; and their
 expenses, sacred or profane, circulated in various channels
 for the emolument of the Romans.","('Romans', 'NORP')"
