Sentence,Entities
"In the
 comparison of the tables of Solon with those of the
 Decemvirs, some casual resemblance may be found; some rules
 which nature and reason have revealed to every society; some
 proofs of a common descent from Egypt or Phoenicia. (19)","('Solon', 'GPE'), ('Decemvirs', 'NORP'), ('Egypt', 'GPE'), ('Phoenicia', 'GPE'), ('19', 'CARDINAL')"
"In the
 contemplation of these events, he was permitted to
 substitute second and third heirs, to replace each other
 according to the order of the testament; and the incapacity
 of a madman or an infant to bequeath his property might be
 supplied by a similar substitution.","('second', 'ORDINAL'), ('third', 'ORDINAL')"
"In the
 first year of his reign, he directed the faithful Tribonian,
 and nine learned associates, to revise the ordinances of his
 predecessors, as they were contained, since the time of
 Adrian, in the Gregorian Hermogenian, and Theodosian codes;
 to purge the errors and contradictions, to retrench whatever
 was obsolete or superfluous, and to select the wise and
 salutary laws best adapted to the practice of the tribunals
 and the use of his subjects.","('the\r\n first year', 'DATE'), ('Tribonian', 'PERSON'), ('nine', 'CARDINAL'), ('Adrian', 'PERSON'), ('the Gregorian Hermogenian', 'LOC'), ('Theodosian', 'NORP')"
"In the
 language of ancient jurisprudence, which was corrupted and
 forgotten before the age of Justinian, these spoils were
 distinguished by the name of manceps or manicipium, taken
 with the hand; and whenever they were sold or emancipated,
 the purchaser required some assurance that they had been the
 property of an enemy, and not of a fellow- citizen. (139)","('Justinian', 'PERSON'), ('139', 'CARDINAL')"
"In the
 sedition of Constantinople, his removal was granted to the
 clamors, perhaps to the just indignation, of the people: but
 the quaestor was speedily restored, and, till the hour of
 his death, he possessed, above twenty years, the favor and
 confidence of the emperor.","('Constantinople', 'GPE'), ('the hour', 'TIME'), ('twenty years', 'DATE')"
"In the Roman jurisprudence, an essential distinction was admitted between the inheritance and the legacies.","('Roman', 'NORP')"
"In the age of peace and learning, between Cicero and the
 last of the Antonines, many losses had been already
 sustained, and some luminaries of the school, or forum, were
 known only to the curious by tradition and report.","('Cicero', 'PERSON'), ('Antonines', 'PRODUCT')"
"In the beginning of the
 seventh century of Rome they were made perpetual: four
 praetors were annually empowered to sit in judgment on the
 state offences of treason, extortion, peculation, and
 bribery; and Sylla added new praetors and new questions for
 those crimes which more directly injure the safety of
 individuals.","('the beginning of the\r\n seventh century', 'DATE'), ('Rome', 'GPE'), ('four', 'CARDINAL'), ('Sylla', 'PERSON')"
"In the condemnation
 of illustrious Romans, the senate was always prepared to
 confound, at the will of their masters, the judicial and
 legislative powers.","('Romans', 'NORP')"
"In the decline of the
 Roman empire, the proud distinctions of the republic were
 gradually abolished, and the reason or instinct of Justinian
 completed the simple form of an absolute monarchy.","('Roman', 'NORP'), ('Justinian', 'PERSON')"
"In the first
 ages, the father of a family might sell his children, and
 his wife was reckoned in the number of his children: the
 domestic judge might pronounce the death of the offender, or
 his mercy might expel her from his bed and house; but the
 slavery of the wretched female was hopeless and perpetual,
 unless he asserted for his own convenience the manly
 prerogative of divorce.","('first', 'ORDINAL')"
"In the first
 ages, when the city was pressed, and often famished, by her
 Latin and Tuscan neighbors, the sale of children might be a
 frequent practice; but as a Roman could not legally purchase
 the liberty of his fellow-citizen, the market must gradually
 fail, and the trade would be destroyed by the conquests of
 the republic.","('first', 'ORDINAL'), ('Latin', 'NORP'), ('Tuscan', 'NORP'), ('Roman', 'NORP')"
"In the first ages these
 questions were rare and occasional.","('first', 'ORDINAL')"
"In the hope of
 a robust progeny, Lycurgus had delayed the season of
 marriage: it was fixed by Numa at the tender age of twelve
 years, that the Roman husband might educate to his will a
 pure and obedient virgin. (115)","('Lycurgus', 'PERSON'), ('Numa', 'PERSON'), ('twelve\r\n years', 'DATE'), ('Roman', 'NORP'), ('115', 'CARDINAL')"
"In the redress of private wrongs, compensations and fines
 were substituted to the obsolete rigor of the Twelve Tables;
 time and space were annihilated by fanciful suppositions;
 and the plea of youth, or fraud, or violence, annulled the
 obligation, or excused the performance, of an inconvenient
 contract.","('Twelve', 'CARDINAL')"
"In the selection of
 ancient laws, he seems to have viewed his predecessors
 without jealousy, and with equal regard: the series could
 not ascend above the reign of Adrian, and the narrow
 distinction of Paganism and Christianity, introduced by the
 superstition of Theodosius, had been abolished by the
 consent of mankind.","('Adrian', 'PERSON'), ('Paganism', 'NORP'), ('Christianity', 'NORP'), ('Theodosius', 'GPE')"
"In the simple state of society, this
 last use or abuse of the right of property is seldom
 indulged: it was introduced at Athens by the laws of Solon;
 and the private testaments of the father of a family are
 authorized by the Twelve Tables.","('Athens', 'GPE'), ('Solon', 'GPE'), ('the Twelve Tables', 'ORG')"
"In the space of ten centuries, the infinite variety of laws
 and legal opinions had filled many thousand volumes, which
 no fortune could purchase and no capacity could digest.","('the space of ten centuries', 'DATE'), ('many thousand', 'CARDINAL')"
"In the successive
 states of society, the hunter, the shepherd, the husbandman,
 may defend their possessions by two reasons which forcibly
 appeal to the feelings of the human mind: that whatever they
 enjoy is the fruit of their own industry; and that every man
 who envies their felicity, may purchase similar acquisitions
 by the exercise of similar diligence.","('two', 'CARDINAL')"
"In the third period, between the reigns of Alexander and Justinian, the oracles of jurisprudence were almost mute.","('third', 'ORDINAL'), ('Alexander', 'PERSON'), ('Justinian', 'PERSON')"
"In the time of Cicero, each private citizen enjoyed the
 privilege of anarchy; each minister of the republic was
 exalted to the temptations of regal power, and their virtues
 are entitled to the warmest praise, as the spontaneous
 fruits of nature or philosophy.","('Cicero', 'PERSON')"
"In the times of freedom, the resolves of the people
 had often been dictated by the passion or error of the
 moment: the Cornelian, Pompeian, and Julian laws were
 adapted by a single hand to the prevailing disorders; but
 the senate, under the reign of the Caesars, was composed of
 magistrates and lawyers, and in questions of private
 jurisprudence, the integrity of their judgment was seldom
 perverted by fear or interest. (32)","('Cornelian', 'NORP'), ('Pompeian', 'NORP'), ('Julian', 'PERSON'), ('Caesars', 'ORG')"
"In this computation, a distinction was made,
 essential to the laws and even the constitution of Rome; the agnats, or persons connected by a line of males, were called, as they stood in the nearest degree, to an equal partition; but a female was incapable of transmitting any legal claims; and the cognats of every rank, without
 excepting the dear relation of a mother and a son, were disinherited by the Twelve Tables, as strangers and aliens.","('Rome', 'GPE'), ('Twelve', 'CARDINAL')"
"In this connection, the two Antonines, the best of
 princes and of men, enjoyed the comforts of domestic love:
 the example was imitated by many citizens impatient of
 celibacy, but regardful of their families.","('two', 'CARDINAL'), ('Antonines', 'ORG')"
"In this private prison, twelve ounces of rice were
 his daily food; he might be bound with a chain of fifteen
 pounds weight; and his misery was thrice exposed in the
 market place, to solicit the compassion of his friends and
 countrymen.","('twelve ounces', 'QUANTITY'), ('fifteen\r\n pounds', 'QUANTITY')"
"In this state of disgrace and agony,
 two bishops, Isaiah of Rhodes and Alexander of Diospolis,
 were dragged through the streets of Constantinople, while
 their brethren were admonished, by the voice of a crier, to
 observe this awful lesson, and not to pollute the sanctity
 of their character.","('two', 'CARDINAL'), ('Isaiah', 'PERSON'), ('Rhodes', 'PERSON'), ('Alexander', 'PERSON'), ('Diospolis', 'GPE'), ('Constantinople', 'GPE')"
"Injuries 
3.","('3', 'CARDINAL')"
"Instead
 of the centuries, they convened the tribes; and the
 patricians, after an impotent struggle, submitted to the
 decrees of an assembly, in which their votes were confounded
 with those of the meanest plebeians.","('the centuries', 'DATE')"
"Instead of a statue cast in a
 simple mould by the hand of an artist, the works of
 Justinian represent a tessellated pavement of antique and
 costly, but too often of incoherent, fragments.","('Justinian', 'PERSON')"
"It is the first care of a reformer to prevent any future
 reformation.","('first', 'ORDINAL')"
"It was reserved for the curiosity and learning of Adrian, to accomplish the design which had been conceived by the genius of Caesar; and the praetorship of Salvius Julian, an eminent lawyer, was immortalized by the composition of the PERPETUAL EDICT.","('Adrian', 'PERSON'), ('Caesar', 'PERSON'), ('Salvius Julian', 'PERSON')"
"It was revived by their wants and
 idleness, tolerated by the discretion of the praetors, and
 finally determined by the Code of Justinian.","('the Code of Justinian', 'LAW')"
"It was the duty of the governors to
 maintain the peace of their province, by the arbitrary and
 rigid administration of justice; the freedom of the city
 evaporated in the extent of empire, and the Spanish
 malefactor, who claimed the privilege of a Roman, was
 elevated by the command of Galba on a fairer and more lofty
 cross. (187)","('Spanish', 'NORP'), ('Roman', 'NORP'), ('Galba', 'PERSON'), ('187', 'CARDINAL')"
"It was their duty to select the
 useful and practical parts of the Roman law; and the writings of the old republicans, however curious on excellent, were no longer suited to the new system of manners, religion, and government.","('Roman', 'NORP'), ('republicans', 'NORP')"
"It was transcribed at
 Constantinople in the beginning of the seventh century, (87)
 was successively transported by the accidents of war and
 commerce to Amalphi, (88) Pisa, (89) and Florence, (90) and is
 now deposited as a sacred relic (91) in the ancient palace of the republic. (92)","('Constantinople', 'GPE'), ('the beginning of the seventh century', 'DATE'), ('87', 'DATE'), ('Amalphi', 'ORG'), ('88', 'CARDINAL'), ('Pisa', 'GPE'), ('89', 'CARDINAL'), ('Florence', 'GPE'), ('90', 'CARDINAL')"
"Italy produces no monkeys;  but the want could never be felt, till the middle of the
 sixth century first revealed the guilt of a parricide. (176)4.","('Italy', 'GPE'), ('the middle of the\r\n sixth century', 'DATE'), ('first', 'ORDINAL'), ('176', 'CARDINAL'), ('4', 'CARDINAL')"
"Justinian
 respected the rights of patrons; but his indulgence removed
 the badge of disgrace from the two inferior orders of
 freedmen; whoever ceased to be a slave, obtained, without
 reserve or delay, the station of a citizen; and at length
 the dignity of an ingenuous birth, which nature had refused,
 was created, or supposed, by the omnipotence of the emperor.","('Justinian', 'PERSON'), ('two', 'CARDINAL')"
"Justinian addressed to the senate and provinces his eternal oracles; and his pride, under the mask of piety, ascribed the consummation of this great design to the support and inspiration of the Deity.","('Justinian', 'PERSON')"
"Justinian relaxed the punishment at least of female
 infidelity: the guilty spouse was only condemned to solitude
 and penance, and at the end of two years she might be
 recalled to the arms of a forgiving husband.","('Justinian', 'PERSON'), ('the end of two years', 'DATE')"
"Justinian, the Greek emperor of Constantinople
 and the East, was the legal successor of the Latin shepherd
 who had planted a colony on the banks of the Tyber.","('Justinian', 'PERSON'), ('Greek', 'NORP'), ('Constantinople', 'GPE'), ('East', 'LOC'), ('Latin', 'NORP'), ('Tyber', 'PRODUCT')"
"Labeo was attached to the form of the
 old republic; his rival embraced the more profitable
 substance of the rising monarchy.","('Labeo', 'PERSON')"
Laws of the kings of Rome.,"('Rome', 'GPE')"
Legal inconstancy of Justinian.,"('Justinian', 'PERSON')"
"Like the Chaldean
 astrologers, they announced to their clients the days of
 business and repose; these important trifles were interwoven
 with the religion of Numa; and after the publication of the
 Twelve Tables, the Roman people was still enslaved by the
 ignorance of judicial proceedings.","('Chaldean', 'NORP'), ('Numa', 'NORP'), ('the\r\n Twelve Tables', 'EVENT'), ('Roman', 'NORP')"
"Like the contemporary philosophers, the lawyers of the age
 of the Antonines disclaimed the authority of a master, and
 adopted from every system the most probable doctrines. (69)","('Antonines', 'PERSON')"
"Many of his acts were
 rescinded by himself; many were rejected by his successors; many have been obliterated by time; but the number of sixteen EDICTS, and one hundred and The Novels, A.D. 534-565.","('sixteen', 'CARDINAL'), ('EDICTS', 'ORG'), ('one hundred', 'CARDINAL'), ('The Novels', 'WORK_OF_ART'), ('534-565', 'CARDINAL')"
"Monarchs seldom condescend to become the preceptors of their
 subjects; and some praise is due to Justinian, by whose
 command an ample system was reduced to a short and
 elementary treatise.","('Justinian', 'PERSON')"
"Neither age, nor rank, nor the consular office,
 nor the honors of a triumph, could exempt the most
 illustrious citizen from the bonds of filial subjection:
 (107) his own descendants were included in the family of
 their common ancestor; and the claims of adoption were not
 less sacred or less rigorous than those of nature.","('107', 'CARDINAL')"
"Of the collection of his rival Capito, the two hundred and fifty-ninth book is expressly quoted; and few teachers could deliver their opinions in less than a century of volumes.","('Capito', 'PERSON'), ('two hundred and fifty-ninth', 'CARDINAL'), ('less than a century', 'DATE')"
"Of these,
 the armor of the stoics (56) was found to be of the firmest
 temper; and it was chiefly worn, both for use and ornament,
 in the schools of jurisprudence.","('56', 'CARDINAL')"
"On the public days of market or assembly, the masters of the art were seen walking in the forum ready to
 impart the needful advice to the meanest of their
 fellow-citizens, from whose votes, on a future occasion,
 they might solicit a grateful return.","('the public days', 'DATE')"
"On this
 principle, the most daring attack on the life and property
 of a private citizen is judged less atrocious than the crime
 of treason or rebellion, which invades the majesty of the
 republic: the obsequious civilians unanimously pronounced,
 that the republic is contained in the person of its chief;
 and the edge of the Julian law was sharpened by the
 incessant diligence of the emperors.","('Julian', 'PERSON')"
"On this principle, the civilians of every country have erected a similar jurisprudence, the fair conclusion of universal reason and justice. (158)
 Promises.","('158', 'CARDINAL')"
"Our calmer
 reflection will suggest, that such forms and delays are
 necessary to guard the person and property of the citizen;
 that the discretion of the judge is the first engine of
 tyranny; and that the laws of a free people should foresee
 and determine every question that may probably arise in the
 exercise of power and the transactions of industry.","('first', 'ORDINAL')"
"Passion, interest, or caprice, suggested daily motives for
 the dissolution of marriage; a word, a sign, a message, a
 letter, the mandate of a freedman, declared the separation;
 the most tender of human connections was degraded to a
 transient society of profit or pleasure.","('daily', 'DATE')"
"Perhaps, if the preceptors and friends of Cicero were still alive, our candor would acknowledge, that, except in purity of language, (79) their intrinsic merit was excelled by the school of Papinian and Ulpian.","('Cicero', 'PERSON'), ('Papinian', 'NORP'), ('Ulpian', 'ORG')"
"Persons of
 illustrious rank were confined to the moderate profit of
 four per cent.; six was pronounced to be the ordinary and
 legal standard of interest; eight was allowed for the
 convenience of manufactures and merchants; twelve was
 granted to nautical insurance, which the wiser ancients had
 not attempted to define; but, except in this perilous
 adventure, the practice of exorbitant usury was severely
 restrained.","('four per cent', 'PERCENT'), ('six', 'CARDINAL'), ('eight', 'CARDINAL'), ('twelve', 'CARDINAL')"
"Persons, to, 2.","('2', 'CARDINAL')"
"Poison is still
 more odious than the sword or dagger; and we are surprised
 to discover, in two flagitious events, how early such subtle
 wickedness had infected the simplicity of the republic, and
 the chaste virtues of the Roman matrons. (174)","('two', 'CARDINAL'), ('Roman', 'NORP'), ('174', 'CARDINAL')"
Praise and censure of the Code and Pandects.,"('Pandects', 'WORK_OF_ART')"
"Pride and ignorance contributed, during the first period, to confine within narrow limits the science of the Roman law.","('first', 'ORDINAL'), ('Roman', 'NORP')"
"Romulus, Numa, and
 Servius Tullius, are celebrated as the most ancient
 legislators; and each of them claims his peculiar part in
 the threefold division of jurisprudence.","('Romulus', 'PERSON'), ('Numa', 'PERSON'), ('Servius Tullius', 'PERSON')"
"Second period, A.U.C. 648-988","('Second', 'ORDINAL'), ('A.U.C.', 'EVENT'), ('648-988', 'TIME')"
"Seventeen lawyers, with Tribonian at their head, were appointed by the emperor to exercise an absolute
 jurisdiction over the works of their predecessors.","('Seventeen', 'CARDINAL'), ('Tribonian', 'PERSON')"
Severity of the twelve tables.,"('twelve', 'CARDINAL')"
"She acquired and
 inherited for the sole profit of her lord; and so clearly
 was woman defined, not as a person, but as a thing, that, if
 the original title were deficient, she might be claimed,
 like other movables, by the use and possession of an entire
 year.","('an entire\r\n year', 'DATE')"
"Six years had not
 elapsed from the publication of the Code, before he
 condemned the imperfect attempt, Second edition of the Code, A.D. 534, Nov 16.","('Six years', 'DATE'), ('Code', 'ORG'), ('Second', 'ORDINAL'), ('the Code', 'LAW'), ('A.D. 534', 'DATE'), ('Nov 16', 'DATE')"
"Sixty thousand plebeian
 legislators, whom numbers made formidable, and poverty
 secure, were supplanted by six hundred senators, who held
 their honors, their fortunes, and their lives, by the
 clemency of the emperor.","('Sixty thousand', 'CARDINAL'), ('six hundred', 'CARDINAL')"
"Some salutary restraints,
 imposed by the people or their own passions, were at once
 the cause and effect of the gravity and temperance of the
 Romans.","('Romans', 'NORP')"
"Such
 an example was not necessary to instruct a prudent usurper
 of the mischief of popular assemblies; and their abolition,
 which Augustus had silently prepared, was accomplished
 without resistance, and almost without notice, on the
 accession of his successor. (31)","('Augustus', 'PERSON')"
"Such a trustee
 had been first instituted by the praetor, to save a family
 from the blind havoc of a prodigal or madman; and the minor
 was compelled, by the laws, to solicit the same protection,
 to give validity to his acts till he accomplished the full
 period of twenty-five years.","('first', 'ORDINAL'), ('twenty-five years', 'DATE')"
"Such conscientious injustice,
 without any mixture of fraud or force could seldom injure
 the members of a small republic; but the various periods of
 three, of ten, or of twenty years, determined by Justinian,
 are more suitable to the latitude of a great empire.","('three', 'CARDINAL'), ('ten', 'CARDINAL'), ('twenty years', 'DATE'), ('Justinian', 'PERSON')"
"Such, at least,
 was the stern and haughty spirit of the ancient law, which
 had been insensibly mollified before the time of Justinian.","('Justinian', 'PERSON')"
"Suicides are enumerated by
 Virgil among the unfortunate, rather than the guilty; (208)
 and the poetical fables of the infernal shades could not
 seriously influence the faith or practice of mankind.","('Virgil', 'PERSON')"
"That eminent lawyer of the Augustan age divided the year between the city and country, between business and composition; and four hundred books are enumerated as the fruit of his retirement.","('the Augustan age', 'DATE'), ('the year', 'DATE'), ('four hundred', 'CARDINAL')"
"The
 Romans had aspired to be equal; they were levelled by the
 equality of servitude; and the dictates of Augustus were
 patiently ratified by the formal consent of the tribes or
 centuries.","('Romans', 'NORP'), ('Augustus', 'PERSON'), ('centuries', 'DATE')"
"The
 degrees of kindred (146) are numbered by the civilians, ascending from the last possessor to a common parent, and descending from the common parent to the next heir: my father stands in the first degree, my brother in the second, his children in the third, and the remainder of the series may be conceived by a fancy, or pictured in a genealogical table.","('146', 'CARDINAL'), ('first', 'ORDINAL'), ('second', 'ORDINAL'), ('third', 'ORDINAL')"
"The
 discretion of the praetor was now governed by the lessons of
 his teachers; the judges were enjoined to obey the comment
 as well as the text of the law; and the use of codicils was
 a memorable innovation, which Augustus ratified by the
 advice of the civilians. (61) 
Sects.","('Augustus', 'PERSON'), ('61', 'CARDINAL')"
"The
 friends of Sempronius, who answered for his ability and inclination, might be separately sued at the option of
 Seius; and the benefit of partition, or order of reciprocal
 actions, insensibly deviated from the strict theory of
 stipulation.","('Sempronius', 'PERSON'), ('Seius', 'ORG')"
"The
 law of nations and of religious worship, which Numa
 introduced, was derived from his nocturnal converse with the
 nymph Egeria.","('Numa', 'PERSON'), ('Egeria', 'PERSON')"
"The
 majesty of a parent was armed with the power of life and
 death; (106) and the examples of such bloody executions,
 which were sometimes praised and never punished, may be
 traced in the annals of Rome beyond the times of Pompey and
 Augustus.","('106', 'CARDINAL'), ('Rome', 'GPE'), ('Pompey', 'PERSON'), ('Augustus', 'PERSON')"
"The
 original territory of Rome consisted only of some miles of
 wood and meadow along the banks of the Tyber; and domestic
 exchange could add nothing to the national stock.","('Rome', 'GPE'), ('some miles', 'QUANTITY'), ('Tyber', 'GPE')"
"The
 profane lawgivers of Rome were never tempted by interest or
 superstition to multiply the forbidden degrees: but they
 inflexibly condemned the marriage of sisters and brothers,
 hesitated whether first cousins should be touched by the
 same interdict; revered the parental character of aunts and
 uncles,  and treated affinity and adoption as a just
 imitation of the ties of blood.","('Rome', 'GPE'), ('first', 'ORDINAL')"
"The
 scholars of Accursius, of Bartolus, of Cujacius, should
 blush for their accumulated guilt, unless they dare to
 dispute his right of binding the authority of his
 successors, and the native freedom of the mind.","('Accursius', 'WORK_OF_ART'), ('Bartolus', 'GPE'), ('Cujacius', 'GPE')"
"The
 slaves, who were liberated by a generous master, immediately
 entered into the middle class of libertines or freedmen; but
 they could never be enfranchised from the duties of
 obedience and gratitude; whatever were the fruits of their
 industry, their patron and his family inherited the third
 part; or even the whole of their fortune, if they died
 without children and without a testament.","('third', 'ORDINAL')"
"The
 superiority of form to matter was introduced to ascertain
 the right of property: and the equality of crimes is
 countenanced by an opinion of Trebatius, (57) that he who
 touches the ear, touches the whole body; and that he who
 steals from a heap of corn, or a hogshead of wine, is guilty
 of the entire theft. (58)
Authority.","('Trebatius', 'PERSON'), ('57', 'DATE')"
The  Decrees of the Senate— The  Edicts of the Magistrates and Emperors.,"('Senate', 'ORG'), ('The  Edicts of the Magistrates and Emperors', 'WORK_OF_ART')"
The  Laws of the Kings— The  Twelve Tables of the Decemvirs— The  Laws of the People.,"('Twelve', 'CARDINAL'), ('The  Laws of the People', 'WORK_OF_ART')"
"The Aquilian law (169) defended the living property of a
 citizen, his slaves and cattle, from the stroke of malice or
 negligence: the highest price was allowed that could be
 ascribed to the domestic animal at any moment of the year
 preceding his death; a similar latitude of thirty days was
 granted on the destruction of any other valuable effects.","('The Aquilian law (169', 'LAW'), ('the year', 'DATE'), ('thirty days', 'DATE')"
