Sentence,Entities
"The haughty step and
 demeanour of the king of the Huns expressed the
 consciousness of his superiority above the rest of mankind;
 and he had a custom of fiercely rolling his eyes, as if he
 wished to enjoy the terror which he inspired.","('Huns', 'NORP')"
"The historian Priscus, whose embassy is
 a source of curious instruction, was accosted in the camp of
 Attila by a stranger, who saluted him in the Greek language,
 but whose dress and figure displayed the appearance of a
 wealthy Scythian.","('Priscus', 'PERSON'), ('Attila', 'PERSON'), ('Greek', 'LANGUAGE'), ('Scythian', 'PERSON')"
"The inhabitants who had submitted to their
 discretion were ordered to evacuate their houses and to
 assemble in some plain adjacent to the city, where a
 division was made of the vanquished into three parts.","('three', 'CARDINAL')"
"The king of the Huns appears to have established as a principle of
 national jurisprudence, that he could never lose the
 property which he had once acquired in the persons who had
 yielded either a voluntary or reluctant submission to his
 authority.","('Huns', 'PERSON')"
"The king of the Huns held a long and familiar
 conversation with Maximin; but his civility was interrupted
 by rude expressions and haughty reproaches; and he was
 provoked, by a motive of interest, to support, with
 unbecoming zeal, the private claims of his secretary
 Constantius.","('Huns', 'NORP'), ('Maximin', 'PERSON'), ('Constantius', 'PERSON')"
"The king of the Huns required and obtained that his
 tribute or subsidy should be augmented from seven hundred
 pounds of gold to the annual sum of two thousand one
 hundred; and he stipulated the immediate payment of six
 thousand pounds of gold to defray the expenses, or to
 expiate the guilt, of the war.","('The king of the Huns', 'PERSON'), ('seven hundred\r\n pounds', 'QUANTITY'), ('two thousand one\r\n hundred', 'CARDINAL'), ('six\r\n thousand pounds', 'QUANTITY')"
"The kings of the Huns assumed the solid
 benefits, as well as the vain honours, of the negotiation.","('Huns', 'NORP')"
"The laws of war, that
 restrain the exercise of national rapine and murder, are
 founded on two principles of substantial interest: the
 knowledge of the permanent benefits which may be obtained by
 a moderate use of conquest, and a just apprehension lest the
 desolation which we inflict on the enemy's country may be
 retaliated on our own.","('two', 'CARDINAL')"
"The mechanic arts were encouraged
 and esteemed, as they tended to satisfy the wants of the
 Huns.","('Huns', 'NORP')"
"The memory of this invasion was still recent in
 the minds of the Orientals.","('Orientals', 'NORP')"
"The ministers
 of Theodosius confessed, with shame and with truth, that
 they no longer possessed any authority over a society of men
 who so bravely asserted their natural independence; and the
 king of the Huns condescended to negotiate an equal exchange
 with the citizens of Azimus.","('Theodosius', 'PERSON'), ('Huns', 'NORP'), ('Azimus', 'GPE')"
"The ministers of
 Attila pressed him to communicate the business and the
 instructions which he reserved for the ear of their
 sovereign.","('Attila', 'PERSON')"
"The miraculous conception, which fraud
 and credulity ascribed to the virgin mother of Zingis,
 raised him above the level of human nature; and the naked
 prophet, who, in the name of the Deity, invested him with
 the empire of the earth, pointed the valour of the Moguls
 with irresistible enthusiasm.","('Zingis', 'PERSON'), ('Moguls', 'ORG')"
"The monarch alone assumed the superior
 pride of still adhering to the simplicity of his Scythian
 ancestors. (46)","('Scythian', 'NORP'), ('46', 'CARDINAL')"
"The more sagacious Italians admonished their Eastern
 brethren of the folly and danger of such a hope; and
 convinced them, that the Medes and Persians were incapable
 of resisting the arms of the Huns; and that the easy and
 important acquisition would exalt the pride, as well as
 power, of the conqueror.","('Italians', 'NORP'), ('Eastern', 'NORP'), ('Medes', 'NORP'), ('Persians', 'NORP'), ('Huns', 'NORP')"
"The palace of
 Attila, which surpassed all other houses in his dominions,
 was built entirely of wood, and covered an ample space of
 ground.","('Attila', 'PERSON')"
"The public
tranquillity was frequently interrupted by the fierce impatience of the barbarians and the perfidious intrigues of the Byzantine court.","('Byzantine', 'NORP')"
"The public danger and distress could not, however, provoke
 Theodosius to interrupt his amusements and devotion or to
 appear in person at the head of the Roman legions.","('Theodosius', 'PERSON'), ('Roman', 'NORP')"
"The refusal of the Byzantine court was the signal
 of war; and the Maesians at first applauded the generous
 firmness of their sovereign.","('Byzantine', 'NORP'), ('Maesians', 'NORP'), ('first', 'ORDINAL')"
"The reluctance
 of the victim, some domestic troubles, and the unjust
 confiscation of her fortune, cooled the ardour of her
 interested lover; but he still demanded, in the name of
 Attila, an equivalent alliance; and, after many ambiguous
 delays and excuses, the Byzantine court was compelled to
 sacrifice to this insolent stranger the widow of Armatius,
 whose birth, opulence, and beauty placed her in the most
 illustrious rank of the Roman matrons.","('Attila', 'PERSON'), ('Byzantine', 'NORP'), ('Armatius', 'PERSON'), ('Roman', 'NORP')"
"The renowned Ardaric, king of the Gepidae, was the
 faithful and sagacious counsellor of the monarch, who
 esteemed his intrepid genius, whilst he loved the mild and
 discreet virtues of the noble Walamir, king of the
 Ostrogoths.","('Ardaric', 'PERSON'), ('Gepidae', 'PERSON'), ('Walamir', 'PERSON'), ('Ostrogoths', 'NORP')"
"The revenue was dissipated by
 Theodosius and his favourites in wasteful and profuse
 luxury, which was disguised by the names of imperial
 magnificence or Christian charity.","('Theodosius', 'PERSON'), ('Christian', 'NORP')"
"The royal table and
 couch, covered with carpets and fine linen, was raised by
 several steps in the midst of the hall; and a son, an uncle,
 or perhaps a favourite king, were admitted to share the
 simple and homely repast of Attila.","('Attila', 'PERSON')"
"The royal table was served in wooden cups
 and platters; flesh was his only food; and the conqueror of
 the North never tasted the luxury of bread.","('North', 'LOC')"
"The second class,
 composed of the young and beautiful women, of the artificers
 of every rank and profession, and of the more wealthy or
 honourable citizens, from whom a private ransom might be
 expected, was distributed in equal or proportionable lots.","('second', 'ORDINAL')"
"The son of Arcadius, who was accustomed only to the voice of flattery, heard with astonishment the severe language of truth: he blushed and trembled; nor did he presume directly to refuse the head of Chrysaphius, which Eslaw and Orestes were instructed to demand.","('Arcadius', 'PERSON'), ('Chrysaphius', 'PRODUCT'), ('Eslaw', 'PERSON'), ('Orestes', 'PERSON')"
"The spoils of war had restored and improved his private
 property; he was admitted to the table of his former lord
 and the apostate Greek blessed the hour of his captivity,
 since it had been the introduction to a happy and
 independent state, which he held by the honourable tenure of
 military service.","('Greek', 'NORP'), ('the hour', 'TIME')"
"The subjects of Attila might
 execute, with superior forces, the design which these
 adventurers had so boldly attempted; and it soon became the
 subject of anxious conjecture whether the tempest would fall
 on the dominions of Rome or of Persia.","('Attila', 'PERSON'), ('Rome', 'GPE'), ('Persia', 'GPE')"
"The sunshine of the succeeding day was
 dedicated to repose, to collect and dry the baggage, and to
 the refreshment of the men and horses; but, in the evening,
 before they pursued their journey, the ambassadors expressed
 their gratitude to the bounteous lady of the village by a
 very acceptable present of silver cups, red fleeces, dried
 fruits, and Indian pepper.","('the succeeding day', 'DATE'), ('Indian', 'NORP')"
"The surface of the country was
 covered with the bones of the slain; and the ambassadors,
 who directed their course to the north-west, were obliged to
 pass the hills of modern Servia before they descended into
 the flat and marshy grounds which are terminated by the
 Danube.","('Servia', 'GPE'), ('Danube', 'LOC')"
"The surprise and satisfaction of Edecon, when he
 contemplated the splendour of Constantinople had encouraged
 the interpreter Vigilius to procure for him a secret
 interview with the eunuch Chrysaphius,(49) who governed the 
 emperor and the empire.","('Edecon', 'PERSON'), ('Constantinople', 'GPE'), ('Vigilius', 'PERSON'), ('Chrysaphius', 'PERSON'), ('49', 'DATE')"
"The three great
 capitals of Khorasan, Maru, Neisabour, and Herat, were
 destroyed by the armies of Zingis; and the exact account
 which was taken of the slain amounted to four millions three
 hundred and forty-seven thousand persons. (25) Timur, or 
 Tamerlane, was educated in a less barbarous age and in the
 profession of the Mahometan religion; yet, if Attila
 equalled the hostile ravages of Tamerlane, (26) either the 
 Tartar or the Hun might deserve the epithet of the SCOURGE
 OF GOD.(27)","('three', 'CARDINAL'), ('Khorasan', 'GPE'), ('Maru', 'GPE'), ('Neisabour', 'GPE'), ('Herat', 'GPE'), ('Zingis', 'GPE'), ('four millions three\r\n hundred and forty-seven thousand', 'CARDINAL'), ('Timur', 'PERSON'), ('Tamerlane', 'PERSON'), ('Mahometan', 'NORP'), ('Attila', 'PERSON'), ('Tamerlane', 'GPE'), ('26', 'CARDINAL'), ('Tartar', 'NORP'), ('Hun', 'PERSON'), ('27', 'CARDINAL')"
"The timid or selfish policy of the Western Romans had
 abandoned the Eastern empire to the Huns.(34)","('the Western Romans', 'NORP'), ('Eastern', 'NORP'), ('Huns', 'NORP'), ('34', 'CARDINAL')"
"The two former, on the banks of the Utus, and under
 the walls of Marcianopolis, were fought in the extensive
 plains between the Danube and Mount Haemus.","('two', 'CARDINAL'), ('Utus', 'FAC'), ('Marcianopolis', 'GPE'), ('Danube', 'LOC'), ('Mount Haemus', 'LOC')"
"The two last ambassadors of the
 Huns, Orestes, a noble subject of the Pannonian province,
 and Edecon, a valiant chieftain of the tribe of the Scyrri,
 returned at the same time from Constantinople to the royal
 camp.","('two', 'CARDINAL'), ('Huns', 'NORP'), ('Orestes', 'PERSON'), ('Pannonian', 'NORP'), ('Edecon', 'PERSON'), ('Scyrri', 'NORP'), ('Constantinople', 'GPE')"
"The whole breadth of Europe, as
 it extends above five hundred miles from the Euxine to the
 Hadriatic, was at once invaded, and occupied, and desolated,
 by the myriads of barbarians whom Attila led into the field.","('Europe', 'LOC'), ('five hundred miles', 'QUANTITY'), ('Euxine', 'LOC'), ('Hadriatic', 'NORP'), ('Attila', 'PERSON')"
"The wife
 of his favourite Onegesius, with a train of female
 attendants, saluted Attila at the door of her own house, on
 his way to the palace; and offered, according to the custom
 of the country, her respectful homage, by entreating him to
 taste the wine and meat which she had prepared for his
 reception.","('Onegesius', 'PERSON'), ('Attila', 'PERSON')"
"The wife of Attila received
 their visit sitting, or rather lying, on a soft couch; the
 floor was covered with a carpet; the domestics formed a
 circle round the queen; and her damsels, seated on the
 ground, were employed in working the variegated embroidery
 which adorned the dress of the barbaric warriors.","('Attila', 'PERSON')"
"The wooden houses of the more illustrious Huns were built
 and adorned with rude magnificence, according to the rank,
 the fortune, or the taste of the proprietors.","('Huns', 'NORP')"
"The zeal which he displayed for the orthodox creed,
 as it was established by the council of Chalcedon, would
 alone have inspired the grateful eloquence of the catholics.","('Chalcedon', 'GPE')"
Their establishment in modern Hungary,"('Hungary', 'GPE')"
"Their obscure names were afterwards illustrated by the
 extraordinary fortune and the contrast of their sons: the
 two servants of Attila became the fathers of the last Roman
 emperor of the West, and of the first barbarian king of
 Italy.","('two', 'CARDINAL'), ('Attila', 'PERSON'), ('Roman', 'NORP'), ('West', 'LOC'), ('first', 'ORDINAL'), ('Italy', 'GPE')"
"Their victorious hordes had spread from the Volga to the
 Danube; but the public force was exhausted by the discord of independent chieftains; their valour was idly consumed in obscure and predatory excursions; and they often degraded their national dignity, by condescending, for the hopes of spoil, to enlist under the banners of their fugitive enemies.","('Volga', 'LOC'), ('Danube', 'LOC')"
"Theodosius might still affect the style as well as the title
 of Invincible Augustus, but he was reduced to solicit the
 clemency of Attila who imperiously dictated these harsh and
 humiliating conditions of peace.","('Theodosius', 'PERSON'), ('Invincible Augustus', 'WORK_OF_ART'), ('Attila', 'PERSON')"
"Theodosius the Younger dies, A.D. 450, July 28.","('Theodosius the Younger', 'PERSON'), ('A.D. 450', 'DATE'), ('July 28', 'DATE')"
"They
 advanced, by a secret path, along the shores of the Caspian
 Sea; traversed the snowy mountains of Armenia; passed the
 Tigris, the Euphrates, and the Halys; recruited their weary
 cavalry with the generous breed of Cappadocian horses
 occupied the hilly country of Cilicia; and disturbed the
 festal songs and dances of the citizens of Antioch.(16) Egypt 
 trembled at their approach; and the monks and pilgrims of
 the Holy Land prepared to escape their fury by a speedy
 embarkation.","('the Caspian\r\n Sea', 'LOC'), ('Armenia', 'GPE'), ('Tigris', 'LOC'), ('Euphrates', 'LOC'), ('Halys', 'NORP'), ('Cappadocian', 'NORP'), ('Cilicia', 'GPE'), ('Antioch', 'GPE'), ('16', 'CARDINAL'), ('Egypt', 'GPE'), ('the Holy Land', 'GPE')"
"They ,destroyed, with fire and 
 sword, the populous cities of Sirmium and Singidunum, of
 Ratiaria and Marcianopolis, of Naissus and Sardica; where
 every circumstance in the discipline of the people and the
 construction of the buildings had been gradually adapted to
 the sole purpose of defence.","('Sirmium', 'GPE'), ('Singidunum', 'GPE'), ('Ratiaria', 'GPE'), ('Marcianopolis', 'GPE'), ('Naissus', 'GPE'), ('Sardica', 'GPE')"
"They attack the Eastern empire, A.D. 441, etc 
 While the powers of Europe and Asia were solicitous to avert
 the impending danger, the alliance of Attila maintained the
 Vandals in the possession of Africa.","('Eastern', 'NORP'), ('A.D. 441', 'FAC'), ('Europe', 'LOC'), ('Asia', 'LOC'), ('Attila', 'PERSON'), ('Vandals', 'PRODUCT'), ('Africa', 'LOC')"
"They boldly entered :he Imperial presence
 with the fatal purse hanging down from the neck of Orestes,
 who interrogated the eunuch Chrysaphius, as he stood beside
 the throne, whether he recognised the evidence of his guilt.","('Orestes', 'PERSON'), ('Chrysaphius', 'PERSON')"
"They encountered the Persian army in the plains 
 of Media, and the air, according to their own expression,
 was darkened by a cloud of arrows.","('Persian', 'NORP')"
"They marched before him,
 distributed into long and regular files: the intervals
 between the files were filled by white veils of thin linen,
 which the women on either side bore aloft in their hands,
 and which formed a canopy for a chorus of young virgins, who
 chanted hymns and songs in the Scythian language.","('Scythian', 'LANGUAGE')"
"They provided, with the assistance of the
 provincials, a sufficient number of sheep and oxen, and
 invited the Huns to a splendid, or, at least, a plentiful
 supper.","('Huns', 'NORP')"
"They related, during their
 residence at Rome, the circumstances of an expedition which
 they had lately made into the East.","('Rome', 'GPE'), ('East', 'LOC')"
"They watched his
 nod; they trembled at his frown; and at the first signal of
 his will, they executed, without murmur or hesitation, his
 stern and absolute commands.","('first', 'ORDINAL')"
"They were crucified on the territories of the empire,
 by the command of Attila: and, as soon as the king of the
 Huns had impressed the Romans with the terror of his name,
 he indulged them in a short and arbitrary respite, whilst he
 subdued the rebellious or independent nations of Scythia and
 Germany.(4)","('Attila', 'PERSON'), ('Huns', 'NORP'), ('Romans', 'NORP'), ('Scythia', 'GPE'), ('Germany', 'GPE'), ('4', 'CARDINAL')"
"This prudent and officious dissimulation may be condemned or
 excused by the casuists as they incline to the rigid decree
 of St. Augustin, or the milder sentiment of St. Jerom and
 St. Chrysostom: but every soldier, every statesman, must
 acknowledge that, if the race of the Azimuntines had been
 encouraged and multiplied, the barbarians would have ceased
 to trample on the majesty of the empire.(38)
Embassies from Attila to Constantinople","('St. Augustin', 'GPE'), ('St. Jerom', 'LOC'), ('St. Chrysostom', 'GPE'), ('Azimuntines', 'NORP'), ('38', 'CARDINAL'), ('Attila', 'PERSON'), ('Constantinople', 'GPE')"
"This reflection naturally produced a
 dispute on the advantages and defects of the Roman
 government, which was severely arraigned by the apostate,
 and defended by Priscus in a prolix and feeble declamation.","('Roman', 'NORP'), ('Priscus', 'PERSON')"
"Thuringia,
 which stretched beyond its actual limits as far as the
 Danube, was in the number of his provinces; he interposed,
 with the weight of a powerful neighbour, in the domestic
 affairs of the Franks; and one of his lieutenants chastised,
 and almost exterminated, the Burgundians of the Rhine.","('Thuringia', 'GPE'), ('Danube', 'LOC'), ('Franks', 'PERSON'), ('one', 'CARDINAL'), ('Burgundians', 'NORP'), ('Rhine', 'LOC')"
"Towards the East, it is difficult to
 circumscribe the dominion of Attila over the Scythian
 deserts; yet we may be assured that he reigned on the banks
 of the Volga; that the king of the Huns was dreaded, not
 only as a warrior, but as a magician;(14) that he insulted 
 and vanquished the khan of the formidable Geougen; and that
 he sent ambassadors to negotiate an equal alliance with the
 empire of China.","('East', 'LOC'), ('Attila', 'PERSON'), ('Scythian', 'NORP'), ('Volga', 'LOC'), ('Huns', 'PERSON'), ('14', 'DATE'), ('Geougen', 'PERSON'), ('China', 'GPE')"
"Two Scythians stood before the couch of Attila,
 and recited the verses which they had composed to celebrate
 his valour and his victories.","('Two', 'CARDINAL'), ('Scythians', 'NORP'), ('Attila', 'PERSON')"
"Two days afterwards
 the ambassadors received a second invitation; and they had
 reason to praise the politeness, as well as the hospitality,
 of Attila.","('Two days afterwards', 'DATE'), ('second', 'ORDINAL'), ('Attila', 'PERSON')"
"Two lines of small
 tables, each of which contained three or four guests, were
 ranged in order on either hand; the right was esteemed the
 most honourable, but the Romans ingenuously confess that
 they were placed on the left; and that Beric, an unknown
 chieftain, most probably of the Gothic race, preceded the
 representatives of Theodosius and Valentinian.","('Two', 'CARDINAL'), ('three', 'CARDINAL'), ('four', 'CARDINAL'), ('Romans', 'NORP'), ('Beric', 'PERSON'), ('Gothic', 'NORP'), ('Theodosius', 'PERSON'), ('Valentinian', 'NORP')"
"Under the faith of the 
 treaty of Margus, a free market was held on the northern
 side of the Danube, which was protected by a Roman fortress
 surnamed Constantia.","('Margus', 'GPE'), ('Danube', 'LOC'), ('Roman', 'NORP'), ('Constantia', 'PRODUCT')"
"Under the name of ransom, or
 confiscation, the rapacious king of the Huns accepted two
 hundred pounds of gold for the life of a traitor whom he
 disdained to punish.","('Huns', 'NORP'), ('two\r\n hundred pounds', 'QUANTITY')"
"When Attila first gave audience to the Roman ambassadors on
 the banks of the Danube, his tent was encompassed with a
 formidable guard.","('Attila', 'PERSON'), ('first', 'ORDINAL'), ('Roman', 'NORP'), ('Danube', 'LOC')"
"When Maximin offered his presents to Cerca the principal
 queen, he admired the singular architecture of her mansion,
 the height of the round columns, the size and beauty of the
 wood, which was curiously shaped or turned, or polished or
 carved; and his attentive eye was able to discover some
 taste in the ornaments, and some regularity in the
 proportions.","('Maximin', 'PERSON'), ('Cerca', 'PERSON')"
"When Maximin temperately urged the contrary
 practice of nations, he was still more confounded to find
 that the resolutions of the Sacred Consistory, those secrets
 (says Priscus) which should not be revealed to the gods
 themselves, had been treacherously disclosed to the public
 enemy.","('Maximin', 'PERSON'), ('the Sacred Consistory', 'ORG'), ('Priscus', 'PERSON')"
"When they rose from table the Imperial
 ambassador presented Edecon and Orestes with rich gifts of
 silk robes and Indian pearls, which they thankfully
 accepted.","('Imperial', 'NORP'), ('Edecon', 'PERSON'), ('Orestes', 'PERSON'), ('Indian', 'NORP')"
"Whether human sacrifices formed any part of the worship of Attila, or whether he propitiated the god of war with the victims which he continually offered in the field of battle, the
 favourite of Mars soon acquired a sacred character, which
 rendered his conquests more easy and more permanent; and the
 barbarian princes confessed, in the language of devotion or
 flattery, that they could not presume to gaze, with a steady
 eye, on the divine majesty of the king of the Huns.(11) His brother Bleda, who reigned over a considerable part of the nation, was compelled to resign his sceptre and his life.","('Attila', 'PERSON'), ('Mars', 'LOC'), ('Huns', 'NORP'), ('Bleda', 'PERSON')"
"Without any legal trial, the eunuch
 Chrysaphius was executed before the gates of the city; and
 the immense riches which had been accumulated by the
 rapacious favourite served only to hasten and to justify his
 punishment.(52) Amidst the general acclamations of the clergy 
 and people, the empress did not forget the prejudice and
 disadvantage to which her sex was exposed; and she wisely
 resolved to prevent their murmurs by the choice of a
 colleague who would always respect the superior rank and
 virgin chastity of his wife.","('Chrysaphius', 'PERSON')"
"Yet Orestes could not forbear insinuating that he
 had not always been treated with such respect and
 liberality: and the offensive distinction which was implied
 between his civil office and the hereditary rank of his
 colleague seems to have made Edecon a doubtful friend and
 Orestes an irreconcilable enemy.","('Orestes', 'PERSON'), ('Edecon', 'PERSON'), ('Orestes', 'PERSON')"
"Yet even this cruel act was attributed to a supernatural
 impulse; and the vigour with which Attila wielded the sword
 of Mars convinced the world that it had been reserved alone
 for his invincible arm. (12)","('Attila', 'PERSON'), ('Mars', 'LOC')"
"Yet this
 savage hero was not inaccessible to pity; his suppliant
 enemies might confide in the assurance of peace or pardon;
 and Attila was considered by his subjects as a just and
 indulgent master.","('Attila', 'PERSON')"
and acquires the empire of Scythia and Germany.,"('Scythia', 'ORG'), ('Germany', 'GPE')"
"and is succeeded by Marcian, August 25.","('Marcian', 'PERSON'), ('August 25', 'DATE')"
"and ravage Europe, as far as Constantinople","('Europe', 'LOC'), ('Constantinople', 'GPE')"
