Sentence,Entities
"If we now
 review the embassy of Maximin and the behaviour of Attila,
 we must applaud the barbarian, who respected the laws of
 hospitality, and generously entertained and dismissed the
 minister of a prince who had conspired against his life.","('Maximin', 'GPE'), ('Attila', 'PERSON')"
"In all their invasions of the civilised empires of the
 South, the Scythian shepherds have been uniformly actuated
 by a savage and destructive spirit.","('South', 'LOC'), ('Scythian', 'NORP')"
"In its origin 
 it could be no more than an accidental camp, which, by the
 long and frequent residence of Attila, had insensibly
 swelled into a huge village, for the reception of his court,
 of the troops who followed his person, and of the various
 multitude of idle or industrious slaves and retainers.(45)","('Attila', 'PERSON'), ('45', 'CARDINAL')"
"In the
 hands of a wise legislator such an industrious colony might
 have contributed to diffuse through the deserts of Scythia
 the rudiments of the useful and ornamental arts; but these
 captives, who had been taken in war, were accidentally
 dispersed among the hordes that obeyed the empire of Attila","('Scythia', 'LOC'), ('Attila', 'PERSON')"
"In the execution of this cruel and ignominious
 treaty the Imperial officers were forced to massacre several
 loyal and noble deserters who refused to devote themselves
 to certain death; and the Romans forfeited all reasonable
 claims to the friendship of any Scythian people by this
 public confession that they were destitute either of faith
 or power to protect the suppliant who had embraced the
 throne of Theodosius.(36)
Spirit of Azimuntines","('Imperial', 'ORG'), ('Romans', 'NORP'), ('Scythian', 'NORP'), ('Theodosius', 'PERSON'), ('36', 'CARDINAL')"
"In the free conversation of the
 Imperial ambassadors, who discussed, at the court of Attila,
 the character and designs of their formidable enemy, the
 ministers of Constantinople expressed their hope that his
 strength might be diverted and employed in a long and
 doubtful contest with the princes of the house of Sassan.","('Imperial', 'NORP'), ('Attila', 'PERSON'), ('Constantinople', 'GPE'), ('Sassan', 'PERSON')"
"In the midst of this
 intemperate riot, Attila alone, without a change of
 countenance, maintained his steadfast and inflexible
 gravity, which was never relaxed, except on the entrance of
 Irnac, the youngest of his sons: he embraced the boy with a
 smile of paternal tenderness, gently pinched him by the
 cheek, and betrayed a partial affection, which was justified
 by the assurance of his prophets that Irnac would be the
 future support of his family and empire.","('Attila', 'PERSON'), ('Irnac', 'PERSON'), ('Irnac', 'PERSON')"
"In the proud review of the nations who
 acknowledged the sovereignty of Attila, and who never
 entertained, during his lifetime, the thought of a revolt,
 the Gepidae and the Ostrogoths were distinguished by their
 numbers, their bravery, and the personal merit of their
 chiefs.","('Attila', 'PERSON'), ('Gepidae', 'PERSON'), ('Ostrogoths', 'NORP')"
"In the reign of ATTILA (1) the Huns again became the terrors of the world; and I shall now describe the character and actions of that formidable barbarian, who alternately insulted and invaded the East and the West and urged the rapid downfall of the Roman Empire.","('ATTILA', 'EVENT'), ('1', 'CARDINAL'), ('Huns', 'NORP'), ('East', 'LOC'), ('West', 'LOC'), ('the Roman Empire', 'GPE')"
"In the reign of his father Arcadius, a band of adventurous
 Huns had ravaged the provinces of the East, from whence they
 brought away rich spoils and innumerable captives.","('Arcadius', 'PERSON'), ('Huns', 'NORP'), ('East', 'LOC')"
"In the siege of Viminiacum he had lost,
 according to his own account, his fortune and liberty: he
 became the slave of Onegesius but his faithful services
 against the Romans and the Acatzires had gradually raised
 him to the rank of the native Huns, to whom he was attached
 by the domestic pledges of a new wife and several children.","('Viminiacum', 'GPE'), ('Onegesius', 'PERSON'), ('Romans', 'NORP'), ('Acatzires', 'PERSON'), ('Huns', 'NORP')"
"In the tide of emigration which impetuously rolled from the confines of China to those of Germany, the most powerful and populous tribes may commonly be found on the verge of the Roman provinces.","('China', 'GPE'), ('Germany', 'GPE'), ('Roman', 'NORP')"
"In this advantageous situation, Rugilas, and his valiant brothers, who continually added to their power and reputation, commanded the alternative of peace or war with the two empires.","('Rugilas', 'PERSON'), ('two', 'CARDINAL')"
"In time of peace, the dependent
 princes, with their national troops, attended the royal camp
 in regular succession; but when Attila collected his
 military force he was able to bring into the field an army
 of five, or, according to another account, of seven hundred
 thousand barbarians.","('Attila', 'PERSON'), ('five', 'CARDINAL'), ('seven hundred\r\n thousand', 'CARDINAL')"
"Instead of contenting himself with
 a moderate contribution and a military title, which equalled
 him only to the generals of Theodosius, Attila would proceed
 to impose a disgraceful and intolerable yoke on the necks of
 the prostrate and captive Romans, who would then be
 encompassed on all sides by the empire of the Huns.(18)","('Theodosius', 'PERSON'), ('Attila', 'PERSON'), ('Romans', 'NORP'), ('Huns', 'NORP'), ('18', 'CARDINAL')"
"Instead of tamely
 expecting their approach, the Azimuntines attacked, in
 frequent and successful sallies, the troops of the Huns, who
 gradually declined the dangerous neighbourhood, rescued from
 their hands the spoil and the captives, and recruited their
 domestic force by the voluntary association of fugitives and
 deserters.","('Azimuntines', 'NORP'), ('Huns', 'NORP')"
"It may be affirmed with bolder assurance that the Huns
 depopulated the provinces of the empire by the number of
 Roman subjects whom they led away into captivity.","('Huns', 'NORP'), ('Roman', 'NORP')"
"It was natural enough that the Scythians should
 adore, with peculiar devotion, the god of war; but as they
 were incapable of forming either an abstract idea or a
 corporeal representation, they worshipped their tutelar
 deity under the symbol of an iron cimeter.(8)","('Scythians', 'NORP')"
"It would have been strange, indeed, if Theodosius had
 purchased, by the loss of honour, a secure and solid
 tranquillity, or if his tameness had not invited the
 repetition of injuries.","('Theodosius', 'PERSON')"
"Maximin and his colleagues
 were stopped on the threshold, till they had made a devout
 libation to the health and prosperity of the king of the
 Huns; and were conducted, after this ceremony, to their
 respective seats in a spacious hall.","('Maximin', 'PERSON'), ('Huns', 'NORP')"
"Maximin returned, by the same road, to Constantinople; and though he was involved in an accidental dispute with Beric, the new ambassador of Attila, he flattered himself that he had contributed, by the laborious journey to confirm the peace and alliance of the two nations.(48)
Conspiracy of the Romans against the life of Attila 
 But the Roman ambassador was ignorant of the treacherous
 design which had been concealed under the mask of the public
 faith.","('Maximin', 'PERSON'), ('Constantinople', 'GPE'), ('Beric', 'PERSON'), ('Attila', 'PERSON'), ('two', 'CARDINAL'), ('48', 'CARDINAL'), ('Romans', 'NORP'), ('Attila', 'PERSON'), ('Roman', 'NORP')"
"Maximin,(41) a respectable courtier, whose abilities 
 had been long exercised in civil and military employments,
 accepted with reluctance the troublesome, and perhaps
 dangerous, commission of reconciling the angry spirit of the
 king of the Huns.","('Maximin', 'PERSON'), ('41', 'CARDINAL'), ('Huns', 'NORP')"
"No sooner had Maximin advanced about two miles from the
 Danube than he began to experience the fastidious insolence
 of the conqueror.","('Maximin', 'PERSON'), ('about two miles', 'QUANTITY'), ('Danube', 'LOC')"
"No sooner had Pulcheria ascended the throne than she
 indulged her own and the public resentment by an act of
 popular justice.","('Pulcheria', 'PERSON')"
"On his refusal to comply with such ignominious terms,
 the Imperial envoy was commanded instantly to depart; the
 order was recalled; it was again repeated; and the Huns
 renewed their ineffectual attempts to subdue the patient
 firmness of Maximin.","('Imperial', 'NORP'), ('Huns', 'NORP'), ('Maximin', 'PERSON')"
"On the third day the ambassadors were dismissed; the freedom of several captives was granted, for a moderate ransom to their pressing entreaties; and, besides the royal presents, they were permitted to accept from each of the Scythian nobles the honourable and useful gift of a horse.","('the third day', 'DATE'), ('Scythian', 'NORP')"
"One might imagine that such a
 demand, which scarcely equalled the measure of private
 wealth, would have been readily discharged by the opulent
 empire of the East; and the public distress affords a
 remarkable proof of the impoverished, or at least of the
 disorderly, state of the finances.","('East', 'LOC')"
"One of the 
 shepherds of the Huns perceived that a heifer, who was
 grazing, had wounded herself in the foot, and curiously
 followed the track of the blood, he discovers the sword of Mars, till he discovered, among
 the long grass, the point of an ancient sword which he dug
 out of the ground, and presented to Attila.","('One', 'CARDINAL'), ('Huns', 'NORP'), ('Mars', 'LOC'), ('Attila', 'PERSON')"
Peace was the unanimous wish of the senate: their decree was ratified by the emperor; and two ambassadors were named—,"('two', 'CARDINAL')"
"Perhaps they might not understand the merit of a
 theologian profoundly skilled in the controversies of the
 Trinity and the Incarnation; yet they respected the
 ministers of every religion; and the active zeal of the
 Christian missionaries, without approaching the person or
 the palace of the monarch, successfully laboured in the
 propagation of the gospel.(28)","('Trinity', 'ORG'), ('Christian', 'NORP'), ('28', 'CARDINAL')"
"Plinthas, a general of Scythian extraction, but of consular rank; and the quaestor Epigenes, a wise and experienced statesman, who was recommended to
that office by his ambitious colleague.","('Plinthas', 'PERSON'), ('Scythian', 'NORP'), ('Epigenes', 'PERSON')"
"Reign of Attila, A.D. 433-453","('Attila', 'PERSON'), ('A.D. 433-453', 'DATE')"
"She gave her hand to Marcian, a
 senator, about sixty years of age, and the nominal husband
 of Pullcheria was solemnly invested with the Imperial
 purple.","('Marcian', 'PERSON'), ('about sixty years of age', 'DATE'), ('Pullcheria', 'PERSON'), ('Imperial', 'ORG')"
"Some ecclesiastical historians have destroyed the barbarians with lightning and pestilence;(3) but Theodosius was reduced to the more humble expedient of stipulating an annual payment of three hundred and fifty pounds of gold, and of disguising this dishonourable tribute by the title of general, which the king of the Huns condescended to accept.","('3', 'CARDINAL'), ('Theodosius', 'PERSON'), ('three hundred and fifty pounds', 'QUANTITY'), ('Huns', 'NORP')"
"Some of the great
 vassals of the king of the Huns, who were themselves in the
 rank of powerful princes, had been sent to ratify an
 alliance and society of arms with the emperor, or rather
 with the general, of the West.","('Huns', 'NORP'), ('West', 'LOC')"
"Soon after this adventure they
 rejoined the march of Attila, from whom they had been
 separated about six days; and slowly proceeded to the
 capital of an empire which did not contain, in the space of
 several thousand miles, a single city.","('Attila', 'PERSON'), ('about six days', 'DATE'), ('several thousand miles', 'QUANTITY')"
"Such was the
 behaviour of the Moguls when they were not conscious of any
 extraordinary rigour.(24)","('Moguls', 'ORG')"
"That
 magnanimous, or rather that artful, prince accepted, with
 pious gratitude, this celestial favour; and, as the rightful
 possessor of the sword of Mars, asserted his divine and
 indefeasible claim to the dominion of the earth.","('Mars', 'LOC')"
"That Gallic 
 adventurer, who was recommended by Aetius to the king of the
 Huns, had engaged his service to the ministers of
 Constantinople for the stipulated reward of a wealthy and
 noble wife; and the daughter of Count Saturninus was chosen
 to discharge the obligations of her country.","('Gallic', 'NORP'), ('Aetius', 'PERSON'), ('Huns', 'NORP'), ('Constantinople', 'GPE'), ('Saturninus', 'PERSON')"
"That flourishing city, which had given birth to the
 great Constantine, was levelled with the ground; the
 inhabitants were destroyed or dispersed; and the appearance
 of some sick persons, who were still permitted to exist
 among the ruins of the churches, served only to increase the
 horror of the prospect.","('Constantine', 'PERSON')"
"The
 Scythian conquerors, Attila and Zingis, surpassed their rude
 countrymen in art, rather than in courage; and it may be
 observed that the monarchies, both of the Huns and of the
 Moguls, were erected by their founders on the basis of
 popular superstition.","('Scythian', 'NORP'), ('Attila', 'PERSON'), ('Zingis', 'PERSON'), ('Huns', 'NORP'), ('Moguls', 'ORG')"
"The
 first class consisted of the soldiers of the garrison and
 the young men capable of bearing arms; and their fate was
 instantly decided: they were either enlisted among the
 Moguls, or they were massacred on the spot by the troops,
 who, with pointed spears and bended bows, had formed a
 circle round the captive multitude.","('first', 'ORDINAL'), ('Moguls', 'NORP')"
"The
 greatness of the emperor and the empire was warmly
 maintained by their ministers; the Huns, with equal ardour,
 asserted the superiority of their victorious monarch: the
 dispute was inflamed by the rash and unseasonable flattery
 of Vigilius, who passionately rejected the comparison of a
 mere mortal with the divine Theodosius, and it was with
 extreme difficulty that Maximin and Priscus were able to
 divert the conversation or soothe the angry minds of the
 barbarians.","('Huns', 'NORP'), ('Vigilius', 'PERSON'), ('Theodosius', 'PERSON'), ('Maximin', 'PERSON'), ('Priscus', 'PERSON')"
"The
 interpreter was instantly seized and dragged before the
 tribunal of Attila where he asserted his innocence with
 specious firmness; till the threat of inflicting instant
 death on his son extorted from him a sincere discovery of
 the criminal transaction.","('Attila', 'PERSON')"
"The 
 perpetual intercourse of the Huns and the Goths had
 communicated the familiar knowledge of the two national
 dialects; and the barbarians were ambitious of conversing in
 Latin, the military idiom even of the Eastern empire.(30) But 
 they disdained the language and the sciences of the Greeks
 and the vain sophist or grave philosopher who had enjoyed
 the flattering applause of the schools, was mortified to
 find that his robust servant was a captive of more value and
 importance than himself.","('Huns', 'NORP'), ('Goths', 'NORP'), ('two', 'CARDINAL'), ('Latin', 'LANGUAGE'), ('Eastern', 'NORP'), ('Greeks', 'NORP')"
"The Byzantine court was insulted by
 five or six successive embassies; (39) and the ministers of 
 Attila were uniformly instructed to press the tardy or
 imperfect execution of the last treaty; to produce the names
 of fugitives and deserters who were still protected by the
 empire; and to declare, with seeming moderation, that,
 unless their sovereign obtained complete and immediate
 satisfaction, it would be impossible for him, were it even
 his wish, to check the resentment of his warlike tribes.","('Byzantine', 'NORP'), ('five or six', 'CARDINAL'), ('39', 'CARDINAL'), ('Attila', 'PERSON')"
"The Character, Conquests, and Court of Attila, King of the Huns—Death of Theodosius the Younger—Elevation of Marcian to the Empire of the EastThe Huns, A.D. 376-433 
 THE WESTERN world was oppressed by the Goths and Vandals, who fled before the Huns; but the achievements of the Huns themselves were not adequate to their power and prosperity.","('Attila', 'PERSON'), ('Death of Theodosius the Younger—Elevation of Marcian to the Empire of the EastThe Huns', 'WORK_OF_ART'), ('376-433', 'CARDINAL'), ('WESTERN', 'NORP'), ('Goths', 'NORP'), ('Vandals', 'NORP'), ('Huns', 'NORP'), ('Huns', 'NORP')"
"The Hungarians, who ambitiously insert the name of Attila among their native kings, may affirm with truth that the hordes which were subject to his uncle Roas, or Rugilas, had formed their encampments within the limits of modern Hungary, (2) in a fertile country which liberally supplied the wants of a nation of hunters and shepherds.","('Hungarians', 'NORP'), ('Attila', 'PERSON'), ('Roas', 'PERSON'), ('Rugilas', 'PERSON'), ('Hungary', 'GPE'), ('2', 'CARDINAL')"
"The Huns
 justified this outrage as an act of reprisal; alleged that
 the bishop of Margus had entered their territories, to
 discover and steal a secret treasure of their kings; and
 sternly demanded the guilty prelate, the sacrilegious spoil,
 and the fugitive subjects, who had escaped from the justice
 of Attila.","('Huns', 'NORP'), ('Margus', 'PERSON'), ('Attila', 'PERSON')"
"The Huns
 were ambitious of displaying those riches which were the
 fruit and evidence of their victories; the trappings of
 their horses, their swords, and even their shoes, were
 studded with gold and precious stones; and their tables were
 profusely spread with plates, and goblets, and vases of gold
 and silver, which had been fashioned by the labour of
 Grecian artists.","('Huns', 'NORP'), ('Grecian', 'NORP')"
"The Huns of Attila may without injustice be compared to the
 Moguls and Tartars before their primitive manners were
 changed by religion and luxury; and the evidence of Oriental
 history may reflect some light on the short and imperfect
 annals of Rome.","('The Huns of Attila', 'PERSON'), ('Moguls', 'NORP'), ('Tartars', 'NORP'), ('Oriental', 'NORP'), ('Rome', 'GPE')"
"The Huns were masters of the great river: their
 navigation was performed in large canoes, hollowed out of
 the trunk of a single tree; the ministers of Theodosius were
 safely landed on the opposite bank; and their barbarian
 associates immediately hastened to the camp of Attila, which
 was equally prepared for the amusements of hunting or of
 war.","('Huns', 'NORP'), ('Theodosius', 'GPE'), ('Attila', 'PERSON')"
"The Illyrian frontier was
 covered by a line of castles and fortresses; and though the
 greatest part of them consisted only of a single tower, with
 a small garrison, they were commonly sufficient to repel, or
 to intercept, the inroads of an enemy who was ignorant of
 the art, and impatient of the delay, of a regular siege.","('Illyrian', 'NORP')"
"The Imperial
 treasury was exhausted to procure the friendly offices of
 the ambassadors and their principal attendants, whose
 favourable report might conduce to the maintenance of peace.","('Imperial', 'ORG')"
"The Romans of the East were not less apprehensive of the arms of Rugilas, which threatened the provinces, or even the capital.","('Romans', 'NORP'), ('East', 'LOC'), ('Rugilas', 'GPE')"
"The Romans who traversed the plains
 of Hungary suppose that they passed several navigable
 rivers, either in canoes or portable boats; but there is
 reason to suspect that the winding stream of the Theiss, or
 Tibiscus, might present itself in different places under
 different names.","('Romans', 'NORP'), ('Hungary', 'GPE'), ('Theiss', 'PRODUCT'), ('Tibiscus', 'ORG')"
"The Romans, both of the East and of the West, were
 twice invited to the banquets,The royal feast where Attila feasted with the princes and nobles of Scythia.","('Romans', 'NORP'), ('East', 'LOC'), ('West', 'LOC'), ('Attila', 'PERSON'), ('Scythia', 'PERSON')"
"The Scythian or Tartar, wars.","('Scythian', 'NORP'), ('Tartar', 'NORP')"
"The ambassador of the Huns listened to the tempting
 offer; and professed, with apparent zeal, his ability, as
 well as readiness, to execute the bloody deed: the design
 was communicated to the master of the offices, and the
 devout Theodosius consented to the assassination of his
 invincible enemy.","('Huns', 'NORP'), ('Theodosius', 'PERSON')"
"The ambassadors of the Huns might awaken the attention of
 Theodosius, by reminding him that they were his neighbours
 both in Europe and Asia; since they touched the Danube on
 one hand, and reached with the other as far as the Tanais.","('Huns', 'NORP'), ('Theodosius', 'PERSON'), ('Europe', 'LOC'), ('Asia', 'LOC'), ('Danube', 'LOC'), ('one', 'CARDINAL'), ('Tanais', 'NORP')"
"The ambassadors, who were followed by a numerous train of
 men and horses, made their first halt at Sardica, at the
 distance of three hundred and fifty miles, or thirteen days'
 journey, from Constantinople.","('first', 'ORDINAL'), ('Sardica', 'GPE'), ('three hundred and fifty miles', 'QUANTITY'), (""thirteen days'"", 'DATE'), ('Constantinople', 'GPE')"
"The armies of the Eastern
 empire were vanquished in three successive engagements; and
 the progress of Attila may be traced by the fields of
 battle.","('Eastern', 'NORP'), ('three', 'CARDINAL'), ('Attila', 'PERSON')"
"The barbarian monarch was flattered by the liberal reception
 of his ministers; he computed with pleasure the value and
 splendour of their gifts, rigorously exacted the performance
 of every promise which would contribute to their private
 emolument, and treated as an important business of state the
 marriage of his secretary Constantius. (40)","('Constantius', 'PERSON'), ('40', 'CARDINAL')"
"The barbarians condescended,
 by producing an accurate list, to expose the bold falsehood
 of Vigilius, who had affirmed that no more than seventeen
 deserters could be found.","('Vigilius', 'PERSON'), ('no more than seventeen', 'CARDINAL')"
"The baths, constructed by Onegesius, were the only edifice
 of stone; the materials had been transported from Pannonia;
 and since the adjacent country was destitute even of large
 timber, it may be presumed that the meaner habitations of
 the royal village consisted of straw, of mud, or of canvas.","('Onegesius', 'FAC'), ('Pannonia', 'GPE')"
The behaviour of Attila to the Roman ambassadors.,"('Attila', 'PERSON'), ('Roman', 'NORP')"
"The bishop
 of Margus, who did not possess the spirit of a martyr,
 resolved to prevent the designs which he suspected.","('Margus', 'PERSON')"
"The breadth was defined by
 the vague computation of fifteen days' journey; but, from
 the proposal of Attila to remove the situation of the
 national market, it soon appeared that he comprehended the
 ruined city of Naissus within the limits of his dominions.","(""fifteen days'"", 'DATE'), ('Attila', 'PERSON'), ('Naissus', 'GPE')"
"The council
 of Theodosius eluded this proposal by representing the
 desolate and ruined condition of Sardica; and even ventured
 to insinuate that every officer of the army or household was
 qualified to treat with the most powerful princes of
 Scythia.","('Theodosius', 'GPE'), ('Sardica', 'GPE'), ('Scythia', 'PERSON')"
"The crowd of vulgar kings, the leaders of so
 many martial tribes, who served under the standard of
 Attila, were ranged in the submissive order of guards and
 domestics round the person of their master.","('Attila', 'PERSON')"
"The damage indeed was speedily repaired; but this
 accident was aggravated by a superstitious fear that Heaven
 itself had delivered the Imperial city to the shepherds of
 Scythia, who were strangers to the laws, the language, and
 the religion of the Romans.(22)","('Imperial', 'NORP'), ('Scythia', 'LOC'), ('Romans', 'NORP'), ('22', 'CARDINAL')"
The death of Rugilas suspended the progress of the treaty.,"('Rugilas', 'PERSON')"
"The dress of Attila, his arms, and the 
 furniture of his horse, were plain, without ornament, and of
 a single colour.","('Attila', 'PERSON')"
"The embassy of Maximin to Attila, A.D. 448.","('Maximin', 'GPE'), ('Attila', 'GPE'), ('448', 'CARDINAL')"
"The emperor Theodosius did not long survive the most
 humiliating circumstance of an inglorious life.","('Theodosius', 'PERSON')"
"The entrance of Attila into the royal village was marked by a very
 singular ceremony.","('Attila', 'PERSON')"
"The firmness of a Chinese mandarin, (23) who 
 insinuated some principles of rational policy into the mind
 of Zingis, diverted him from the execution of this horrid
 design.","('Chinese', 'NORP'), ('23', 'DATE'), ('Zingis', 'PERSON')"
"The freedman of Onegesius exposed, in true and lively
 colours, the vices of a declining empire of which he had so
 long been the victim; the cruel absurdity of the Roman
 princes, unable to protect their subjects against the public
 enemy, unwilling to trust them with arms for their own
 defence; the intolerable weight of taxes, rendered still
 more oppressive by the intricate or arbitrary modes of
 collection; the obscurity of numerous and contradictory
 laws; the tedious and expensive forms of judicial
 proceedings; the partial administration of justice; and the
 universal corruption which increased the influence of the
 rich and aggravated the misfortunes of the poor A sentiment
 of patriotic sympathy was at length revived in the breast of
 the fortunate exile, and he lamented with a flood of tears
 the guilt or weakness of those magistrates who had perverted
 the wisest and most salutary institutions.(33)
Treaty of peace between Attila and the Eastern empire, A.D. 446.","('Onegesius', 'PERSON'), ('Roman', 'NORP'), ('33)\r\nTreaty', 'LAW'), ('Attila', 'PERSON'), ('Eastern', 'NORP'), ('446', 'CARDINAL')"
