Sentence,Entities
"The
 difficulties of a German war forced him to confine his
 immediate care to the safety of his own dominions; and, as
 every channel of communication was stopped or corrupted, he
 listened, with doubtful anxiety, to the rumours which were
 industriously spread that the defeat and death of Valens had
 left Procopius sole master of the Eastern provinces.","('German', 'NORP'), ('Valens', 'PERSON'), ('Procopius', 'PERSON'), ('Eastern', 'NORP')"
"The
 emperor of the East, and the Judge of the Visigoths,
 accompanied by an equal number of armed followers, advanced
 in their respective barges to the middle of the stream.","('East', 'LOC'), ('Visigoths', 'PERSON')"
"The
 immense fortunes of the Roman ladies were gradually consumed
 in lavish alms and expensive pilgrimages; and the artful
 monk, who had assigned himself the first, or possibly the
 sole place, in the testament of his spiritual daughter,
 still presumed to declare, with the smooth face of
 hypocrisy, that he was only the instrument of charity, and
 the steward of the poor.","('Roman', 'NORP'), ('first', 'ORDINAL')"
"The
 obstinacy with which they disputed the vain honours of rank
 and precedency was the cause of their destruction, and,
 while they acted with separate forces and divided councils,
 they were surprised and slaughtered by the active vigour of
 the Sarmatian horse.","('Sarmatian', 'NORP')"
"The
 passions which had been so long suppressed by the presence
 of a master immediately revived in the Imperial council, and
 the ambitious design of reigning in the name of an infant
 was artfully executed by Mellobaudes and Equitius, who
 commanded the attachment of the Illyrian and Italian bands.","('Imperial', 'NORP'), ('Mellobaudes', 'PERSON'), ('Equitius', 'PERSON'), ('Illyrian', 'NORP'), ('Italian', 'NORP')"
"The
 rigid impartiality of Palladius was easily disarmed.","('Palladius', 'GPE')"
"The
 submission of the barbarians appeased the resentment of
 Valens and his council: the emperor listened with
 satisfaction to the flattering and eloquent remonstrance of
 the senate of Constantinople, which assumed, for the first
 time, a share in the public deliberations; and the same
 generals, Victor and Arintheus, who had successfully
 directed the conduct of the war, were empowered to regulate
 the conditions of peace.","('Valens', 'PERSON'), ('the senate of Constantinople', 'ORG'), ('first', 'ORDINAL'), ('Victor', 'PERSON'), ('Arintheus', 'PERSON')"
"The
 treasure deposited in that strong fortress tempted the
 avarice of Sapor; but the danger of Olympias, the wife or
 widow of the Armenian king, excited the public compassion
 and animated the desperate valour of her subjects and
 soldiers.","('Sapor', 'PERSON'), ('Olympias', 'NORP'), ('Armenian', 'NORP')"
"The
 two bold headlands of Caledonia almost touch the shores of a
 spacious island, which obtained, from its luxuriant
 vegetation, the epithet of Green; and has preserved, with a
 slight alteration, the name of Erin, or Ierne, or Ireland.","('two', 'CARDINAL'), ('Caledonia', 'GPE'), ('Erin', 'PERSON'), ('Ierne', 'PERSON'), ('Ireland', 'GPE')"
"The
 victorious Goths, who were not inferior in numbers,
 prevailed in the contest, by the decisive advantages of
 exercise and discipline.","('Goths', 'NORP')"
"The 
 present age is satisfied with the simple and rational
 opinion that the islands of Great Britain and Ireland were
 gradually peopled from the adjacent continent of Gaul.","('Great Britain', 'GPE'), ('Ireland', 'GPE'), ('Gaul', 'LOC')"
"The Alemanni invade Gaul , A.D. 365.","('Alemanni', 'PERSON'), ('Gaul', 'PERSON'), ('365', 'CARDINAL')"
"The Alemanni, unable to prevent the devastation of
 their villages, fixed their camp on a lofty and almost
 inaccessible mountain in the modern duchy of Wirtemberg, and
 resolutely expected the approach of the Romans.","('Alemanni', 'NORP'), ('Wirtemberg', 'GPE'), ('Romans', 'NORP')"
"The Batavians were
 degraded from their rank, stripped of their arms and
 condemned to be sold for slaves to the highest bidder.","('Batavians', 'NORP')"
The Britain.,"('Britain', 'GPE')"
"The Christians had
 forgotten the spirit of the Gospel, and the Pagans had
 imbibed the spirit of the church.","('Christians', 'NORP'), ('Pagans', 'NORP')"
The Danube—Death of Valentinian—,"('The Danube—Death of Valentinian', 'WORK_OF_ART')"
The EAST.,"('EAST', 'ORG')"
"The East; and V. The Danube - will impress a more distinct image of the military
 state of the empire under the reigns of Valentinian and
 Valens.","('East', 'LOC'), ('Danube', 'LOC'), ('Valentinian', 'NORP'), ('Valens', 'PERSON')"
The East—,"('East', 'LOC')"
"The Euphrates was
 protected by the valour of Arintheus.","('Euphrates', 'LOC'), ('Arintheus', 'PERSON')"
"The Goths had contracted an hereditary attachment for the
 Imperial house of Constantine, of whose power and liberality
 they had received so many signal proofs.","('Goths', 'NORP'), ('Imperial', 'NORP'), ('Constantine', 'PERSON')"
"The Government and Death of Jovian—Election of Valentinian, who Associates His Brother Valens, and Makes the Final Division of the Eastern and Western Empires—Revolt of Procopius—Civil and Ecclesiastical Administration—Germany—Britain—Africa.—","('Government', 'ORG'), ('Death of Jovian', 'PERSON'), ('Valentinian', 'WORK_OF_ART'), ('Valens', 'PERSON'), ('Makes the Final Division of the Eastern and Western Empires', 'WORK_OF_ART'), ('Civil and Ecclesiastical Administration', 'ORG'), ('Germany', 'GPE'), ('Britain', 'GPE'), ('Africa', 'LOC')"
"The Heruli, who inhabited the marshy lands near the lake 
 Maeotis, were renowned for their strength and agility; and
 the assistance of their light infantry was eagerly
 solicited, and highly esteemed, in all the wars of the
 barbarians.","('Heruli', 'PERSON'), ('Maeotis', 'LOC')"
"The Homoousians were fortified by the
 reconciliation of fifty-nine Macedonian, or Semi-Arian,
 bishops but their secret reluctance to embrace the divinity
 of the Holy Ghost clouded the splendour of the triumph; and
 the declaration of Valens, who, in the first years of his
 reign, had imitated the impartial conduct of his brother,
 was an important victory on the side of Arianism.","('Homoousians', 'NORP'), ('fifty-nine', 'CARDINAL'), ('Macedonian', 'NORP'), ('Semi-Arian', 'NORP'), ('the Holy Ghost', 'PERSON'), ('Valens', 'PERSON'), ('the first years', 'DATE'), ('Arianism', 'ORG')"
"The Persians were surprised and repulsed under the
 walls of Artogerassa by a bold and well-concerted sally of
 the besieged.","('Persians', 'NORP'), ('Artogerassa', 'PERSON')"
"The Quadi
 complained that the ground for an intended fortress had been
 marked out on their territories, and their complaints were
 urged with so much reason and moderation, that Equitius,
 master-general of Illyricum, consented to suspend the
 prosecution of the work till he should be more clearly
 informed of the will of his sovereign.","('Quadi', 'PERSON'), ('Equitius', 'PERSON'), ('Illyricum', 'ORG')"
"The Quadi were much declined from
 that formidable power which in the time of Marcus Antoninus,
 had spread terror to the gates of Rome.","('Quadi', 'NORP'), ('Marcus Antoninus', 'PERSON'), ('Rome', 'GPE')"
"The Roman
 army was saved by an inglorious, perhaps a necessary,
 treaty;(1) and the first moments of peace were consecrated by the pious Jovian to restore the domestic tranquillity of the
 church and state.","('Roman', 'NORP'), ('1', 'CARDINAL'), ('first', 'ORDINAL'), ('Jovian', 'NORP')"
"The Roman province was reduced 
 to the state of civilised and peaceful servitude: the rights
 of savage freedom were contracted to the narrow limits of
 Caledonia.","('Roman', 'NORP'), ('Caledonia', 'GPE')"
"The Romans at
 length prevailed, with the loss of about twelve hundred men.","('Romans', 'NORP'), ('about twelve hundred', 'CARDINAL')"
"The Saxon boats drew so little water that
 they could easily proceed four-score or an hundred miles up
 the great rivers; their weight was so inconsiderable that
 they were transported on waggons from one river to another;
 and the pirates who had entered the mouth of the Seine or of
 the Rhine might descend,  A.D. 371 with the rapid stream of the Rhone,
 into the Mediterranean.","('Saxon', 'NORP'), ('four-score or an hundred miles', 'QUANTITY'), ('one', 'CARDINAL'), ('Seine', 'LOC'), ('Rhine', 'LOC'), ('A.D. 371', 'FAC'), ('Rhone', 'LOC'), ('Mediterranean', 'LOC')"
"The Saxons, surrounded and outnumbered, were forced to
 relinquish their spoil, and to yield a select band of their
 tall and robust youth to serve in the Imperial armies.","('Saxons', 'NORP'), ('Imperial', 'NORP')"
"The Scots and Picts. 
 II.","('Scots', 'NORP'), ('Picts', 'NORP')"
"The acclamations of the
 people seated him once more on the archiepiscopal throne,
 and he wisely accepted or anticipated the invitation of
 Jovian.","('Jovian', 'PERSON')"
"The active policy of Valentinian was
 continually employed in adding new fortifications to the
 security of the frontier; but the abuse of this policy
 provoked the just resentment of the barbarians.","('Valentinian', 'GPE')"
"The aged Sallust, who had long observed the irregular
 fluctuations of popular assemblies, proposed, under pain of
 death, that none of those persons whose rank in the service
 might excite a party in their favour, should appear in
 public on the day of the inauguration","('Sallust', 'PERSON'), ('the day', 'DATE')"
"The alliance of Faustina, the widow of the
 emperor Constantius, who intrusted herself and her daughter
 to the hands of the usurper, added dignity and reputation to
 his cause.","('Faustina', 'PERSON'), ('Constantius', 'PERSON')"
"The ambassadors of the Alemanni had been offended by the
 harsh and haughty behaviour of Ursacius, master of the
 offices;(88) who, by an act of unseasonable parsimony, had 
 diminished the value, as well as the quantity, of the
 presents to which they were entitled, either from custom or
 treaty, on the accession of a new emperor.","('Alemanni', 'PERSON'), ('Ursacius', 'PERSON'), ('88', 'CARDINAL')"
"The ancients, who had a
 very faint and imperfect knowledge of the great peninsula of
 Africa, were sometimes tempted to believe that the torrid
 zone must ever remain destitute of inhabitants;(126) and they 
 sometimes amused their fancy by filling the vacant space
 with headless men, or rather monsters,(127) with horned and 
 cloven-footed satyrs,(128) with fabulous centaurs,(129) and 
 with human pigmies, who waged a bold and doubtful warfare
 against the cranes. (130)","('Africa', 'LOC'), ('126', 'CARDINAL'), ('127', 'CARDINAL'), ('128', 'CARDINAL'), ('129', 'CARDINAL'), ('130', 'CARDINAL')"
"The appellation of
 Hendinos was given to the king or general, and the title
 of Sinistus to the high-priest of the nation.","('Hendinos', 'PERSON'), ('Sinistus', 'PERSON')"
"The archbishop, who asserted,
 with inflexible pride, (72) the truth of his opinions and the dignity of his rank, was left in the free possession of his conscience and his throne.","('72', 'CARDINAL')"
"The art of magic, as it
 was more cruelly punished, was more strictly proscribed: but
 the emperor admitted a formal distinction to protect the
 ancient methods of divination, which were approved by the
 senate and exercised by the Tuscan haruspices.","('Tuscan', 'NORP')"
"The arts of magic were equally 
 condemned by the public opinion and by the laws of Rome,
 but, as they tended to gratify the most imperious passions
 of the heart of man, they were continually proscribed and
 continually practised.(48)","('Rome', 'GPE')"
"The banks of the Rhine, from its source to the 
 straits of the ocean, were closely planted with strong
 castles and convenient towers; new works and new arms were
 invented by the ingenuity of a prince who was skilled in the
 mechanical arts; and his numerous levies of Roman and
 barbarian youth were severely trained in all the exercises
 of war.","('Rhine', 'FAC'), ('Roman', 'NORP')"
"The body of Jovian 
 was sent to Constantinople to be interred with his
 predecessors, and the sad procession was met on the road by
 his wife Charito, the daughter of Count Lucillian, who still
 wept the recent death of her father, and was hastening to
 dry her tears in the embraces of an Imperial husband.","('Jovian', 'PERSON'), ('Constantinople', 'GPE'), ('Charito', 'PERSON'), ('Lucillian', 'PERSON'), ('Imperial', 'NORP')"
"The body of the people was infected with
 a spirit of discontent: they regretted the justice and the
 abilities of Sallust, who had been imprudently dismissed
 from the praefecture of the East.","('Sallust', 'PERSON'), ('East', 'LOC')"
"The cages of those trusty guards were always placed near the bed-chamber of Valentinian, who frequently amused his eyes with the grateful spectacle of seeing them tear and devour the bleeding limbs of the malefactors who were abandoned to their rage.","('Valentinian', 'NORP')"
"The calamities which the afflicted provincials 
 continued to experience from foreign war and domestic
 tyranny were aggravated by the feeble and corrupt
 administration of the eunuchs of Constantius; and the
 transient relief which they might obtain from the virtues of
 Julian was soon lost by the absence and death of their
 benefactor.","('Constantius', 'ORG'), ('Julian', 'PERSON')"
"The cause of the Gothic war, A.D. 366","('the Gothic war', 'EVENT'), ('A.D. 366', 'DATE')"
"The celerity and success
 with which he executed an important commission recommended
 him to the favour of Jovian, and to the honourable command
 of the second school, or company, of Targeteers of the
 domestic guards.","('Jovian', 'NORP'), ('second', 'ORDINAL'), ('Targeteers', 'ORG')"
"The charge of the Tripolitans was declared to
 be false and frivolous, and Palladius himself was sent back
 from Treves to Africa with a special commission to discover
 and prosecute the authors of this impious conspiracy against
 the representatives of the sovereign.","('Tripolitans', 'PERSON'), ('Palladius', 'PERSON'), ('Treves', 'LOC'), ('Africa', 'LOC')"
"The circumstantial narrative has been composed by the friends and admirers of Basil; and as soon as we have
 stripped away a thick coat of rhetoric and miracle, we shall
 be astonished by the unexpected mildness of the Arian tyrant, who admired the firmness of his character, or was apprehensive, if he employed violence, of a general revolt in the province of Cappadocia.","('Basil', 'PERSON'), ('Arian', 'NORP'), ('Cappadocia', 'GPE')"
"The citizens of
 London, who had almost despaired of their safety, threw open
 their gates, and, as soon as Theodosius had obtained from
 the court of Treves the important aid of a military
 lieutenant and a civil governor, he executed with wisdom and
 vigour the laborious task of the deliverance of Britain.","('London', 'GPE'), ('Theodosius', 'PERSON'), ('Treves', 'PERSON'), ('Britain', 'GPE')"
"The city of Artogerassa(134) was the only place of 
 Armenia which presumed to resist the effort of his arms.","('Artogerassa', 'GPE'), ('134', 'CARDINAL'), ('Armenia', 'GPE')"
"The coarse and
 undistinguishing pencil of Ammianus has delineated his
 bloody figures with tedious and disgusting accuracy.","('Ammianus', 'PERSON')"
"The consternation of the Pagan world was dispelled by a wise and gracious edict of toleration, in which Jovian explicitly declared that, although he should severely punish
 the sacrilegious rites of magic, his subjects might
 exercise, with freedom and safety, the ceremonies of the
 ancient worship.","('Pagan', 'NORP'), ('Jovian', 'PERSON')"
"The contending parties supported their
 claims by mutual reproaches of perfidy and ambition; and it
 should seem that the original treaty was expressed in very
 obscure terms, since they were reduced to the necessity of
 making their inconclusive appeal to the partial testimony of
 the generals of the two nations who had assisted at the
 negotiations.(136)","('two', 'CARDINAL'), ('136', 'CARDINAL')"
"The country was alarmed, and the two roads, which were only
 separated by an interval of three miles, had been occupied
 by a thousand archers on horseback, under the command of a
 count and a tribune.","('two', 'CARDINAL'), ('three miles', 'QUANTITY'), ('a thousand', 'CARDINAL')"
The cruelty of Valentinian and Valens.,"('Valentinian', 'NORP'), ('Valens', 'PERSON')"
"The cultivation of the earth might introduce a
 more accurate separation of property, and the habits of a
 sedentary life; but the love of arms and rapine was still
 the ruling passion of the Picts, and their warriors, who
 stripped themselves for a day of battle, were distinguished,
 in the eyes of the Romans, by the strange fashion of
 painting their naked bodies with gaudy colours and fantastic
 figures.","('Picts', 'NORP'), ('Romans', 'NORP')"
"The death of Athanasius was the signal of the
 persecution of Egypt; and the Pagan minister of Valens, who
 forcibly seated the worthless Lucius on the archiepiscopal
 throne, purchased the favour of the reigning party by the
 blood and sufferings of their Christian brethren.","('Athanasius', 'PERSON'), ('Egypt', 'GPE'), ('Pagan', 'NORP'), ('Valens', 'PERSON'), ('Lucius', 'PERSON'), ('Christian', 'NORP')"
"The decent, but peremptory, refusal of these
 extravagant demands was signified to the barbarians by
 Victor, master-general of the cavalry, who expressed, with
 force and dignity, the just complaints of the emperor of the
 East.(146)","('Victor', 'PERSON'), ('146', 'CARDINAL')"
"The dispassionate
 judgment of the Western emperor could clearly perceive, and
 accurately pursue, his own and the public interest; and the
 sovereign of the East, who imitated with equal docility the
 various examples which he received from his elder brother,
 was sometimes guided by the wisdom and virtue of the
 praefect Sallust.","('Western', 'NORP'), ('East', 'LOC'), ('Sallust', 'PERSON')"
"The disputed 
 possession of some salt-pits(98) engaged the Alemanni and the 
 Burgundians in frequent contests: the latter were easily
 tempted by the secret solicitations and liberal offers of
 the emperor; and their fabulous descent from the Roman
 soldiers who had formerly been left to garrison the
 fortresses of Drusus was admitted with mutual credulity, as
 it was conducive to mutual interest. (99)","('98', 'CARDINAL'), ('Alemanni', 'PERSON'), ('Burgundians', 'NORP'), ('Roman', 'NORP'), ('Drusus', 'PERSON')"
"The domestic assassin was instigated and protected
 by the Romans; (92) and the violation of the laws of humanity 
 and justice betrayed their secret apprehension of the
 weakness of the declining empire.","('Romans', 'NORP'), ('92', 'CARDINAL')"
"The eagerness of the troops, who pressed
 him to nominate his colleague, was justified by the
 dangerous situation of public affairs; and Valentinian
 himself was conscious that the abilities of the most active
 mind were unequal to the defence of the distant frontiers of
 an invaded monarchy.","('Valentinian', 'NORP')"
"The eastern coast of Caledonia may be considered as a
 level and fertile country, which, even in a rude state of
 tillage, was capable of producing a considerable quantity of
 corn; and the epithet of cruitnich, or wheat-eaters,
 expressed the contempt or envy of the carnivorous
 highlander.","('Caledonia', 'GPE')"
"The emperor Valens, who respected the obligations of the
 treaty, and who was apprehensive of involving the East in a
 dangerous war, ventured with slow and cautious measures, to
 support the Roman party in the kingdoms of Iberia and
 Armenia.","('Valens', 'PERSON'), ('East', 'LOC'), ('the Roman party', 'ORG'), ('Iberia', 'LOC'), ('Armenia', 'GPE')"
"The emperor could not sustain
 the indiscreet and malicious raillery of the people of
 Antioch.(11) He was impatient to possess the palace of 
 Constantinople, and to prevent the ambition of some
 competitor who might occupy the vacant allegiance of Europe;
 but he soon received the grateful intelligence that his
 authority was acknowledged from the Thracian Bosphorus to
 the Atlantic ocean.","('Antioch', 'GPE'), ('Constantinople', 'GPE'), ('Europe', 'LOC'), ('the Thracian Bosphorus', 'LOC'), ('Atlantic', 'LOC')"
"The emperor devoutly assisted at
 the solemn service of the cathedral; and, instead of a
 sentence of banishment, subscribed the donation of a
 valuable estate for the use of an hospital which Basil had
 lately founded in the neighbourhood of Casarea.(73) 3. I am not able to discover that any law (such as Theodosius afterwards enacted against the Arians) was published by Valens against the Athanasian sectaries; and the edict which
 excited the most violent clamours may not appear so extremely reprehensible.","('Basil', 'PERSON'), ('Casarea', 'GPE'), ('73', 'CARDINAL'), ('3', 'CARDINAL'), ('Theodosius', 'PERSON'), ('Arians', 'PERSON'), ('Valens', 'PERSON'), ('Athanasian', 'NORP')"
"The emperor had observed that several of his subjects, gratifying their lazy disposition under the pretence of religion, had associated themselves
 with the monks of Egypt; and he directed the count of the East to drag them from their solitude, and to compel those deserters of society to accept the fair alternative of renouncing their temporal possessions, or of discharging the public duties of men and citizens.","('Egypt', 'GPE'), ('East', 'LOC')"
"The emperor himself, with a light and
 unencumbered band, condescended to pass the Rhine, marched
 fifty miles into the country, and would infallibly have
 seized the object of his pursuit, if his judicious measures
 had not been defeated by the impatience of the troops.","('Rhine', 'LOC'), ('fifty miles', 'QUANTITY')"
"The emperor in person, accompanied by his son
 Gratian, passed the Rhine at the head of a formidable army,
 which was supported on both flanks by Jovinus and Severus,
 the two master-generals of the cavalry and infantry of the
 West.","('Gratian', 'PERSON'), ('Rhine', 'LOC'), ('Jovinus', 'PERSON'), ('Severus', 'PERSON'), ('two', 'CARDINAL'), ('West', 'LOC')"
"The emperor of the West established his temporary
 residence at Milan, and the emperor of the East returned to
 Constantinople to assume the dominion of fifty provinces, of
 whose language he was totally ignorant.(33)
Revolt of Procopius.","('West', 'LOC'), ('Milan', 'GPE'), ('East', 'LOC'), ('Constantinople', 'GPE'), ('fifty', 'CARDINAL'), ('Revolt of Procopius', 'WORK_OF_ART')"
"The emperor of the West, who had resigned to his brother the
 command of the Lower Danube, reserved for his immediate care
 the defence of the Rhaetian and Illyrian provinces, which
 spread so many hundred miles along the greatest of the
 European rivers.","('West', 'LOC'), ('the Lower Danube', 'LOC'), ('Rhaetian', 'NORP'), ('Illyrian', 'NORP'), ('so many hundred miles', 'QUANTITY'), ('European', 'NORP')"
"The emperor, who suppressed his displeasure without altering his intention, slowly proceeded from Nice to Nicomedia and Constantinople.","('Nice to Nicomedia and Constantinople', 'ORG')"
"The emperors Gratian, and Valentinian II","('Gratian', 'PERSON'), ('Valentinian II', 'PERSON')"
"The empress
 Justina, who had been left in a palace about one hundred
 miles from Bregetio, was respectfully invited to appear in
 the camp with the son of the deceased emperor.","('Justina', 'PERSON'), ('about one hundred\r\n miles', 'QUANTITY'), ('Bregetio', 'GPE')"
"The enemies of
 Athanasius attempted to disturb the last years of his
 venerable age; and his temporary retreat to his father's
 sepulchre has been celebrated as a fifth exile.","('Athanasius', 'PERSON'), ('the last years', 'DATE'), ('fifth', 'ORDINAL')"
"The episcopal leaders of the contending sects,
 convinced from experience how much their fate would depend
 on the earliest impressions that were made on the mind of an
 untutored soldier, hastened to the court of Edessa, or
 Antioch.","('Edessa', 'PERSON'), ('Antioch', 'GPE')"
"The execution of the bloody deed was committed to
 the subtle prudence of Count Trajan, and he had the merit of
 insinuating himself into the confidence of the credulous
 prince, that he might find an opportunity of stabbing him to
 the heart.","('Trajan', 'PERSON')"
"The expedition, A.D. 375,  
 The mind of Valentinian, who then resided at Treves, was
 deeply affected by the calamities of Illyricum, but the
 lateness of the season suspended the execution of his
 designs till the ensuing spring.","('A.D. 375', 'DATE'), ('Valentinian', 'NORP'), ('Treves', 'PERSON'), ('Illyricum', 'NORP'), ('the season', 'DATE'), ('the ensuing spring', 'DATE')"
"The expressions which issued the most readily from the mouth of the emperor of the West were, ""Strike off his head;"" — ""Burn him alive;""","('West', 'LOC')"
"The extreme devastation and promiscuous
 massacre of a savage war were justified in the eyes of the
 emperor, and perhaps in those of the world, by the cruel
 equity of retaliation; (153) and such was the discipline of the Romans, and the consternation of the enemy, that Valentinian repassed the Danube without the loss of a single
 man.","('153', 'CARDINAL'), ('Romans', 'NORP'), ('Valentinian', 'NORP'), ('Danube', 'LOC')"
"The fabulous colonies of Egyptians and Trojans, of
 Scandinavians and Spaniards, which flattered the pride and
 amused the credulity of our rude ancestors, have insensibly
 vanished in the light of science and philosophy.(108)","('Egyptians', 'NORP'), ('Trojans', 'NORP'), ('Scandinavians', 'NORP'), ('Spaniards', 'NORP'), ('108', 'CARDINAL')"
