Sentence,Entities
"Mirza Mehemmed Sultan, the eldest and best
 beloved of his grandsons, was despatched to Boursa, with
 thirty thousand horse; and such was his youthful ardour, that
 he arrived with only four thousand at the gates of the
 capital, after performing in five days a march of two
 hundred and thirty miles.","('Mirza Mehemmed Sultan', 'PERSON'), ('Boursa', 'GPE'), ('thirty thousand', 'CARDINAL'), ('only four thousand', 'CARDINAL'), ('five days', 'DATE'), ('two\r\n hundred and thirty miles', 'QUANTITY')"
"Moscow trembled at the approach of the Tartar, and the resistance would have been feeble, since the hopes of the Russians were placed in a miraculous image of the Virgin, to whose protection they ascribed the casual and voluntary retreat of the conqueror.","('Moscow', 'GPE'), ('Tartar', 'NORP'), ('Russians', 'NORP'), ('Virgin', 'PERSON')"
"Mousa fled in
 disguise from the palace of Boursa; traversed the Propontis
 in an open boat; wandered over the Walachian and Servian
 hills; and after some vain attempts, ascended the throne of
 Adrianople, so recently stained with the blood of Soliman.","('Mousa', 'PERSON'), ('Boursa', 'GPE'), ('Propontis', 'FAC'), ('Walachian', 'LOC'), ('Servian\r\n hills', 'LOC'), ('Adrianople', 'GPE'), ('Soliman', 'PERSON')"
"Neither age,
 nor the severity of the winter, could retard the impatience
 of Timour; he mounted on horseback, passed the Sihoon on the
 ice, marched seventy-six parasangs, three hundred miles,
 from his capital, and pitched his last camp in the
 neighbourhood of Otrar, where he was expected by the angel of
 death.","('the winter', 'DATE'), ('Timour', 'PERSON'), ('Sihoon', 'NORP'), ('seventy-six parasangs', 'QUANTITY'), ('three hundred miles', 'QUANTITY'), ('Otrar', 'GPE')"
"No more than fourteen or fifteen guards remained near the standard of Timour: he stood firm as a rock, and received on his helmet two weighty strokes of a cimeter: (15) the Moguls rallied; the head of Mansour was thrown at his feet; and he declared his esteem of the valour of a foe, by extirpating all the males of so intrepid a race.","('more than fourteen or fifteen', 'CARDINAL'), ('Timour', 'PERSON'), ('two', 'CARDINAL'), ('15', 'CARDINAL'), ('Moguls', 'PERSON'), ('Mansour', 'PERSON')"
"No sooner had Timour reunited to the patrimony of Zagatai the dependent countries of Carizme and Candahar, than he turned his eyes towards the kingdoms of Iran or Persia.","('Timour', 'PERSON'), ('Zagatai', 'GPE'), ('Carizme', 'GPE'), ('Candahar', 'GPE'), ('Iran', 'GPE'), ('Persia', 'GPE')"
"No sooner was Timour informed that
 the captive Ottoman was at the door of his tent, than he
 graciously stepped forwards to receive him, seated him by
 his side, and mingled with just reproaches a soothing pity
 for his rank and misfortune.","('Timour', 'PERSON'), ('Ottoman', 'NORP')"
"Nor can the
 victory appear doubtful, if we compare the discipline and
 exercise of the Janizaries with the pride of birth, the
 independence of chivalry, the ignorance of the new levies,
 the mutinous temper of the veterans, and the vices of
 intemperance and disorder, which so long contaminated the
 armies of Europe.","('Janizaries', 'NORP'), ('Europe', 'LOC')"
"Nor was it possible to circumscribe the secret within the pale of the church; it was disclosed to the Turks by the treachery of apostates and the selfish policy of rivals; and the sultans had sense to adopt, and wealth to reward, the talents of a Christian engineer.","('Turks', 'NORP'), ('Christian', 'NORP')"
"Of his
 exploits and discipline Poggius was informed by several
 ocular witnesses; nor does he forget an example so apposite
 to his theme as the Ottoman monarch, whom the Scythian
 confined like a wild beast in an iron cage, and exhibited a
 spectacle to Asia.","('Poggius', 'PERSON'), ('Ottoman', 'NORP'), ('Scythian', 'NORP'), ('Asia', 'LOC')"
"On a sudden, he was astonished and rejoiced by
 the intelligence of the retreat, the overthrow, and the
 captivity of the Ottoman.","('Ottoman', 'NORP')"
"On his descent from the hills, the emperor gave audience to the first ambassadors of Bajazet, and opened the hostile correspondence of complaints and menaces, which
 fermented two years before the final explosion.","('first', 'ORDINAL'), ('Bajazet', 'GPE'), ('two years', 'DATE')"
"On his return to his native country, Timour was successively joined by the parties of his confederates, who anxiously sought him in the desert; nor can I refuse to describe, in his pathetic simplicity, one of their fortunate encounters.","('Timour', 'PERSON'), ('one', 'CARDINAL')"
"On the arrival of the harem from Boursa, Timour restored the queen Despina and her daughter to their father and husband; but he piously required, that the Servian princess, who had hitherto been indulged in the profession of Christianity, should embrace
 without delay the religion of the prophet.","('Boursa', 'PERSON'), ('Timour', 'PERSON'), ('Despina', 'PERSON'), ('Servian', 'NORP'), ('Christianity', 'NORP')"
"On the banks of the Don, or Tanais, he received an humble deputation from the consuls and merchants of Egypt, (21) Venice, Genoa, Catalonia, and Biscay, who occupied the commerce and city of Tana, or Azoph, at the mouth of the river.","('Don', 'FAC'), ('Tanais', 'ORG'), ('Egypt', 'GPE'), ('21', 'CARDINAL'), ('Venice', 'GPE'), ('Genoa', 'GPE'), ('Catalonia', 'GPE'), ('Biscay', 'GPE'), ('Tana', 'GPE'), ('Azoph', 'GPE')"
"On the eastern bank of the Hyphasis, on the edge of the desert, the Macedonian hero halted and wept: the Mogul entered the desert, reduced the fortress of Batmir, and stood in arms before the gates of Delhi, a great and flourishing city, which had subsisted three centuries under the dominion of the Mahometan kings.","('Hyphasis', 'LOC'), ('Macedonian', 'NORP'), ('Mogul', 'PERSON'), ('Batmir', 'PERSON'), ('Delhi', 'GPE'), ('three centuries', 'DATE'), ('Mahometan', 'NORP')"
"On the throne of Samarcand, (63) he displayed, in a short repose, his magnificence and power; listened to the
 complaints of the people; distributed a just measure of
 rewards and punishments; employed his riches in the
 architecture of palaces and temples; and gave audience to
 the ambassadors of Egypt, Arabia, India, Tartary, Russia,
 and Spain, the last of whom presented a suit of tapestry
 which eclipsed the pencil of the Oriental artists.","('Samarcand', 'PERSON'), ('63', 'DATE'), ('Egypt', 'GPE'), ('Arabia', 'GPE'), ('India', 'GPE'), ('Tartary', 'GPE'), ('Russia', 'GPE'), ('Spain', 'GPE'), ('Oriental', 'NORP')"
"On this great
 occasion, they forgot the difference of religion, to act
 with union and firmness in the common cause: the double
 straits were guarded with ships and fortifications; and they
 separately withheld the transports which Timour demanded of
 either nation, under the pretence of attacking their enemy.","('Timour', 'PERSON')"
"On this refusal, the Byzantine councils were
 divided; but the age and caution of Manuel yielded to the
 presumption of his son John; and they unsheathed a dangerous
 weapon of revenge, by dismissing the true or false Mustapha,
 who had long been detained as a captive and hostage, and for
 whose maintenance they received an annual pension of three
 hundred thousand aspers. (81)","('Byzantine', 'NORP'), ('Manuel', 'PERSON'), ('John', 'PERSON'), ('Mustapha', 'PERSON'), ('annual', 'DATE'), ('three\r\n hundred thousand', 'CARDINAL')"
"Our imagination is not less
 astonished by the portrait of a Mogul, who, in his camp
 before Smyrna, meditates, and almost accomplishes, the
 invasion of the Chinese empire. (61)","('Mogul', 'PERSON'), ('Smyrna', 'GPE'), ('Chinese', 'NORP')"
Peace and justice had been banished from the land above forty years; and the Mogul invader might seem to listen to the cries of an oppressed people.,"('forty years', 'DATE'), ('Mogul', 'PERSON')"
Restoration of the Turkish Monarchy by Mahomet the First.,"('Turkish', 'NORP'), ('Mahomet', 'PERSON'), ('First', 'ORDINAL')"
"Reunion of the Ottoman empire, A.D. 1421.","('Ottoman', 'NORP'), ('A.D. 1421', 'DATE')"
"Revenge prompted him to burn the cities of  Serai and Astrachan, the monuments of rising civilization; and his vanity proclaimed, that he had penetrated to the region of perpetual daylight, a strange phenomenon, which authorized his Mahometan doctors to dispense with the obligation of evening prayer. (23)
III of Hindostan, A.D. 1398-1399","('Serai', 'GPE'), ('Astrachan', 'GPE'), ('Mahometan', 'NORP'), ('evening', 'TIME'), ('Hindostan', 'GPE'), ('1398-1399', 'CARDINAL')"
"Shah Mansour, prince of Fars, or the proper Persia, was one of the least powerful, but most dangerous, of his enemies.","('Shah Mansour', 'PERSON'), ('Fars', 'NORP'), ('Persia', 'GPE'), ('one', 'CARDINAL')"
Siege of Constantinople by Amurath the Second.,"('Constantinople', 'GPE'), ('Amurath', 'PERSON'), ('Second', 'ORDINAL')"
"Since the reign of Aurungzebe, their
 empire had been dissolved; their treasures of Delhi have
 been rifled by a Persian robber; and the richest of their
 kingdoms is now possessed by a company of Christian
 merchants, of a remote island in the Northern Ocean.","('Aurungzebe', 'GPE'), ('Delhi', 'GPE'), ('Persian', 'NORP'), ('Christian', 'NORP'), ('the Northern Ocean', 'LOC')"
"Soliman is
 not numbered in the list of the Turkish emperors: yet he
 checked the victorious progress of the Moguls; and after
 their departure, united for a while the thrones of
 Adrianople and Boursa.","('Soliman', 'PERSON'), ('Turkish', 'NORP'), ('Moguls', 'ORG'), ('Adrianople', 'PERSON'), ('Boursa', 'PERSON')"
"Soliman saluted the
 emperor by the name of father; solicited at his hands the
 government or gift of Romania; and promised to deserve his
 favour by inviolable friendship, and the restitution of
 Thessalonica, with the most important places along the
 Strymon, the Propontis, and the Black Sea.","('Soliman', 'PERSON'), ('Romania', 'GPE'), ('Thessalonica', 'GPE'), ('Strymon', 'LOC'), ('Propontis', 'LOC'), ('the Black Sea', 'LOC')"
"Soliman, the son of
 Bajazet, implored his clemency for his father and himself;
 accepted, by a red patent, the investiture of the kingdom of
 Romania, which he already held by the sword; and reiterated
 his ardent wish, of casting himself in person at the feet of
 the king of the world.","('Soliman', 'PERSON'), ('Bajazet', 'PERSON'), ('Romania', 'GPE')"
"State of the Greek empire, A.D. 1402-1425.","('Greek', 'NORP'), ('A.D. 1402-1425', 'DATE')"
"Such is the portrait of a generous conqueror, which has been
 extracted from his own memorials, and dedicated to his son
 and grandson, nineteen years after his decease; (47) and, at
 a time when the truth was remembered by thousands, a
 manifest falsehood would have implied a satire on his real
 conduct.","('nineteen years', 'DATE'), ('47', 'DATE'), ('thousands', 'CARDINAL')"
"Such is the separation of language, that the testimony of a Greek is not less independent than that of a Latin or an Arab.","('Greek', 'NORP'), ('Latin', 'LANGUAGE'), ('Arab', 'NORP')"
"Tartary, and, III.","('Tartary', 'ORG')"
"Term of the conquests of Timour, A.D. 1403.","('Timour', 'GPE'), ('A.D. 1403', 'DATE')"
"The
 conqueror of Hindostan ostentatiously showed a line of
 elephants, the trophies, rather than the instruments, of
 victory; the use of the Greek fire was familiar to the
 Moguls and Ottomans; but had they borrowed from Europe the
 recent invention of gunpowder and cannon, the artificial
 thunder, in the hands of either nation, must have turned the
 fortune of the day.","('Hindostan', 'GPE'), ('Greek', 'NORP'), ('Moguls', 'NORP'), ('Ottomans', 'NORP'), ('Europe', 'LOC'), ('the day', 'DATE')"
"The
 final victory of Mahomet was the just recompense of his
 prudence and moderation.","('Mahomet', 'PERSON')"
"The
 marriage of six of the emperor's grandsons was esteemed an
 act of religion as well as of paternal tenderness; and the
 pomp of the ancient caliphs was revived in their nuptials.","('six', 'CARDINAL')"
"The
 race of Timour would have been extinct, if a hero, his
 descendant in the fifth degree, had not fled before the
 Uzbek arms to the conquest of Hindostan.","('Timour', 'PERSON'), ('fifth', 'ORDINAL'), ('Uzbek', 'NORP'), ('Hindostan', 'GPE')"
"The
 recent expulsion of the house of Zingis was an insult on the
 Mogul name; and the disorders of the empire afforded the
 fairest opportunity for revenge.","('Zingis', 'PERSON'), ('Mogul', 'PERSON')"
"The
 torrents which he had shed of Mussulman blood could be
 expiated only by an equal destruction of the infidels; and
 as he now stood at the gates of paradise, he might best
 secure his glorious entrance by demolishing the idols of
 China, founding mosques in every city, and establishing the
 profession of faith in one God, and his prophet Mahomet.","('Mussulman', 'NORP'), ('China', 'GPE'), ('one', 'CARDINAL'), ('Mahomet', 'PERSON')"
"The Genoese, who transported Amurath into Europe, must be accused as his preceptors; and it was probably by their hands that his cannon was cast and directed at the siege of Constantinople. (93)","('Genoese', 'PERSON'), ('Amurath', 'PERSON'), ('Europe', 'LOC'), ('Constantinople', 'GPE')"
"The Greek emperor (60) (either John or
 Manuel) submitted to pay the same tribute which he had
 stipulated with the Turkish sultan, and ratified the treaty
 by an oath of allegiance, from which he could absolve his
 conscience so soon as the Mogul arms had retired from
 Anatolia.","('Greek', 'NORP'), ('60', 'CARDINAL'), ('John', 'PERSON'), ('Manuel', 'PERSON'), ('Turkish', 'NORP'), ('Mogul', 'PERSON'), ('Anatolia', 'LOC')"
"The Mogul and Ottoman conquests now touched each other in the neighbourhood of Erzerum, and the
 Euphrates; nor had the doubtful limit been ascertained by time and treaty.","('Mogul', 'PERSON'), ('Ottoman', 'NORP'), ('Erzerum', 'GPE'), ('Euphrates', 'LOC')"
"The Mogul army moved in three great divisions; and Timour observes with pleasure, that the ninety-two squadrons of a thousand horse most fortunately corresponded with the ninety-two names or epithets of the prophet Mahomet.","('Mogul', 'PERSON'), ('three', 'CARDINAL'), ('Timour', 'PERSON'), ('ninety-two', 'CARDINAL'), ('a thousand', 'CARDINAL'), ('ninety-two', 'CARDINAL'), ('Mahomet', 'PERSON')"
"The Mogul prince was a zealous Mussulman; but his Persian schools had taught him to revere
 the memory of Ali and Hosein; and he had imbibed a deep prejudice against the Syrians, as the enemies of the son of the daughter of the apostle of God.","('Mogul', 'PERSON'), ('Mussulman', 'NORP'), ('Persian', 'NORP'), ('Ali', 'PERSON'), ('Hosein', 'PERSON'), ('Syrians', 'NORP')"
"The Moslems of Asia rejoiced in their deliverance from a
 dangerous and domestic foe; and a parallel was drawn between
 the two rivals, by observing that Timour, in fourteen days,
 had reduced a fortress which had sustained seven years the
 siege, or at least the blockade, of Bajazet. (45)","('Moslems', 'NORP'), ('Asia', 'LOC'), ('two', 'CARDINAL'), ('Timour', 'PERSON'), ('fourteen days', 'DATE'), ('seven years', 'DATE'), ('Bajazet', 'GPE'), ('45', 'CARDINAL')"
"The Ottoman candidates were
 trained by the virtues of abstinence to those of action; by
 the habits of submission to those of command.","('Ottoman', 'NORP')"
The Ottoman princes were lodged in a splendid pavilion; and the respect of the guards could be surpassed only by their vigilance.,"('Ottoman', 'NORP')"
"The Ottomans cannot style themselves, like the Arabian caliphs, the descendants or successors of the apostle of God; and the kindred which they claim with the Tartar khans of the house of Zingis appears to be founded in flattery rather than in truth.","('Ottomans', 'NORP'), ('Arabian', 'NORP'), ('Tartar', 'NORP'), ('Zingis', 'PERSON')"
"The Syrian emirs (34) were assembled at Aleppo to repel the invasion: they confided in the fame and discipline of the Mamalukes, in the temper of their swords and lances of the purest steel of Damascus, in the strength of their walled cities, and in the populousness of sixty thousand villages; and instead of sustaining a siege, they threw open their gates, and arrayed their forces in the plain.","('Syrian', 'NORP'), ('34', 'CARDINAL'), ('Aleppo', 'GPE'), ('Mamalukes', 'NORP'), ('Damascus', 'GPE'), ('sixty thousand', 'CARDINAL')"
"The Tartar followed
 the impulse of ambition; and the deliverance of
 Constantinople was the accidental consequence.","('Tartar', 'NORP'), ('Constantinople', 'GPE')"
"The alliance of
 Soliman exposed the emperor to the enmity and revenge of
 Mousa: the Turks appeared in arms before the gates of
 Constantinople; but they were repulsed by sea and land; and
 unless the city was guarded by some foreign mercenaries, the
 Greeks must have wondered at their own triumph.","('Soliman', 'PERSON'), ('Mousa', 'PERSON'), ('Turks', 'NORP'), ('Constantinople', 'GPE'), ('Greeks', 'NORP')"
"The ambassadors of the
 son of Bajazet were soon introduced to his presence; but
 their pride was fallen, their tone was modest: they were
 awed by the just apprehension, lest the Greeks should open
 to the Moguls the gates of Europe.","('Bajazet', 'PERSON'), ('Greeks', 'NORP'), ('Moguls', 'ORG'), ('Europe', 'LOC')"
"The birth and power of emir Houssein compelled him to accept a vicious and unworthy colleague, whose sister was the best beloved of his wives.","('Houssein', 'PERSON')"
"The castle, in Asiatic warfare, was esteemed
 impregnable; and the city of Amasia, (74) which is equally
 divided by the River Iris, rises on either side in the form
 of an amphitheatre, and represents on a smaller scale the
 image of Bagdad.","('Asiatic', 'NORP'), ('Amasia', 'GPE'), ('74', 'CARDINAL'), ('the River Iris', 'LOC'), ('Bagdad', 'GPE')"
"The chemists of China or Europe had found, by casual or elaborate experiments, that a mixture of saltpetre, sulphur, and charcoal, produces, with a spark of fire, a tremendous explosion.","('China', 'GPE'), ('Europe', 'LOC')"
"The chiefs of the law and of the
 army had pledged their salvation to support him with their
 lives and fortunes; but in the hour of danger they were
 silent and afraid; and, after waiting seven days on the
 hills of Samarcand, he retreated to the desert with only
 sixty horsemen.","('the hour', 'TIME'), ('seven days', 'DATE'), ('Samarcand', 'GPE'), ('only\r\n sixty', 'CARDINAL')"
"The city was reduced to ashes; the Moslems were pillaged and dismissed; but all the Christians, who had not fled to their ships, were condemned either to death or slavery. (22)","('Moslems', 'NORP'), ('Christians', 'NORP')"
The conquest and monarchy of the world was the first object of the ambition of TIMOUR.,"('first', 'ORDINAL')"
"The conquest of
 Kipzak, or the Western Tartary, (17) was founded on the
 double motive of aiding the distressed, and chastising the
 ungrateful.","('Kipzak', 'GPE'), ('the Western Tartary', 'LOC'), ('17', 'CARDINAL')"
"The dignity of Timour
 could not endure the impunity of the Getes: he passed the
 Sihoon, subdued the kingdom of Kashgar, and marched seven
 times into the heart of their country.","('Timour', 'PERSON'), ('Getes', 'PERSON'), ('Sihoon', 'PERSON'), ('Kashgar', 'GPE'), ('seven', 'CARDINAL')"
"The eight years of his sole and peaceful reign
 were usefully employed in banishing the vices of civil
 discord, and restoring on a firmer basis the fabric of the
 Ottoman monarchy.","('The eight years', 'DATE'), ('Ottoman', 'NORP')"
"The emperor John Palaeologus II. A.D. 1425, July 21 - 1448, October 31 .  and John Palaeologus was permitted to reign, for an annual tribute of three hundred thousand aspers, and the dereliction of almost all that he
 held beyond the suburbs of Constantinople.","('John Palaeologus II', 'PERSON'), ('A.D. 1425', 'DATE'), ('July 21 - 1448', 'DATE'), ('October 31', 'DATE'), ('John Palaeologus', 'PERSON'), ('three hundred thousand', 'CARDINAL'), ('Constantinople', 'GPE')"
"The emperor was at once
 the enemy of the two rivals; from whom he had sustained, and
 to whom he had offered, an injury; and the victory of
 Amurath was followed, in the ensuing spring, by the siege of
 Constantinople. (82)
Siege of Constantinople by Amurath II.","('two', 'CARDINAL'), ('Amurath', 'PERSON'), ('the ensuing spring', 'DATE'), ('Constantinople', 'GPE'), ('Siege of Constantinople', 'WORK_OF_ART')"
"The fame of Timour has pervaded the East and West: his
 posterity is still invested with the Imperial title; and the
 admiration of his subjects, who revered him almost as a
 deity, may be justified in some degree by the praise or
 confession of his bitterest enemies. (66)","('Timour', 'PERSON'), ('East', 'LOC'), ('West', 'LOC'), ('Imperial', 'NORP')"
"The fearless confidence of the sultan urged him to meet his antagonist; and, as if he had chosen that spot for revenge, he displayed his banner near the ruins of the unfortunate Suvas.","('Suvas', 'NORP')"
"The first attempt was indeed unsuccessful; but in the general warfare of the age, the advantage was on their side, who were most commonly the assailants: for a while the proportion of the attack and defence was suspended; and this thundering artillery was pointed against the walls and towers which had been erected only to resist the less potent engines of antiquity.","('first', 'ORDINAL')"
"The first epistle (28)
 of the Mogul emperor must have provoked, instead of reconciling, the Turkish sultan, whose family and nation he affected to despise. (29)","('first', 'ORDINAL'), ('28', 'CARDINAL'), ('Turkish', 'NORP')"
"The forces of Anatolia, loyal in their
 revolt, were drawn away to the banners of their lawful
 princes.","('Anatolia', 'LOC')"
"The four following observations will
 serve to appreciate his claim to the public gratitude; and
 perhaps we shall conclude, that the Mogul emperor was rather
 the scourge than the benefactor of mankind.","('four', 'CARDINAL'), ('Mogul', 'PERSON')"
"The fugitives were overtaken by a thousand
 Getes, whom he repulsed with incredible slaughter, and his
 enemies were forced to exclaim, ""Timour is a wonderful man:
 fortune and the divine favour are with him.""","('Getes', 'PERSON'), ('Timour', 'PERSON')"
"The general's eye watched over the field, and at
 his command the front and rear of the right and left wings
 successively moved forwards in their several divisions, and
 in a direct or oblique line: the enemy was pressed by
 eighteen or twenty attacks; and each attack afforded a
 chance of victory.","('eighteen or twenty', 'CARDINAL')"
"The highland robbers were subdued or extirpated; but great numbers of men and horses perished in the snow; the emperor himself was let down a precipice on a portable scaffold  the ropes were one hundred and fifty cubits in length; and before he could reach the bottom, this dangerous operation was five times repeated.","('one hundred and fifty cubits', 'QUANTITY'), ('five', 'CARDINAL')"
"The illustrious Hongvou,
 founder of the dynasty of Ming, died four years before the
 battle of Angora; and his grandson, a weak and unfortunate
 youth, was burnt in his palace, after a million of Chinese
 had perished in the civil war. (62)","('Hongvou', 'PERSON'), ('Ming', 'PERSON'), ('four years', 'DATE'), ('Angora', 'EVENT'), ('a million', 'CARDINAL'), ('Chinese', 'NORP'), ('62', 'CARDINAL')"
"The investiture of Mousa degraded him as the slave of the Moguls: his tributary kingdom of Anatolia was confined within a narrow limit, nor could his
 broken militia and empty treasury contend with the hardy and
 veteran bands of the sovereign of Romania.","('Mousa', 'PERSON'), ('Moguls', 'PERSON'), ('Anatolia', 'LOC'), ('Romania', 'GPE')"
"The iron cage in which Bajazet was imprisoned by Tamerlane,
 so long and so often repeated as a moral lesson, is now
 rejected as a fable by the modern writers, who smile at the
 vulgar credulity. (46)","('Bajazet', 'PERSON'), ('Tamerlane', 'PERSON')"
"The khans of Zagatai were extinct; the emirs aspired to independence; and their domestic feuds could only be suspended by the conquest and tyranny of the khans of Kashgar, who, with an army of Getes or Calmucks, (11) invaded the Transoxian kingdom.","('Zagatai', 'LOC'), ('Kashgar', 'GPE'), ('Getes', 'NORP'), ('Calmucks', 'NORP'), ('11', 'CARDINAL'), ('Transoxian', 'NORP')"
"The last evidence, in every sense, is that of the Turkish
 annals, which have been consulted or transcribed by
 Leunclavius, Pocock, and Cantemir. (57)","('Turkish', 'NORP'), ('Leunclavius, Pocock', 'ORG'), ('Cantemir', 'PERSON'), ('57', 'CARDINAL')"
"The losses
 and fatigues of the campaign obliged Timour to renounce the
 conquest of Palestine and Egypt; but in his return to the
 Euphrates he delivered Aleppo to the flames; and justified
 his pious motive by the pardon and reward of two thousand
 sectaries of Ali, who were desirous to visit the tomb of his
 son.","('Timour', 'PERSON'), ('Palestine', 'GPE'), ('Egypt', 'GPE'), ('Euphrates', 'LOC'), ('Aleppo', 'GPE'), ('two thousand', 'CARDINAL'), ('Ali', 'PERSON')"
"The military republic of the Mamalukes still reigned in Egypt and Syria: but the dynasty of the Turks was overthrown by that of the Circassians; (33) and their favourite Barkok, from a slave and a prisoner, was raised and restored to the throne.","('Mamalukes', 'NORP'), ('Egypt', 'GPE'), ('Syria', 'GPE'), ('Turks', 'NORP'), ('Circassians', 'NORP'), ('33', 'CARDINAL'), ('Barkok', 'PERSON')"
The name of Poggius the Italian (50) is deservedly famous among the revivers of learning in the fifteenth century.,"('Poggius the', 'PERSON'), ('Italian', 'LANGUAGE'), ('the fifteenth century', 'DATE')"
