Sentence,Entities
"But the
 Athenian monuments are silent; nor will it seem credible
 that the patricians should undertake a long and perilous
 navigation to copy the purest model of democracy.","('Athenian', 'NORP')"
"But the
 emperor was unable to fix his own inconstancy; and, while he
 boasted of renewing the exchange of Diomede, of transmuting
 brass into gold, (93) discovered the necessity of purifying
 his gold from the mixture of baser alloy.","('Diomede', 'PERSON'), ('93', 'DATE')"
"But the
 errors or vices of each praetor expired with his annual
 office; such maxims alone as had been approved by reason and practice were copied by succeeding judges; the rule of
 proceeding was defined by the solution of new cases; and the temptations of injustice were removed by the Cornelian law,
 which compelled the praetor of the year to adhere to the spirit and letter of his first proclamation.","('annual', 'DATE'), ('Cornelian', 'NORP'), ('the year', 'DATE'), ('first', 'ORDINAL')"
"But the
 exclusive, absolute, and perpetual dominion of the father
 over his children, is peculiar to the Roman jurisprudence,
 (102) and seems to be coeval with the foundation of the city.","('Roman', 'NORP'), ('102', 'CARDINAL')"
"But the
 goods of an alien or enemy were lawfully exposed to the
 first hostile occupier; the city was enriched by the
 profitable trade of war; and the blood of her sons was the
 only price that was paid for the Volscian sheep, the slaves
 of Briton, or the gems and gold of Asiatic kingdoms.","('first', 'ORDINAL'), ('Volscian', 'NORP'), ('Briton', 'NORP'), ('Asiatic', 'NORP')"
"But the
 government of Justinian united the evils of liberty and
 servitude; and the Romans were oppressed at the same time by
 the multiplicity of their laws and the arbitrary will of
 their master.","('Justinian', 'NORP'), ('Romans', 'NORP')"
"But the condition of the slave was far more
 advantageous, since he regained, by the first manumission,
 his alienated freedom: the son was again restored to his
 unnatural father; he might be condemned to servitude a
 second and a third time, and it was not till after the third
 sale and deliverance, (105) that he was enfranchised from the
 domestic power which had been so repeatedly abused.","('first', 'ORDINAL'), ('second', 'ORDINAL'), ('third', 'ORDINAL'), ('third', 'ORDINAL'), ('105', 'CARDINAL')"
"But the disposition of a
 courtier is tame and submissive; and Capito seldom presumed
 to deviate from the sentiments, or at least from the words,
 of his predecessors; while the bold republican pursued his
 independent ideas without fear of paradox or innovations.","('Capito', 'PERSON'), ('republican', 'NORP')"
"But the exposition of children was the
 prevailing and stubborn vice of antiquity: it was sometimes
 prescribed, often permitted, almost always practised with
 impunity, by the nations who never entertained the Roman
 ideas of paternal power; and the dramatic poets, who appeal
 to the human heart, represent with indifference a popular
 custom which was palliated by the motives of economy and
 compassion.","('Roman', 'NORP')"
"But the favorable
 persuasion of the same writer, that a legislator may confide
 in the taste and reason of mankind, is impeached by the
 unwelcome discovery of the antiquity and extent of the
 disease. (200)","('200', 'CARDINAL')"
"But the hardships of this dependent state
 were continually diminished by the influence of government
 and religion: and the pride of a subject was no longer
 elated by his absolute dominion over the life and happiness
 of his bondsman. (101)","('101', 'CARDINAL')"
"But the jurisprudence of the Pandects is
 circumscribed within a period of a hundred years, from the
 perpetual edict to the death of Severus Alexander: the
 civilians who lived under the first Caesars are seldom
 permitted to speak, and only three names can be attributed
 to the age of the republic.","('Pandects', 'PERSON'), ('a period of a hundred years', 'DATE'), ('Severus Alexander', 'PERSON'), ('first', 'ORDINAL'), ('Caesars', 'ORG'), ('three', 'CARDINAL')"
"But the power of
 the testator expired with the acceptance of the testament:
 each Roman of mature age and discretion acquired the
 absolute dominion of his inheritance, and the simplicity of
 the civil law was never clouded by the long and intricate
 entails which confine the happiness and freedom of unborn
 generations.","('Roman', 'NORP')"
"But the same
 emperor declared himself the implacable enemy of unmanly
 lust, and the cruelty of his persecution can scarcely be
 excused by the purity of his motives. (198)","('198', 'CARDINAL')"
"But the substance of the Twelve
 Tables was adapted to the state of the city; and the Romans had emerged from Barbarism, since they were capable of studying and embracing the institutions of their more enlightened neighbors.","('Twelve', 'CARDINAL'), ('Romans', 'NORP'), ('Barbarism', 'ORG')"
"But the sylvan deities were less implacable, and the extirpation of a more valuable tree was compensated by the moderate fine of twenty-five pounds of copper.","('twenty-five pounds', 'QUANTITY')"
"But the three codes obtained an equal authority in the tribunals; and any act which was not included in the sacred deposit might be disregarded by the judge as epurious or obsolete. (48)
Forms of the Roman law.","('three', 'CARDINAL'), ('Roman', 'NORP')"
"But these
 interpreters could neither enact nor execute the laws of the
 republic; and the judges might disregard the authority of
 the Scaevolas themselves, which was often overthrown by the
 eloquence or sophistry of an ingenious pleader. (60) Augustus
 and Tiberius were the first to adopt, as a useful engine,
 the science of the civilians; and their servile labors
 accommodated the old system to the spirit and views of
 despotism.","('Scaevolas', 'NORP'), ('Augustus', 'PERSON'), ('Tiberius', 'PERSON'), ('first', 'ORDINAL')"
"But this union of the judicial and legislative powers left
 it doubtful whether the accused party was pardoned or
 acquitted; and, in the defence of an illustrious client, the
 orators of Rome and Athens address their arguments to the
 policy and benevolence, as well as to the justice, of their
 sovereign.","('Rome', 'GPE'), ('Athens', 'GPE')"
"But, if the victims of Tiberius and Nero
 anticipated the decree of the prince or senate, their
 courage and despatch were recompensed by the applause of the
 public, the decent honors of burial, and the validity of
 their testaments. (205)","('Tiberius', 'PERSON'), ('Nero', 'PERSON'), ('205', 'CARDINAL')"
"But, in the character
 of a legislator, he respected the prejudices of the times;
 and, instead of pronouncing a sentence of death against the
 robber or assassin, the general who betrayed an army, or the
 magistrate who ruined a province, Sylla was content to
 aggravate the pecuniary damages by the penalty of exile, or,
 in more constitutional language, by the interdiction of fire
 and water.","('Sylla', 'PERSON')"
"By his judgment or caprice her
 behavior was approved, or censured, or chastised; he
 exercised the jurisdiction of life and death; and it was
 allowed, that in the cases of adultery or drunkenness, (118)
 the sentence might be properly inflicted.","('118', 'CARDINAL')"
"By this
 law, the rape, perhaps the seduction, of an ingenuous youth,
 was compensated, as a personal injury, by the poor damages
 of ten thousand sesterces, or fourscore pounds; the ravisher
 might be slain by the resistance or revenge of chastity; and
 I wish to believe, that at Rome, as in Athens, the voluntary
 and effeminate deserter of his sex was degraded from the
 honors and the rights of a citizen. (194)","('ten thousand', 'CARDINAL'), ('fourscore pounds', 'QUANTITY'), ('Rome', 'GPE'), ('Athens', 'GPE'), ('194', 'CARDINAL')"
"By this epithet of
 natural, the offspring of the concubine were distinguished
 from the spurious brood of adultery, prostitution, and
 incest, to whom Justinian reluctantly grants the necessary
 aliments of life; and these natural children alone were
 capable of succeeding to a sixth part of the inheritance of
 their reputed father.","('Justinian', 'PERSON'), ('sixth', 'ORDINAL')"
"Cato the censor derived some additional fame from his legal studies, and those of his son: the kindred appellation of Mucius Scaevola was illustrated by three sages of the law; but the perfection of the science was ascribed to Servius Sulpicius, their disciple, and the friend of Tully; and the long succession,
 which shone with equal lustre under the republic and under the Caesars, is finally closed by the respectable characters of Papinian, of Paul, and of Ulpian.","('Cato', 'PERSON'), ('Mucius Scaevola', 'PERSON'), ('three', 'CARDINAL'), ('Servius Sulpicius', 'PERSON'), ('Tully', 'PERSON'), ('Caesars', 'ORG'), ('Papinian', 'NORP'), ('Paul', 'PERSON'), ('Ulpian', 'GPE')"
"Cicero, his contemporary and friend, declined the reputation
 of a professed lawyer; but the jurisprudence of his country
 was adorned by his incomparable genius, which converts into
 gold every object that it touches.","('Cicero', 'PERSON')"
"Copies were slowly
 multiplied and cautiously renewed: the hopes of profit
 tempted the sacrilegious scribes to erase the characters of
 antiquity,  and Sophocles or Tacitus were obliged to
 resign the parchment to missals, homilies, and the golden
 legend.","('Sophocles', 'PERSON'), ('Tacitus', 'PERSON')"
"Cumae and Rhegium, Crotona and Tarentum, Agrigentum and Syracuse, were in the rank of the most flourishing
 cities.","('Cumae', 'ORG'), ('Rhegium', 'GPE'), ('Crotona', 'GPE'), ('Tarentum', 'GPE'), ('Agrigentum', 'GPE'), ('Syracuse', 'GPE')"
Do you promise to pay me one hundred pieces of gold?,"('one hundred', 'CARDINAL')"
"During four centuries, from
 Adrian to Justinian the public and private jurisprudence was
 moulded by the will of the sovereign; and few institutions,
 either human or divine, were permitted to stand on their
 former basis.","('four centuries', 'DATE'), ('Adrian', 'PERSON'), ('Justinian', 'PERSON')"
"Each family contained a domestic tribunal, which was
 not confined, like that of the praetor, to the cognizance of
 external actions: virtuous principles and habits were
 inculcated by the discipline of education; and the Roman
 father was accountable to the state for the manners of his
 children, since he disposed, without appeal, of their life,
 their liberty, and their inheritance.","('Roman', 'NORP')"
"Even
 the Pandects themselves have escaped with difficulty and
 danger from the common shipwreck, and criticism has
 pronounced that all the editions and manuscripts of the West
 are derived from one original. (86)","('Pandects', 'NORP'), ('West', 'LOC'), ('one', 'CARDINAL')"
"Every act of a citizen was subject to the judgment of the
 censors; the first who used the privilege of divorce
 assigned, at their command, the motives of his conduct; (127)
 and a senator was expelled for dismissing his virgin spouse
 without the knowledge or advice of his friends.","('first', 'ORDINAL'), ('127', 'CARDINAL')"
"Every year, or, according to Procopius, each day, of his long reign, was marked by some legal innovation.","('Procopius', 'PERSON'), ('each day', 'DATE')"
"Except in the
 singular institutions of Sparta, the wisest legislators have
 disapproved an agrarian law as a false and dangerous
 innovation.","('Sparta', 'GPE')"
"Five civilians, Caius, Papinian,
 Paul, Ulpian, and Modestinus, were established as the
 oracles of jurisprudence: a majority was decisive: but if
 their opinions were equally divided, a casting vote was
 ascribed to the superior wisdom of Papinian. (70)
Reformation of the Roman law by Justinian, A.D. 527, etc.","('Five', 'CARDINAL'), ('Caius', 'PERSON'), ('Papinian', 'GPE'), ('Paul', 'PERSON'), ('Ulpian', 'NORP'), ('Modestinus', 'PERSON'), ('Papinian', 'PERSON'), ('Roman', 'NORP'), ('Justinian', 'PERSON'), ('A.D. 527', 'DATE')"
"For that important work, the
 emperor Adrian preferred the chief of the Sabinians: the
 friends of monarchy prevailed; but the moderation of Salvius
 Julian insensibly reconciled the victors and the vanquished.","('Adrian', 'PERSON'), ('Sabinians', 'NORP'), ('Salvius\r\n Julian', 'PERSON')"
"For the discernment of truth and falsehood he applied, as an
 infallible rule, the logic of Aristotle and the stoics,
 reduced particular cases to general principles, and diffused
 over the shapeless mass the light of order and eloquence.","('Aristotle', 'PERSON')"
"For the perpetration of similar enormities, a
 vile plebeian might claim and abuse the sacred character of
 a member of the republic: but, on the proof or suspicion of
 guilt, the slave, or the stranger, was nailed to a cross;
 and this strict and summary justice might be exercised
 without restraint over the greatest part of the populace of
 Rome.","('Rome', 'GPE')"
"Forfeiture was sometimes commuted to a fine;
 the fine was sometimes aggravated by transportation to an
 island, or imprisonment in a monastery; the injured party
 was released from the bonds of marriage; but the offender,
 during life, or a term of years, was disabled from the
 repetition of nuptials.","('years', 'DATE')"
"From
 Catullus to Juvenal, (195) the poets accuse and celebrate the
 degeneracy of the times; and the reformation of manners was
 feebly attempted by the reason and authority of the
 civilians till the most virtuous of the Caesars proscribed
 the sin against nature as a crime against society. (196)
 Rigour of the Christian emperors.","('Catullus', 'GPE'), ('Juvenal', 'GPE'), ('195', 'CARDINAL'), ('Caesars', 'ORG'), ('196', 'CARDINAL'), ('Christian', 'NORP')"
"From Augustus to Trajan, the modest Caesars were content to
 promulgate their edicts in the various characters of a Roman
 magistrate;  and, in the decrees of the senate, the  epistles and orations of the prince were respectfully
 inserted.","('Augustus', 'PERSON'), ('Trajan', 'PERSON'), ('Caesars', 'ORG'), ('Roman', 'NORP')"
"From a similar
 motive of national pride, both Livy and Dionysius are
 willing to believe, that the deputies of Rome visited Athens
 under the wise and splendid administration of Pericles; and
 the laws of Solon were transfused into the twelve tables.","('Livy', 'PERSON'), ('Dionysius', 'PERSON'), ('Rome', 'GPE'), ('Athens', 'GPE'), ('Pericles', 'PERSON'), ('Solon', 'PERSON'), ('twelve', 'CARDINAL')"
"From the bar of
 the Praetorian praefects, he raised himself to the honors of
 quaestor, of consul, and of master of the offices: the
 council of Justinian listened to his eloquence and wisdom;
 and envy was mitigated by the gentleness and affability of
 his manners.","('Praetorian', 'NORP'), ('Justinian', 'PERSON')"
"From the library of Tribonian, they chose forty, the most eminent civilians of former times: (76) two thousand treatises were comprised in an abridgment of fifty books; and it has been carefully recorded, that three millions of lines or sentences, (77) were reduced, in this abstract, to the moderate number of one hundred and fifty thousand.","('Tribonian', 'GPE'), ('forty', 'CARDINAL'), ('76', 'CARDINAL'), ('two thousand', 'CARDINAL'), ('fifty', 'CARDINAL'), ('three millions', 'CARDINAL'), ('77', 'CARDINAL'), ('one hundred and fifty thousand', 'CARDINAL')"
"From the portico, the
 Roman civilians learned to live, to reason, and to die: but
 they imbibed in some degree the prejudices of the sect; the
 love of paradox, the pertinacious habits of dispute, and a
 minute attachment to words and verbal distinctions.","('Roman', 'NORP')"
"He could no longer take the life of a son without
 incurring the guilt and punishment of murder; and the pains
 of parricide, from which he had been excepted by the
 Pompeian law, were finally inflicted by the justice of
 Constantine.","('Pompeian', 'NORP'), ('Constantine', 'PERSON')"
"He gloried in the arbitrary proscription of four
 thousand seven hundred citizens. (185)","('four\r\n thousand seven hundred', 'CARDINAL'), ('185', 'CARDINAL')"
"Her modest station, below the honors of a wife,
 above the infamy of a prostitute, was acknowledged and
 approved by the laws: from the age of Augustus to the tenth
 century, the use of this secondary marriage prevailed both
 in the West and East; and the humble virtues of a concubine
 were often preferred to the pomp and insolence of a noble
 matron.","('the age of Augustus to the tenth\r\n century', 'DATE'), ('secondary', 'ORDINAL'), ('West', 'LOC'), ('East', 'LOC')"
"His fame and fortunes were preserved, at least to his
 children, by this civil death; and he might still be happy
 in every rational and sensual enjoyment, if a mind
 accustomed to the ambitious tumult of Rome could support the
 uniformity and silence of Rhodes or Athens.","('Rome', 'GPE'), ('Rhodes', 'PERSON'), ('Athens', 'GPE')"
"His humble
 privilege was at length transformed into the prerogative of
 a tyrant; and the Latin expression of ""released from the
 laws"" (38) was supposed to exalt the emperor above all human restraints, and to leave his conscience and reason as the sacred measure of his conduct.","('Latin', 'LANGUAGE'), ('38', 'DATE')"
"His passive and dutiful
 submission had been honored with the praise of Justinian
 himself, whose vanity was incapable of discerning how often
 that submission degenerated into the grossest adulation.","('Justinian', 'PERSON')"
"His stolen goods (his oxen or his children) might be
 recovered by the same action of theft; (104) and if either
 had been guilty of a trespass, it was in his own option to
 compensate the damage, or resign to the injured party the
 obnoxious animal.","('104', 'CARDINAL')"
"Homer's catalogue and the four-and-twenty sorts of metre; the astronomical canon of Ptolemy; the changes of the months; the houses of the
 planets; and the harmonic system of the world.","('Homer', 'PERSON'), ('four-and-twenty sorts of metre', 'QUANTITY'), ('Ptolemy', 'PERSON'), ('the months', 'DATE')"
"I do promise, was the reply of Sempronius.","('Sempronius', 'PERSON')"
"I shall not repeat the well-known story of the Decemvirs, (11) who sullied by their actions the honor of inscribing on brass, or wood, or ivory, the TWELVE TABLES of the Roman
 laws.","('Decemvirs', 'PERSON'), ('11', 'CARDINAL'), ('TWELVE', 'CARDINAL'), ('Roman', 'NORP')"
"If Caesar had achieved the reformation of the Roman law, his
 creative genius, enlightened by reflection and study, would
 have given to the world a pure and original system of
 jurisprudence.","('Caesar', 'PERSON'), ('Roman', 'NORP')"
"If a Roman was surprised by death in a remote
 province of the empire, he addressed a short epistle to his
 legitimate or testamentary heir; who fulfilled with honor,
 or neglected with impunity, this last request, which the
 judges before the age of Augustus were not authorized to
 enforce.","('Roman', 'NORP'), ('Augustus', 'PERSON')"
"If a fair
 exchange had been substituted to the payment of money,
 Capito still considered the transaction as a legal sale; (64)
 and he consulted nature for the age of puberty, without
 confining his definition to the precise period of twelve or
 fourteen years. (65)","('Capito', 'ORG'), ('twelve or\r\n fourteen years', 'DATE'), ('65', 'CARDINAL')"
"If candour will acquit the emperor himself, and transfer the corruption to his wife and favorites, the suspicion of so foul a vice must still degrade the majesty of his laws; and the advocates of Justinian may acknowledge, that such levity, whatsoever be the motive, is unworthy of a legislator and a man.","('Justinian', 'PERSON')"
"If he encloses and cultivates a field for their
 sustenance and his own, a barren waste is converted into a
 fertile soil; the seed, the manure, the labor, create a new
 value, and the rewards of harvest are painfully earned by
 the fatigues of the revolving year.","('the revolving year', 'DATE')"
"If he were swayed by
 gifts in the administration of justice, the example of Bacon
 will again occur; nor can the merit of Tribonian atone for
 his baseness, if he degraded the sanctity of his profession;
 and if laws were every day enacted, modified, or repealed,
 for the base consideration of his private emolument.","('Bacon', 'PERSON'), ('Tribonian', 'NORP')"
"If such an embassy had indeed been received from the
 Barbarians of Hesperia, the Roman name would have been
 familiar to the Greeks before the reign of Alexander; (18)
 and the faintest evidence would have been explored and
 celebrated by the curiosity of succeeding times.","('Barbarians', 'NORP'), ('Hesperia', 'GPE'), ('Roman', 'NORP'), ('Greeks', 'NORP'), ('Alexander', 'PERSON'), ('18', 'CARDINAL')"
"If the
 property of another be intrusted to our care, the requisite
 degree of care may rise and fall according to the benefit
 which we derive from such temporary possession; we are
 seldom made responsible for inevitable accident, but the
 consequences of a voluntary fault must always be imputed to
 the author. (168) A Roman pursued and recovered his stolen goods by a civil action of theft; they might pass through a succession of pure and innocent hands, but nothing less than
 a prescription of thirty years could extinguish his original
 claim.","('Roman', 'NORP'), ('thirty years', 'DATE')"
"If the deceased father had not signified his choice, the
 agnats, or paternal kindred of the nearest degree, were
 compelled to act as the natural guardians: the Athenians
 were apprehensive of exposing the infant to the power of
 those most interested in his death; but an axiom of Roman
 jurisprudence has pronounced, that the charge of tutelage
 should constantly attend the emolument of succession.","('Athenians', 'NORP'), ('Roman', 'NORP')"
"If the father could subdue his own
 feelings, he might escape, though not the censure, at least
 the chastisement, of the laws; and the Roman empire was
 stained with the blood of infants, till such murders were
 included, by Valentinian and his colleagues, in the letter
 and spirit of the Cornelian law.","('Roman', 'NORP'), ('Valentinian', 'PERSON'), ('Cornelian', 'NORP')"
"If the feeble tenant was
 oppressed by accident, contagion, or hostile violence, he
 claimed a proportionable relief from the equity of the laws:
 five years were the customary term, and no solid or costly
 improvements could be expected from a farmer, who, at each
 moment might be ejected by the sale of the estate. (162)","('five years', 'DATE'), ('162', 'CARDINAL')"
"If they had obeyed his commands in ten years, Justinian would have been satisfied with their diligence; and the rapid composition of the DIGEST or PANDECTS, (75) in three years, will deserve praise or censure, according to the merit of the execution.","('ten years', 'DATE'), ('Justinian', 'ORG'), ('DIGEST', 'ORG'), ('PANDECTS', 'ORG'), ('75', 'CARDINAL'), ('three years', 'DATE')"
"In
 the forum, the senate, or the camp, the adult son of a Roman
 citizen enjoyed the public and private rights of a person:
 in his father's house he was a mere thing;  confounded by
 the laws with the movables, the cattle, and the slaves, whom
 the capricious master might alienate or destroy, without
 being responsible to any earthly tribunal.","('Roman', 'NORP')"
"In
 three centuries of prosperity and corruption, this principle
 was enlarged to frequent practice and pernicious abuse.","('three centuries', 'DATE')"
"In Egypt, the marriage of brothers and sisters was admitted
 without scruple or exception: a Spartan might espouse the
 daughter of his father, an Athenian, that of his mother; and
 the nuptials of an uncle with his niece were applauded at
 Athens as a happy union of the dearest relations.","('Egypt', 'GPE'), ('Spartan', 'NORP'), ('Athenian', 'NORP'), ('Athens', 'GPE')"
"In France, the remains of
 liberty are kept alive by the spirit, the honours, and even
 the prejudices, of fifty thousand nobles. (99)","('France', 'GPE'), ('fifty thousand', 'CARDINAL')"
"In a
 bigoted and persecuting court, the principal minister was
 accused of a secret aversion to the Christian faith, and was
 supposed to entertain the sentiments of an Atheist and a
 Pagan, which have been imputed, inconsistently enough, to
 the last philosophers of Greece.","('Christian', 'NORP'), ('Atheist', 'NORP'), ('Pagan', 'NORP'), ('Greece', 'GPE')"
"In a
 period of thirteen hundred years, the laws had reluctantly
 followed the changes of government and manners; and the
 laudable desire of conciliating ancient names with recent
 institutions destroyed the harmony, and swelled the
 magnitude, of the obscure and irregular system.","('a\r\n period of thirteen hundred years', 'DATE')"
"In a single,
 if possible in a short, chapter, I shall trace the Roman
 jurisprudence from Romulus to Justinian, (5) appreciate the
 labors of that emperor, and pause to contemplate the
 principles of a science so important to the peace and
 happiness of society.","('Roman', 'NORP'), ('Romulus', 'PERSON'), ('Justinian', 'PERSON')"
"In each particular cause, a sufficient number was drawn from
 the urn; their integrity was guarded by an oath; the mode of
 ballot secured their independence; the suspicion of
 partiality was removed by the mutual challenges of the
 accuser and defendant; and the judges of Milo, by the
 retrenchment of fifteen on each side, were reduced to
 fifty-one voices or tablets, of acquittal, of condemnation,
 or of favorable doubt. (203)","('Milo', 'PERSON'), ('fifteen', 'CARDINAL'), ('fifty-one', 'CARDINAL'), ('203', 'CARDINAL')"
