Sentence,Entities
"But the pride of the Persian had not yet
 sunk to the level of his fortune; he derived a momentary
 confidence from the retreat of the emperor; he wept with
 impotent rage over the ruins of his Assyrian palaces, and
 disregarded too long the rising murmurs of the nation, who
 complained that their lives and fortunes were sacrificed to
 the obstinacy of an old man.","('Persian', 'NORP'), ('Assyrian', 'NORP')"
"But the provinces, which had been
 fashioned by the habits of six hundred years to the virtues
 and vices of the Roman government, supported with reluctance
 the yoke of the Barbarians.","('six hundred years', 'DATE'), ('Roman', 'NORP'), ('Barbarians', 'NORP')"
"But the revenge and ambition
 of Chosroes exhausted his kingdom; and the new levies of
 subjects, strangers, and slaves, were divided into three
 formidable bodies.","('Chosroes', 'PERSON'), ('three', 'CARDINAL')"
"But the revenue no
 longer flowed in the usual channels; the credit of an
 arbitrary prince is annihilated by his power; and the
 courage of Heraclius was first displayed in daring to borrow
 the consecrated wealth of churches, under the solemn vow of
 restoring, with usury, whatever he had been compelled to
 employ in the service of religion and the empire.","('Heraclius', 'PERSON'), ('first', 'ORDINAL')"
"But the review of his loss, and the consciousness
 of his danger, determined Chosroes to a speedy retreat: he
 burnt, in his passage, the vacant town of Melitene; and,
 without consulting the safety of his troops, boldly swam the
 Euphrates on the back of an elephant.","('Chosroes', 'PERSON'), ('Melitene', 'GPE'), ('Euphrates', 'LOC')"
"But the senate and
 people were animated by the spirit of Heraclius, who had
 detached to their relief a body of twelve thousand
 cuirassiers; the powers of fire and mechanics were used with
 superior art and success in the defence of Constantinople;
 and the galleys, with two and three ranks of oars, commanded
 the Bosphorus, and rendered the Persians the idle spectators
 of the defeat of their allies.","('Heraclius', 'PERSON'), ('twelve thousand', 'CARDINAL'), ('Constantinople', 'GPE'), ('two', 'CARDINAL'), ('three', 'CARDINAL'), ('Bosphorus', 'LOC'), ('Persians', 'NORP')"
"But the spirit of the empress Constantina, still mindful of
 her father, her husband, and her sons, aspired to freedom
 and revenge.","('Constantina', 'PERSON')"
"But the will of Chosroes was no longer
 revered, and Siroes,  who gloried in the rank and merit of
 his mother Sira, had conspired with the malecontents to
 assert and anticipate the rights of primogeniture. (106)","('Chosroes', 'PERSON'), ('Siroes', 'PERSON'), ('Sira', 'PERSON'), ('106', 'CARDINAL')"
"But their new subjects were soon disgusted
 with the vices or virtues which they had imbibed in a
 foreign land; the instability of their dominion gave birth
 to a vulgar observation, that the choice of Rome was
 solicited and rejected with equal ardor by the capricious
 levity of Oriental slaves. (18)","('Rome', 'GPE'), ('Oriental', 'NORP'), ('18', 'CARDINAL')"
"But these losses, which astonished the provinces and the court, produced a salutary effect in the repentance and abdication of the emperor Justin: a new spirit arose in the Byzantine councils; and a truce of three years was obtained by the prudence of Tiberius.","('Justin', 'PERSON'), ('Byzantine', 'NORP'), ('three years', 'DATE'), ('Tiberius', 'PERSON')"
"By
 these implacable enemies, Heraclius, on either side, was
 insulted and besieged: and the Roman empire was reduced to
 the walls of Constantinople, with the remnant of Greece,
 Italy, and Africa, and some maritime cities, from Tyre to
 Trebizond, of the Asiatic coast.","('Heraclius', 'PERSON'), ('Roman', 'NORP'), ('Constantinople', 'GPE'), ('Greece', 'GPE'), ('Italy', 'GPE'), ('Africa', 'LOC'), ('Tyre', 'GPE'), ('Trebizond', 'GPE'), ('Asiatic', 'NORP')"
"By a false motion, which
 seemed to threaten Armenia, he drew them, against their
 wishes, to a general action.","('Armenia', 'GPE')"
"By a just gradation of magnificent scenes, they
 penetrated to the royal seat of Dastagerd,  and, though
 much of the treasure had been removed, and much had been
 expended, the remaining wealth appears to have exceeded
 their hopes, and even to have satiated their avarice.","('Dastagerd', 'GPE')"
"By the departure of the Lombards, and the ruin of the
 Gepidae, the balance of power was destroyed on the Danube;
 and the Avars spread their permanent dominion from the foot
 of the Alps to the sea-coast of the Euxine.","('Lombards', 'NORP'), ('Gepidae', 'GPE'), ('Danube', 'LOC'), ('Avars', 'NORP'), ('Alps', 'LOC'), ('Euxine', 'PRODUCT')"
"By the fatal vicissitude of human affairs, the
 same scenes were renewed at Ctesiphon, which had been
 exhibited at Rome after the death of Marcus Antoninus.","('Ctesiphon', 'GPE'), ('Rome', 'GPE'), ('Marcus Antoninus', 'PERSON')"
"By the oppressive laws
 of Justinian, the adversaries of the church were made the
 enemies of the state; the alliance of the Jews, Nestorians,
 and Jacobites, had contributed to the success of Chosroes,
 and his partial favour to the sectaries provoked the hatred
 and fears of the Catholic clergy.","('Justinian', 'PERSON'), ('Jews', 'NORP'), ('Nestorians', 'NORP'), ('Jacobites', 'NORP'), ('Chosroes', 'NORP'), ('Catholic', 'NORP')"
"By the secret
 emissaries of Crispus and the senate, the independent exarch
 was solicited to save and to govern his country; but his
 ambition was chilled by age, and he resigned the dangerous
 enterprise to his son Heraclius, and to Nicetas, the son of
 Gregory, his friend and lieutenant.","('Crispus', 'PERSON'), ('Heraclius', 'PERSON'), ('Nicetas', 'PERSON'), ('Gregory', 'PERSON')"
Chosroes flies to the Romans.,"('Chosroes', 'PERSON'), ('Romans', 'NORP')"
"Chosroes had ascended the throne without guilt, and
 his piety strove to alleviate the misery of the abdicated
 monarch; from the dungeon he removed Hormouz to an apartment
 of the palace, supplied with liberality the consolations of
 sensual enjoyment, and patiently endured the furious sallies
 of his resentment and despair.","('Chosroes', 'PERSON'), ('Hormouz', 'PERSON')"
"Chosroes invades the Roman empire, A.D. 603, etc.","('Chosroes', 'PERSON'), ('Roman', 'NORP'), ('A.D. 603', 'DATE')"
"Chosroes led
 into the field the slaves of the palace and the populace of
 the capital: they beheld with terror the banners of a
 veteran army; they were encompassed and surprised by the
 evolutions of the general; and the satraps who had deposed
 Hormouz, received the punishment of their revolt, or
 expiated their first treason by a second and more criminal
 act of disloyalty.","('Chosroes', 'PERSON'), ('Hormouz', 'PERSON'), ('first', 'ORDINAL'), ('second', 'ORDINAL')"
"Cilicia was
 soon encompassed with the Persian arms; but their cavalry
 hesitated to enter the defiles of Mount Taurus, till they
 were circumvented by the evolutions of Heraclius, who
 insensibly gained their rear, whilst he appeared to present
 his front in order of battle.","('Cilicia', 'PERSON'), ('Persian', 'NORP'), ('Mount Taurus', 'LOC'), ('Heraclius', 'PERSON')"
"Conquest of Yemen by Nushirvan, A.D. 570, etc","('Yemen', 'GPE'), ('Nushirvan', 'GPE'), ('A.D. 570', 'DATE')"
"Conscious of their fear
 and hatred, the Persian conqueror governed his new subjects
 with an iron sceptre; and, as if he suspected the stability
 of his dominion, he exhausted their wealth by exorbitant
 tributes and licentious rapine despoiled or demolished the
 temples of the East; and transported to his hereditary
 realms the gold, the silver, the precious marbles, the arts,
 and the artists of the Asiatic cities.","('Persian', 'NORP'), ('East', 'LOC'), ('Asiatic', 'NORP')"
Contest of Rome and Persia,"('Rome', 'GPE'), ('Persia', 'GPE')"
"Deaf to their advice and
 entreaty, the emperor boldly advanced (34) seven miles from
 the capital; the sacred ensign of the cross was displayed in
 the front; and Maurice reviewed, with conscious pride, the
 arms and numbers of the veterans who had fought and
 conquered beyond the Tigris.","('34', 'CARDINAL'), ('seven miles', 'QUANTITY'), ('Maurice', 'PERSON'), ('Tigris', 'LOC')"
Death of Bahram.,"('Bahram', 'PERSON')"
"Death of Maurice and his children, A.D. 602, Nov. 27.","('Maurice', 'PERSON'), ('A.D. 602', 'DATE'), ('Nov. 27', 'DATE')"
"Deprived of
 the only chief whom they could fear or esteem, the bands
 which he had led to victory were twice broken by the
 cavalry, trampled by the elephants, and pierced by the
 arrows of the Barbarians; and a great number of the captives
 were beheaded on the field of battle by the sentence of the
 victor, who might justly condemn these seditious mercenaries
 as the authors or accomplices of the death of Maurice.","('Barbarians', 'NORP'), ('Maurice', 'PERSON')"
"Deprived of his firmest support, and doubtful of the
 fidelity of his subjects, the greatness of Chosroes was
 still conspicuous in its ruins.","('Chosroes', 'PERSON')"
"During
 the vigour of the Roman power, several princes were seated on
 the throne of Persia by the arms and the authority of the
 first Caesars.","('Roman', 'NORP'), ('Persia', 'GPE'), ('first', 'ORDINAL'), ('Caesars', 'ORG')"
"During ten successive days, the capital was
 assaulted by the Avars, who had made some progress in the
 science of attack; they advanced to sap or batter the wall,
 under the cover of the impenetrable tortoise; their engines
 discharged a perpetual volley of stones and darts; and
 twelve lofty towers of wood exalted the combatants to the
 height of the neighbouring ramparts.","('ten successive days', 'DATE'), ('Avars', 'NORP'), ('twelve', 'CARDINAL')"
"Eastward of the Tigris, at the
 end of the bridge of Mosul, the great Nineveh had formerly
 been erected: (101) the city, and even the ruins of the city,
 had long since disappeared; (102) the vacant space afforded a
 spacious field for the operations of the two armies.","('Tigris', 'LOC'), ('Mosul', 'GPE'), ('Nineveh', 'GPE'), ('101', 'CARDINAL'), ('102', 'CARDINAL'), ('two', 'CARDINAL')"
"Elated by his recent success, he
 despatched a herald with a bold defiance to the camp of the
 Romans, requesting them to fix a day of battle, and to
 choose whether they would pass the river themselves, or
 allow a free passage to the arms of the great king.","('Romans', 'NORP'), ('a day', 'DATE')"
"Election of Phocas, A.D. 602, October.","('Election of Phocas', 'ORG'), ('A.D. 602', 'DATE'), ('October', 'DATE')"
"Elevation of Heraclius — The Persian War — Chosroes Subdues Syria, Egypt, and Asia Minor — Siege of Constantinople by the Persians and Avars — Persian Expeditions.","('The Persian War — Chosroes Subdues Syria', 'WORK_OF_ART'), ('Egypt', 'GPE'), ('Asia Minor — Siege of Constantinople by the Persians and Avars — Persian Expeditions', 'WORK_OF_ART')"
"Even after his death the republic was afflicted by the
 crimes of Phocas, which armed with a pious cause the most
 formidable of her enemies.","('Phocas', 'PERSON')"
"Every
 province, and each city of Persia, was the scene of
 independence, of discord, and of blood; and the state of
 anarchy prevailed about eight years longer, ! till the
 factions were silenced and united under the common yoke of
 the Arabian caliphs. (108)","('Persia', 'GPE'), ('about eight years', 'DATE'), ('Arabian', 'NORP'), ('108', 'CARDINAL')"
"Exasperated by long and hopeless oppression,
 the provinces of Babylon, Susa, and Carmania, erected the
 standard of revolt; and the princes of Arabia, India, and
 Scythia, refused the customary tribute to the unworthy
 successor of Nushirvan.","('Babylon', 'GPE'), ('Susa', 'GPE'), ('Carmania', 'GPE'), ('Arabia', 'GPE'), ('India', 'GPE'), ('Scythia', 'PERSON'), ('Nushirvan', 'PERSON')"
"Exploits of Bahram, A.D. 590.","('Bahram', 'GPE'), ('590', 'CARDINAL')"
"First expedition of Heraclius against the Persians, A.D. 622.","('First', 'ORDINAL'), ('Heraclius', 'PERSON'), ('Persians', 'NORP'), ('622', 'CARDINAL')"
"For himself, he refused
 to fly: his body was tortured with sciatic pains, (45) his
 mind was enfeebled by superstition; he patiently awaited the
 event of the revolution, and addressed a fervent and public
 prayer to the Almighty, that the punishment of his sins
 might be inflicted in this world rather than in a future
 life.","('45', 'CARDINAL')"
"For the crime of an ambitious centurion, the
 nation which he oppressed was chastised with the calamities
 of war; and the same calamities, at the end of twenty years,
 were retaliated and redoubled on the heads of the Persians.
 (57)","('the end of twenty years', 'DATE'), ('Persians', 'NORP')"
"Fourscore thousand (95) of his native subjects,
 and of the vassal tribes of Gepidae, Russians, Bulgarians,
 and Sclavonians, advanced under the standard of the chagan;
 a month was spent in marches and negotiations, but the whole
 city was invested on the thirty-first of July, from the
 suburbs of Pera and Galata to the Blachernae and seven
 towers; and the inhabitants descried with terror the flaming
 signals of the European and Asiatic shores.","('Gepidae', 'NORP'), ('Russians', 'NORP'), ('Bulgarians', 'NORP'), ('Sclavonians', 'NORP'), ('a month', 'DATE'), ('thirty-first of July', 'DATE'), ('Pera', 'GPE'), ('Galata', 'GPE'), ('Blachernae', 'GPE'), ('seven', 'CARDINAL'), ('European', 'NORP'), ('Asiatic', 'NORP')"
"From
 thence the king of Persia was conducted to the more
 honourable residence of Hierapolis; and Maurice dissembled
 his pride, and displayed his benevolence, at the reception
 of the letters and ambassadors of the grandson of Nushirvan.","('Persia', 'GPE'), ('Hierapolis', 'PERSON'), ('Maurice', 'PERSON'), ('Nushirvan', 'PERSON')"
"From Belgrade to the
 walls of Constantinople a line may be measured of six
 hundred miles: that line was marked with flames and with
 blood; the horses of the Avars were alternately bathed in
 the Euxine and the Adriatic; and the Roman pontiff, alarmed
 by the approach of a more savage enemy, (29) was reduced to cherish the Lombards, as the protectors of Italy.","('Belgrade', 'GPE'), ('Constantinople', 'GPE'), ('six\r\n hundred miles', 'QUANTITY'), ('Avars', 'NORP'), ('Euxine', 'NORP'), ('Adriatic', 'LOC'), ('Roman', 'NORP'), ('29', 'CARDINAL'), ('Lombards', 'NORP'), ('Italy', 'GPE')"
"From all sides, the
 scattered garrisons of the maritime cities and the mountains
 might repair with speed and safety to his Imperial standard.","('Imperial', 'ORG')"
"From the commanding heights, a band of resolute men might
 overwhelm with stones and darts the myriads of the Turkish
 host: their emperor and his son were transpierced with
 arrows; and the fugitives were left, without counsel or
 provisions, to the revenge of an injured people.","('Turkish', 'NORP')"
"From the long-disputed banks of the Tigris and Euphrates,
 the reign of the grandson of Nushirvan was suddenly extended
 to the Hellespont and the Nile, the ancient limits of the
 Persian monarchy.","('Tigris', 'LOC'), ('Euphrates', 'LOC'), ('Nushirvan', 'PERSON'), ('Hellespont', 'LOC'), ('Nile', 'LOC'), ('Persian', 'NORP')"
"From the palace of Dastagerd, he
 pursued his march within a few miles of Modain or Ctesiphon,
 till he was stopped, on the banks of the Arba, by the
 difficulty of the passage, the rigour of the season, and
 perhaps the fame of an impregnable capital.","('Dastagerd', 'GPE'), ('a few miles', 'QUANTITY'), ('Modain', 'GPE'), ('Ctesiphon', 'GPE'), ('Arba', 'LOC'), ('season', 'DATE')"
"From the spacious and fruitful plains of
 Albania, the emperor appears to follow the chain of
 Hyrcanian Mountains, to descend into the province of Media
 or Irak, and to carry his victorious arms as far as the
 royal cities of Casbin and Ispahan, which had never been
 approached by a Roman conqueror.","('Albania', 'GPE'), ('Hyrcanian Mountains', 'LOC'), ('Irak', 'GPE'), ('Casbin', 'LOC'), ('Ispahan', 'GPE'), ('Roman', 'NORP')"
"He again ascended his throne to receive the
 congratulations of the ambassadors of France and India: and
 the fame of Moses, Alexander, and Hercules, (112) was
 eclipsed in the popular estimation, by the superior merit
 and glory of the great Heraclius.","('France', 'GPE'), ('India', 'GPE'), ('Moses', 'PERSON'), ('Alexander', 'PERSON'), ('Hercules', 'PERSON'), ('112', 'CARDINAL'), ('Heraclius', 'PERSON')"
"He commands Chosroes, the son of Hormouz, to shun the example and fate of his father, to confine the
 traitors who had been released from their chains, to deposit
 in some holy place the diadem which he had usurped, and to
 accept from his gracious benefactor the pardon of his faults
 and the government of a province.","('Chosroes', 'PERSON'), ('Hormouz', 'PERSON')"
"He defined the duties
 of a king, and the Persian nobles listened with a smile of
 contempt; they were fired with indignation when he dared to
 vilify the character of Chosroes; and by the indiscreet
 offer of resigning the sceptre to the second of his sons, he
 subscribed his own condemnation, and sacrificed the life of
 his own innocent favorite.","('Persian', 'NORP'), ('Chosroes', 'PERSON'), ('second', 'ORDINAL')"
"He is deposed, A.D. 628, February 25.","('A.D. 628', 'DATE'), ('February 25', 'DATE')"
"He landed his troops on the confines of Syria and
 Cilicia, in the Gulf of Scanderoon, where the coast suddenly
 turns to the south; (79) and his discernment was expressed in
 the choice of this important post. (80)","('Syria', 'GPE'), ('Cilicia', 'GPE'), ('the Gulf of Scanderoon', 'LOC'), ('79', 'CARDINAL'), ('80', 'CARDINAL')"
"He might despise the
 resentment of a blind and unpopular tyrant, but the tiara
 was trembling on his head, till he could subvert the power,
 or acquire the friendship, of the great Bahram, who sternly
 denied the justice of a revolution, in which himself and his
 soldiers, the true representatives of Persia, had never been
 consulted.","('Bahram', 'NORP'), ('Persia', 'GPE')"
"He permitted the Persians
 to oppress for a while the provinces, and to insult with
 impunity the capital of the East; while the Roman emperor
 explored his perilous way through the Black Sea, (84) and the
 mountains of Armenia, penetrated into the heart of Persia,
 (85) and recalled the armies of the great king to the defence
 of their bleeding country.","('Persians', 'NORP'), ('East', 'LOC'), ('Roman', 'NORP'), ('the Black Sea', 'LOC'), ('84', 'CARDINAL'), ('Armenia', 'GPE'), ('Persia', 'GPE'), ('85', 'CARDINAL')"
"He proudly displayed the ensigns of
 royalty; but the city and palace of Modain had already
 escaped from the hand of the tyrant.","('Modain', 'GPE')"
"He repelled the threefold attack of the Persians, improved the divisions of their chiefs, and, by a well-concerted train of marches, retreats, and successful actions, finally chased them from the field into the fortified cities of Media and Assyria.","('Persians', 'NORP'), ('Media', 'GPE'), ('Assyria', 'GPE')"
"He surveyed the enormous beast with surprise, with
 disgust, and possibly with terror; and smiled at the vain
 industry of the Romans, who, in search of such useless
 rarities, could explore the limits of the land and sea.","('Romans', 'NORP')"
"He swore by
 his sword, the symbol of the god of war, that he did not, as
 the enemy of Rome, construct a bridge upon the Save.","('Rome', 'GPE')"
"He would have been content with the neutrality of the
 Avars; and his friendly entreaty, that the chagan would act,
 not as the enemy, but as the guardian, of the empire, was
 accompanied with a more persuasive donative of two hundred
 thousand pieces of gold.","('Avars', 'PERSON'), ('two hundred\r\n thousand', 'CARDINAL')"
"Her life was forfeited to revenge, and even
 to justice: but the patriarch obtained and pledged an oath
 for her safety: a monastery was allotted for her prison, and
 the widow of Maurice accepted and abused the lenity of his
 assassin.","('Maurice', 'PERSON')"
"Heraclius
 himself, with the skill and patience of a centurion,
 inculcated the lessons of the school of tactics, and the
 soldiers were assiduously trained in the use of their
 weapons, and the exercises and evolutions of the field.","('Heraclius', 'PERSON')"
"Heraclius
 was rewarded by their tears and grateful acclamations; but
 this wise measure, which spread the fame of his benevolence,
 diffused the murmurs of the Persians against the pride and
 obstinacy of their own sovereign.","('Heraclius', 'PERSON'), ('Persians', 'NORP')"
"Heraclius performed in person the
 pilgrimage of Jerusalem, the identity of the relic was
 verified by the discreet patriarch, (111) and this august
 ceremony has been commemorated by the annual festival of the
 exaltation of the cross.","('Heraclius', 'PERSON'), ('Jerusalem', 'GPE'), ('111', 'CARDINAL')"
"Heraclius subscribed these
 ignominious terms; but the time and space which he obtained
 to collect such treasures from the poverty of the East, was
 industriously employed in the preparations of a bold and
 desperate attack.","('Heraclius', 'PERSON'), ('East', 'LOC')"
"His
 zeal was rewarded by the gratitude and docility of Hormouz,
 who acknowledged himself more indebted to his preceptor than
 to his parent: but when age and labor had impaired the
 strength, and perhaps the faculties, of this prudent
 counsellor, he retired from court, and abandoned the
 youthful monarch to his own passions and those of his
 favorites.","('Hormouz', 'PERSON')"
"His anxiety was relieved by the deliverance of
 Constantinople; his hopes were confirmed by a victory of his
 brother Theodorus; and to the hostile league of Chosroes
 with the Avars, the Roman emperor opposed the useful and
 honourable alliance of the Turks.","('Constantinople', 'GPE'), ('Theodorus', 'PERSON'), ('Chosroes', 'PERSON'), ('Avars', 'PERSON'), ('Roman', 'NORP'), ('Turks', 'NORP')"
"His armour of
 pure and massy gold, the shield of one hundred and twenty
 plates, the sword and belt, the saddle and cuirass, adorned
 the triumph of Heraclius; and if he had not been faithful to
 Christ and his mother, the champion of Rome might have
 offered the fourth opime spoils to the Jupiter of the
 Capitol. (103)","('one hundred and twenty', 'CARDINAL'), ('Heraclius', 'PERSON'), ('Christ', 'PERSON'), ('Rome', 'GPE'), ('fourth', 'ORDINAL'), ('Jupiter', 'LOC'), ('103', 'CARDINAL')"
"His avarice defrauded the troops; his jealous
 caprice degraded the satraps; the palace, the tribunals, the
 waters of the Tigris, were stained with the blood of the
 innocent, and the tyrant exulted in the sufferings and
 execution of thirteen thousand victims.","('Tigris', 'LOC'), ('thirteen thousand', 'CARDINAL')"
"His character,  and Phocas does not appear less hateful in the exercise than in the acquisition of power.","('Phocas', 'PERSON')"
"His coronation was accompanied by that of his wife Eudoxia; and their posterity, till the fourth
 generation, continued to reign over the empire of the East.","('Eudoxia', 'PERSON'), ('fourth', 'ORDINAL'), ('East', 'LOC')"
"His death, A.D. 579.","('A.D. 579', 'DATE')"
"His empire extended over Hungary,
 Poland, and Prussia, from the mouth of the Danube to that of
 the Oder; (31) and his new subjects were divided and
 transplanted by the jealous policy of the conqueror. (32)","('Hungary', 'GPE'), ('Poland', 'GPE'), ('Prussia', 'GPE'), ('Danube', 'LOC'), ('Oder', 'PERSON'), ('31', 'CARDINAL'), ('32', 'CARDINAL')"
"His fall and death, A.D. 610, October 4.","('A.D. 610', 'DATE'), ('October 4', 'DATE')"
"His fate alone was remembered; and at the end of twenty years, in the recital of the history of Theophylact, the mournful tale was interrupted by the tears of the audience. (47)","('the end of twenty years', 'DATE'), ('Theophylact', 'EVENT'), ('47', 'CARDINAL')"
"His last war with the Romans, A.D. 72,etc  but as soon as war became inevitable, he took the field with the alacrity of youth, whilst the aggressor trembled in the palace of Constantinople.","('Romans', 'NORP'), ('A.D. 72', 'DATE'), ('Constantinople', 'GPE')"
"His preparations for war, A.D. 621.","('621', 'CARDINAL')"
"His second expedition, A.D. 623,624,625.","('second', 'ORDINAL'), ('623,624,625', 'CARDINAL')"
"His ships were already
 laden with the treasures of the palace; but his flight was
 arrested by the patriarch, who armed the powers of religion
 in the defence of his country; led Heraclius to the altar of
 St. Sophia, and extorted a solemn oath, that he would live
 and die with the people whom God had intrusted to his care.","('Heraclius', 'PERSON'), ('St. Sophia', 'GPE')"
"His soul was
 superior to the vanity of entertaining Constantinople with
 an imperfect triumph; but the presence of the emperor was
 indispensably required to soothe the restless and rapacious
 spirit of the Avars.","('Constantinople', 'PERSON'), ('Avars', 'NORP')"
"His superstition was subdued by fear: on the
 third day, he entered with joy the fortifications of
 Ctesiphon; yet he still doubted of his safety till he had
 opposed the River Tigris to the pursuit of the Romans.","('the\r\n third day', 'DATE'), ('Ctesiphon', 'PERSON'), ('the River Tigris', 'LOC'), ('Romans', 'NORP')"
"His third expedition, A.D. 627.","('third', 'ORDINAL'), ('627', 'CARDINAL')"
