Sentence,Entities
"From Shiraz, his troops advanced to the Persian Gulf; and the richness and weakness of Ormuz (16) were displayed in an annual tribute of six hundred thousand dinars of gold.","('Shiraz', 'GPE'), ('the Persian Gulf', 'LOC'), ('Ormuz', 'PERSON'), ('16', 'CARDINAL'), ('six hundred thousand', 'CARDINAL')"
"From a single
 troop to a great army, the mode of attack was the same: a
 foremost line first advanced to the charge, and was
 supported in a just order by the squadrons of the great
 vanguard.","('first', 'ORDINAL')"
"From the Irtish and Volga to the Persian Gulf, and from the
 Ganges to Damascus and the Archipelago, Asia was in the hand
 of Timour: his armies were invincible, his ambition was
 boundless, and his zeal might aspire to conquer and convert
 the Christian kingdoms of the West, which already trembled
 at his name.","('Irtish', 'NORP'), ('Volga', 'LOC'), ('the Persian Gulf', 'LOC'), ('Ganges', 'LOC'), ('Damascus', 'GPE'), ('Archipelago', 'LOC'), ('Asia', 'LOC'), ('Timour', 'PERSON'), ('Christian', 'NORP'), ('West', 'LOC')"
"From the Oxus to the Tigris, that extensive country was left without a lawful sovereign since the death of Abousaid, the last of the descendants of the great Holacou.","('Oxus', 'NORP'), ('Tigris', 'LOC'), ('Abousaid', 'PERSON'), ('Holacou', 'PERSON')"
"From the time of
 Orchan and the first Amurath, the sultans were persuaded
 that a government of the sword must be renewed in each
 generation with new soldiers; and that such soldiers must be
 sought, not in effeminate Asia, but among the hardy and
 warlike natives of Europe.","('Orchan', 'PERSON'), ('first', 'ORDINAL'), ('Asia', 'LOC'), ('Europe', 'LOC')"
"From the twelfth year of his age, Timour had entered the field of action; in the twenty-fifth  he stood forth as the deliverer of his country; and the eyes and wishes of the people were turned towards a hero who
 suffered in their cause.","('the twelfth year', 'DATE'), ('Timour', 'PERSON'), ('the twenty-fifth', 'DATE')"
"From their account, the hardships of the prison
 and death of Bajazet are affirmed by the marshal's servant
 and historian, within the distance of seven years. (49) 2.by the Italians.","('Bajazet', 'PERSON'), ('seven years', 'DATE'), ('49) 2.by', 'DATE'), ('Italians', 'NORP')"
"He
 fought by his father's side in the battle of Angora: but
 when the captive sultan was permitted to inquire for his
 children, Mousa alone could be found; and the Turkish
 historians, the slaves of the triumphant faction, are
 persuaded that his brother was confounded among the slain.","('Angora', 'PERSON'), ('Mousa', 'PERSON'), ('Turkish', 'NORP')"
"He
 relieved himself from the dangerous neighbourhood of Isa; but
 in the contests of their more powerful brethren his firm
 neutrality was respected; till, after the triumph of Mousa,
 he stood forth the heir and avenger of the unfortunate
 Soliman.","('Isa', 'PERSON'), ('Mousa', 'PERSON'), ('Soliman', 'PERSON')"
"He ascends the throne of Zagatai, A.D. 1370, April","('Zagatai', 'GPE'), ('1370', 'DATE'), ('April', 'DATE')"
"He concluded a
 treaty with Mahomet, whose progress was checked by the
 insuperable barrier of Gallipoli: the sultan and his troops
 were transported over the Bosphorus; he was hospitably
 entertained in the capital; and his successful sally was the
 first step to the conquest of Romania.","('Mahomet', 'PERSON'), ('Gallipoli', 'GPE'), ('Bosphorus', 'LOC'), ('first', 'ORDINAL'), ('Romania', 'GPE')"
"He fled to the Christian duke of Lithuania; again returned to the banks of the Volga; and, after fifteen battles with a domestic rival, at last perished in the wilds of Siberia.","('Christian', 'NORP'), ('Lithuania', 'GPE'), ('Volga', 'LOC'), ('fifteen', 'CARDINAL'), ('Siberia', 'LOC')"
"He had improved the tactics, without violating the manners, of his nation,
 (41) whose force still consisted in the missile weapons, and
 rapid evolutions, of a numerous cavalry.","('41', 'CARDINAL')"
"He invaded Turkestan, Kipzak, Russia, Hindostan,
 Syria, Anatolia, Armenia, and Georgia, without a hope or a
 desire of preserving those distant provinces.","('Turkestan', 'GPE'), ('Kipzak', 'GPE'), ('Russia', 'GPE'), ('Hindostan', 'GPE'), ('Syria', 'GPE'), ('Anatolia', 'GPE'), ('Armenia', 'GPE'), ('Georgia', 'GPE')"
"He presented himself as a guide to three chiefs, who were at the head of seventy
 horse.","('three', 'CARDINAL'), ('seventy', 'CARDINAL')"
"He resolved to purify his soldiers in the blood of the idolaters, or Gentoos, who still surpass, in the proportion of ten to one, the numbers of the Moslems.","('Gentoos', 'PERSON'), ('ten to one', 'CARDINAL'), ('Moslems', 'NORP')"
"He touched the utmost verge of the land; but
 an insuperable, though narrow, sea rolled between the two
 continents of Europe and Asia; (59) and the lord of so many
 tomans, or myriads, of horse, was not master of a single
 galley.","('two', 'CARDINAL'), ('Europe', 'LOC'), ('Asia', 'LOC'), ('59', 'CARDINAL')"
"He wandered in the desert with his wife, seven companions, and four horses; and sixty-two days   was he plunged in a loathsome dungeon, from whence he escaped by his own courage and the remorse of the oppressor.","('seven', 'CARDINAL'), ('four', 'CARDINAL'), ('sixty-two days', 'DATE')"
"He warred not with the
 dead: a tear and a sepulchre were all that he could bestow
 on a captive who was delivered from his power; and if Mousa,
 the son of Bajazet, was permitted to reign over the ruins of
 Boursa, the greatest part of the province of Anatolia had
 been restored by the conqueror to their lawful sovereigns.","('Mousa', 'PERSON'), ('Bajazet', 'PERSON'), ('Boursa', 'GPE'), ('Anatolia', 'LOC')"
"He was born forty miles to the south of Samarcand in the village of Sebzar, in the fruitful territory of Cash, of which his fathers were the hereditary chiefs, as well as of a toman of ten thousand horse.","('forty miles', 'QUANTITY'), ('Samarcand', 'GPE'), ('Sebzar', 'GPE'), ('Cash', 'LOC'), ('ten thousand', 'CARDINAL')"
He was informed by his spies of the weakness and anarchy of Hindostan: the soubahs of the provinces had erected the standard of rebellion; and the perpetual infancy of Sultan Mahmoud was despised even in the harem of Delhi.,"('Hindostan', 'NORP'), ('Sultan Mahmoud', 'PERSON'), ('Delhi', 'GPE')"
"He was pursued and taken by the
 titular khan of Zagatai; and, after his capture, and the
 defeat of the Ottoman powers, the kingdom of Anatolia
 submitted to the conqueror, who planted his standard at
 Kiotahia, and dispersed on all sides the ministers of rapine
 and destruction.","('Zagatai', 'PERSON'), ('Ottoman', 'NORP'), ('Anatolia', 'LOC'), ('Kiotahia', 'GPE')"
Hereditary succession and merit of the Ottomans.,"('Ottomans', 'NORP')"
"His
 designs were lost; his armies were disbanded; China was
 saved; and fourteen years after his decease, the most
 powerful of his children sent an embassy of friendship and
 commerce to the court of Pekin. (65)","('China', 'GPE'), ('fourteen years', 'DATE'), ('Pekin', 'GPE'), ('65', 'CARDINAL')"
"His Conquests in Persia, Georgia, Tartary, Russia, India, Syria,
and Anetolia.","('Persia', 'GPE'), ('Georgia', 'GPE'), ('Tartary', 'GPE'), ('Russia', 'GPE'), ('India', 'GPE'), ('Syria', 'GPE'), ('Anetolia', 'GPE')"
"His Tartar allies had been tempted by the letters
 and emissaries of Timour; (44) who reproached their ignoble
 servitude under the slaves of their fathers; and offered to
 their hopes the dominion of their new, or the liberty of
 their ancient, country.","('Tartar', 'NORP'), ('Timour', 'PERSON'), ('44', 'CARDINAL')"
"His Turkish War.
 Defeat and Captivity of Bajazet.","('Turkish', 'NORP'), ('Captivity of Bajazet', 'WORK_OF_ART')"
"His birth (10) was cast on one of those periods of anarchy, which announce the fall of the Asiatic dynasties, and open a new field to adventurous ambition.","('10', 'CARDINAL'), ('one', 'CARDINAL'), ('Asiatic', 'NORP')"
"His conquests, A.D. 1370-1400
I. of Persia, A.D. 1380-1393.","('A.D. 1370-1400\r\nI. of Persia', 'DATE'), ('1380-1393', 'CARDINAL')"
"His death on the road to China, A.D. 1405, April 1.","('China', 'GPE'), ('A.D. 1405', 'DATE'), ('April 1', 'DATE')"
"His elegant dialogue on the vicissitudes of fortune (51) was
 composed in his fiftieth year, twenty-eight years after the
 Turkish victory of Tamerlane; (52) whom he celebrates as not
 inferior to the illustrious Barbarians of antiquity.","('51', 'CARDINAL'), ('fiftieth year', 'DATE'), ('twenty-eight years', 'DATE'), ('Turkish', 'NORP'), ('Tamerlane', 'PERSON'), ('52', 'CARDINAL'), ('Barbarians', 'NORP')"
"His first adventures, A.D. 1361-1370.","('first', 'ORDINAL'), ('A.D. 1361-1370', 'DATE')"
"His first defeat would
 have been his last, had not the true, or false, Mustapha
 been saved by the Greeks, and restored, after the decease of
 his brother Mahomet, to liberty and empire.","('first', 'ORDINAL'), ('Mustapha', 'PERSON'), ('Greeks', 'NORP'), ('Mahomet', 'PERSON')"
"His indiscreet mention of women and divorces was deeply
 resented by the jealous Tartar: in the feast of victory the
 wine was served by female cupbearers, and the sultan beheld
 his own concubines and wives confounded among the slaves,
 and exposed without a veil to the eyes of intemperance.","('Tartar', 'NORP')"
"His last care was the choice of two
 viziers, Bajazet and Ibrahim, (75) who might guide the youth
 of his son Amurath; Reign of Amurath II. A.D. 1421-1451, February 9.  and such was their union and prudence,
 that they concealed above forty days the emperor's death,
 till the arrival of his successor in the palace of Boursa.","('two', 'CARDINAL'), ('Bajazet', 'PERSON'), ('Ibrahim', 'PERSON'), ('75', 'DATE'), ('Amurath', 'PERSON'), ('A.D. 1421-1451', 'DATE'), ('February 9', 'DATE'), ('forty days', 'DATE'), ('Boursa', 'GPE')"
"His life
 and liberty were in their hands; nor can we, without
 reluctance, applaud the fidelity of Adorno, who, in the
 midst of the passage, knelt before him, and gratefully
 accepted a discharge of his arrears of tribute.","('Adorno', 'PERSON')"
"His most distant
 camp was two months' journey, or four hundred and eighty
 leagues to the north-east of Samarcand; and his emirs, who
 traversed the River Irtish, engraved in the forests of
 Siberia a rude memorial of their exploits.","(""two months'"", 'DATE'), ('four hundred and eighty', 'CARDINAL'), ('Samarcand', 'GPE'), ('the River Irtish', 'LOC'), ('Siberia', 'LOC')"
"His peace-offerings of silks, horses, and jewels, were composed, according to the Tartar fashion, each article of nine pieces; but a critical spectator observed, that there were only eight slaves.","('Tartar', 'NORP'), ('nine', 'CARDINAL'), ('eight', 'CARDINAL')"
"His return was along the skirts of the northern hills; nor could this rapid campaign of one year justify the strange foresight of his emirs, that their children in a warm climate would degenerate into a race of Hindoos.","('one year', 'DATE'), ('Hindoos', 'NORP')"
"His rigour and avarice  had provoked a mutiny among the Turks; and even his son Soliman too hastily withdrew
 from the field.","('Turks', 'NORP'), ('Soliman', 'PERSON')"
"His sons and grandsons, of whom Timour left six-and-thirty
 at his decease, were his first and most submissive subjects;
 and whenever they deviated from their duty, they were
 corrected, according to the laws of Zingis, with the
 bastinade, and afterwards restored to honour and command.","('Timour', 'PERSON'), ('six-and-thirty', 'DATE'), ('first', 'ORDINAL'), ('Zingis', 'PERSON')"
"His successors
 (the great Moguls (71)) extended their sway from the
 mountains of Cashmir to Cape Comorin, and from Candahar to
 the Gulf of Bengal.","('Moguls', 'ORG'), ('71', 'CARDINAL'), ('Cashmir', 'GPE'), ('Cape Comorin', 'GPE'), ('Candahar', 'GPE'), ('the Gulf of Bengal', 'LOC')"
"His triumph at Samarcand, A.D. 1404, July - 1405, January 8.","('Samarcand', 'GPE'), ('A.D. 1404', 'DATE'), ('July - 1405', 'DATE'), ('January 8', 'DATE')"
"His trusty bands were soon increased by the bravest of the tribes; he led them against a superior foe; and, after some vicissitudes of war the Getes were finally driven from the kingdom of Transoxiana.","('Getes', 'PERSON'), ('Transoxiana', 'GPE')"
"His vigour of mind and body was not impaired by sixty-three years, and innumerable fatigues; and, after enjoying some tranquil months in the palace of Samarcand, he proclaimed a new expedition of seven years into the western countries of Asia. (27)","('sixty-three years', 'DATE'), ('some tranquil months', 'DATE'), ('Samarcand', 'GPE'), ('seven years', 'DATE'), ('Asia', 'LOC'), ('27', 'CARDINAL')"
"His war against sultan Bajazet, A.D. 1400, September 1.","('Bajazet', 'PERSON'), ('A.D. 1400', 'DATE'), ('September 1', 'DATE')"
"Histories of TIMOUR, or Tamerlane","('TIMOUR', 'ORG'), ('Tamerlane', 'ORG')"
"I am satisfied that Sherefeddin Ali has
 faithfully described the first ostentatious interview, in
 which the conqueror, whose spirits were harmonized by
 success, affected the character of generosity.","('Sherefeddin Ali', 'PERSON'), ('first', 'ORDINAL')"
"I have expatiated on the personal anecdotes which mark
 the character of the Mogul hero; and Bagdad, A.D. 1401, July 23.","('Mogul', 'PERSON'), ('Bagdad', 'GPE'), ('1401', 'CARDINAL'), ('July 23', 'DATE')"
"I might add the authority of two Italian
 chronicles, perhaps of an earlier date, which would prove at
 least that the same story, whether false or true, was
 imported into Europe with the first tidings of the
 revolution. (53)3.by the Arabs.","('two', 'CARDINAL'), ('Italian', 'NORP'), ('Europe', 'LOC'), ('first', 'ORDINAL'), ('53', 'CARDINAL'), ('3.by', 'CARDINAL'), ('Arabs', 'NORP')"
"I shall not dwell on the march of the destroyer from Aleppo to Damascus, where he was rudely encountered, and almost overthrown, by the armies of Egypt.","('Aleppo', 'GPE'), ('Damascus', 'GPE'), ('Egypt', 'GPE')"
"I suppress the names of Chalcondyles and Ducas, who flourished in the latter period, and who
 speak in a less positive tone; but more attention is due to George Phranza, (56) protovestiare of the last emperors, and
 who was born a year before the battle of Angora.","('Chalcondyles', 'PERSON'), ('Ducas', 'PERSON'), ('George Phranza', 'PERSON'), ('56', 'DATE'), ('a year', 'DATE'), ('Angora', 'GPE')"
"II of Turkestan, A.D. 1370-1383","('Turkestan', 'GPE'), ('1370-1383', 'DATE')"
"Ibrahim, prince of Shirwan, or Albania, kissed the footstool of the Imperial throne.","('Ibrahim', 'PERSON'), ('Shirwan', 'GPE'), ('Albania', 'GPE'), ('Imperial', 'ORG')"
"If Mustapha escaped from that disastrous field, he was
 concealed twelve years from his friends and enemies; till he
 emerged in Thessaly, and was hailed by a numerous party, as
 the son and successor of Bajazet.","('Mustapha', 'PERSON'), ('twelve years', 'DATE'), ('Thessaly', 'PERSON'), ('Bajazet', 'PERSON')"
"If Timour had generously marched at the request, and to the
 relief, of the Greek emperor, he might be entitled to the
 praise and gratitude of the Christians. (79)","('Timour', 'PERSON'), ('Greek', 'NORP'), ('Christians', 'NORP')"
"In
 the last civil war of the Ottomans, the Genoese governor,
 Adorno, a bold and ambitious youth, embraced the party of
 Amurath; and undertook, with seven stout galleys, to
 transport him from Asia to Europe.","('Ottomans', 'NORP'), ('Genoese', 'NORP'), ('Adorno', 'PERSON'), ('Amurath', 'GPE'), ('seven', 'CARDINAL'), ('Asia', 'LOC'), ('Europe', 'LOC')"
"In a battle under the walls of Shiraz, he broke, with three or four thousand soldiers, the coul or main body of thirty thousand horse, where the emperor fought in person.","('Shiraz', 'GPE'), ('three or four thousand', 'CARDINAL'), ('thirty thousand', 'CARDINAL')"
"In a march of five months, they rarely beheld the footsteps of man; and their daily subsistence was often trusted to the fortune of the chase.","('five months', 'DATE')"
"In a reign of three years and a half, his troops were
 victorious against the Christians of Hungary and the Morea;
 but Mousa was ruined by his timorous disposition and
 unseasonable clemency.","('three years and a half', 'DATE'), ('Christians', 'NORP'), ('Hungary', 'GPE'), ('Morea', 'NORP'), ('Mousa', 'PERSON')"
"In four successive schools,
 under the rod of the white eunuchs, the arts of horsemanship
 and of darting the javelin were their daily exercise, while
 those of a more studious cast applied themselves to the
 study of the Koran, and the knowledge of the Arabic and
 Persian tongues.","('four', 'CARDINAL'), ('Koran', 'WORK_OF_ART'), ('Arabic', 'LANGUAGE'), ('Persian', 'NORP')"
"In his familiar discourse he was grave and
 modest, and if he was ignorant of the Arabic language, he
 spoke with fluency and elegance the Persian and Turkish
 idioms.","('Arabic', 'LANGUAGE'), ('Persian', 'NORP'), ('Turkish', 'NORP')"
"In his rapid career, Timour appears to
 have overlooked this obscure and contumacious angle of
 Anatolia; and Mahomet, without provoking the conqueror,
 maintained his silent independence, and chased from the
 province the last stragglers of the Tartar host.","('Timour', 'PERSON'), ('Anatolia', 'LOC'), ('Mahomet', 'PERSON'), ('Tartar', 'NORP')"
"In his religion he was a zealous, though not perhaps an orthodox, Mussulman; (68) but his sound understanding may tempt us to believe, that a superstitious reverence for omens and prophecies, for saints and astrologers, was only affected as an instrument of
 policy.","('Mussulman', 'PERSON'), ('68', 'DATE')"
"In his replies, Bajazet poured forth the indignation of a soul which was deeply stung by such unusual contempt.","('Bajazet', 'PERSON')"
"In that day Bajazet displayed the
 qualities of a soldier and a chief: but his genius sunk
 under a stronger ascendant; and, from various motives, the
 greatest part of his troops failed him in the decisive
 moment.","('that day', 'DATE'), ('Bajazet', 'PERSON')"
"In the cities, from Erzeroum to Belgrade, that
 national appellation is common to all the Moslems, the first
 and most honourable inhabitants; but they have abandoned, at
 least in Romania, the villages, and the cultivation of the
 land, to the Christian peasants.","('Erzeroum', 'GPE'), ('Belgrade', 'GPE'), ('Moslems', 'NORP'), ('first', 'ORDINAL'), ('Romania', 'GPE'), ('Christian', 'NORP')"
"In the establishment and restoration of the Turkish empire, the first merit must doubtless be assigned to the personal qualities of the sultans; since, in human life, the most important scenes will depend on the character of a single actor.","('Turkish', 'NORP'), ('first', 'ORDINAL')"
"In the eyes of the Moguls, who held the indefeasible succession of the house of Zingis, he was doubtless a rebel subject; yet he sprang from the noble tribe of Berlass: his fifth ancestor, Carashar Nevian, had been the vizier  of Zagatai, in his new realm of Transoxiana; and in the ascent of some generations, the branch of Timour is confounded, at least by the females, (7) with the Imperial stem. (8)","('Moguls', 'PERSON'), ('Zingis', 'PERSON'), ('Berlass', 'PERSON'), ('fifth', 'ORDINAL'), ('Carashar Nevian', 'PERSON'), ('Zagatai', 'NORP'), ('Transoxiana', 'NORP'), ('Timour', 'GPE'), ('8', 'CARDINAL')"
"In the feast of victory, to which Bajazet was invited, the Mogul emperor placed a crown on his head and a sceptre in his hand, with a solemn assurance of restoring him with an increase of glory to the throne of his ancestors.","('Bajazet', 'PERSON'), ('Mogul', 'PERSON')"
"In the mean while, Timour moved from the Araxes through the countries of Armenia and Anatolia: his boldness was secured by the wisest precautions; his speed was guided by order and discipline; and the woods, the mountains, and the rivers, were diligently explored by the flying squadrons, who marked his road and preceded his standard.","('Timour', 'PERSON'), ('Araxes', 'NORP'), ('Armenia', 'GPE'), ('Anatolia', 'LOC')"
"In the midst of rebellion and discord, he braved the menaces, corresponded with the enemies, and detained the
 ambassadors, of the Mogul, who patiently expected his decease, to revenge the crimes of the father on the feeble reign of his son Farage.","('Mogul', 'PERSON'), ('Farage', 'PERSON')"
"In the mountains of Georgia, the native Christians still braved the law and the sword of Mahomet, by three expeditions he obtained the merit of the gazie, or holy war; and the prince of Teflis became his proselyte and friend.","('Georgia', 'GPE'), ('Christians', 'NORP'), ('Mahomet', 'PERSON'), ('three', 'CARDINAL'), ('Teflis', 'PERSON')"
"In the pillage of Syria, the Moguls had acquired immense riches: but the delivery of their pay and arrears for seven years more firmly attached them to the Imperial standard.","('Syria', 'GPE'), ('Moguls', 'ORG'), ('seven years', 'DATE'), ('Imperial', 'ORG')"
"In the right wing of Bajazet the
 cuirassiers of Europe charged, with faithful hearts and
 irresistible arms: but these men of iron were soon broken by
 an artful flight and headlong pursuit; and the Janizaries,
 alone, without cavalry or missile weapons, were encompassed
 by the circle of the Mogul hunters.","('Bajazet', 'GPE'), ('Europe', 'LOC'), ('Janizaries', 'NORP'), ('Mogul', 'PERSON')"
"In the slumber of intoxication
 he was surprised by his brother Mousa; and as he fled from
 Adrianople towards the Byzantine capital, Soliman was
 overtaken and slain in a bath,  after a reign of seven years and ten months.","('Mousa', 'PERSON'), ('Adrianople', 'GPE'), ('Byzantine', 'NORP'), ('Soliman', 'PERSON'), ('seven years and ten months', 'DATE')"
"In the vigorous age of the
 Ottoman government, the Turks were themselves excluded from
 all civil and military honours; and a servile class, an
 artificial people, was raised by the discipline of education
 to obey, to conquer, and to command. (87)","('Ottoman', 'NORP'), ('Turks', 'NORP')"
"In these conflicts, the wisest Turks, and indeed the body of
 the nation, were strongly attached to the unity of the
 empire; and Romania and Anatolia, so often torn asunder by
 private ambition, were animated by a strong and invincible
 tendency of cohesion.","('Turks', 'NORP'), ('Romania', 'GPE'), ('Anatolia', 'LOC')"
"In these transactions, the Ottoman prince, by the Orientals, and even by Timour, is styled the Kaissar of Roum, the Caesar of the Romans; a title which, by a small anticipation, might be given to a monarch who possessed the provinces, and threatened the city, of the successors of Constantine. (32)","('Ottoman', 'NORP'), ('Orientals', 'NORP'), ('Timour', 'PERSON'), ('the Kaissar of Roum', 'WORK_OF_ART'), ('Caesar', 'PERSON'), ('Romans', 'NORP'), ('Constantine', 'PERSON'), ('32', 'CARDINAL')"
"In this pious design, he advanced one hundred miles to the north-east of Delhi, passed the Ganges, fought several battles by land and water, and penetrated to the famous rock of Coupele, the statue of the cow, that seems to discharge the mighty river, whose source is far distant among the mountains of Thibet. (26)","('one hundred miles', 'QUANTITY'), ('Delhi', 'GPE'), ('Ganges', 'LOC'), ('Coupele', 'GPE'), ('Thibet', 'GPE'), ('26', 'CARDINAL')"
"India, (13) and from thence proceed to the more interesting narrative of his Ottoman war.","('India', 'GPE'), ('13', 'CARDINAL'), ('Ottoman', 'NORP')"
"Invades Anatolia, A.D. 1402.","('Anatolia', 'GPE'), ('1402', 'CARDINAL')"
"It is
 doubtful, whether I relate the story of the true Mustapha,
 or of an impostor who personated that lost prince.","('Mustapha', 'PERSON')"
"It was first directed against the Christians of Georgia, who were strong only in their rocks, their castles, and the winter season; but these obstacles were overcome by the zeal and perseverance of Timour: the rebels submitted to the tribute or the Koran; and if both religions boasted of their martyrs, that name is more justly due to the Christian
 prisoners, who were offered the choice of abjuration or death.","('first', 'ORDINAL'), ('Christians', 'NORP'), ('Georgia', 'GPE'), ('Timour', 'PERSON'), ('Koran', 'WORK_OF_ART'), ('Christian', 'NORP')"
"It was on the banks of the Ganges that Timour was informed, by his speedy messengers, of the disturbances which had arisen on the confines of Georgia and Anatolia, of the revolt of the Christians, and the ambitious designs of the
 sultan Bajazet.","('Ganges', 'LOC'), ('Timour', 'PERSON'), ('Georgia', 'GPE'), ('Anatolia', 'LOC'), ('Christians', 'NORP'), ('Bajazet', 'PERSON')"
"It was the first care of their masters to
 instruct them in the Turkish language: their bodies were
 exercised by every labor that could fortify their strength;
 they learned to wrestle, to leap, to run, to shoot with the
 bow, and afterwards with the musket; till they were drafted
 into the chambers and companies of the Janizaries, and
 severely trained in the military or monastic discipline of
 the order.","('first', 'ORDINAL'), ('Turkish', 'LANGUAGE'), ('Janizaries', 'NORP')"
"Mahomet obtained Anatolia by treaty, and Romania
 by arms; and the soldier who presented him with the head of
 Mousa was rewarded as the benefactor of his king and
 country.","('Mahomet', 'PERSON'), ('Anatolia', 'LOC'), ('Romania', 'GPE'), ('Mousa', 'PERSON')"
"Manuel (80) immediately sailed
 from Modon in the Morea; ascended the throne of
 Constantinople, and dismissed his blind competitor to an
 easy exile in the Isle of Lesbos.","('Manuel', 'PERSON'), ('80', 'DATE'), ('Modon', 'GPE'), ('Morea', 'LOC'), ('Constantinople', 'GPE'), ('the Isle of Lesbos', 'GPE')"
Manuel sank into the grave;,"('Manuel', 'PERSON')"
