Sentence,Entities
"""Let him be beaten with clubs till he expires;"" (57) and his most favoured ministers soon understood that, by a rash attempt to dispute or suspend the execution of his sanguinary commands; they might involve themselves in the guilt and punishment of disobedience.","('57', 'DATE')"
(113),"('113', 'CARDINAL')"
(117),"('117', 'CARDINAL')"
(119),"('119', 'CARDINAL')"
(131),"('131', 'CARDINAL')"
(3),"('3', 'CARDINAL')"
(31),"('31', 'CARDINAL')"
"(5) As soon as he had gained the confidence and 
 secured the faith of the Christian emperor, he returned in
 triumph to his diocese, and continued, with mature counsels
 and undiminished vigour, to direct, ten years longer,(6) the 
 ecclesiastical government of Alexandria, Egypt, and the
 Catholic church.","('Christian', 'NORP'), ('ten years longer', 'DATE'), ('6', 'CARDINAL'), ('Alexandria', 'GPE'), ('Egypt', 'GPE'), ('Catholic', 'NORP')"
"1. The silence of 
 Valentinian may suggest a probable argument that the partial
 severities which were exercised in the name and provinces of
 his colleague amounted only to some obscure and
 inconsiderable deviations from the established system of
 religious toleration; and the judicious historian, who has
 praised the equal temper of the elder brother, has not
 thought himself obliged to contrast the tranquillity of the
 West with the cruel persecution of the East.(70)","('1', 'CARDINAL'), ('Valentinian', 'NORP'), ('West', 'LOC'), ('East', 'LOC'), ('70', 'CARDINAL')"
"2. Whatever 
 credit may be allowed to vague and distant reports, the
 character, or at least the behaviour, of Valens may be most
 distinctly seen in his personal transactions with the
 eloquent Basil, archbishop of Gaesarea, who had succeeded
 Athanasius in the management of the Trinitarian cause.(71)","('2', 'CARDINAL'), ('Valens', 'PERSON'), ('Basil', 'PERSON'), ('Gaesarea', 'PERSON'), ('Athanasius', 'PERSON'), ('Trinitarian', 'NORP'), ('71', 'CARDINAL')"
"A
 dark conspiracy was detected by the penetration of
 Theodosius, and he satisfied, without much reluctance, the
 public indignation which he had secretly excited.","('Theodosius', 'PERSON')"
"A
 separate view of the five great theatres of war—","('five', 'CARDINAL')"
"A bloody sentence was pronounced, without hesitation, by the
 rash and headstrong cruelty of Valentinian.","('Valentinian', 'NORP')"
"A bridge of boats was established upon
 the Danube, the presence of Valens animated his troops, and
 his ignorance of the art of war was compensated by personal
 bravery, and a wise deference to the advice of Victor and
 Arintheus, his masters-general of the cavalry and infantry.","('Danube', 'LOC'), ('Valens', 'PERSON'), ('Victor', 'PERSON'), ('Arintheus', 'PERSON')"
"A chain of posts and fortifications,
 skilfully disposed by Valens, or the generals of Valens,
 resisted their march, prevented their retreat, and
 intercepted their subsistence.","('Valens', 'PERSON'), ('Valens', 'PERSON')"
"A dark and
 almost impervious path securely conveyed the Armenian troops
 through the thicket; and Para had left behind him the count
 and the tribune, while they patiently expected his approach
 along the public highways.","('Armenian', 'NORP'), ('Para', 'PERSON')"
"A detachment
 of cavalry and infantry, consisting of three thousand men, marched from Alexandria into the adjacent desert of Nitria, (75) which was peopled by five thousand monks.","('three thousand', 'CARDINAL'), ('Alexandria', 'GPE'), ('Nitria', 'GPE'), ('75', 'CARDINAL'), ('five thousand', 'CARDINAL')"
"A legion was
 ordered to pursue the royal fugitive; but the pursuit of
 infantry could not be very alarming to a body of light
 cavalry; and upon the first cloud of arrows that was
 discharged into the air, they retreated with precipitation
 to the gates of Tarsus.","('first', 'ORDINAL'), ('Tarsus', 'GPE')"
"A military
 confederation was gradually moulded into a national body by
 the gentle operation of marriage and consanguinity; and the
 adjacent tribes, who solicited the alliance, accepted the
 name and laws of the Saxons.","('Saxons', 'NORP')"
"A numerous and active party acknowledged
 Para, the son of Tiranus, as the lawful sovereign of
 Armenia, and his title to the throne was deeply rooted in
 the hereditary succession of five hundred years.","('Para', 'PERSON'), ('Tiranus', 'PERSON'), ('Armenia', 'GPE'), ('five hundred years', 'DATE')"
"A powerful army, under
 the command of Count Trajan, and of Vadomair king of the
 Alemanni, fixed their camp on the confines of Armenia.","('Trajan', 'PERSON'), ('Vadomair', 'PERSON'), ('Alemanni', 'PERSON'), ('Armenia', 'GPE')"
"A robust and desperate barbarian instantly rushed on the
 king of Armenia, and though he bravely defended his life
 with the first weapon that chance offered to  A.D. 374.his hand, the
 table of the Imperial general was stained with the royal
 blood of a guest and an ally.","('Armenia', 'GPE'), ('first', 'ORDINAL'), ('A.D. 374.his', 'DATE'), ('Imperial', 'NORP')"
"A.D. 363, October","('A.D. 363', 'DATE'), ('October', 'DATE')"
A.D. 364-375.,"('364-375', 'CARDINAL')"
A.D. 364.,"('A.D. 364', 'DATE')"
A.D. 365.,"('A.D. 365', 'DATE')"
A.D. 366-384.,"('A.D. 366-384', 'DATE')"
A.D. 366.,"('A.D. 366', 'DATE')"
A.D. 367-378.,"('A.D. 367-378', 'DATE')"
A.D. 370.,"('370', 'CARDINAL')"
A.D. 371,"('A.D. 371', 'DATE')"
A.D. 372,"('A.D. 372', 'DATE')"
"A.D. 373 that the great Theodosius, with a small band of
 veterans, had landed near Igilgilis, or Gigeri, on the
 African coast, and the timid usurper sunk under the
 ascendant of virtue and military genius.","('A.D. 373', 'DATE'), ('Theodosius', 'GPE'), ('Igilgilis', 'GPE'), ('Gigeri', 'GPE'), ('African', 'NORP')"
A.D. 380,"('A.D. 380', 'DATE')"
"About
 the same time the restorer of Britain and Africa, on a vague
 suspicion that his name and services were superior to the
 rank of a subject, was ignominiously beheaded at Carthage.","('Britain', 'GPE'), ('Africa', 'LOC'), ('Carthage', 'GPE')"
"About the
 middle of the fourth century, the countries, perhaps of
 Lusace and Thuringia, on either side of the Elbe, were
 occupied by the vague dominion of the BURGUNDIANS, a warlike
 and numerous people of the Vandal race,(96) whose obscure 
 name insensibly swelled into a powerful kingdom, and has
 finally settled on a flourishing province.","('About the\r\n middle of the fourth century', 'DATE'), ('Lusace', 'GPE'), ('Thuringia', 'GPE'), ('Elbe', 'LOC'), ('BURGUNDIANS', 'NORP'), ('Vandal', 'NORP'), ('96', 'CARDINAL')"
"According
 to others, he was suffocated in his sleep by the vapour of
 charcoal, which extracted from the walls of the apartment
 the unwholesome moisture of the fresh plaster.(16) But the 
 want of a regular inquiry into the death of a prince whose
 reign and person were soon forgotten appears to have been
 the only circumstance which countenanced the malicious
 whispers of poison and domestic guilt.(17)","('17', 'CARDINAL')"
Africa IV.,"('Africa', 'LOC')"
"After
 his return to his native kingdom, Para still continued to
 profess himself the friend and ally of the Romans: but the
 Romans had injured him too deeply ever to forgive, and the
 secret sentence of his death was signed in the council of
 Valens.","('Para', 'PERSON'), ('Romans', 'NORP'), ('Romans', 'NORP'), ('Valens', 'PERSON')"
"After an honourable defence the city and
 island of Cyzicus yielded to his power, the renowned legions
 of the Jovians and Herculians embraced the cause of the
 usurper whom they were ordered to crush, and, as the
 veterans were continually augmented with new levies, he soon
 appeared at the head of an army whose valour, as well as
 numbers, were not unequal to the greatness of the contest.","('Cyzicus', 'GPE'), ('Jovians', 'NORP'), ('Herculians', 'NORP')"
"After an incessant march of two days
 and two nights, Para and his Armenians reached the banks of
 the Euphrates; but the passage of the river, which they were
 obliged to swim, was attended with some delay and some loss.","('two days', 'DATE'), ('two nights', 'DATE'), ('Para', 'PERSON'), ('Armenians', 'NORP'), ('Euphrates', 'LOC')"
"After indulging himself with a plentiful, perhaps an
 intemperate supper, he retired to rest, and the next morning
 the emperor Jovian was found dead in his bed.","('the next morning', 'TIME'), ('Jovian', 'PERSON')"
"After the death of Jovian the throne of the Roman world
 remained ten days (19) without a master.","('Jovian', 'PERSON'), ('Roman', 'NORP'), ('ten days', 'DATE'), ('19', 'DATE')"
"After the ratification of the treaty, and the delivery of
 hostages, Valens returned in triumph to Constantinople, and
 the Goths remained in a state of tranquillity about six
 years, till they were violently impelled against the Roman
 empire by an innumerable host of Scythians, who appeared to
 issue from the frozen regions of the North.(149)","('Valens', 'PERSON'), ('Constantinople', 'GPE'), ('Goths', 'NORP'), ('about six\r\n years', 'DATE'), ('Roman', 'NORP'), ('Scythians', 'NORP'), ('North', 'LOC'), ('149', 'CARDINAL')"
"After the submission of the Venedi,
 the conqueror advanced, without resistance, as far as the
 confines of the Aestii,(142) an ancient people, whose name is 
 still preserved in the province of Esthonia.","('Venedi', 'NORP'), ('Aestii', 'NORP'), ('142', 'CARDINAL'), ('Esthonia', 'GPE')"
"After they had 
 acquired an accurate knowledge of the maritime provinces of
 the West they extended the scene of their depredations, and
 the most sequestered places had no reason to presume on
 their security.","('West', 'LOC')"
"After this signal victory Valentinian returned to his winter
 quarters at Treves, where he indulged the public joy by the
 exhibition of splendid and triumphal games.(93)","('Valentinian', 'NORP'), ('Treves', 'ORG'), ('93', 'CARDINAL')"
"After wandering some time among the woods and mountains of
 Phrygia, he was betrayed by his desponding followers,
 conducted to the Imperial camp, and immediately beheaded.","('Phrygia', 'GPE'), ('Imperial', 'NORP')"
"All ranks of subjects who had
 been injured or oppressed under the reign of Julian were
 invited to support their public accusations.","('Julian', 'PERSON')"
"Amidst the boundless plains of Gaetulia and the innumerable
 valleys of Mount Atlas, it was impossible to prevent the
 escape of Firmus; and if the usurper could have tired the
 patience of his antagonist, he would have secured his person
 in the depth of some remote solitude, and expected the hopes
 of a future revolution.","('Gaetulia', 'LOC'), ('Mount Atlas', 'LOC'), ('Firmus', 'ORG')"
"Among the
 princes of the Alemanni, Macrianus, who, with a Roman name,
 had assumed the arts of a soldier and a statesman, deserved
 his hatred and esteem.","('Alemanni', 'NORP'), ('Macrianus', 'PERSON'), ('Roman', 'NORP')"
"An anxious regard 
 to his personal safety was the ruling principle of the
 administration of Valens.","('Valens', 'PERSON')"
"An army of 
 four-score thousand Burgundians soon appeared on the banks
 of the Rhine, and impatiently required the support and
 subsidies which Valentinian had promised; but they were
 amused with excuses and delays, till at length, after a
 fruitless expectation, they were compelled to retire.","('four-score thousand', 'CARDINAL'), ('Burgundians', 'NORP'), ('Rhine', 'LOC'), ('Valentinian', 'ORG')"
"Another division, or
 rather army, of the enemy, after the cruel and wanton
 devastation of the adjacent country, reposed themselves on
 the shady banks of the Moselle.","('Moselle', 'GPE')"
"Arintheus, who in strength, beauty, and
 valour excelled all the heroes of the age, attacked with a
 small troop a superior body of the rebels.","('Arintheus', 'PERSON')"
"As
 soon as the Christians of the West had extricated themselves
 from the snares of the creed of Rimini, they happily
 relapsed into the slumber of orthodoxy; and the small
 remains of the Arian party, that still subsisted at Sirmium
 or Milan, might be considered rather as objects of contempt
 than of resentment.","('Christians', 'NORP'), ('West', 'LOC'), ('Rimini', 'GPE'), ('Arian', 'NORP'), ('Sirmium', 'ORG'), ('Milan', 'GPE')"
"As
 soon as the zeal of informers was encouraged by the
 ministers of Valens and Valentinian, they could not refuse
 to listen to another charge too frequently mingled in the
 scenes of domestic guilt, a charge of a softer and less
 malignant nature, for which the pious though excessive
 rigour of Constantine had recently decreed the punishment of
 death.","('Valens', 'PERSON'), ('Valentinian', 'NORP'), ('Constantine', 'PERSON')"
"As he had resolved to complete the destruction of the
 Quadi by a second campaign, he fixed his winter-quarters at
 Bregetio, on the Danube, near the Hungarian city of
 Presburg.","('Quadi', 'NORP'), ('second', 'ORDINAL'), ('winter-quarters', 'DATE'), ('Bregetio', 'GPE'), ('Danube', 'LOC'), ('Hungarian', 'NORP'), ('Presburg', 'GPE')"
"As long as he wrestled with his equals in the bold competition of an active and ambitious life, Valentinian was seldom injured, and never insulted, with impunity: if his prudence was arraigned, his
 spirit was applauded; and the proudest and most powerful generals were apprehensive of provoking the resentment of a fearless soldier.","('Valentinian', 'PERSON')"
"As soon as Igmazen was satisfied that his enemy had strength and resolution to execute the fatal menace, he consented to purchase a necessary peace by the sacrifice of a guilty fugitive.","('Igmazen', 'PERSON')"
"As soon as he
 ascended the throne he transmitted a circular epistle to all
 the governors of provinces, in which he confessed the divine
 truth and secured the legal establishment of the Christian
 religion.","('Christian', 'NORP')"
"As soon as he was informed that the village
 where she stopped only to dine was almost encompassed by the
 barbarians, he hastily placed her in his own chariot, and
 drove full speed till he reached the gates of Sirmium, which
 were at the distance of six-and-twenty miles.","('Sirmium', 'PRODUCT'), ('six-and-twenty miles', 'QUANTITY')"
"As soon as the death of Julian had
 relieved the barbarians from the terror of his name, the
 most sanguine hopes of rapine and conquest excited the
 nations of the East, of the North, and of the South.","('Julian', 'PERSON'), ('East', 'LOC'), ('North', 'LOC'), ('South', 'LOC')"
"As the guardian of domestic
 happiness and virtue, Valentinian applied this severe remedy
 to the growing evil.","('Valentinian', 'NORP')"
"As they were incapable of
 furnishing the four thousand camels and the exorbitant
 present which he required before he would march to the
 assistance of Tripoli, his demand was equivalent to a
 refusal, and he might justly be accused as the author of the
 public calamity.","('four thousand', 'CARDINAL'), ('Tripoli', 'GPE')"
Associates his brother Valens.,"('Valens', 'PERSON')"
"At
 this tremendous sentence the troops fell prostrate on the
 ground, deprecated the indignation of their sovereign, and
 protested that if he would indulge them in another trial,
 they would approve themselves not unworthy of the name of
 Romans, and of his soldiers.","('Romans', 'NORP')"
"At 
 length, when the hour was supposed to be propitious,
 Valentinian showed himself from a lofty tribunal; the
 judicious choice was applauded, and the new prince was
 solemnly invested with the diadem and the purple, amidst the
 acclamations of the troops, who were disposed in martial
 order round the tribunal.","('the hour', 'TIME'), ('Valentinian', 'PERSON')"
"At first he lurked in the villages of
 Bithynia, continually changing his habitation and his
 disguise. (36)","('first', 'ORDINAL'), ('Bithynia', 'GPE')"
"At first he pitied their
 blindness; by degrees he was provoked at their obstinacy;
 and he insensibly hated those sectaries to whom he was an
 object of hatred. (67)","('first', 'ORDINAL')"
"At length, when the repetition of complaint
 had been justified by the repetition of public misfortunes,
 the notary Palladius was sent from the court of Treves to
 examine the state of Africa and the conduct of Romanus.","('Palladius', 'PERSON'), ('Treves', 'GPE'), ('Africa', 'LOC'), ('Romanus', 'PERSON')"
"At the
 signal of the general assault, the Roman troops encompassed
 and ascended the mountain of Solicinium on three different
 sides.","('Roman', 'NORP'), ('Solicinium', 'LOC'), ('three', 'CARDINAL')"
"At the dawn of day they were drawn up near the
 baths of Anastasia, and Procopius, clothed in a purple
 garment more suitable to a player than to a monarch,
 appeared, as if he rose from the dead, in the midst of
 Constantinople.","('Anastasia', 'LOC'), ('Procopius', 'PERSON'), ('Constantinople', 'GPE')"
"At the death of his father the royal youth was in
 the seventeenth year of his age, and his virtues already
 justified the favourable opinion of the army and people.","('the seventeenth year', 'DATE')"
"At the head of a
 well-disciplined army of cavalry, infantry, and light
 troops, Jovinus advanced, with cautious and rapid steps, to
 Scarponna,(90) in the territory of Metz, where he surprised a 
 large division of the Alemanni before they had time to run
 to their arms; and flushed his soldiers with the confidence
 of an easy and bloodless victory.","('Jovinus', 'NORP'), ('Scarponna', 'PERSON'), ('90', 'CARDINAL'), ('Metz', 'GPE'), ('Alemanni', 'PERSON')"
"At the head of a small
 body of troops, which seldom exceeded three thousand five
 hundred men, the Roman general advanced with a steady
 prudence, devoid of rashness or of fear, into the heart of a
 country where he was sometimes attacked by armies of twenty
 thousand Moors.","('three thousand five\r\n hundred', 'CARDINAL'), ('Roman', 'NORP'), ('twenty\r\n thousand', 'CARDINAL'), ('Moors', 'NORP')"
"Athanaric was provoked, or compelled, to risk a battle,
 which he lost, in the plains; and the pursuit was rendered
 more bloody by the cruel precaution of the victorious
 generals, who had promised a large reward for the head of
 every Goth that was brought into the Imperial camp.","('Athanaric', 'PERSON'), ('Goth', 'PERSON'), ('Imperial', 'ORG')"
"Athanaric, who, on this
 occasion, appears to have consulted his private interest,
 without expecting the orders of his sovereign, supported his
 own dignity, and that of his tribe, in the personal
 interview which was proposed by the ministers of Valens.","('Athanaric', 'PERSON'), ('Valens', 'PERSON')"
"Athanasius had reason to
 hope that he should be allowed either the merit of a
 successful prediction, or the excuse of a grateful though
 ineffectual prayer.(7)
Jovian proclaims universal toleration.","('Athanasius', 'PERSON'), ('Jovian', 'PERSON')"
"Athanasius still reigned at Alexandria; the thrones
 of Constantinople and Antioch were occupied by Arian
 prelates; and every episcopal vacancy was the occasion of a
 popular tumult.","('Athanasius', 'PERSON'), ('Alexandria', 'GPE'), ('Constantinople', 'GPE'), ('Antioch', 'GPE'), ('Arian', 'NORP')"
"Before
 Valentinian could pass the Alps, the villages of Gaul were
 in flames; before his general Dagalaiphus could encounter
 the Alemanni, they had secured the captives and the spoil in
 the forests of Germany.","('Valentinian', 'NORP'), ('Alps', 'LOC'), ('Gaul', 'PERSON'), ('Dagalaiphus', 'GPE'), ('Alemanni', 'PERSON'), ('Germany', 'GPE')"
"Before Valentinian divided the provinces, he reformed the
 administration of the empire.","('Valentinian', 'NORP')"
"Before he could procure any certain
 intelligence that the emperor of the West had fixed the
 choice of a general, or that a fleet of transports was
 collected at the mouth of the Rhone, he was suddenly
 informed Theodosius recovers Africa.","('West', 'LOC'), ('Rhone', 'LOC'), ('Theodosius', 'PERSON'), ('Africa', 'LOC')"
"Before he had
 attained the ninth year of his age the royal youth received
 from the hands of his indulgent father the purple robe and
 diadem, with the title of Augustus; the election was
 solemnly ratified by the consent and applause of the armies
 of Gaul,(156) and the name of Gratian was added to the names 
 of Valentinian and Valens in all the legal transactions of
 the Roman government.","('the ninth year', 'DATE'), ('Augustus', 'PERSON'), ('Gaul', 'PERSON'), ('156', 'CARDINAL'), ('Gratian', 'PERSON'), ('Valentinian', 'NORP'), ('Valens', 'PERSON'), ('Roman', 'NORP')"
"Before his departure from Antioch, he
 assured Jovian that his orthodox devotion would be rewarded
 with a long and peaceful reign.","('Antioch', 'GPE'), ('Jovian', 'PERSON')"
"Beyond the utmost limits of the Moors, the vast and
 inhospitable desert of the South extends above a thousand
 miles to the banks of the Niger.","('Moors', 'LOC'), ('South', 'LOC'), ('a thousand\r\n miles', 'QUANTITY'), ('Niger', 'LOC')"
Britain; III.,"('Britain', 'GPE')"
"But
 Gratian resided, without apprehension, in the palace of
 Treves, whilst at the distance of many hundred miles
 Valentinian suddenly expired in the camp of Bregetio.","('Gratian', 'PERSON'), ('Treves', 'GPE'), ('many hundred miles', 'QUANTITY'), ('Valentinian', 'NORP'), ('Bregetio', 'GPE')"
"But
 they were strictly enjoined not to commit the first
 hostilities, which might be understood as a breach of the
 treaty; and such was the implicit obedience of the Roman
 general, that they retreated, with exemplary patience, under
 a shower of Persian arrows, till they had clearly acquired a
 just title to an honourable and legitimate victory.","('first', 'ORDINAL'), ('Roman', 'NORP'), ('Persian', 'NORP')"
"But as
 our attention is no longer engaged by the contrast of
 freedom and servitude, of recent greatness and of actual
 misery, we should turn with horror from the frequent
 executions which disgraced, both at Rome and Antioch, the
 reign of the two brothers.(53) Valens was of a timid,(54) and 
 Valentinian of a choleric, disposition.(55)","('Rome', 'GPE'), ('Antioch', 'GPE'), ('two', 'CARDINAL'), ('53', 'CARDINAL'), ('Valens', 'PERSON'), ('Valentinian', 'NORP')"
"But as he left, either by his wives or concubines, a very
 numerous posterity, the wealthy inheritance was eagerly
 disputed, and Zamma, one of his sons, was slain in a
 domestic quarrel by his brother Firmus.","('Zamma', 'PERSON'), ('one', 'CARDINAL'), ('Firmus', 'PERSON')"
"But in the calmer moments of reflection, when the mind of
 Valens was not agitated by fear, or that of Valentinian by
 rage, the tyrant resumed the sentiments, or at least the
 conduct, of the father of his country.","('Valens', 'PERSON'), ('Valentinian', 'NORP')"
"But in the provinces of the East, from
 the Euxine to the extremity of Thebais, the strength and
 numbers of the hostile factions were more equally balanced;
 and this equality, instead of recommending the counsels of
 peace, served only to perpetuate the horrors of religious
 war.","('East', 'LOC'), ('Euxine', 'LOC'), ('Thebais', 'GPE')"
"But the
 daring spirit of the pirates braved the perils both of the
 sea and of the shore: their skill was confirmed by the
 habits of enterprise; the meanest of their mariners was
 alike capable of handling an oar, of rearing a sail, or of
 conducting a vessel and the Saxons rejoiced in the
 appearance of a tempest, which concealed their design, and
 dispersed the fleets of the enemy. (105)","('Saxons', 'NORP'), ('105', 'CARDINAL')"
"But the active spirit of the Heruli was subdued
 by the slow and steady perseverance of the Goths; and, after
 a bloody action, in which the king was slain, the remains of
 that warlike tribe became an useful accession to the camp of
 Hermanric.","('Heruli', 'PERSON'), ('Goths', 'NORP'), ('Hermanric', 'GPE')"
"But the count, long exercised
 in the arts of corruption, had despatched a swift and trusty
 messenger to secure the venal friendship of Remigius, master
 of the offices.","('Remigius', 'PERSON')"
"But the forces of Sapor were continually
 renewed and increased; the hopeless courage of the garrison
 was exhausted; the strength of the walls yielded to the
 assault; and the proud conqueror, after wasting the
 rebellious city with fire and sword, led away captive an
 unfortunate queen, who, in a more auspicious hour, had been
 the destined bride of the son of Constantine.(135)","('Sapor', 'PERSON'), ('a more auspicious hour', 'TIME'), ('Constantine', 'PERSON'), ('135', 'CARDINAL')"
"But the imprudent and unhappy Africans soon
 discovered that, in this rash insurrection, they had not
 sufficiently consulted their own strength or the abilities
 of their leader.","('Africans', 'NORP')"
"But the inquisition into the crime of magic,
 which, under the reign of the two brothers, was so
 rigorously prosecuted both at Rome and Antioch, was
 interpreted as the fatal symptom, either of the displeasure
 of Heaven or of the depravity of mankind.(43)","('two', 'CARDINAL'), ('Rome', 'GPE'), ('Antioch', 'GPE')"
"But the intemperance which gratified their appetites
 retarded their progress; and before the Goths could receive
 any certain intelligence of the defeat and death of
 Procopius, they perceived, by the hostile state of the
 country, that the civil and military powers were resumed by
 his successful rival.","('Goths', 'NORP'), ('Procopius', 'PERSON')"
"But the most honourable circumstance of the character of
 Valentinian is the firm and temperate impartiality which he
 uniformly preserved in an age of religious contention.","('Valentinian', 'PERSON')"
