Sentence,Entities
"(11) Seville and Carthagena became 
 the reward, or rather the prey, of the ferocious conquerors;
 and the vessels which they found in the harbour of
 Carthagena might easily transport them to the isles of
 Majorca and Minorca, where the Spanish fugitives, as in a
 secure recess, had vainly concealed their families and their
 fortunes.","('Seville', 'GPE'), ('Carthagena', 'GPE'), ('Carthagena', 'GPE'), ('Majorca', 'LOC'), ('Minorca', 'LOC'), ('Spanish', 'NORP')"
(31),"('31', 'CARDINAL')"
"A
 female attendant, transported in the same ship, and sold in
 the same family, still continued to respect a mistress whom
 fortune had reduced to the common level of servitude; and
 the daughter of Eudaemon received from her grateful
 affection the domestic services which she had once required
 from her obedience.","('Eudaemon', 'PERSON')"
"A
 shepherd, whom the popular credulity transformed into an
 angel, guided the Eastern cavalry, by a secret, and, it was
 thought, an impassable road, through the morasses of the Po:
 the gates of Ravenna, after a short struggle, were thrown
 open; and the defenceless tyrant was delivered to the mercy,
 or rather to the cruelty, of the conquerors.","('Eastern', 'NORP'), ('Po', 'PERSON'), ('Ravenna', 'GPE')"
"A peasant, who
 complained of the criminal intimacy between his wife and a
 Gothic soldier, was directed to attend his tribunal the
 following day: in the evening the count, who had diligently
 informed himself of the time and place of the assignation,
 mounted his horse, rode ten miles into the country,
 surprised the guilty couple, punished the soldier with
 instant death, and silenced the complaints of the husband,
 by presenting him, the next morning, with the head of the
 adulterer.","('Gothic', 'NORP'), ('the\r\n following day', 'DATE'), ('ten miles', 'QUANTITY'), ('the next morning', 'TIME')"
"A regular scale of fines, from ten to two
 hundred pounds of silver, was curiously ascertained,
 according to the distinctions of rank and fortune, to punish
 the crime of assisting at a schismatic conventicle; and if
 the fine had been levied five times without subduing the
 obstinacy of the offender, his future punishment was
 referred to the discretion of the Imperial court.(18) By 
 these severities, which obtained the warmest approbation of
 St. Augustin,(19) great numbers of Donatists were reconciled 
 to the Catholic church; but the fanatics who still
 persevered in their opposition were provoked to madness and
 despair; the distracted country was filled with tumult and
 bloodshed; the armed troops of Circumcellions alternately
 pointed their rage against themselves or against their
 adversaries; and the calendar of martyrs received on both
 sides a considerable augmentation. (20)","('ten to two\r\n hundred pounds', 'QUANTITY'), ('five', 'CARDINAL'), ('Imperial', 'ORG'), ('18', 'CARDINAL'), ('St. Augustin', 'GPE'), ('19', 'CARDINAL'), ('Donatists', 'NORP'), ('Catholic', 'NORP'), ('Circumcellions', 'NORP'), ('20', 'CARDINAL')"
"A regular subordination of
 civil honours gradually ascended from the procurators of the
 streets and quarters of the city to the tribunal of the
 supreme magistrate, who, with the title of proconsul,
 represented the state and dignity of a consul of ancient
 Rome.","('Rome', 'GPE')"
"A simple reflection will impress every
 thinking mind with the clearest idea of fertility and
 cultivation: the country was extremely populous; the
 inhabitants reserved a liberal subsistence for their own
 use; and the annual exportation, particularly of wheat, was
 so regular and plentiful, that Africa deserved the name of
 the common granary of Rome and of mankind.","('Africa', 'LOC'), ('Rome', 'GPE')"
"A temperate
 inquiry into the real motives of Boniface would have
 restored a faithful servant to his duty and to the republic;
 but the arts of Aetius still continued to betray and to
 inflame, and the count was urged by persecution to embrace
 the most desperate counsels.","('Boniface', 'PERSON'), ('Aetius', 'ORG')"
"According to the judgment of the most impartial critics, 
 the superficial learning of Augustin was confined to the
 Latin language;(28) and his style, though sometimes animated 
 by the eloquence of passion, is usually clouded by false and
 affected rhetoric.","('Augustin', 'PERSON'), ('Latin', 'LANGUAGE'), ('28', 'CARDINAL')"
Aetius and Boniface.—,"('Aetius', 'ORG'), ('Boniface', 'PERSON')"
"After a
 slumber, as they thought of a few hours, they were pressed
 by the calls of hunger; and resolved that Jamblichus, one of
 their number, should secretly return to the city to purchase
 bread for the use of his companions.","('a few hours', 'TIME'), ('Jamblichus', 'PERSON'), ('one', 'CARDINAL')"
"After her
 return from Spain to Italy, Placidia experienced a new
 persecution in the bosom of her family.","('Spain', 'GPE'), ('Italy', 'GPE'), ('Placidia', 'PERSON')"
"After some hesitation,
 the last struggles of prudence and loyalty, Boniface
 despatched a trusty friend to the court, or rather to the
 camp, of Gonderic, king of the Vandals, with the proposal of
 a strict alliance, and the offer of an advantageous and
 perpetual settlement.","('Boniface', 'PERSON'), ('Gonderic', 'PERSON'), ('Vandals', 'NORP')"
"After the loss of a battle he retired to Hippo Regius, where
 he was immediately besieged by an enemy who considered him
 as the real bulwark of Africa.","('Hippo Regius', 'PERSON'), ('Africa', 'LOC')"
"Almost in the moment of his departure he was informed that Hermanric, king of the Suevi, had presumed to ravage the Spanish territories which he was resolved to abandon.","('Hermanric', 'PERSON'), ('Suevi', 'PERSON'), ('Spanish', 'NORP')"
"Amidst the decay of
 military spirit, her armies were commanded by two generals, Her two generals Aetius (8) and Boniface, (9) who may be deservedly named as the last of the Romans.","('two', 'CARDINAL'), ('two', 'CARDINAL'), ('Aetius', 'PERSON'), ('8', 'CARDINAL'), ('Boniface', 'PERSON'), ('9', 'CARDINAL'), ('Romans', 'NORP')"
"Among the insipid legends of ecclesiastical history, I am
 tempted to distinguish the memorable fable of the SEVEN
 SLEEPERS;(42) whose imaginary date corresponds with the reign of the younger Theodosius, and the conquest of Africa by the
 Vandals. (43)","('SEVEN', 'CARDINAL'), ('42', 'CARDINAL'), ('Theodosius', 'PERSON'), ('Africa', 'LOC'), ('Vandals', 'PERSON'), ('43', 'CARDINAL')"
"Ardaburius employed, or abused, the
 courteous freedom which he was permitted to enjoy, to revive
 among the troops a sense of loyalty and gratitude; and, as
 soon as the conspiracy was ripe for execution, he invited,
 by private messages, and pressed the approach of Aspar.","('Ardaburius', 'PERSON'), ('Aspar', 'ORG')"
"As he advanced towards Carthage he was forced to withdraw his troops from the Western provinces; the sea-coast was exposed to the naval enterprises of the Romans of Spain and Italy; and, in the heart of Numidia, the strong inland city of Cirta still persisted in obstinate independence.(35) These difficulties were gradually subdued by the spirit, the perseverance, and the cruelty of Genseric, who alternately: applied the arts of peace and war to the establishment of his African kingdom.","('Carthage', 'GPE'), ('Western', 'NORP'), ('Romans', 'NORP'), ('Spain', 'GPE'), ('Italy', 'GPE'), ('Numidia', 'GPE'), ('Cirta', 'GPE'), ('Genseric', 'PERSON'), ('African', 'NORP')"
"As soon as the
 force of the two empires was united under the command of
 Boniface, he boldly marched against the Vandals; and the
 loss of a second battle irretrievably decided the fate of
 Africa.","('two', 'CARDINAL'), ('Boniface', 'PERSON'), ('Vandals', 'NORP'), ('second', 'ORDINAL'), ('Africa', 'LOC')"
"At the end of that time, the slaves of
 Adolius, to whom the inheritance of the mountain had
 descended, removed the stones, to supply materials for some
 rustic edifice: the light of the sun darted into the cavern,
 and the Seven Sleepers were permitted to awake.","('Adolius', 'GPE'), ('Seven', 'CARDINAL')"
"At the same time, as a compensation, perhaps,
 for the expenses of the war, the Western Illyricum was
 detached from the Italian dominions, and yielded to the
 throne of Constantinople.(5)","('Italian', 'NORP'), ('Constantinople', 'GPE'), ('5', 'CARDINAL')"
"Boniface accepted with gratitude the
 rank of patrician and the dignity of master-general of the
 Roman armies; but he must have blushed at the sight of those
 medals in which he was represented with the name and
 attributes of victory.","('Boniface', 'PERSON'), ('Roman', 'NORP')"
"Boniface was successful; His death, A.D. 432 but he received in the conflict a mortal wound from the spear of his adversary, of which he expired within a few days, in such Christian and charitable
 sentiments that he exhorted his wife, a rich heiress of
 Spain, to accept Aetius for her second husband.","('Boniface', 'PERSON'), ('A.D. 432', 'DATE'), ('a few days', 'DATE'), ('Christian', 'NORP'), ('Spain', 'GPE'), ('Aetius', 'PERSON'), ('second', 'ORDINAL')"
"But Aetius
 could not derive any immediate advantage from the generosity
 of his dying enemy: he was proclaimed a rebel by the justice
 of Placidia; and though he attempted to defend some strong
 fortresses, erected on his patrimonial estate, the Imperial
 power soon compelled him to retire into Pannonia, to the
 tents of his faithful Huns.","('Aetius', 'PERSON'), ('Placidia', 'PERSON'), ('Imperial', 'NORP'), ('Pannonia', 'GPE'), ('Huns', 'PERSON')"
"But Aetius
 possessed an advantage of singular moment in a female reign:
 he was present: he besieged with artful and assiduous
 flattery the palace of Ravenna; disguised his dark designs
 with the mask of loyalty and friendship; and at length
 deceived both his mistress and his absent rival, by a subtle
 conspiracy which a weak woman and a brave man could not
 easily suspect.","('Aetius', 'PERSON'), ('Ravenna', 'PERSON')"
"But he possessed a strong, capacious,
 argumentative mind; he boldly sounded the dark abyss of
 grace, predestination, free-will, and original sin; and the
 rigid system of Christianity which he framed or restored(29) 
 has been entertained with public applause and secret
 reluctance by the Latin church.(30)
Defeat and retreat of Bonniface, A.D. 431.","('Christianity', 'NORP'), ('29', 'CARDINAL'), ('Latin', 'NORP'), ('30', 'CARDINAL'), ('Bonniface', 'PERSON'), ('431', 'CARDINAL')"
"But her resistance ended with the ceremony of the
 nuptials; nor did Placidia refuse to become the mother of
 Honoria and Valentinian the Third, or to assume and exercise
 an absolute dominion over the mind of her grateful husband.","('Placidia', 'PERSON'), ('Honoria', 'PERSON'), ('Valentinian', 'NORP'), ('Third', 'ORDINAL')"
"But if the interval
 between two memorable eras could be instantly annihilated;
 if it were possible, after a momentary slumber of two
 hundred years, to display the new world to the eyes of a
 spectator who still retained a lively and recent impression
 of the old, his surprise and his reflections would furnish
 the pleasing subject of a philosophical romance.","('two', 'CARDINAL'), ('two\r\n hundred years', 'DATE')"
But the public discontent burst forth in dangerous and frequent conspiracies; and the warlike tyrant is supposed to have shed more Vandal blood by the hand of the executioner than in the field of battle.(34),"('Vandal', 'NORP'), ('34', 'CARDINAL')"
"By a positive declaration, the validity of all
 future laws was limited to the dominions of their peculiar
 author; unless he should think proper to communicate them,
 subscribed with his own hand, for the approbation of his
 independent colleague.(6)
Administration of his mother Placidia, A.D. 425-450 
Valentinian, when he received the title of Augustus, was no
 more than six years of age; and his long minority was
 intrusted to the guardian care of a mother who might assert
 a female claim to the succession of the Western empire
 Placidia envied, but she could not equal, the reputation and
 virtues of the wife and sister of Theodosius; the elegant
 genius of Eudocia, the wise and successful policy of
 Pulcheria.","('Placidia', 'PERSON'), ('A.D. 425-450', 'DATE'), ('Valentinian', 'WORK_OF_ART'), ('Augustus', 'PERSON'), ('six years of age', 'DATE'), ('Western', 'NORP'), ('Placidia', 'PERSON'), ('Theodosius', 'PERSON'), ('Eudocia', 'PERSON'), ('Pulcheria', 'PERSON')"
"By the agreement of the three females who 
 governed the Roman world, the son of Placidia was betrothed
 to Eudoxia, the daughter of Theodosius and Athenais; and, as
 soon as the lover and his bride had attained the age of
 puberty, this honourable alliance was faithfully
 accomplished.","('three', 'CARDINAL'), ('Roman', 'NORP'), ('Placidia', 'PERSON'), ('Eudoxia', 'PERSON'), ('Theodosius', 'PERSON'), ('Athenais', 'PERSON')"
"By the skill of Boniface, and perhaps by the ignorance of
 the Vandals, the siege of Hippo was protracted above
 fourteen months: the sea was continually open; and when the
 adjacent country had been exhausted by irregular rapine, the
 besiegers themselves were compelled by famine to relinquish
 their enterprise.","('Boniface', 'PERSON'), ('Vandals', 'NORP'), ('Hippo', 'PERSON'), ('fourteen months', 'DATE')"
"Carthage and the Roman garrisons returned with
 their general to the allegiance of Valentinian, but the rest
 of Africa was still distracted with war and faction; and the
 inexorable king of the Vandals, disdaining all terms of
 accommodation, sternly refused to relinquish the possession
 of his prey.","('Carthage', 'GPE'), ('Roman', 'NORP'), ('Valentinian', 'NORP'), ('Africa', 'LOC'), ('Vandals', 'NORP')"
"Carthage contained the manufactures, the arms, and the
 treasures of the six provinces.","('Carthage', 'GPE'), ('six', 'CARDINAL')"
Conquest of Africa by the Vandals.,"('Africa', 'LOC'), ('Vandals', 'NORP')"
Death of Honorius.—,"('Death of Honorius', 'PERSON')"
Desolation of Africa,"('Africa', 'LOC')"
"During this period the seat of
 government had been transported from Rome to a new city on
 the banks of the Thracian Bosphorus and the abuse of
 military spirit had been suppressed by an artificial system
 of tame and ceremonious servitude.","('Rome', 'GPE'), ('the Thracian Bosphorus', 'LOC')"
Eight years however elapsed from the evacuation of Hippo to the reduction of Carthage.,"('Eight years', 'DATE'), ('Hippo', 'GPE'), ('Carthage', 'GPE')"
"Elated by the submission of Italy, and
 the hope of an alliance with the Huns, John presumed to
 insult by an embassy, the majesty of the Eastern emperor;
 but when he understood that his agents had been banished,
 imprisoned, and at length chased away with deserved
 ignominy, John prepared to assert by arms the injustice of
 his claims.","('Italy', 'GPE'), ('Huns', 'NORP'), ('John', 'PERSON'), ('Eastern', 'NORP'), ('John', 'PERSON')"
"Elevation and fall of the usurper John, A.D. 423-425","('John', 'PERSON')"
"Emperor of the West, A.D. 425-455","('425-455', 'CARDINAL')"
Emperor of the West—Administration of His Mother Placidia.—,"('His Mother Placidia', 'PERSON')"
"Error and revolt of Boniface in Africa, A.D. 427","('Boniface', 'PERSON'), ('Africa', 'LOC'), ('A.D. 427', 'DATE')"
Fable of the seven sleepers.,"('seven', 'CARDINAL')"
"He contented himself with
 the possession of the East; and wisely relinquished the
 laborious task of waging a distant and doubtful war against
 the barbarians beyond the Alps, or of securing the obedience
 of the Italians and Africans, whose minds were alienated by
 the irreconcilable difference of language and interest.","('East', 'LOC'), ('Alps', 'LOC'), ('Italians', 'NORP'), ('Africans', 'NORP')"
"He embarked with the precipitation of despair, and
 the people of Hippo were permitted, with their families and
 effects, to occupy the vacant place of the soldiers, the
 greatest part of whom were either slain or made prisoners by
 the Vandals.","('Hippo', 'PERSON'), ('Vandals', 'NORP')"
"He hastily returned from Gaul to Italy, with a
 retinue, or rather With an army, of barbarian followers; and
 such was the weakness of the government, that the two
 generals decided their private quarrel in a bloody battle.","('Gaul', 'PERSON'), ('Italy', 'GPE'), ('two', 'CARDINAL')"
"He invites the vandals, A.D. 428 
 After the retreat of the Goths the authority of Honorius had
 obtained a precarious establishment in Spain, except only in
 the province of Gallicia, where the Suevi and the Vandals
 had fortified their camps in mutual discord and hostile
 independence.","('A.D. 428', 'FAC'), ('Goths', 'NORP'), ('Honorius', 'GPE'), ('Spain', 'GPE'), ('Gallicia', 'GPE'), ('Suevi', 'GPE'), ('Vandals', 'PRODUCT')"
"He secretly persuaded (10) Placidia to recall 
 Boniface from the government of Africa; he secretly advised
 Boniface to disobey the Imperial summons: to the one, he
 represented the order as a sentence of death; to the other,
 he stated the refusal as a signal of revolt; and when the
 credulous and unsuspectful count had armed the province in
 his defence, Aetius applauded his sagacity in foreseeing the
 rebellion which his own perfidy had excited.","('10', 'CARDINAL'), ('Placidia', 'PERSON'), ('Boniface', 'PERSON'), ('Africa', 'LOC'), ('Boniface', 'PERSON'), ('Imperial', 'NORP'), ('Aetius', 'PERSON')"
"Her filial impatience was seconded
 by the pious bishop: Theodoret, in a letter still extant,
 recommends Maria to the bishop of Aegae, a maritime city of
 Cilicia, which was frequented, during the annual fair, by
 the vessels of the West; most earnestly requesting that his
 colleague would use the maiden with a tenderness suitable to
 her birth; and that he would intrust her to the care of such
 faithful merchants as would esteem it a sufficient gain if
 they restored a daughter, lost beyond all human hope, to the
 arms of her afflicted parent.","('Theodoret', 'PERSON'), ('Maria', 'PERSON'), ('Aegae', 'GPE'), ('Cilicia', 'GPE'), ('West', 'LOC')"
"His
 singular dress and obsolete language confounded the baker,
 whom he offered an ancient medal of Decius the current coin
 of the empire; and Jamblichus, on the suspicion of a secret
 treasure, was dragged before the judge.","('Decius', 'PERSON'), ('Jamblichus', 'PERSON')"
"His right hand
 was first cut off, and after he had been exposed, mounted on
 an ass, to the public derision, John was beheaded in the
 circus of Aquileia.","('first', 'ORDINAL'), ('John', 'PERSON'), ('Aquileia', 'PERSON')"
"His throne was encompassed with domestic enemies, who accused the baseness of his birth, and asserted the legitimate claims of his nephews, the sons of Gonderic.","('Gonderic', 'PERSON')"
"Impatient of the insult, Genseric pursued the hasty retreat of the Suevi as far as Merida, precipitated the king and his army into the river Anas, He lands in Africa, A.D. 429, May, and calmly returned to the seashore to embark his victorious troops.","('Genseric', 'PERSON'), ('Suevi', 'NORP'), ('Merida', 'GPE'), ('Anas', 'PERSON'), ('Africa', 'LOC'), ('A.D. 429', 'DATE'), ('May', 'DATE')"
"In a monarchy which, according to various precedents, might
 be considered as elective, or hereditary, or patrimonial, it
 was impossible that the intricate claims of female and
 collateral succession should be clearly defined; (3) and 
 Theodosius, by the right of consanguinity or conquest, might
 have reigned the sole legitimate emperor of the Romans.","('3', 'CARDINAL'), ('Theodosius', 'PERSON'), ('Romans', 'NORP')"
"In such a cause the grandson of the great
 Theodosius should have marched in person; but the young
 emperor was easily diverted by his physicians from so rash
 and hazardous a design; and the conduct of the Italian
 expedition was prudently intrusted to Ardaburius and his son
 Aspar, who had already signalised their valour against the
 Persians.","('Theodosius', 'PERSON'), ('Italian', 'NORP'), ('Ardaburius', 'PERSON'), ('Aspar', 'PERSON'), ('Persians', 'NORP')"
"In the field of
 battle, in partial encounters, in single combats, he was
 still the terror of the barbarians: the clergy, and
 particularly his friend Augustin, were edified by the
 Christian piety which had once tempted him to retire from
 the world; the people applauded his spotless integrity; the
 army dreaded his equal and inexorable justice, which may be
 displayed in a very singular example.","('Augustin', 'PERSON'), ('Christian', 'NORP')"
"In the melancholy season
 of her exile and distress, Boniface alone had maintained her
 cause with unshaken fidelity; and the troops and treasures
 of Africa had essentially contributed to extinguish the
 rebellion.","('Boniface', 'PERSON'), ('Africa', 'LOC')"
"In the midst of that interval the ambitious Genseric, in the full tide of apparent prosperity, negotiated a treaty of peace, by which he gave his son Hunneric for an hostage, and consented to leave the Western emperor in the undisturbed possession of the three Mauritanias. (33)","('Genseric', 'ORG'), ('Hunneric', 'PERSON'), ('Western', 'NORP'), ('three', 'CARDINAL'), ('Mauritanias', 'NORP'), ('33', 'CARDINAL')"
"In the room of a prince not conspicuous for
 any superior powers of the mind or body, they acquired his
 bastard brother, Genseric, King Of The Vandals the terrible Genseric;(12) a name which in the destruction of the Roman empire has reserved an equal rank with the names of Alaric and Attila.","('Genseric', 'PERSON'), ('King Of The Vandals', 'PERSON'), ('Genseric', 'PERSON'), ('12', 'CARDINAL'), ('Roman', 'NORP'), ('Alaric', 'PERSON'), ('Attila', 'PERSON')"
"In the sack of Carthage she was
 purchased from the Vandals by some merchants of Syria, who
 afterwards sold her as a slave in their native country.","('Carthage', 'GPE'), ('Vandals', 'PRODUCT'), ('Syria', 'GPE')"
"In their first interview at Carthage the imaginary
 provocations were mutually explained, the opposite letters
 of Aetius were produced and compared, and the fraud was
 easily detected.","('first', 'ORDINAL'), ('Carthage', 'GPE'), ('Aetius', 'PRODUCT')"
"Instead of listening to the voice of ambition, Theodosius
 resolved to imitate the moderation of his grandfather, and
 to seat his cousin Valentinian on the throne of the West.","('Theodosius', 'PERSON'), ('Valentinian', 'PERSON'), ('West', 'LOC')"
"It might naturally be expected, after the retreat of Boniface, that the Vandals would achieve without resistance or delay the conquest of Africa.","('Boniface', 'PERSON'), ('Vandals', 'NORP'), ('Africa', 'LOC')"
"It was natural enough that Genseric should hate those whom
 he had injured: the nobility and senators of Carthage, were
 exposed to his jealousy and resentment; and all those who
 refused the ignominious terms which their honour and
 religion forbade them to accept were compelled by the Arian
 tyrant to embrace the condition of perpetual banishment.","('Genseric', 'PERSON'), ('Carthage', 'GPE'), ('Arian', 'NORP')"
"It was resolved that Ardaburius should embark with
 the infantry; whilst Aspar, at the head of the cavalry,
 conducted Placidia, and her son Valentinian, along the
 sea-coast of the Hadriatic.","('Ardaburius', 'PERSON'), ('Aspar', 'PERSON'), ('Placidia', 'PERSON'), ('Valentinian', 'NORP'), ('Hadriatic', 'PRODUCT')"
"James of
 Sarug, a Syrian bishop, who was born only two years after
 the death of the younger Theodosius, has devoted one of his
 two hundred and thirty homilies to the praise of the young
 men of Ephesus.(44)","('James of\r\n Sarug', 'PERSON'), ('Syrian', 'NORP'), ('only two years', 'DATE'), ('Theodosius', 'PERSON'), ('one', 'CARDINAL'), ('two hundred and thirty', 'CARDINAL'), ('Ephesus', 'GPE'), ('44', 'CARDINAL')"
"Last years and death of Honorius, A.D. 423, August 27 
 DURING a long and disgraceful reign of twenty-eight years,
 Honorius, emperor of the West, was separated from the
 friendship of his brother, and afterwards of his nephew, who
 reigned over the East; and Constantinople beheld, with
 apparent indifference and secret joy, the calamities of
 Rome.","('Last years', 'DATE'), ('Honorius', 'GPE'), ('A.D. 423', 'DATE'), ('August 27', 'DATE'), ('twenty-eight years', 'DATE'), ('Honorius', 'PERSON'), ('West', 'LOC'), ('East', 'LOC'), ('Constantinople', 'GPE'), ('Rome', 'GPE')"
"Nor has 
 their reputation been confined to the Christian world.","('Christian', 'NORP')"
"On a sudden the
 seven fruitful provinces, from Tangier to Tripoli, were
 overwhelmed by the invasion of the Vandals, whose
 destructive rage has perhaps been exaggerated by popular
 animosity, religious zeal, and extravagant declamation.","('seven', 'CARDINAL'), ('Tangier', 'GPE'), ('Tripoli', 'GPE'), ('Vandals', 'LOC')"
"On a sudden, by some base
 intrigues of a steward and a nurse, this excessive fondness
 was converted into an irreconcilable quarrel: the debates of
 the emperor and his sister were not long confined within the
 walls of the palace; and as the Gothic soldiers adhered to
 their queen, the city of Ravenna was agitated with bloody
 and dangerous tumults, which could only be appeased by the
 forced or voluntary retreat of Placidia and her children.","('Gothic', 'NORP'), ('Ravenna', 'GPE'), ('Placidia', 'PERSON')"
"Our fancy, so long accustomed to exaggerate and multiply the
 martial swarms of barbarians that seemed to issue from the
 North, will perhaps be surprised by the account of the army
 which Genseric mustered on the coast of Mauritania.","('North', 'LOC'), ('Genseric', 'GPE'), ('Mauritania', 'GPE')"
