Sentence,Entities
"During a short time, the preacher was
 revered as a patriot; and the discontent, or revolt, of
 Brescia against her bishop, was the first fruits of his
 dangerous lessons.","('Brescia', 'GPE'), ('first', 'ORDINAL')"
"During the festival of Easter, while the bishop and the clergy, barefooted and in procession, visited the tombs of the martyrs, they were twice assaulted, at the bridge of St. Angelo, and before the Capitol, with volleys of stones and darts.","('Easter', 'EVENT'), ('St. Angelo', 'GPE'), ('Capitol', 'FAC')"
"During the vacancy of the holy see, the cardinals are prohibited from touching the revenues, or assuming, unless
 in some rare emergency, the government of the church: all  agreements and promises among the electors are formally annulled; and their integrity is fortified by their solemn oath and the prayers of the Catholics.","('Catholics', 'NORP')"
Family of Leo the jew.,"('Family of Leo the jew', 'PERSON')"
Feud of the Colonna and Ursini.,"('Colonna', 'PERSON'), ('Ursini', 'PERSON')"
Frederic I. A.D. 1155.,"('Frederic I. A.D. 1155', 'PERSON')"
"Frederic was convinced by these arguments, or tempted by the desire of the Imperial crown: in the balance of ambition, the innocence or life of an individual is of small account; and their common enemy was sacrificed to a moment of political concord.","('Frederic', 'PERSON'), ('Imperial', 'NORP')"
"From a Roman station, (23) a
 royal villa, a chapter of noble virgins, Zurich had
 gradually increased to a free and flourishing city; where
 the appeals of the Milanese were sometimes tried by the
 Imperial commissaries. (24)","('Roman', 'NORP'), ('23', 'CARDINAL'), ('Zurich', 'GPE'), ('Milanese', 'NORP'), ('Imperial', 'ORG'), ('24', 'CARDINAL')"
"From a city without trade or
 industry, all casual riches will speedily evaporate: but the
 avarice and envy of the next generation solicited Clement
 the Sixth (87) to anticipate the distant period of the
 century.","('Clement', 'PERSON'), ('the Sixth (87', 'DATE'), ('the distant period of the\r\n century', 'DATE')"
"From his school they had probably derived a new article of faith, that the metropolis of the Catholic church is exempt from the penalties of excommunication and interdict.","('Catholic', 'NORP')"
"From the earliest ages, the Capitol had been used as a temple in peace, a fortress in war: after the loss of the city, it maintained a siege against the victorious Gauls, and the sanctuary of the empire was occupied, assaulted, and burnt, in the civil wars of Vitellius and Vespasian. (37)","('Capitol', 'FAC'), ('Gauls', 'NORP'), ('Vitellius', 'GPE'), ('Vespasian', 'NORP'), ('37', 'CARDINAL')"
"From the persecution of the emperors, and the wars of Italy,
 they escaped beyond the Alps into the hospitable bosom of
 France; from the tumults of Rome they prudently withdrew to
 live and die in the more tranquil stations of Anagni,
 Perugia, Viterbo, and the adjacent cities.","('Italy', 'GPE'), ('Alps', 'LOC'), ('France', 'GPE'), ('Rome', 'GPE'), ('Anagni', 'GPE'), ('Perugia', 'GPE'), ('Viterbo', 'GPE')"
"From this master, Arnold most probably imbibed some
 metaphysical definitions of the Trinity, repugnant to the
 taste of the times: his ideas of baptism and the eucharist
 are loosely censured; but a political heresy was the source
 of his fame and misfortunes.","('Arnold', 'PERSON'), ('Trinity', 'LOC')"
"Gelasius was dragged by the hair along the ground, buffeted with blows, wounded with spurs, and bound with an iron chain in the house of his brutal tyrant.","('Gelasius', 'PERSON')"
"Gregory the Seventh, who may be adored or
 detested as the founder of the papal monarchy, was driven
 from Rome, and died in exile at Salerno.","('Gregory', 'PERSON'), ('Seventh', 'ORDINAL'), ('Rome', 'GPE'), ('Salerno', 'GPE')"
"Had the election been always held in the Vatican, the rights
 of the senate and people would not have been violated with
 impunity.","('Vatican', 'FAC')"
"Had the policy of the senate and the discipline of the legions been restored with the Capitol, the divided condition of Italy would have offered the fairest opportunity of a second conquest.","('Capitol', 'ORG'), ('Italy', 'GPE'), ('second', 'ORDINAL')"
"He
 proclaimed a crusade against his personal enemies; their
 estates were confiscated; their fortresses on either side of
 the Tyber were besieged by the troops of St. Peter and those
 of the rival nobles; and after the ruin of Palestrina or
 Praeneste, their principal seat, the ground was marked with
 a ploughshare, the emblem of perpetual desolation.","('Tyber', 'PERSON'), ('St. Peter', 'GPE'), ('Palestrina', 'GPE'), ('Praeneste', 'GPE')"
"He exhorted them to assert the
 inalienable rights of men and Christians; to restore the
 laws and magistrates of the republic; to respect the name of
 the emperor; but to confine their shepherd to the spiritual
 government of his flock. (26)","('Christians', 'NORP'), ('26', 'CARDINAL')"
"He presumed to quote the
 declaration of Christ, that his kingdom is not of this
 world: he boldly maintained, that the sword and the sceptre
 were intrusted to the civil magistrate; that temporal honours
 and possessions were lawfully vested in secular persons;
 that the abbots, the bishops, and the pope himself, must
 renounce either their state or their salvation; and that
 after the loss of their revenues, the voluntary tithes and
 oblations of the faithful would suffice, not indeed for
 luxury and avarice, but for a frugal life in the exercise of
 spiritual labours.","('Christ', 'PERSON')"
"He supported with the same virtue the return of prosperity; and, till the ruin of his declining age, the ancestors, the character, and the children of Stephen Colonna, exalted his dignity in the Roman republic, and at the court of Avignon. and Ursini.","('Stephen Colonna', 'PERSON'), ('Roman', 'NORP'), ('Avignon', 'GPE'), ('Ursini', 'PERSON')"
"He was
 engaged, by promise and affection, to prefer the residence
 of France; and, after dragging his court through Poitou and
 Gascony, and devouring, by his expense, the cities and
 convents on the road, he finally reposed at Avignon, (80)
 which flourished above seventy years (81) the seat of the
 Roman pontiff and the metropolis of Christendom.","('France', 'GPE'), ('Poitou', 'PERSON'), ('Gascony', 'PERSON'), ('Avignon', 'GPE'), ('80', 'CARDINAL'), ('seventy years (81', 'DATE'), ('Roman', 'NORP'), ('Christendom', 'GPE')"
"He was succeeded by Benedict the Eleventh, the mildest of mankind.","('Benedict', 'PERSON'), ('Eleventh', 'DATE')"
"Her
 repentance was tardy and fruitless: after the death of the
 old members, the sacred college was filled with French
 cardinals, (84) who beheld Rome and Italy with abhorrence and
 contempt, and perpetuated a series of national, and even
 provincial, popes, attached by the most indissoluble ties to
 their native country.","('French', 'NORP'), ('84', 'DATE'), ('Rome', 'GPE'), ('Italy', 'GPE')"
"His civil acts were annulled by the
 Roman people, who restored the honours and possessions of the
 Colonna; and some estimate may be formed of their wealth by
 their losses, of their losses by the damages of one hundred
 thousand gold florins which were granted them against the
 accomplices and heirs of the deceased pope.","('Roman', 'NORP'), ('Colonna', 'ORG'), ('one hundred\r\n thousand', 'CARDINAL')"
"His execution, A.D. 1155.","('A.D. 1155', 'DATE')"
"His nephew and successor, Frederic Barbarossa, was more ambitious of the Imperial crown; nor had any of the successors of Otho acquired such absolute sway over the kingdom of Italy.","('Frederic Barbarossa', 'PERSON'), ('Imperial', 'ORG'), ('Otho', 'PERSON'), ('Italy', 'GPE')"
"His triumph is stained with the reproach of violating the truce; their defeat was basely
 avenged by the assassination, before the church door, of an innocent boy and his two servants.","('two', 'CARDINAL')"
"Hope or fear, lassitude or remorse, the characters of the men, and the circumstances of the times, might sometimes obtain an interval of peace and obedience; and the pope was restored with joyful acclamations to the Lateran or Vatican, from whence he had been driven with threats and violence.","('Lateran', 'NORP'), ('Vatican', 'FAC')"
"I have described the peaceful
 order of his entry and coronation; but that order was
 commonly disturbed by the clamour and sedition of the Romans,
 who encountered their sovereign as a foreign invader: his
 departure was always speedy, and often shameful; and, in the
 absence of a long reign, his authority was insulted, and his
 name was forgotten.","('Romans', 'NORP')"
"I. The Capitoline hill, one of her seven eminences, (36) is about four hundred yards in length, and two hundred in breadth.","('one', 'CARDINAL'), ('seven', 'CARDINAL'), ('36', 'CARDINAL'), ('about four hundred yards', 'QUANTITY'), ('two hundred', 'CARDINAL')"
"I. The name and arms of Colonna (97) have been the
 theme of much doubtful etymology; nor have the orators and
 antiquarians overlooked either Trajan's pillar, or the
 columns of Hercules, or the pillar of Christ's flagellation,
 or the luminous column that guided the Israelites in the
 desert.","('Colonna', 'PERSON'), ('97', 'CARDINAL'), ('Trajan', 'PERSON'), ('Hercules', 'WORK_OF_ART'), ('Christ', 'PERSON'), ('Israelites', 'NORP')"
"If the election be not consummated in three days, the luxury of their table is contracted to a single
 dish at dinner and supper; and after the eighth day, they are reduced to a scanty allowance of bread, water, and wine.","('three days', 'DATE'), ('the eighth day', 'DATE')"
"In
 its utmost plenitude, the order or assembly consisted of
 fifty-six senators, (44) the most eminent of whom were distinguished by the title of counsellors: they were nominated, perhaps annually, by the people; and a previous
 choice of their electors, ten persons in each region, or
 parish, might afford a basis for a free and permanent
 constitution.","('fifty-six', 'CARDINAL'), ('44', 'CARDINAL'), ('ten', 'CARDINAL')"
"In a civil commotion, several of his priests had been made prisoners; and the inhuman Romans, reserving one as a guide for his brethren, put out their eyes, crowned them with ludicrous mitres, mounted them on asses with their faces towards the tail, and extorted an oath, that, in this wretched condition, they should offer themselves as a lesson to the head of the church.","('Romans', 'NORP'), ('one', 'CARDINAL')"
"In an age less ripe for
 reformation, the precursor of Zuinglius was heard with
 applause: a brave and simple people imbibed, and long
 retained, the colour of his opinions; and his art, or merit,
 seduced the bishop of Constance, and even the pope's legate,
 who forgot, for his sake, the interest of their master and
 their order.","('Zuinglius', 'PERSON'), ('Constance', 'PERSON')"
"In an age of superstition, it should seem that the union of the royal and sacerdotal characters would mutually fortify each other; and that the keys of Paradise would be the surest pledge of earthly obedience.","('Paradise', 'LOC')"
"In his bull, a perpetual
 law, the imperious pontiff asserts the truth, validity, and use of the donation of Constantine, not less essential to the peace of the city than to the independence of the church; establishes the annual election of the senator; and formally disqualifies all emperors, kings, princes, and persons of an eminent and conspicuous rank. (51) Pope Martin IV.","('Constantine', 'PERSON'), ('51', 'CARDINAL'), ('Martin IV', 'PERSON')"
"In his place an
 ecclesiastic, a present or future cardinal, was named by the
 pope to the civil government of Rome; but his jurisdiction
 has been reduced to a narrow compass; and in the days of
 freedom, the right or exercise was derived from the senate
 and people.","('Rome', 'GPE')"
"In his theological
 studies, he had been the disciple of the famous and
 unfortunate Abelard, (21) who was likewise involved in the
 suspicion of heresy: but the lover of Eloisa was of a soft
 and flexible nature; and his ecclesiastic judges were
 edified and disarmed by the humility of his repentance.","('Abelard', 'PERSON'), ('21', 'DATE'), ('Eloisa', 'PERSON')"
"In origin and affection, they were
 aliens to their country: (92) and a genuine Roman, could such
 have been produced, might have renounced these haughty
 strangers, who disdained the appellation of citizens, and
 proudly styled themselves the princes, of Rome. (93)","('92', 'CARDINAL'), ('Roman', 'NORP'), ('Rome', 'GPE'), ('93', 'CARDINAL')"
"In the beginning of the eleventh century, Italy was exposed
 to the feudal tyranny, alike oppressive to the sovereign and
 the people.","('the beginning of the eleventh century', 'DATE'), ('Italy', 'GPE')"
"In the beginning of the twelfth century, (2) the aera of the
 first crusade, Rome was revered by the Latins, as the
 metropolis of the world, as the throne of the pope and the
 emperor, who, from the eternal city, derived their title,
 their honours, and the right or exercise of temporal
 dominion.","('the beginning of the twelfth century', 'DATE'), ('2', 'CARDINAL'), ('first', 'ORDINAL'), ('Rome', 'GPE'), ('Latins', 'NORP')"
"In the busy age of the crusades, some
 sparks of curiosity and reason were rekindled in the Western
 world: the heresy of Bulgaria, the Paulician sect, was
 successfully transplanted into the soil of Italy and France;
 the Gnostic visions were mingled with the simplicity of the
 gospel; and the enemies of the clergy reconciled their
 passions with their conscience, the desire of freedom with
 the profession of piety.","('Western', 'NORP'), ('Bulgaria', 'GPE'), ('Paulician', 'NORP'), ('Italy', 'GPE'), ('France', 'GPE'), ('Gnostic', 'NORP')"
"In the church of St. Peter, the
 coronation was performed by his successor: the voice of God
 was confounded with that of the people; and the public
 consent was declared in the acclamations of The names of Caesar and Augustus, the
 laws of Constantine and Justinian, the example of
 Charlemagne and Otho, established the supreme dominion of
 the emperors: their title and image was engraved on the
 papal coins; (5) and their jurisdiction was marked by the
 sword of justice, which they delivered to the praefect of
 the city.","('St. Peter', 'GPE'), ('Caesar', 'PERSON'), ('Augustus', 'PERSON'), ('Constantine', 'PERSON'), ('Justinian', 'PERSON'), ('Charlemagne', 'PERSON'), ('Otho', 'PERSON'), ('5', 'CARDINAL')"
"In the eighth century of the Christian aera, a religious quarrel, the worship of images, provoked the Romans to assert their independence: their bishop became the temporal, as well as the spiritual, father of a free people; and of the Western empire, which was restored by Charlemagne, the title and image still decorate the singular constitution of modern Germany.","('the eighth century', 'DATE'), ('the Christian aera', 'EVENT'), ('Romans', 'NORP'), ('Western', 'NORP'), ('Charlemagne', 'PERSON'), ('Germany', 'GPE')"
"In the feudal system of Europe, arms were the title of
 distinction and the measure of allegiance; and amidst their
 tumult, the still voice of law and reason was seldom heard
 or obeyed.","('Europe', 'LOC')"
"In the first ages of the decline and fall of the Roman empire, our eye is invariably fixed on the royal city, which had given laws to the fairest portion of the globe.","('first', 'ORDINAL'), ('Roman', 'NORP')"
"In the first moments of rebellion, when Arnold of Brescia had inflamed their minds against the church, the Romans artfully labored to conciliate the favour of the empire, and to recommend their merit and services in the cause of Caesar.","('first', 'ORDINAL'), ('Arnold', 'PERSON'), ('Brescia', 'GPE'), ('Romans', 'NORP'), ('Caesar', 'PERSON')"
"In the first of these petty wars, thirty thousand Romans were overthrown by a thousand German horse, whom Frederic Barbarossa had detached to the relief of Tusculum: and if we number the slain at three, the prisoners at two, thousand, we shall embrace the most authentic and moderate account.","('first', 'ORDINAL'), ('thirty thousand', 'CARDINAL'), ('Romans', 'NORP'), ('thousand', 'CARDINAL'), ('German', 'NORP'), ('Frederic Barbarossa', 'PERSON'), ('Tusculum', 'PERSON'), ('three', 'CARDINAL'), ('two, thousand', 'CARDINAL')"
"In the presence, and by the authority, of the people, two electors conferred, not on the pope, but on the noble and faithful Martin, the dignity of senator, and the supreme administration of the republic, (52) to hold during his natural life, and to exercise at pleasure by himself or his deputies.","('two', 'CARDINAL'), ('Martin', 'PERSON'), ('52', 'CARDINAL')"
"In the revolution of the twelfth century, which gave a new existence and aera to Rome, we may observe the real and important events that marked or confirmed her political independence.","('the twelfth century', 'DATE'), ('Rome', 'GPE')"
"In the same age, and from the
 same motives, most of the Italian republics were prompted to
 embrace a measure, which, however strange it may seem, was
 adapted to their situation, and productive of the most
 salutary effects. (46)","('Italian', 'NORP'), ('46', 'CARDINAL')"
"In the time of Leo the Ninth, a wealthy and learned Jew
 was converted to Christianity, and honoured at his baptism
 with the name of his godfather, the reigning Pope.","('the time of Leo the Ninth', 'DATE'), ('Jew', 'NORP'), ('Christianity', 'NORP'), ('Pope', 'PERSON')"
"In the twelfth and thirteenth centuries the
 Romans incessantly laboured to reduce or destroy the
 contumacious vassals of the church and senate; and if their
 headstrong and selfish ambition was moderated by the pope,
 he often encouraged their zeal by the alliance of his
 spiritual arms.","('the twelfth and thirteenth centuries', 'DATE'), ('Romans', 'NORP')"
"In the work of destruction, the ambition of the Romans was often checked and repulsed by the neighbouring cities and their allies: in the first siege of Tibur, they were driven from their camp; Battle of Tusculum, A.D. 1167.","('Romans', 'NORP'), ('first', 'ORDINAL'), ('Tibur', 'GPE'), ('Battle of Tusculum', 'FAC'), ('A.D. 1167', 'DATE')"
"In their interview at Viterbo, the pope represented
 to the emperor the furious, ungovernable spirit of the
 Romans; the insults, the injuries, the fears, to which his
 person and his clergy were continually exposed; and the
 pernicious tendency of the heresy of Arnold, which must
 subvert the principles of civil, as well as ecclesiastical,
 subordination.","('Viterbo', 'GPE'), ('Romans', 'NORP'), ('Arnold', 'PERSON')"
"In these occasional retreats, the
 exiles and fugitives of the Vatican were seldom long, or
 far, distant from the metropolis; but in the beginning of
 the fourteenth century, the apostolic throne was
 transported, as it might seem forever, from the Tyber to the
 Rhône Boniface VIII.","('Vatican', 'FAC'), ('the beginning of\r\n the fourteenth century', 'DATE')"
"In this double hope,
 the French court was their surest asylum; they prompted and
 directed the enterprise of Philip; and I should praise their
 magnanimity, had they respected the misfortune and courage
 of the captive tyrant.","('French', 'NORP'), ('Philip', 'PERSON')"
"In this unworthy flight, which excited the compassion of the Roman matrons, his attendants were
 scattered or unhorsed; and, in the fields behind the church of St. Peter, his successor was found alone and half dead with fear and fatigue.","('Roman', 'NORP'), ('St. Peter', 'GPE'), ('half', 'CARDINAL')"
"Instead of the arbitrary or venal nomination of a German court, the vicar of Christ was freely chosen by the college of cardinals, most of whom were either natives or inhabitants of the city.","('German', 'NORP'), ('Christ', 'PERSON')"
Institution of the conclave established by Gregory X. A.D. 1274.,"('Gregory X. A.D. 1274', 'PERSON')"
"Institution of the jubilee, or holy year, A.D. 1300.","('A.D. 1300', 'DATE')"
"It
 was fortunately a season of peace and plenty; and if forage
 was scarce, if inns and lodgings were extravagantly dear, an
 inexhaustible supply of bread and wine, of meat and fish,
 was provided by the policy of Boniface and the venal
 hospitality of the Romans.","('Boniface', 'PERSON'), ('Romans', 'NORP')"
"It is not my design to
 enumerate the Roman families which have failed at different
 periods, or those which are continued in different degrees
 of splendour to the present time.","('Roman', 'NORP')"
"It was proposed by Arnold to
 revive and discriminate the equestrian order; but what could
 be the motive or measure of such distinction? (34)","('Arnold', 'PERSON')"
"It was the first act of the Romans, an act of freedom, to restore the strength, though not the beauty, of the Capitol; to fortify the seat of their arms and counsels; and as often as they ascended the hill, the coldest minds must have glowed with the remembrance of their ancestors.","('first', 'ORDINAL'), ('Romans', 'NORP'), ('Capitol', 'ORG')"
"It was thus that the
 seats of the cardinal bishops, Porto, Ostia, Albanum,
 Tusculum, Praeneste, and Tibur or Tivoli, were successively
 overthrown by the ferocious hostility of the Romans. (63)","('Porto', 'GPE'), ('Ostia', 'GPE'), ('Albanum', 'GPE'), ('Tusculum', 'FAC'), ('Praeneste', 'ORG'), ('Tibur', 'ORG'), ('Tivoli', 'ORG'), ('Romans', 'NORP'), ('63', 'CARDINAL')"
"It was thus, about the middle of the thirteenth century,
 that the Romans called from Bologna the senator Brancaleone,
 (48) whose fame and merit have been rescued from oblivion by
 the pen of an English historian.","('about the middle of the thirteenth century', 'DATE'), ('Romans', 'NORP'), ('Bologna', 'GPE'), ('Brancaleone', 'PERSON'), ('48', 'DATE'), ('English', 'LANGUAGE')"
"It was universally believed, that Constantine had invested the popes with the temporal dominion of Rome; and the boldest civilians, the most profane skeptics, were satisfied with disputing the right of the emperor and the validity of his gift.","('Constantine', 'PERSON'), ('Rome', 'GPE')"
"Italy could no longer afford a
 refuge; and the disciple of Abelard escaped beyond the Alps,
 till he found a safe and hospitable shelter in Zurich, now
 the first of the Swiss cantons.","('Italy', 'GPE'), ('Abelard', 'PERSON'), ('Alps', 'LOC'), ('Zurich', 'GPE'), ('first', 'ORDINAL'), ('Swiss', 'NORP')"
Lucius II.,"('Lucius II', 'PERSON')"
Lucius III.,"('Lucius III', 'PERSON')"
"Nine days are allowed for the obsequies of the deceased pope, and the arrival of the  absent cardinals; on the tenth, they are imprisoned, each with one domestic, in a common apartment or conclave, without any separation of walls or curtains: a small window is reserved for the introduction of necessaries; but the door is locked on both sides and guarded by the magistrates of the city, to seclude them from all correspondence with the world.","('Nine days', 'DATE'), ('the tenth', 'DATE'), ('one', 'CARDINAL')"
Noble Families of Rome.,"('Rome', 'GPE')"
"Nogaret, a foreign adversary, was content to
 execute the orders of his master: by the domestic enmity of Colonna, he was insulted with words and blows; and during a confinement of three days his life was threatened by the hardships which they inflicted on the obstinacy which they
 provoked.","('Nogaret', 'PERSON'), ('Colonna', 'PERSON'), ('three days', 'DATE')"
"Nor could his spiritual government escape the censure and control of the reformer; and the inferior clergy were taught by his lessons to resist
 the cardinals, who had usurped a despotic command over the
 twenty-eight regions or parishes of Rome. (27)","('twenty-eight', 'CARDINAL'), ('Rome', 'GPE'), ('27', 'CARDINAL')"
"Nor shall I dismiss the present work till I have reviewed the state and revolutions of the Roman City, which acquiesced under the absolute dominion of the popes, about the same time that Constantinople was enslaved by the Turkish arms.","('the Roman City', 'GPE'), ('Constantinople', 'GPE'), ('Turkish', 'NORP')"
"Of
 these, (64) Porto and Ostia, the two keys of the Tyber, are still vacant and desolate: the marshy and unwholesome banks are peopled with herds of buffaloes, and the river is lost to every purpose of navigation and trade.","('64', 'CARDINAL'), ('Porto', 'GPE'), ('Ostia', 'GPE'), ('two', 'CARDINAL'), ('Tyber', 'FAC')"
"Of her two sovereigns, the emperor had precariously reigned by the right of conquest; but the authority of the pope was founded on the soft, though more solid, basis of opinion and habit.","('two', 'CARDINAL')"
"Of these, Peter was elected senator of Rome,
 introduced to the Capitol in a triumphal car, and hailed in
 some vain acclamations with the title of Caesar; while John
 and Stephen were declared marquis of Ancona and count of
 Romagna, by Nicholas the Fourth, a patron so partial to
 their family, that he has been delineated in satirical
 portraits, imprisoned as it were in a hollow pillar. (101)","('Peter', 'PERSON'), ('Rome', 'GPE'), ('Capitol', 'FAC'), ('Caesar', 'PERSON'), ('John', 'PERSON'), ('Stephen', 'PERSON'), ('Ancona', 'PERSON'), ('Romagna', 'PERSON'), ('Nicholas the Fourth', 'PERSON'), ('101', 'CARDINAL')"
"On Holy Thursday, while Paschal officiated before the altar, he was interrupted by the clamours of the multitude, who imperiously demanded the confirmation of a favourite magistrate.","('Holy Thursday', 'DATE'), ('Paschal', 'PERSON')"
